,id,label,keyword,date,content,time,forward,comment,like,predict,__label__positive,__label__negative,__label__neutral,predict_score,topic,topic_keyword,topic_keyword_en
181,231,-1,冠状病毒,2020-01-21,武汉 制定 诊疗 方案 为 坚决 遏制 新型 冠状病毒 感染 引起 的 肺炎 疫情 扩散 武汉市 对 进出 武汉 人员 加强 管控 武汉市 旅游 团队 不组团 外出 公安 交管部门 对 进出 武汉 的 私家 车辆 进行 抽检 检查 后备箱 是否 携带 活禽 野生动物 等 武汉 加强 了 对 公共场所 及 公共交通 的 管理 自 一月 十四日 起 在 机场 火车站 长途汽车站 ​ ,2020-01-21 22:59:00,0,0,0,__label__positive,0.95258,0.00272,0.08511,0.95258,0.0,"🙏, 确诊, 病例, 九十, 国内","🙏, Confirmed diagnosis, Case, ninety, domestic"
182,232,-1,冠状病毒,2020-01-21,请 核查 这例 病人 是否 为 新型 冠状病毒 感染 病人 姓名 徐恩恩 男 六十九岁 武汉 协和 新华 医院 武汉 普仁 医院 发热 门诊 都 已登记 在案 我们 有 病历,2020-01-21 18:55:00,0,0,0,__label__negative,0.30076,0.62247,0.0073599999999999985,0.62247,3.0,"武汉, 医院, 感染, 病人, 请","Wuhan, hospital, infection, patient, please"
183,233,-1,冠状病毒,2020-01-21,全国 确诊 三百 零九例 新型 冠状病毒 肺炎 妈呀 又 增加 了,2020-01-21 22:59:00,0,0,0,__label__neutral,0.011,0.11597,0.86705,0.86705,1.0,"武汉, 确诊, 病例, 三百, 全国","Wuhan, Confirmed diagnosis, Case, three hundred, Nationwide"
184,234,-1,冠状病毒,2020-01-21,国内 确诊 二百 九十 一例 新型 冠状病毒 肺炎 病例 o 正 滚动 播报 武汉 新型 肺炎 全国 疫情 实时 动态,2020-01-21 22:59:00,0,0,0,__label__negative,1e-05,0.98257,0.2069,0.98257,4.0,"病例, 确诊, 一例, 国内, 九十","Case, Confirmed diagnosis, A case, domestic, ninety"
185,235,-1,冠状病毒,2020-01-21,上思县 召开 新型 冠状病毒 感染 肺炎 防控 工作 部署 会 为 进一步 加强 上思县 新型 冠状病毒 肺炎 疫情 防控 工作 的 领导 指导 和 规范 新型 冠状病毒 肺炎 疫情 防控 卫生 应急 处置 工作 提高 应对 新型 冠状病毒 肺炎 防控 能力 和 科学决策 水平 一月 二十日 下午 上思县 新型 冠状病毒 感染 肺炎 防控 工作 部署 会 在 县 卫健局 召开 ​ ,2020-01-21 22:59:00,0,0,0,__label__positive,0.98459,0.0007700000000000001,0.32083,0.98459,3.0,"武汉, 医院, 感染, 病人, 请","Wuhan, hospital, infection, patient, please"
186,236,-1,冠状病毒,2020-01-21,您 说话 了 我们 就 踏实,2020-01-21 15:37:00,0,0,0,__label__negative,1e-05,0.7186,0.34866,0.7186,2.0,"五例, 确诊, 一例, 例, 三百","Five cases, Confirmed diagnosis, A case, example, three hundred"
187,237,-1,冠状病毒,2020-01-21,国内 确诊 二百 九十 一例 新型 冠状病毒 肺炎 病例 人数 越来越 多 了 坐立 难安 寝食难安 不敢 看微信 朋友圈 的 消息 越 看 越 难过 越 看 越 惶恐 男朋友 已经 退 了 车票 春节 期间 二十四 小时 待命 急诊 手术 而 我 过年 期间 被 排 了 出诊 班 面临 要 去 各 大病 区床 旁 出诊 如今 每天 接触 的 患者 不知道 谁 是 潜伏期 谁 会 发热 或 不适 密闭 的 诊室 只有 出 ​ ,2020-01-21 22:59:00,5,24,26,__label__neutral,0.01973,0.30737,0.5775100000000001,0.5775100000000001,1.0,"武汉, 确诊, 病例, 三百, 全国","Wuhan, Confirmed diagnosis, Case, three hundred, Nationwide"
188,238,-1,冠状病毒,2020-01-21,国内 确诊 二百 九十 一例 新型 冠状病毒 肺炎 病例 🙏 🏻 🙏 🏻 🙏 🏻 🙏 🏻,2020-01-21 22:59:00,0,0,0,__label__negative,1e-05,0.96591,0.00972,0.96591,0.0,"🙏, 确诊, 病例, 九十, 国内","🙏, Confirmed diagnosis, Case, ninety, domestic"
189,239,-1,冠状病毒,2020-01-21,二千 零 一十九 一 二十 补 跟 前一天 差不多 也 要 上课 上课 也 有点累 课上 讲 的 内容 还是 挺 好 的 感觉 上课 还 行 再 上课 就要 等到 春节 后 了 从 这天 开始 就 有 对 新 冠状病毒 肺炎 的 报道 了 不过 好像 还 没有 很多 病例 但 好像 已经 确定 了 病源 在 武汉 反正 应该 不会 有啥 危险的 事 希望 能够 不要 有啥 大事 注意 小心谨慎 预防 疾病 ​ ,2020-01-21 22:59:00,0,2,0,__label__negative,0.26285,0.36298,0.0421,0.36298,0.0,"🙏, 确诊, 病例, 九十, 国内","🙏, Confirmed diagnosis, Case, ninety, domestic"
190,240,-1,冠状病毒,2020-01-21,国内 确诊 二百 九十 一例 新型 冠状病毒 肺炎 病例 每次 都 他 爹 的 自己 作 的 自古以来 都 说 什么 野味 儿大补 大补个 几把 日,2020-01-21 22:59:00,0,0,0,__label__neutral,0.02097,0.04338,0.93047,0.93047,4.0,"病例, 确诊, 一例, 国内, 九十","Case, Confirmed diagnosis, A case, domestic, ninety"
191,241,-1,冠状病毒,2020-01-21,国内 确诊 二百 九十 一例 新型 冠状病毒 肺炎 病例 大家 一定 要 保护 好 自己 希望 可以 安心 过个 年 🙏 不要 再 扩散 了 🙏 🙏,2020-01-21 22:59:00,0,0,1,__label__positive,0.25092,0.23372,0.04086,0.25092,0.0,"🙏, 确诊, 病例, 九十, 国内","🙏, Confirmed diagnosis, Case, ninety, domestic"
192,242,-1,冠状病毒,2020-01-21,全国 确诊 三百 零九例 新型 冠状病毒 肺炎 病例 新型 肺炎 疫情 最新 汇总 截至 二十一日 二十一时 全国 共 确诊 新型 冠状病毒 肺炎 三百 零九例 其中 湖北 二百七十 例 北京 五例 广东 十四 例 上海 六例 浙江 五例 天津 二例 河南 一例 重庆 五例 台湾 一例 ​ ​,2020-01-21 22:59:00,0,0,1,__label__neutral,0.011,0.4688,0.7982,0.7982,2.0,"五例, 确诊, 一例, 例, 三百","Five cases, Confirmed diagnosis, A case, example, three hundred"
193,247,-1,冠状病毒,2020-01-21,爸妈 群里 说 他们 公司 旁边 部队 有个 解放军 疑似 冠状病毒 说 才 从 武汉 回来 有 一种 紧张的 氛围 了 生 了 娃 那种 宝宝 是 软肋 的 感觉 又 来 了 上 一次 还是 哥哥 是 婴儿 的 时候 一点点 传染病 毒 我 都 提心吊胆 马上 过年 了 希望 一切 平安,2020-01-21 22:59:00,0,0,0,__label__negative,0.00759,0.97905,0.00462,0.97905,2.0,"五例, 确诊, 一例, 例, 三百","Five cases, Confirmed diagnosis, A case, example, three hundred"
194,248,-1,冠状病毒,2020-01-21,新型 冠状病毒 肺炎 潜伏期 国家 卫健委 专家 组成员 高占成 表示 新型 冠状病毒 肺炎 的 潜伏期 平均 在 七天 左右 短 的 在 二 三天 长 的 十 十二天 如 出现 发热 干咳 呼吸衰竭 休克 等 症状 请 及时 就医 央视 l 央视 新闻 的 微博 视频 ​ ​,2020-01-21 22:59:00,0,0,0,__label__neutral,0.1733,0.12941,0.29422,0.29422,1.0,"武汉, 确诊, 病例, 三百, 全国","Wuhan, Confirmed diagnosis, Case, three hundred, Nationwide"
195,249,-1,冠状病毒,2020-01-21,好 的 好,2020-01-21 15:37:00,0,0,0,__label__negative,0.0927,0.99952,1e-05,0.99952,0.0,"🙏, 确诊, 病例, 九十, 国内","🙏, Confirmed diagnosis, Case, ninety, domestic"
196,250,-1,冠状病毒,2020-01-21,我 提出 了 问题 怎么 确定 自己 是不是 新型 冠状病毒 验血 结果 看 哪项 o 怎么 确定 自己 是不是 新型 冠状病毒 验血 结果 看 哪项,2020-01-21 22:59:00,0,0,0,__label__negative,0.00161,0.97405,0.02299,0.97405,1.0,"武汉, 确诊, 病例, 三百, 全国","Wuhan, Confirmed diagnosis, Case, three hundred, Nationwide"
197,251,-1,冠状病毒,2020-01-21,权志龙 看秀 造型 权志龙 看秀 造型 粉丝 无意 占用 公共资源 yxh 拉 明星 背锅 太 可耻 了 目前 冠状病毒 是 全 社会 的 大事 请 大家 多多 关注 🙏 🏻 希望 每个 人 都 保护 好 自己 平安 健康 过年,2020-01-21 22:43:00,0,0,0,__label__negative,0.02677,0.6076699999999999,0.11281,0.6076699999999999,0.0,"🙏, 确诊, 病例, 九十, 国内","🙏, Confirmed diagnosis, Case, ninety, domestic"
198,252,-1,冠状病毒,2020-01-21,国内 确诊 二百 九十 一例 新型 冠状病毒 肺炎 病例 最 委屈 巴巴 的 武汉 人民 最近 先 委屈 一下 吧 打赢 了 这场 病毒 战 等 我 有钱 了 我 就 去 武汉 给 你们 送 小花 花 一起 加油 吖,2020-01-21 22:59:00,0,3,28,__label__neutral,0.03211,0.09809,0.39982,0.39982,1.0,"武汉, 确诊, 病例, 三百, 全国","Wuhan, Confirmed diagnosis, Case, three hundred, Nationwide"
199,253,-1,冠状病毒,2020-01-21,国内 确诊 二百 九十 一例 新型 冠状病毒 肺炎 病例 还好 之前 屯 了 点 医用 口罩,2020-01-21 22:59:00,0,0,1,__label__neutral,1e-05,0.62247,0.77185,0.77185,4.0,"病例, 确诊, 一例, 国内, 九十","Case, Confirmed diagnosis, A case, domestic, ninety"
200,254,-1,冠状病毒,2020-01-21,大家 注意安全 勤洗手 出门 一定 要 戴 口罩 快 过年 了 要 平平安安 的 啊,2020-01-20 21:56:00,0,0,0,__label__positive,0.40734,0.06561,0.04744,0.40734,4.0,"病例, 确诊, 一例, 国内, 九十","Case, Confirmed diagnosis, A case, domestic, ninety"
201,255,-1,冠状病毒,2020-01-21, 超话 小秘书 快讯 钟南山 暂无 特效药 担心 出现 毒王 级 超级 传播者 文 羊城 派 记者 丰西西图 羊城 派 记者 周巍 武汉 新型 冠状病毒 感染 肺炎 疫情 牵动人心 截至 一月 二十日 广东 已 报告 十四 例 新型 冠状病毒 感染 的 肺炎 确诊 病例 目前 广东 疫情 究竟 如何 全省 下 一步 将 如何 防控 一月 二十一日 十六时 广东省 ​ ,2020-01-21 22:59:00,1,3,6,__label__neutral,0.0421,0.34159,0.4688,0.4688,4.0,"病例, 确诊, 一例, 国内, 九十","Case, Confirmed diagnosis, A case, domestic, ninety"
202,256,-1,冠状病毒,2020-01-21,国内 确诊 二百 九十 一例 新型 冠状病毒 肺炎 病例 出门 戴 口罩 将 肉蛋 彻底 做熟 不要 随地吐痰 少去 人口 密集 场合 二 黄山,2020-01-21 22:59:00,0,2,7,__label__neutral,0.5000100000000001,0.00383,0.6151,0.6151,4.0,"病例, 确诊, 一例, 国内, 九十","Case, Confirmed diagnosis, A case, domestic, ninety"
203,257,-1,冠状病毒,2020-01-21,光是 看热 搜 我 就 胸闷 气短 呼吸 急促 了 国内 确诊 二百 九十 一例 新型 冠状病毒 肺炎 病例,2020-01-21 22:59:00,0,0,0,__label__neutral,0.0004,0.48439,0.85967,0.85967,0.0,"🙏, 确诊, 病例, 九十, 国内","🙏, Confirmed diagnosis, Case, ninety, domestic"
204,258,-1,冠状病毒,2020-01-21,国内 确诊 二百 九十 一例 新型 冠状病毒 肺炎 病例 好 可怕 能 不能 放假 待在家里 最 安全,2020-01-21 22:59:00,0,0,1,__label__negative,0.00053,0.72488,0.40734,0.72488,4.0,"病例, 确诊, 一例, 国内, 九十","Case, Confirmed diagnosis, A case, domestic, ninety"
205,259,-1,冠状病毒,2020-01-21,国内 确诊 二百 九十 一例 新型 冠状病毒 肺炎 病例 在 武汉 低烧 了 差不多 快 一周 打 了 三天 针 吃 了 无数 盒 难吃 的 可威 终于 退烧 目前 感受 都 正常 身为 武汉 人 身为 一个 妈妈 真的 很 怕 真的 很 怕 一看 新闻 就 流泪 恨不得 二十四 小时 都 戴 着 口罩 键盘 侠们 消停 下 我们 真的 也 不想 这样 我们 身在 武汉 我们 比 你们 更 慌 更 担心 ​ ,2020-01-21 22:59:00,0,11,15,__label__negative,0.32083,0.36298,0.02097,0.36298,1.0,"武汉, 确诊, 病例, 三百, 全国","Wuhan, Confirmed diagnosis, Case, three hundred, Nationwide"
206,260,-1,冠状病毒,2020-01-21,四十多家 保险公司 启动 应急 预案 应对 新型 冠状病毒 肺炎 近日 武汉 广东 等 多个 地区 发生 新型 冠状病毒 感染 的 肺炎 疫情 各大 保险公司 纷纷 启动 应急 预案 应对 据 记者 了解 这些 应急 预案 除了 包括 开通 绿色 报案 特事 特办 以及 提供 专业 专人 服务 外 一些 保险公司 还 取消 了 部分 理赔 条件 限制 大部分 保险公司 成立 专 ​ ,2020-01-21 22:59:00,0,0,0,__label__positive,0.32768,0.12253,0.16452999999999998,0.32768,0.0,"🙏, 确诊, 病例, 九十, 国内","🙏, Confirmed diagnosis, Case, ninety, domestic"
207,261,-1,冠状病毒,2020-01-21,即使 结果 未达 预期 也 是 英雄 尊敬,2020-01-21 15:37:00,0,0,0,__label__negative,1e-05,1.00001,0.00039,1.00001,4.0,"病例, 确诊, 一例, 国内, 九十","Case, Confirmed diagnosis, A case, domestic, ninety"
208,262,-1,冠状病毒,2020-01-21,国内 确诊 二百 九十 一例 新型 冠状病毒 肺炎 病例 也 不用 太 恐慌 认认真真 做好 个人 防护 身体 如 有 不适 及时 就医 就行了 很多 人 就是 一边 恐慌 一边 在 自我 防护 上 又 马马虎虎 随随便便,2020-01-21 22:58:00,0,0,7,__label__negative,0.01206,0.9363,0.02299,0.9363,4.0,"病例, 确诊, 一例, 国内, 九十","Case, Confirmed diagnosis, A case, domestic, ninety"
209,263,-1,冠状病毒,2020-01-21,最新 的 冠状病毒 传染 已经 向 各个 城市 扩散 马上 过年 了 请 各位 亲朋好友 亲戚 不要 触碰 宝宝 的 手 脸 或者 是 对 着 宝宝 脸 说话 喘气 更 不要 去 亲 宝宝 👶 每个 人 都 是 隐性 的 细菌 和 病毒 的 携带者 愿 每个 宝宝 都 健健康康 的 🙏,2020-01-21 22:58:00,0,0,1,__label__positive,0.32768,0.30076,0.01497,0.32768,2.0,"五例, 确诊, 一例, 例, 三百","Five cases, Confirmed diagnosis, A case, example, three hundred"
210,264,-1,冠状病毒,2020-01-21,国内 确诊 二百 九十 一例 新型 冠状病毒 肺炎 病例 希望 钟南山 院士 可以 带领 众将 平息 这 一场 肺炎 病毒 战争 老骥伏枥 志在 必 根治 加油 武汉 二 普宁市,2020-01-21 22:58:00,0,0,9,__label__positive,0.8222,0.00396,0.27514,0.8222,0.0,"🙏, 确诊, 病例, 九十, 国内","🙏, Confirmed diagnosis, Case, ninety, domestic"
211,265,-1,冠状病毒,2020-01-21,国内 确诊 二百 九十 一例 新型 冠状病毒 肺炎 病例 二千 零 一十三年 的 纪录片 非典 十年 祭 不要 认为 纪录片 会 很 枯燥 我 补完 五集 全程 惊心动魄 可以 说 那 就是 一场 没有 硝烟 的 战斗 有 白衣 英雄 有 生活 支离破碎 的 患者 也 有 自私 害人 的 糊涂虫 最后 的 结束语 人类 可能 始终 都 会 面临 传染病 的 危害 而 我们 永远 要 做 的 就是 保 展开 全 ​ ,2020-01-21 22:58:00,0,0,0,__label__negative,0.13662,0.25092,0.14035,0.25092,0.0,"🙏, 确诊, 病例, 九十, 国内","🙏, Confirmed diagnosis, Case, ninety, domestic"
212,270,-1,冠状病毒,2020-01-21,夜畔 轻语 劳累 得 一天 已 结束 我们 的 安眠 是 奋斗 在 抗击 新型 冠状病毒 一线 的 医护人员 你 换来 的 谢谢你们 白衣天使 加油 武汉 加油 中国 晚安 ﾟ д ﾟ ﾉ 二 郑州,2020-01-21 22:58:00,0,0,4,__label__positive,0.9906,0.00248,0.02443,0.9906,1.0,"武汉, 确诊, 病例, 三百, 全国","Wuhan, Confirmed diagnosis, Case, three hundred, Nationwide"
213,271,-1,冠状病毒,2020-01-21,一定 要 做好 防范措施 国内 确诊 二百 九十 一例 新型 冠状病毒 肺炎 病例,2020-01-21 22:58:00,0,0,0,__label__neutral,1e-05,0.39235,0.8933200000000001,0.8933200000000001,4.0,"病例, 确诊, 一例, 国内, 九十","Case, Confirmed diagnosis, A case, domestic, ninety"
214,272,-1,冠状病毒,2020-01-21,全国 确诊 三百 零九例 新型 冠状病毒 肺炎 病例 关注 截至 二十一日 二十一时 全国 共 确诊 新型 冠状病毒 肺炎 三百 零九例 其中 湖北 二百七十 例 北京 五例 广东 十四 例 上海 六例 浙江 五例 天津 二例 河南 一例 重庆 五例 台湾 一例,2020-01-21 22:20:00,0,0,0,__label__neutral,0.02034,0.34866,0.77185,0.77185,2.0,"五例, 确诊, 一例, 例, 三百","Five cases, Confirmed diagnosis, A case, example, three hundred"
215,273,-1,冠状病毒,2020-01-21,面对 致死率 和 传染性 都 远 低于 sars 的 新型 冠状病毒 从 媒体 自 媒体 以及 民间 都 在 相互 刺激 相互 交流 恐惧 和 不安的 情绪 过 几分钟 就 会 去 看 一次 各省 区 的 病例 人数 变化 以 进一步 提升 和 积累 不易 觉察 的 焦虑 特别 是 各地 的 n 九 十五 口罩 的 脱销 及 个别 不良 商家 的 趁机 涨价 更 加剧 了 部分 人群 的 紧张 和 不安 生怕 自己 被 感染 ​ ,2020-01-21 22:58:00,0,0,1,__label__negative,0.0927,0.8267200000000001,0.00807,0.8267200000000001,2.0,"五例, 确诊, 一例, 例, 三百","Five cases, Confirmed diagnosis, A case, example, three hundred"
216,274,-1,冠状病毒,2020-01-21,吃 一颗 定心,2020-01-21 22:50:00,0,0,0,__label__negative,1e-05,0.6723399999999999,0.12253,0.6723399999999999,0.0,"🙏, 确诊, 病例, 九十, 国内","🙏, Confirmed diagnosis, Case, ninety, domestic"
217,275,-1,冠状病毒,2020-01-21,现在 冠状病毒 这么 猖獗 希望 我 的 家人 朋友 们 健康 平安 二 济南,2020-01-21 22:58:00,0,0,1,__label__positive,0.92631,0.26285,1e-05,0.92631,0.0,"🙏, 确诊, 病例, 九十, 国内","🙏, Confirmed diagnosis, Case, ninety, domestic"
218,276,-1,冠状病毒,2020-01-21,国内 确诊 二百 九十 一例 新型 冠状病毒 肺炎 病例 愿 所有人 安好 二千 零 二十 加油,2020-01-21 22:58:00,0,0,0,__label__neutral,1e-05,0.44554,0.96791,0.96791,0.0,"🙏, 确诊, 病例, 九十, 国内","🙏, Confirmed diagnosis, Case, ninety, domestic"
219,277,-1,冠状病毒,2020-01-21,文 羊城 派 记者 符畅 张华据 省卫健委 二十日 晚 通报 广东 已有 十四 例 新型 冠状病毒 感染 的 肺炎 确诊 病例 作为 广东省 突发 急性 传染病 定点 救治 医院 广州市 第八 人民 医院 针对 此次 疾病 防控 有何 准备 一月 二十一日 该院 院长 雷春亮 接受 记者 采访 时 表示 根据 省市 相关 部门 的 部署 市八 医院 已经 制订 了 非常 具体 的 应对 新型 冠状 病 ​ ,2020-01-21 22:58:00,0,0,3,__label__positive,0.47659,0.30737,0.03411,0.47659,4.0,"病例, 确诊, 一例, 国内, 九十","Case, Confirmed diagnosis, A case, domestic, ninety"
220,278,-1,冠状病毒,2020-01-21,国内 确诊 二百 九十 一例 新型 冠状病毒 肺炎 病例,2020-01-21 22:58:00,0,0,0,__label__neutral,1e-05,0.21735,0.99674,0.99674,4.0,"病例, 确诊, 一例, 国内, 九十","Case, Confirmed diagnosis, A case, domestic, ninety"
221,279,-1,冠状病毒,2020-01-21,全国 确诊 三百 零九例 新型 冠状病毒 肺炎 想起 高中 时读 柴静 的 看见 关于 非典 的 描述 具体 细节 记不清 倒 是 更 细致 点 知道 了 当 我 还是 四岁 时 也 就是 三年 在 全国 打响 的 这样 一场 战役 病区 人心惶惶 逝去 的 人 越 多 大家 心里 会越 不平安 不管 是 前线 的 医生 还是 病人 都 会 有 情绪 非常 不稳定的 时候 敬佩 那些 在 前线 抗击 疫情 的 ​ ,2020-01-21 22:58:00,0,0,1,__label__negative,0.21735,0.56219,0.02097,0.56219,1.0,"武汉, 确诊, 病例, 三百, 全国","Wuhan, Confirmed diagnosis, Case, three hundred, Nationwide"
222,280,-1,冠状病毒,2020-01-21,喝 板蓝根 和 熏 醋 可以 预防 武汉 肺炎 辟谣 不可以 板蓝根 和 醋 不能 预防 武汉 肺炎 武汉 肺炎 发生 以来 囤 板蓝根 熏醋 的 声音 越来越 多 甚至 一度 渲染 成为 预防 的 黄金组合 那么 它们 真能 预防 武汉 肺炎 吗 和平 里 医院 呼吸科 主任医师 张骅 称 板蓝根 适用 于 治疗 风热 感冒 病毒性 感冒 等 热 性疾病 的 治疗 有 ​ ,2020-01-21 22:58:00,0,0,5,__label__negative,0.03411,0.8903,0.00539,0.8903,2.0,"五例, 确诊, 一例, 例, 三百","Five cases, Confirmed diagnosis, A case, example, three hundred"
223,281,-1,冠状病毒,2020-01-21,全国 确诊 三百 零九例 新型 冠状病毒 肺炎 这个 传播速度 有点 快,2020-01-21 22:58:00,0,3,2,__label__neutral,0.16887,0.0073599999999999985,0.8397399999999999,0.8397399999999999,1.0,"武汉, 确诊, 病例, 三百, 全国","Wuhan, Confirmed diagnosis, Case, three hundred, Nationwide"
224,282,-1,冠状病毒,2020-01-21,国内 确诊 二百 九十 一例 新型 冠状病毒 肺炎 病例 报应 吧 人类 永远 都 不能 侵犯 大自然 又 一起 野味 引发 的 惨案 好 了 伤疤 忘 了 疼 还 记得 三年 的 果子狸 吗,2020-01-21 22:58:00,0,3,23,__label__neutral,0.00125,0.4225100000000001,0.87749,0.87749,1.0,"武汉, 确诊, 病例, 三百, 全国","Wuhan, Confirmed diagnosis, Case, three hundred, Nationwide"
225,283,-1,冠状病毒,2020-01-21,辛苦 了 注意 安,2020-01-21 15:37:00,0,0,0,__label__negative,0.29422,0.9963,1e-05,0.9963,4.0,"病例, 确诊, 一例, 国内, 九十","Case, Confirmed diagnosis, A case, domestic, ninety"
226,288,-1,冠状病毒,2020-01-21,新型 冠状病毒 感染 江西 要闻 防控 新型 冠状病毒 感染 的 肺炎 疫情 书记 省长 作出 部署 一月 二十一日 针对 新型 冠状病毒 感染 的 肺炎 疫情 省委书记 刘奇 省长 易炼 红 提出 要求 作出 部署 刘奇 强调 各级党委 政府 要 坚决 贯彻落实 习近平 总书记 重要 指示 和 李克强 总理 重要批示 精神 坚持 把 人民 群众 生命安全 和 身体 ​ ,2020-01-21 22:58:00,0,0,9,__label__positive,0.7431800000000001,0.00611,0.59268,0.7431800000000001,3.0,"武汉, 医院, 感染, 病人, 请","Wuhan, hospital, infection, patient, please"
227,289,-1,冠状病毒,2020-01-21,我 提出 了 问题 沈阳 出现 新型 冠状病毒 了 吗 o 沈阳 出现 新型 冠状病毒 了 吗,2020-01-21 22:58:00,0,0,0,__label__negative,0.00372,0.5000100000000001,0.04887,0.5000100000000001,4.0,"病例, 确诊, 一例, 国内, 九十","Case, Confirmed diagnosis, A case, domestic, ninety"
228,290,-1,冠状病毒,2020-01-21,国内 确诊 二百 九十 一例 新型 冠状病毒 肺炎 病例 我 求求 了 不仅 要 电视广播 短信 滚动 通知 请 公交车 公交 站台 公园 小区 啥 玩意儿 的 都 一起 广播 好 吗 庙里 的 菩萨 后面 最好 也 放台 广播 我 奶奶 和 姑姑 居然 还 打算 跟 人 组团 出省 烧香 我 真的 fo 了,2020-01-21 22:58:00,0,7,31,__label__negative,0.0063,0.90193,0.06372,0.90193,0.0,"🙏, 确诊, 病例, 九十, 国内","🙏, Confirmed diagnosis, Case, ninety, domestic"
229,291,-1,冠状病毒,2020-01-21,新型 冠状病毒 一定 会 被 战胜 👉,2020-01-21 22:58:00,0,2,0,__label__negative,0.00477,0.5000100000000001,0.4149100000000001,0.5000100000000001,0.0,"🙏, 确诊, 病例, 九十, 国内","🙏, Confirmed diagnosis, Case, ninety, domestic"
230,292,-1,冠状病毒,2020-01-21,国内 确诊 二百 九十 一例 新型 冠状病毒 肺炎 病例 求求 了 千万 不要 感染 到,2020-01-21 22:58:00,0,0,0,__label__neutral,0.04744,0.05186,0.18244,0.18244,4.0,"病例, 确诊, 一例, 国内, 九十","Case, Confirmed diagnosis, A case, domestic, ninety"
231,293,-1,冠状病毒,2020-01-21,我 在 湖南 真的 好 慌 啊 我 感觉 已经 有 了 只是 还 没上报 或者 还 不知情 以为 是 感冒 四川 现在 也 有 了 我 现在 好 想 去 乌鲁木齐 过年 了 国内 确诊 二百 九十 一例 新型 冠状病毒 肺炎 病例,2020-01-21 22:58:00,0,0,0,__label__negative,1e-05,0.98505,0.14415999999999998,0.98505,4.0,"病例, 确诊, 一例, 国内, 九十","Case, Confirmed diagnosis, A case, domestic, ninety"
232,294,-1,冠状病毒,2020-01-21,现在 已经 到 了 春运 高峰期 很多 人 已经 踏上 返乡 之 路 未来 确诊 人数 会 继续 增长 大 家务 注意 做好 预防 一 出门 一定 要 戴 口罩 n 九 十五 当然 最好 医用 外科 口罩 也 可以 达到 同样 效果 实在 不行 一次性 医用 口罩 也 是 可以 的 主要 是 预防 飞沫 感染 上述 口罩 都 是 一次性 用品 用 完 就 换 新 不要 反复 使用 二 不去 人流 密集 的 ​ ,2020-01-21 22:58:00,0,2,1,__label__negative,0.07371,0.73107,0.018000000000000002,0.73107,4.0,"病例, 确诊, 一例, 国内, 九十","Case, Confirmed diagnosis, A case, domestic, ninety"
233,295,-1,冠状病毒,2020-01-21,哎 哎 请 核查 这例 病人 是否 为 新型 冠状病毒 感染 病人 姓名 徐恩恩 男 六十九岁 武汉 协和 新华 医院 武汉 普仁 医院 发热 门诊 都 已登记 在案 我们 有 病历,2020-01-21 18:55:00,0,0,0,__label__negative,0.22271,0.8558600000000001,0.00219,0.8558600000000001,3.0,"武汉, 医院, 感染, 病人, 请","Wuhan, hospital, infection, patient, please"
234,296,-1,冠状病毒,2020-01-21,新型 冠状病毒 肺炎 纳入 法定 传染病 天佑 中华 向 一线 医护人员 致敬 二 哈尔滨,2020-01-21 22:58:00,0,0,2,__label__negative,0.00886,0.99693,1e-05,0.99693,0.0,"🙏, 确诊, 病例, 九十, 国内","🙏, Confirmed diagnosis, Case, ninety, domestic"
235,297,-1,冠状病毒,2020-01-21,国内 确诊 二百 九十 一例 新型 冠状病毒 肺炎 病例 咳嗽 好 几天 了 医生 看 了 嗓子 说 是 咽炎 况且 在 我们 这种 小 城市 大家 并 不清楚 这个 事情 给 大人 讲 了 他们 都 说 没事 那会 非典 我们 这边 都 没事,2020-01-21 22:58:00,0,4,13,__label__negative,0.00182,0.84798,0.25092,0.84798,4.0,"病例, 确诊, 一例, 国内, 九十","Case, Confirmed diagnosis, A case, domestic, ninety"
236,298,-1,冠状病毒,2020-01-21,国内 确诊 二百 九十 一例 新型 冠状病毒 肺炎 病例 全国 预防 开始 唯新 主义,2020-01-21 22:58:00,0,0,0,__label__neutral,0.00539,0.04887,0.8903,0.8903,4.0,"病例, 确诊, 一例, 国内, 九十","Case, Confirmed diagnosis, A case, domestic, ninety"
