,id,label,keyword,date,content,time,forward,comment,like,predict,__label__positive,__label__negative,__label__neutral,predict_score,topic,topic_keyword,topic_keyword_en
284,424,-1,冠状病毒,2020-01-17,肺炎 的 临床 症状 如何 肺炎 是 指 由 各种 细菌 病毒 衣原体 支原体 等 多种 病原体 感染 肺部 而 导致 的 肺部 感染 可 分为 社区 获得 性肺炎 和 院内 获得 性肺炎 主要 是 根据 获得 肺炎 的 场所 不同 进行 区分 主要 的 临床 症状 是 咳嗽 伴有 或 不伴有 咳痰 胸痛 前驱 症状 主要 有 鼻塞 流涕 咽部 不适 咽痛 咽部 异物感 声 ​ ,2020-01-17 20:18:00,144,43,1078,__label__negative,0.10089,0.26285,0.1067,0.26285,0.0,"武汉, 发现, 泰国, 患者, 第二例","Wuhan, Find, Thailand, patient, Second case"
285,429,-1,冠状病毒,2020-01-17,值得 关注 探讨 分享 的 相关 话题 专家 释疑 武汉 新型 冠状病毒 与 sars 相似 程度 为 八十 持续 传人 风险 较 低 中华民族 传统节日 春节 🔅 🌱 将近 请 注意 饮食习惯 安全的 预防 伤害 o 专家 释疑 武汉 新型 冠状病毒 与 sars 相似 程度 为 八十 持续 传人 风险 较 低,2020-01-17 20:15:00,0,0,1,__label__positive,0.76066,0.6151,0.0013800000000000002,0.76066,2.0,"武汉, sars, 相似, o, 专家","Wuhan, sars, similar, o, expert"
286,430,-1,冠状病毒,2020-01-17,口罩 安排 上 了 我 看 非典 纪录片 当年 山西 一个 女生 去 广东 玩 担心 那边 的 肺炎 她 妈妈 认识 的 媒体 朋友 说 肺炎 都 是 造谣 的 爸爸 上网 查 网友 说 不用 怕 没事 最后 女生 去 了 广东 广东 的 司机 说 不怕 没事 的 我们 连 口罩 都 不带 最后 那个 女生 回 山西 后 全家 感染 除了 武汉 都 在 恐,2020-01-17 16:35:00,5,0,0,__label__neutral,0.01973,0.23936,0.44554,0.44554,4.0,"发现, 患者, 泰国, 确诊, 第二例","Find, patient, Thailand, Confirmed diagnosis, Second case"
287,431,-1,冠状病毒,2020-01-17,泰国 发现 第二例 新型 冠状病毒 肺炎 患者 etc 市值 超越 tron 进入 前十 截至 一月 十七日 十八 时 据 coinmarketcap 资料 伴随 etc 今日 出现 放量 拉升 其 市值 超越 tron 进入 前十 现高达 十一 七十六 亿美元 etc 在 boboo 现报 十 四 美元 二十四 小时 涨幅 三十 三十四,2020-01-17 20:15:00,0,4,7,__label__neutral,0.13662,0.04887,0.83115,0.83115,0.0,"武汉, 发现, 泰国, 患者, 第二例","Wuhan, Find, Thailand, patient, Second case"
288,432,-1,冠状病毒,2020-01-17,有 几个 妈妈 私信 我 过年 准备 带 孩子 来 武汉 有 什么 好玩 的 让 我 给 推荐 一下 额 我 个人 建议 今年过年 期间 别来 武汉 玩 了 一方面 是 武汉 正 处于 关 冠状病毒 肺炎 的 敏感期 不论 官方 称 这个 疫情 控制 的 如何 因为 是 带 孩子 来 玩 所以 哪怕 只有 零 一 的 几率 被 传染 我 也 建议 别带 孩子 来 孩子 年龄 小 抵抗力 弱 特殊 时期 ​ ,2020-01-17 20:14:00,0,15,37,__label__negative,1e-05,0.98868,0.0901,0.98868,3.0,"武汉, 口罩, 发现, 患者, 泰国","Wuhan, Mask, Find, patient, Thailand"
289,433,-1,冠状病毒,2020-01-17,泰国 发现 第二例 新型 冠状病毒 肺炎 患者 一月 十七日 泰国 公共 卫生部 发布 消息 称 发现 第二例 新型 冠状病毒 病例 患者 是 一名 七十四岁 中国 女子 从 武汉 搭乘 飞机 前往 曼谷 泰国 卫生部 发言人 称该 女子 病情 稳定 情况 良好 这是 中国 境外 发现 的 第三例 新型 冠状病毒 确诊 病例,2020-01-17 20:13:00,1,2,2,__label__neutral,0.08037000000000001,0.04086,0.8634,0.8634,4.0,"发现, 患者, 泰国, 确诊, 第二例","Find, patient, Thailand, Confirmed diagnosis, Second case"
290,434,-1,冠状病毒,2020-01-17,腾讯 新闻 专家 释疑 武汉 新型 冠状病毒 与 sars 相似 度 八十 ％ 持续 传人 风险 低 o 专家 释疑 武汉 新型 冠状病毒 与 sars 相似 度 八十 ％ 持续 传人 风险 低,2020-01-17 20:13:00,0,2,0,__label__negative,0.21208,0.9973,1e-05,0.9973,2.0,"武汉, sars, 相似, o, 专家","Wuhan, sars, similar, o, expert"
291,436,-1,冠状病毒,2020-01-17,做足 的 　 　 再说 韩国 人 在 礼仪 这 一块 确实 晨涛 若山 非常 的 看重 　 　 别 客气 我 在 韩国 时 也 曾 受 你 的 热情 款 泰国 发现 一例 新型 冠状病毒 病例,2020-01-17 20:13:00,0,0,0,__label__negative,0.0016600000000000002,0.6723399999999999,0.6442399999999999,0.6723399999999999,1.0,"泰国, 发现, 患者, 第二例, 病毒","Thailand, Find, patient, Second case, virus"
292,437,-1,冠状病毒,2020-01-17,刚刚 刷到 慌 的 一批 作为 一个 武汉 人 从 发现 病例 到 现在 出门 没做 过 任何 防御 措施 专家 释疑 新型 冠状病毒 与 sars 相似 程度 为 八十 持续 传人 风险 较 低 o,2020-01-17 20:12:00,0,0,1,__label__positive,0.7663,0.018000000000000002,0.07808999999999999,0.7663,2.0,"武汉, sars, 相似, o, 专家","Wuhan, sars, similar, o, expert"
293,438,-1,冠状病毒,2020-01-17,泰国 发现 第二例 新型 冠状病毒 肺炎 患者 其实 二千 零 二十年 已经 过 完了 系 七十四岁 中国籍 女子 据 路透社 援引 泰国 公共 卫生部 十七日 消息 已 发现 第二例 二千 零 一十九 ncov 确诊 病例 这 是 在 中国 境外 发现 的 第三例 新型 冠状病毒 确诊 病例 患者 是 一名 七十四岁 的 女性,2020-01-17 20:12:00,0,0,0,__label__neutral,0.018000000000000002,0.47659,0.56219,0.56219,4.0,"发现, 患者, 泰国, 确诊, 第二例","Find, patient, Thailand, Confirmed diagnosis, Second case"
294,439,-1,冠状病毒,2020-01-17,转发 微,2020-01-17 16:35:00,0,0,0,__label__neutral,1e-05,0.10089,0.99898,0.99898,2.0,"武汉, sars, 相似, o, 专家","Wuhan, sars, similar, o, expert"
295,440,-1,冠状病毒,2020-01-17,今天 在 知乎 看到 不明 原因 肺炎 的 判定 卢洪洲 教授 需 同时 满足 一 发热 腋下 体温 ≥ 三十八 二 具有 肺炎 的 影像学 特征 三 发病 早期 白细胞 总数 降低 或 正常 或 淋巴细胞 分类 计数 减少 四 经 规范 抗菌 药物 治疗 三 五天 病情 无 明显改善 或 呈 进行性 加重 满足 这 四个 临床 特征 后 临床 上 才 会 考虑 不明 原因 肺炎,2020-01-17 16:35:00,0,0,0,__label__neutral,0.14035,0.0901,0.45327,0.45327,1.0,"泰国, 发现, 患者, 第二例, 病毒","Thailand, Find, patient, Second case, virus"
296,441,-1,冠状病毒,2020-01-17,保护 好 自己 才能 保护 好 香港 加油 香港 有 港警 香港 一定 行 中国 与 亚美尼亚 全面 免签 泰国 发现 第二例 新型 冠状病毒 肺炎 患者,2020-01-17 20:12:00,1,0,14,__label__neutral,0.00477,0.2069,0.78794,0.78794,1.0,"泰国, 发现, 患者, 第二例, 病毒","Thailand, Find, patient, Second case, virus"
297,446,-1,冠状病毒,2020-01-17,还是 得 转发 真的 感觉 除了 武汉 都 在 恐慌,2020-01-17 16:35:00,0,0,0,__label__negative,1e-05,0.92193,0.25092,0.92193,3.0,"武汉, 口罩, 发现, 患者, 泰国","Wuhan, Mask, Find, patient, Thailand"
298,447,-1,冠状病毒,2020-01-17,泰国 发现 第二例 新型 冠状病毒 肺炎 患者 系一 七十四岁 中国籍 女子 一月 十七日 泰国 公共 卫生部 在 其 官网 公布 已 发现 第二例 二千 零 一十九 ncov 确诊 病例 患者 是 一名 七十四岁 中国籍 女子 这 也 是 在 中国 境外 发现 的 第三例 新型 冠状病毒 确诊 病例 目前 两名 确诊 患者 在 负 气压 隔离病房 中 o,2020-01-17 20:10:00,0,0,0,__label__neutral,0.02097,0.03848,0.9698,0.9698,4.0,"发现, 患者, 泰国, 确诊, 第二例","Find, patient, Thailand, Confirmed diagnosis, Second case"
299,448,-1,冠状病毒,2020-01-17,泰国 发现 第二例 新型 冠状病毒 肺炎 患者 医院 楼下 就 住 着 病人 科室 也 没有 什么 治疗 做 病人 也 没有 几个 了 还要 把 我们 留在 这 每天 上班 而 自己 在家 玩 手机 🤬 🤬 🤬 坐 着 就 拿 这么 多 工资 良心 不痛 吗 不他们 怎么 会 有 良心,2020-01-17 20:10:00,0,0,0,__label__negative,0.00328,0.8222,0.30076,0.8222,1.0,"泰国, 发现, 患者, 第二例, 病毒","Thailand, Find, patient, Second case, virus"
300,450,-1,冠状病毒,2020-01-17,对 的 按 道理 就是 在 国内 扩散 开 了 才 正常 国内 只有 武汉 出现 了 其他 的 都 是 输出 病例 然后 就 这么 多人 怀疑 政府 公信力 的 问题 难道 大家 觉得 这个 病毒 就是 应该 在 国内 扩散 开来 了 才 正常 才 是 他们 所 希望 的 吗 这种 思维 更 某些 歹毒 的 群体 很,2020-01-17 16:35:00,0,0,0,__label__negative,0.01407,0.91965,0.0117,0.91965,3.0,"武汉, 口罩, 发现, 患者, 泰国","Wuhan, Mask, Find, patient, Thailand"
301,451,-1,冠状病毒,2020-01-17,泰国 发现 第二例 新型 冠状病毒 肺炎 患者 搞不懂 为什么 病毒 传 的 都 是 武汉 人 都 跨国 了 得病 的 还是 武汉 人 从 武汉 到 国外 的 路上 又 有 多少 人 感染,2020-01-17 20:10:00,1,51,83,__label__neutral,0.00396,0.21208,0.7431800000000001,0.7431800000000001,0.0,"武汉, 发现, 泰国, 患者, 第二例","Wuhan, Find, Thailand, patient, Second case"
302,452,-1,冠状病毒,2020-01-17,泰国 发现 第二例 新型 冠状病毒 肺炎 患者 吴京 把 道具 蛋糕 给 吃 了 系 七十四岁 中国籍 女子 据 路透社 援引 泰国 公共 卫生部 十七日 消息 已 发现 第二例 二千 零 一十九 ncov 确诊 病例 这 是 在 中国 境外 发现 的 第三例 新型 冠状病毒 确诊 病例 患者 是 一名 七十四岁 的 女性,2020-01-17 20:09:00,0,0,0,__label__neutral,0.08511,0.12253,0.6151,0.6151,4.0,"发现, 患者, 泰国, 确诊, 第二例","Find, patient, Thailand, Confirmed diagnosis, Second case"
303,453,-1,冠状病毒,2020-01-17,新闻 一 一 二千 零 二十万 零 一百一十 五 新型 冠状病毒 肺炎 疫情 防控 进行 时 本期 节目 主要 内容 十五日 上午 武汉市 卫生 健康 委员会 发布 通报 就 新型 冠状病毒 感染 的 肺炎 疫情 回答 相关 疑问 疫情 出现 的 最新 变化 该 如何 对待 十六天 九份 通报 是否 有效 回应 了 公众 关切 更 多 内容 敬请 关注 新闻 一 一 二千 零 二十万 零 一百一十 五 新型 ​ ,2020-01-17 20:07:00,0,0,0,__label__neutral,0.32083,0.00448,0.7982,0.7982,0.0,"武汉, 发现, 泰国, 患者, 第二例","Wuhan, Find, Thailand, patient, Second case"
304,457,-1,冠状病毒,2020-01-17,泰国 发现 第二例 新型 冠状病毒 肺炎 患者 前 几天 去 汉口站 无论是 地铁 还是 火车站 没几个 人 戴 口罩 我 真的 服,2020-01-17 20:07:00,0,0,0,__label__neutral,0.00339,0.39235,0.7431800000000001,0.7431800000000001,3.0,"武汉, 口罩, 发现, 患者, 泰国","Wuhan, Mask, Find, patient, Thailand"
305,458,-1,冠状病毒,2020-01-17,泰国 发现 第二例 新型 冠状病毒 肺炎 患者 开车 进 故宫 系 七十四岁 中国籍 女子 据 路透社 援引 泰国 公共 卫生部 十七日 消息 已 发现 第二例 二千 零 一十九 ncov 确诊 病例 这 是 在 中国 境外 发现 的 第三例 新型 冠状病毒 确诊 病例 患者 是 一名 七十四岁 的 女性,2020-01-17 20:07:00,0,0,0,__label__neutral,0.04744,0.14806,0.77185,0.77185,4.0,"发现, 患者, 泰国, 确诊, 第二例","Find, patient, Thailand, Confirmed diagnosis, Second case"
306,464,-1,冠状病毒,2020-01-17,武汉 肺炎 死亡者 为 感染 新型 冠状病毒 排除 在 已知 六种 病毒 之外 还有 两种 一个 是 三年 的 非典 和 中东 呼吸系统 综合 冠状病毒 而 这次 武汉 出现 的 病毒 和 这 六种 是 不同 的 o,2020-01-17 20:06:00,0,0,0,__label__neutral,0.00713,0.23372,0.7058,0.7058,2.0,"武汉, sars, 相似, o, 专家","Wuhan, sars, similar, o, expert"
307,465,-1,冠状病毒,2020-01-17,接近 过年 了 小伙伴 们 要 多加 防范,2020-01-17 16:35:00,0,0,0,__label__negative,1e-05,0.5234300000000001,0.47659,0.5234300000000001,2.0,"武汉, sars, 相似, o, 专家","Wuhan, sars, similar, o, expert"
308,466,-1,冠状病毒,2020-01-17,泰国 发现 第二例 新型 冠状病毒 肺炎 患者 求问 潜伏期 大概 是 多久 呀,2020-01-17 20:05:00,0,0,0,__label__neutral,0.0016600000000000002,0.32083,0.92631,0.92631,1.0,"泰国, 发现, 患者, 第二例, 病毒","Thailand, Find, patient, Second case, virus"
309,467,-1,冠状病毒,2020-01-17,关,2020-01-17 16:35:00,0,0,0,__label__negative,1e-05,1.00001,1e-05,1.00001,3.0,"武汉, 口罩, 发现, 患者, 泰国","Wuhan, Mask, Find, patient, Thailand"
310,468,-1,冠状病毒,2020-01-17,泰国 发现 第二例 新型 冠状病毒 肺炎 患者 系 中国 女子 据 路透社 报道 泰国 公共 卫生部 部长 阿努丁 十七日 表示 该国 已 发现 第二例 新型 冠状病毒 确诊 病例 患者 是 一名 七十四岁 中国籍 女子 报道 称 最新 一起 确诊 患者 来自 武汉 泰国 卫生部 官员 称 这名 七十四岁 的 女性 十三日 抵达 泰国 后 即 被 隔离 后来 发现 被 感染 阿努丁 说 这二 ​ ,2020-01-17 20:05:00,0,0,0,__label__neutral,0.12253,0.03734,0.8634,0.8634,4.0,"发现, 患者, 泰国, 确诊, 第二例","Find, patient, Thailand, Confirmed diagnosis, Second case"
311,469,-1,冠状病毒,2020-01-17,香港 海豚 听说 出现 了 人 那么 大 的 蟑螂 浮上来 看看 中国 与 亚美尼亚 全面 免签 泰国 发现 第二例 新型 冠状病毒 肺炎 患者 l 古玩 哥 的 微博 视频,2020-01-17 20:05:00,0,1,13,__label__negative,0.0223,0.39982,0.30076,0.39982,1.0,"泰国, 发现, 患者, 第二例, 病毒","Thailand, Find, patient, Second case, virus"
312,471,-1,冠状病毒,2020-01-17,泰 当局 发现 第二例 新型 冠状病毒 肺炎 患者 系 中国 女子 二千 零 二十 一 十七 十九 十一 来源 中国 新闻网 o,2020-01-17 20:04:00,0,0,1,__label__neutral,0.0716,0.14806,0.44554,0.44554,2.0,"武汉, sars, 相似, o, 专家","Wuhan, sars, similar, o, expert"
313,472,-1,冠状病毒,2020-01-17,泰国 发现 第二例 武汉 新型 冠状病毒 肺炎 患者 七十四岁 中国籍 女子 一月 十七日 泰国 公共 卫生部 在 其 官网 公布 已 发现 第二例 二千 零 一十九 ncov 确诊 病例 患者 是 一名 七十四岁 中国籍 女子 这 也 是 在 中国 境外 发现 的 第三例 新型 冠状病毒 确诊 病例 目前 两名 确诊 患者 在 负 气压 隔离病房 中 接受 治疗 两人 之间 发病 并 无 相关性 湖北 之 ​ ,2020-01-17 20:03:00,13,10,64,__label__neutral,0.0716,0.03022,0.90466,0.90466,4.0,"发现, 患者, 泰国, 确诊, 第二例","Find, patient, Thailand, Confirmed diagnosis, Second case"
314,473,-1,冠状病毒,2020-01-17,艹 啊 作为 一个 武汉 人 现在 瑟瑟 发抖 已经 出门 就 带 口罩 了 第一次 感觉 死亡 那么,2020-01-17 16:35:00,0,0,1,__label__negative,1e-05,0.7491,0.51563,0.7491,0.0,"武汉, 发现, 泰国, 患者, 第二例","Wuhan, Find, Thailand, patient, Second case"
315,474,-1,冠状病毒,2020-01-17,病毒 也 要 听 d 指挥 不能 有 例外 只 出国 的 病毒 辛苦,2020-01-17 16:35:00,0,0,0,__label__negative,0.58511,0.97839,1e-05,0.97839,2.0,"武汉, sars, 相似, o, 专家","Wuhan, sars, similar, o, expert"
316,475,-1,冠状病毒,2020-01-17,泰国 发现 第二例 新型 冠状病毒 肺炎 患者 系 中国 女子 据 路透社 报道 泰国 公共 卫生部 部长 阿努丁 十七日 表示 该国 已 发现 第二例 新型 冠状病毒 确诊 病例 患者 是 一名 七十四岁 中国籍 女子,2020-01-17 20:01:00,0,1,5,__label__neutral,0.14415999999999998,0.008329999999999999,0.95916,0.95916,4.0,"发现, 患者, 泰国, 确诊, 第二例","Find, patient, Thailand, Confirmed diagnosis, Second case"
317,477,-1,冠状病毒,2020-01-17,泰国 发现 第二例 新型 冠状病毒 肺炎 患者 sars 之前 就是 被 压下去 了 的 害怕,2020-01-17 20:02:00,0,0,1,__label__negative,0.00462,0.90732,0.03848,0.90732,1.0,"泰国, 发现, 患者, 第二例, 病毒","Thailand, Find, patient, Second case, virus"
318,478,-1,冠状病毒,2020-01-17,这是 一条 置顶 原 id 榛子 姐姐 要 上岸 没事 记录 一下 生活 二千 零 二十 一 十八 应该 要 放弃 二百 二十二 tt 的 演唱会 了 可能 会 后悔 吧 但是 先 让 自己 更好 吧 二千 零 二十 一 十九 今天 换 了 一个 很 喜欢的 发色 开心 二千 零 二十 一 二十二 这个 节骨眼 上 感冒 了 🤯 还好 没有 发烧 我 也 是 服 了 幸好 我家 这边 没有 感染 病例 大家 出 ​ ,2020-01-17 20:01:00,0,1,3,__label__neutral,0.055020000000000006,0.22817,0.28778000000000004,0.28778000000000004,3.0,"武汉, 口罩, 发现, 患者, 泰国","Wuhan, Mask, Find, patient, Thailand"
319,483,-1,冠状病毒,2020-01-17,泰国 发现 第二例 新型 冠状病毒 肺炎 患者,2020-01-17 20:01:00,0,0,0,__label__neutral,0.0006,0.05836,0.99332,0.99332,4.0,"发现, 患者, 泰国, 确诊, 第二例","Find, patient, Thailand, Confirmed diagnosis, Second case"
320,485,-1,冠状病毒,2020-01-17,冠状病毒 你们 连谈 都 不敢 谈 老子 健康 过,2020-01-17 15:40:00,0,0,0,__label__negative,0.0029,0.99554,1e-05,0.99554,4.0,"发现, 患者, 泰国, 确诊, 第二例","Find, patient, Thailand, Confirmed diagnosis, Second case"
321,486,-1,冠状病毒,2020-01-17,泰国 发现 第二例 新型 冠状病毒 肺炎 患者 我靠 我 不敢 去 武汉 了 能 不能不 开学 了,2020-01-17 20:01:00,0,5,1,__label__neutral,1e-05,0.0716,0.98868,0.98868,4.0,"发现, 患者, 泰国, 确诊, 第二例","Find, patient, Thailand, Confirmed diagnosis, Second case"
322,487,-1,冠状病毒,2020-01-17,这样 让 我 怀疑 国内 真的 没有 其他 案例 吗,2020-01-17 16:35:00,0,0,0,__label__negative,1e-05,1.00001,0.00161,1.00001,3.0,"武汉, 口罩, 发现, 患者, 泰国","Wuhan, Mask, Find, patient, Thailand"
323,488,-1,冠状病毒,2020-01-17,细思极 恐 我 的 感冒 还 没好额 刚刚 还 上火 流鼻,2020-01-17 16:35:00,0,0,0,__label__negative,1e-05,0.99961,1e-05,0.99961,1.0,"泰国, 发现, 患者, 第二例, 病毒","Thailand, Find, patient, Second case, virus"
324,493,-1,冠状病毒,2020-01-17,泰国 发现 第二例 新型 冠状病毒 肺炎 患者 一月 十七日 泰国 公共 卫生部 发布 消息 称 发现 第二例 新型 冠状病毒 病例 患者 是 一名 七十四岁 中国 女子 从 武汉 搭乘 飞机 前往 曼谷 泰国 卫生部 发言人 称该 女子 病情 稳定 情况 良好 这是 中国 境外 发现 的 第三例 新型 冠状病毒 确诊 病例 ​ ​,2020-01-17 19:59:00,0,0,0,__label__neutral,0.23936,0.02097,0.73717,0.73717,4.0,"发现, 患者, 泰国, 确诊, 第二例","Find, patient, Thailand, Confirmed diagnosis, Second case"
325,495,-1,冠状病毒,2020-01-17,世卫 组织 武汉 肺炎 可能 在 中国 其他 地区 及 他国 发生 日本 卫生部 一月 十六日 表示 蔡徐坤 想 拜师 学 扔 纸飞机 日本 已 确认 其 首例 由 中国 武汉 发现 的 新 冠状病毒 引起 的 肺炎 世卫 组织 葛西武 takeshi kasai 说 在 武汉 发生 的 事情 可能 会 在 中国 其他 地区 或 其他 国家,2020-01-17 19:59:00,0,0,0,__label__positive,0.25684,0.04887,0.20182,0.25684,0.0,"武汉, 发现, 泰国, 患者, 第二例","Wuhan, Find, Thailand, patient, Second case"
326,501,-1,冠状病毒,2020-01-17,最新 指南 who 二千 零 一十九 新型 冠状病毒 指南 中文 首译版 新鲜出炉 最新 指南 who 二千 零 一十九 新型 冠状病毒 指南 中文 首译版 新鲜出炉 o 最新 指南 who 二千 零 一十九 新型 冠状病毒 指南 中文 首译版 新鲜出炉,2020-01-17 19:58:00,0,0,0,__label__negative,0.05034,0.9698,0.02443,0.9698,2.0,"武汉, sars, 相似, o, 专家","Wuhan, sars, similar, o, expert"
327,504,-1,冠状病毒,2020-01-17,我 有时候 很 看不懂 网民 们 的 g,2020-01-17 16:35:00,0,0,0,__label__negative,0.00048,0.98202,0.00233,0.98202,2.0,"武汉, sars, 相似, o, 专家","Wuhan, sars, similar, o, expert"
328,506,-1,冠状病毒,2020-01-17,泰国 发现 第二例 新型 冠状病毒 肺炎 患者 怎么 都 在 说 武汉 人不慌 怎么 才 叫 慌 二十四 小时 实时 更新 微博报 体温 到处 喊 才 叫 慌 吗 慌 有鬼 用 做好 防护 不就 好 了 我们 公司 都 配 了 抑菌 洗手液 板蓝根 口罩 还要 我们 怎么样,2020-01-17 19:54:00,3,19,55,__label__neutral,0.15204,0.08511,0.56986,0.56986,0.0,"武汉, 发现, 泰国, 患者, 第二例","Wuhan, Find, Thailand, patient, Second case"
329,507,-1,冠状病毒,2020-01-17,泰国 确诊 第二例 新型 冠状病毒 病例 卫生部 无 疫情 爆发 迹象 泰国 公共 卫生部 十七日 表示 已 发现 第二例 二千 零 一十九 ncov 即 新型 冠状病毒 确诊 病例 o,2020-01-17 19:54:00,0,0,0,__label__neutral,0.7186,1e-05,0.98868,0.98868,4.0,"发现, 患者, 泰国, 确诊, 第二例","Find, patient, Thailand, Confirmed diagnosis, Second case"
330,508,-1,冠状病毒,2020-01-17,科普 一下 常见 肺炎 的 发病 机制 一月 十七日 泰国 发现 第二例 新型 冠状病毒 肺炎 患者 患者 是 一名 七十四岁 中国籍 女子 这 也 是 在 中国 境外 发现 的 第三例 新型 冠状病毒 确诊 病例 目前 两名 确诊 患者 在 负 气压 隔离病房 中 接受 治疗 两人 之间 发病 并 无 相关性 via l 医 视频 的 微博 视频 ​ ​ ​,2020-01-17 19:52:00,1,2,1,__label__neutral,0.055020000000000006,0.16028,0.6442399999999999,0.6442399999999999,4.0,"发现, 患者, 泰国, 确诊, 第二例","Find, patient, Thailand, Confirmed diagnosis, Second case"
331,509,-1,冠状病毒,2020-01-17,看哈评,2020-01-17 16:35:00,1,0,0,__label__negative,1e-05,1.00001,1e-05,1.00001,4.0,"发现, 患者, 泰国, 确诊, 第二例","Find, patient, Thailand, Confirmed diagnosis, Second case"
332,510,-1,冠状病毒,2020-01-17,二千 零一 十九年 十一月 二十一日 泰国 发现 第二例 新型 冠状病毒 肺炎 患者 湖南 李先生 送 五岁 女儿 上 幼儿园 出于 爱 子之心 他 不放心 地 站 在 教室 外看 监控 屏 结果 看到 令 他 非常 愤怒的 一幕 幼儿园 老师 竟然 打 了 女儿 一 耳光 他 怒 不可 竭 冲 进 教室 回扇 了 老师 一巴掌 他 有 直,2020-01-17 19:52:00,0,0,0,__label__negative,0.05186,0.7982,0.10972,0.7982,1.0,"泰国, 发现, 患者, 第二例, 病毒","Thailand, Find, patient, Second case, virus"
333,511,-1,冠状病毒,2020-01-17,真的 很 危险 呐 有点 慌 泰国 发现 第二例 新型 冠状病毒 肺炎 患者,2020-01-17 19:52:00,0,3,4,__label__neutral,0.00044,0.27514,0.98902,0.98902,4.0,"发现, 患者, 泰国, 确诊, 第二例","Find, patient, Thailand, Confirmed diagnosis, Second case"
334,512,-1,冠状病毒,2020-01-17,一月 十七日 泰国 公共 卫生部 在 其 官网 公布 已 发现 第二例 二千 零 一十九 ncov 确诊 病例 患者 是 一名 七十四岁 中国籍 女子 这 也 是 在 中国 境外 发现 的 第三例 新型 冠状病毒 确诊 病例 目前 两名 确诊 患者 在 负 气压 隔离病房 中 接受 治疗 两人 之间 发病 并 无 相关性,2020-01-17 19:52:00,0,0,1,__label__neutral,0.0223,0.13297,0.78794,0.78794,4.0,"发现, 患者, 泰国, 确诊, 第二例","Find, patient, Thailand, Confirmed diagnosis, Second case"
335,513,-1,冠状病毒,2020-01-17,泰国 发现 第二例 新型 冠状病毒 肺炎 患者 快 过年 了 愿 大家 都 健健康康 平平安安,2020-01-17 19:51:00,0,0,1,__label__positive,0.3346,0.17782,0.12941,0.3346,1.0,"泰国, 发现, 患者, 第二例, 病毒","Thailand, Find, patient, Second case, virus"
336,514,-1,冠状病毒,2020-01-17,湾 湾 的 一对 情侣 去 按摩 在 同一 室内 仅 隔 一 布帘 距离 只有 三步 女子 竟然 被 越南籍 阮姓 技师 强奸 了 过 了 一天 才 在 男友 陪同 下 报案 说 是因为 自己 太 害怕 了 所以 不敢 求救 警方 将 阮姓 男子 带回 调查 没有 想到 嫌疑人 是 一名 逃逸 外劳 人员 此事 引发 网友 激烈 讨论 对 女 受害者 全程 不敢 呼救 的 做法 感到 无法 理解 怀疑 ​ ,2020-01-17 19:51:00,46,192,1484,__label__neutral,0.0117,0.26895,0.66542,0.66542,4.0,"发现, 患者, 泰国, 确诊, 第二例","Find, patient, Thailand, Confirmed diagnosis, Second case"
337,519,-1,冠状病毒,2020-01-17,泰国 发现 第二例 新型 冠状病毒 肺炎 患者 泰国 现 第二 起 武汉 肺炎 确诊 病例 泰国 今 十七日 公布 该国 发现 第二宗 武汉 肺炎 个案 是 一名 七十四岁 来自 中国 武汉市 的 女子 她 在 十三日 抵达 泰国 后 已 被 隔离 泰国 第一 宗 武汉 肺炎 个案 发生 在 一月 十三日 政府 卫生部门 当天 表示 当地 发现 首宗 武汉 新型 冠状病毒 的 感染 个案 患者 ​ ,2020-01-17 19:50:00,2,0,3,__label__neutral,0.03211,0.01592,0.97839,0.97839,4.0,"发现, 患者, 泰国, 确诊, 第二例","Find, patient, Thailand, Confirmed diagnosis, Second case"
338,520,-1,冠状病毒,2020-01-17,一本 非常 有趣的 历史 书 讲述 了 各个 文明 或 帝国 因何 衰败 消亡 的 故事 今天 是 北方 小年 明天 是 南方 小年 不知 其中 有何 典故 今天 换 股鲁抗 医药 泰国 又 发现 了 冠状病毒 肺炎 感染者 希望 不要 像 当年 sars 一样 稳妥 期间 买 了 一千多块 钱 的 三 m 口罩 备着 希望 用不上,2020-01-17 19:49:00,0,0,0,__label__negative,0.0421,0.8634,0.01497,0.8634,3.0,"武汉, 口罩, 发现, 患者, 泰国","Wuhan, Mask, Find, patient, Thailand"
