,id,label,keyword,date,content,time,forward,comment,like,predict,__label__positive,__label__negative,__label__neutral,predict_score,topic,topic_keyword,topic_keyword_en
295,460,-1,冠状病毒,2020-01-18,武汉 新增 四例 新型 冠状病毒 肺炎 病例 马上 要 过年 了 希望 大家 平安 顺遂 希望 早点 研发 出 预防 疫苗,2020-01-18 15:31:00,0,0,2,__label__negative,0.09536,0.96591,1e-05,0.96591,2.0,"武汉, 新增, 四例, 病例, 口罩","Wuhan, New, Four cases, Case, Mask"
296,461,-1,冠状病毒,2020-01-18,截止 目前 香港 台湾 泰国 等 地 相继 发现 武汉 冠状病毒 患者 按 这个 概率 大陆 不应该 只是 武汉市 一个 地方 有 患者 是否 有 发现 类似 病毒 没报告 或者 瞒报 需要 密切 关注,2020-01-18 09:38:00,0,0,0,__label__negative,0.01913,0.85967,0.03411,0.85967,4.0,"病例, 武汉, 新增, 四例, 感染","Case, Wuhan, New, Four cases, infection"
297,462,-1,冠状病毒,2020-01-18,武汉 新增 四例 新型 冠状病毒 肺炎 病例 我 好奇 这个 新型 冠状病毒 命名 为什么 是不是 还 没有 大佬 给 其 命名 我 也 好奇 它 的 结构 基因 还有 肺部 ct 的 改变 临床 症状 及 治疗 内科 书 是不是 又 要 新增 知识点 了,2020-01-18 15:29:00,0,8,9,__label__negative,0.00421,0.4922,0.39235,0.4922,2.0,"武汉, 新增, 四例, 病例, 口罩","Wuhan, New, Four cases, Case, Mask"
298,463,-1,冠状病毒,2020-01-18,泰国 发现 第二例 新型 冠状病毒 肺炎 患者 一月 十七日 泰国 公共 卫生部 在 其 官网 公布 已 发现 第二例 二千 零 一十九 ncov 确诊 病例 患者 是 一名 七十四岁 中国籍 女子 这 也 是 在 中国 境外 发现 的 第三例 新型 冠状病毒 确诊 病例 目前 两名 确诊 患者 在 负 气压 隔离病房 中 接受 治疗 两人 之间 发病 并 无 相关性 o 泰国 发现 第二例 武汉 新型 冠状病毒 肺炎 患者 ​ ,2020-01-18 15:29:00,0,0,0,__label__neutral,0.07808999999999999,0.0276,0.8962600000000001,0.8962600000000001,4.0,"病例, 武汉, 新增, 四例, 感染","Case, Wuhan, New, Four cases, infection"
299,465,-1,冠状病毒,2020-01-18,引起 此次 疫情 的 新型 冠状病毒 不同于 已 发现 的 人类 冠状病毒 对 该 病毒 的 深入 了解 需要 进一步 科学研究,2020-01-09 08:31:00,0,0,0,__label__negative,0.10376,0.2069,0.04604,0.2069,2.0,"武汉, 新增, 四例, 病例, 口罩","Wuhan, New, Four cases, Case, Mask"
300,466,-1,冠状病毒,2020-01-18,武汉 新增 四例 新型 冠状病毒 肺炎 病例 马上 要 过年 了 求 平安 顺遂 🙏 过年 的 歌,2020-01-18 15:26:00,0,0,3,__label__negative,0.00084,0.99776,0.00092,0.99776,2.0,"武汉, 新增, 四例, 病例, 口罩","Wuhan, New, Four cases, Case, Mask"
301,472,-1,冠状病毒,2020-01-18,武汉 新增 四例 新型 冠状病毒 肺炎 病例 你们 继续 粉红 我 选择 保命,2020-01-18 15:25:00,0,0,6,__label__negative,1e-05,0.99904,0.00759,0.99904,2.0,"武汉, 新增, 四例, 病例, 口罩","Wuhan, New, Four cases, Case, Mask"
302,473,-1,冠状病毒,2020-01-18,八百 七十六 整 点儿 资讯 此刻 你 需要 知道 的 新版 个人 征信 报告 明日 上线 　 自 二千 零 二十年 一月 十九日 起 中国人民银行 征信 中心 将 面向社会 公众 和 金融机构 提供 二代 格式 信用 报告 查询 服务 水电费 信息 尚未 纳入 但 新增 了 最近 二年 的 逾期 金额 个人信息 还 增加 展示 个人 为 企业 提供 担保 就业 状况 国籍 联系 电 ​ ,2020-01-18 15:24:00,0,0,1,__label__positive,0.71224,0.13297,0.03848,0.71224,4.0,"病例, 武汉, 新增, 四例, 感染","Case, Wuhan, New, Four cases, infection"
303,474,-1,冠状病毒,2020-01-18,武汉 新增 四例 新型 冠状病毒 肺炎 病例 有 买 了 明天 早上 的 票 回 湖北 的 还 在 纠结 的 深圳 朋友 吗,2020-01-18 15:24:00,0,10,3,__label__negative,0.00041,0.99653,0.00171,0.99653,2.0,"武汉, 新增, 四例, 病例, 口罩","Wuhan, New, Four cases, Case, Mask"
304,475,-1,冠状病毒,2020-01-18,新型 冠状病毒 来 同济 医院 开点 药 感觉 医院 人比 平时 少 了 很多 戴 口罩 的 人 增加 明显 网传 的 人满为患 没有 看到 全副武装 的 医护人员 也 还 没有 看到 也许 呼吸 内科 如网 传 但 我 也 不会 为了 好奇 去 冒险 微博上 看看 感觉 武汉 人人 都 是 毒源 个个 都 是 肺炎 现实 中 武汉 依然 有条不紊 总 有些 一惊 一 乍 的 外地人 需要 宣扬 ​ ,2020-01-18 15:24:00,0,10,12,__label__negative,0.0927,0.58511,0.03515,0.58511,2.0,"武汉, 新增, 四例, 病例, 口罩","Wuhan, New, Four cases, Case, Mask"
305,476,-1,冠状病毒,2020-01-18,如何 预防 新型 冠状病毒 感染 这 八 点 你 应该 知道 一 什么 是 冠状病毒 和 新型 冠状病毒 冠状病毒 是 一大 类病毒 已知 会 引起 疾病 患者 表现 从 普通 感冒 到 重症 肺部 感染 不不同 例如 中东 呼吸 综合症 mers 和 严重 急性 呼吸 综合症 sars 新型 冠状病毒 ncov 是 一种 先前 尚未 在 人类 中 发现 的 新型 冠状病毒 ​ ,2020-01-18 15:23:00,3,3,7,__label__negative,0.03965,0.7663,0.05034,0.7663,4.0,"病例, 武汉, 新增, 四例, 感染","Case, Wuhan, New, Four cases, infection"
306,478,-1,冠状病毒,2020-01-18,专家 释疑 武汉 新型 冠状病毒 与 sars 相似 度 八十 ％ 持续 传人 风险 低 o 专家 释疑 武汉 新型 冠状病毒 与 sars 相似 度 八十 ％ 持续 传人 风险 低,2020-01-18 15:21:00,0,0,1,__label__negative,0.22271,0.99761,1e-05,0.99761,1.0,"武汉, 美国, 机场, 旅客, 病毒","Wuhan, United States, airport, Passenger, virus"
307,479,-1,冠状病毒,2020-01-18,武汉 新增 四例 新型 冠状病毒 肺炎 病例 治愈 出院 三,2020-01-18 07:05:00,0,0,0,__label__negative,1e-05,0.99195,0.0067,0.99195,4.0,"病例, 武汉, 新增, 四例, 感染","Case, Wuhan, New, Four cases, infection"
308,480,-1,冠状病毒,2020-01-18,入手 了 两支 pbx 隔离 乳 工作 一瓶 在家 一瓶 这个 pbx 隔离 乳 第一次 用 还是 闺蜜 的 后来 觉得 不错 😊 我 就 一下 入手 了 两瓶 因为 我 工作 和 家里 离 的 远 😉 平时 离 哪近 就 住 哪 了 用 着 觉得 还 可以 隔离 效果 很好 😄 可以 说 是 平价 好用 的 吧 挺不错 的 😊 魏大勋 唱 这个 年纪 吴京 把 道具 蛋糕 给 吃 了 ​ ,2020-01-18 15:19:00,0,0,0,__label__negative,0.03965,0.98758,0.0022600000000000003,0.98758,1.0,"武汉, 美国, 机场, 旅客, 病毒","Wuhan, United States, airport, Passenger, virus"
309,481,-1,冠状病毒,2020-01-18,看来 还是 要 n 九 十五 啊 用 流动 的 水流 勤洗手 避免 用手 接触 眼鼻口 处 粘膜 公共场合 佩戴 n 九 十五 之类 口罩 简易 有效 并且 许多 人 做 不到 武汉 新增 四例 新型 冠状病毒 肺炎 病例,2020-01-18 10:34:00,0,0,0,__label__negative,1e-05,0.99901,0.00914,0.99901,2.0,"武汉, 新增, 四例, 病例, 口罩","Wuhan, New, Four cases, Case, Mask"
310,482,-1,冠状病毒,2020-01-18,武汉 新增 四例 新型 冠状病毒 肺炎 病例 我 今天 从 武汉 回老家 先坐 公交车 再 转 地铁 然后 到 武昌 火车站 坐火车 一路上 带 口罩 的 人 真的 寥寥无几 戴 口罩 人群 里面 大部分 都 是 年轻人 大概 就 看到 四五个 带 了 口罩 的 爹爹 婆婆 然后 还 可以 很 明显 看 出来 是 一个 朋友 戴 口罩 那 一群 人 一起 回家 的 就 个个 都 带上 口罩 了 ​ ,2020-01-18 15:18:00,1,1,0,__label__negative,0.00462,0.6002,0.34159,0.6002,2.0,"武汉, 新增, 四例, 病例, 口罩","Wuhan, New, Four cases, Case, Mask"
311,487,-1,冠状病毒,2020-01-18,武汉 新增 四例 新型 冠状病毒 肺炎 病例 所以 到底 是 真的 只有 四十多 人 感染 这个 肺炎 还是 说 其他 病人 根本 还 没确诊 逛 了 一圈 微博 发现 感冒 发烧 的 各大 医院 那么 多 但愿 都 是 普通 感冒 发烧 吧 逛 微博逛 的 人心惶惶 的,2020-01-18 15:18:00,0,5,8,__label__negative,1e-05,1.00001,0.00713,1.00001,1.0,"武汉, 美国, 机场, 旅客, 病毒","Wuhan, United States, airport, Passenger, virus"
312,488,-1,冠状病毒,2020-01-18,丁香 晚间 病例 华山 专家 独家 解读 who 二千 零 一十九 新型 冠状病毒 指南 o,2020-01-18 15:17:00,0,0,1,__label__positive,0.92631,0.00151,0.55448,0.92631,1.0,"武汉, 美国, 机场, 旅客, 病毒","Wuhan, United States, airport, Passenger, virus"
313,489,-1,冠状病毒,2020-01-18,武汉 新增 四例 新型 冠状病毒 肺炎 病例 出门 带 口罩 的 真的 很少 不过 俺 昨天 回来 之后 就 一直 戴 口罩 了 因为 俺妹 化妆 现在 jio 的 更 要 戴 了,2020-01-18 15:16:00,0,0,0,__label__negative,1e-05,0.98758,0.0927,0.98758,2.0,"武汉, 新增, 四例, 病例, 口罩","Wuhan, New, Four cases, Case, Mask"
314,490,-1,冠状病毒,2020-01-18,武汉 新增 四例 新型 冠状病毒 肺炎 病例 二 九号 就要 回去 上学 的 我 感觉 灰常 害怕 本来 以为 不会 再有 新 的 患者 了 🙏 🙏 🙏 马上 要 开学 武汉 那么 多 大学生 涌进去 祝 大家 健康 啊 🙏 🙏 🙏,2020-01-18 15:16:00,0,3,5,__label__negative,0.00248,0.9963,0.0036,0.9963,2.0,"武汉, 新增, 四例, 病例, 口罩","Wuhan, New, Four cases, Case, Mask"
315,492,-1,冠状病毒,2020-01-18,武汉 新增 四例 新型 冠状病毒 肺炎 病例,2020-01-18 15:13:00,0,0,0,__label__negative,1e-05,1.00001,0.00213,1.00001,2.0,"武汉, 新增, 四例, 病例, 口罩","Wuhan, New, Four cases, Case, Mask"
316,493,-1,冠状病毒,2020-01-18,微博 橱窗 武汉 新增 四例 新型 冠状病毒 肺炎 病例 超值 一百 粒 少 点 磕碰 墙壁 不留痕 可 粘贴 于 门把手 后 的 墙面 上 可 防止 门把手 碰撞 损坏 粘贴 于 冰箱 背面 或者 墙面 有效 防止 撞击 刮痕 用途 广泛 大小 家居用品 都 能 使用 一元 券 微博 专享 限时 领券,2020-01-18 15:15:00,0,0,0,__label__negative,0.00886,0.92842,0.03623,0.92842,0.0,"武汉, 防护, 视频, 微博, 新增","Wuhan, Protection, video, Weibo, New"
317,494,-1,冠状病毒,2020-01-18,武汉 新增 四例 新型 冠状病毒 肺炎 病例 它们 也 在 安稳 过小年 它们 应该 在 里面 吃 捞饭 继伟 间伟 你们 在 哪 我 母亲 因为 感冒 被 太原市 太航 医院 治死 为此 我 申请 了 医疗 鉴定 这个 权利 是 国家 赋予 每个 公民 的 当 所有 证据 指向 医院 是治死 我 母亲 的 凶手 时 太原市 卫健委 伙同 太航 医院 在 拖 了 一年 七个 月 后 竟 ​ ,2020-01-18 15:15:00,0,0,0,__label__negative,0.03848,0.84798,0.018000000000000002,0.84798,0.0,"武汉, 防护, 视频, 微博, 新增","Wuhan, Protection, video, Weibo, New"
318,495,-1,冠状病毒,2020-01-18,武汉 肺炎 丨 中国 疾控中心 这 五大 谣言 千万别 信 中国 疾控中心 二千 零 二十万 零 一百一十 八日 澄清 关于 武汉 新型 冠状病毒 肺炎 的 五大 谣言,2020-01-18 15:14:00,0,1,0,__label__neutral,0.07587,0.01323,0.90466,0.90466,3.0,"武汉, 没有, 恐慌, 市场, 口罩","Wuhan, No, panic, market, Mask"
319,496,-1,冠状病毒,2020-01-18,凤凰 新闻 分享 凤凰 新闻 世卫 组织 泰国 发现 一例 新型 冠状病毒 病例 o 世卫 组织 泰国 发现 一例 新型 冠状病毒 病例,2020-01-18 15:14:00,0,0,0,__label__neutral,0.12253,0.14415999999999998,0.29422,0.29422,4.0,"病例, 武汉, 新增, 四例, 感染","Case, Wuhan, New, Four cases, infection"
320,497,-1,冠状病毒,2020-01-18,泰国 发现 第二例 新型 冠状病毒 肺炎 患者 七十四岁 中国籍 女子 一月 十七日 泰国 公共 卫生部 在 其 官网 公布 已 发现 第二例 二千 零 一十九 ncov 确诊 病例 患者 是 一名 七十四岁 中国籍 女子 这 也 是 在 中国 境外 发现 的 第三例 新型 冠状病毒 确诊 病例 目前 两名 确诊 患者 在 负 气压 隔离病房 中 接受 治疗 两人 之间 发病 并 无 相关性 湖北 之 ​ ,2020-01-18 15:14:00,1,0,3,__label__neutral,0.05034,0.02677,0.94166,0.94166,4.0,"病例, 武汉, 新增, 四例, 感染","Case, Wuhan, New, Four cases, infection"
321,498,-1,冠状病毒,2020-01-18,武汉 卫健委 凌晨 通报 新型 冠状病毒 不能 排除 有限 人 传人 的 可能 o,2020-01-18 15:13:00,0,0,0,__label__neutral,0.00886,0.13297,0.8991299999999999,0.8991299999999999,4.0,"病例, 武汉, 新增, 四例, 感染","Case, Wuhan, New, Four cases, infection"
322,499,-1,冠状病毒,2020-01-18,武汉 最近 因为 肺炎 事件 各种 上 热 搜 有些 网友 就 特别 不负责任的 发表 一些 言论 是 这样 的 作为 一个 武汉 人 我 自身 以及 身边 朋友 都 是 很 注意 这方面 的 保护措施 每天 都 会 戴 口罩 当然 地铁 上 也 有 很多 人 没戴 的 但是 最近 网上 就 会 有人 说 就是 太多 像 你们 这样 的 武汉 人 所以 害 得 我们 外地人 怎么 怎么样 的 看得人 一 ​ ,2020-01-18 15:13:00,1,8,46,__label__negative,0.10972,0.28142,0.05034,0.28142,2.0,"武汉, 新增, 四例, 病例, 口罩","Wuhan, New, Four cases, Case, Mask"
323,500,-1,冠状病毒,2020-01-18,武汉 新增 四例 新型 冠状病毒 肺炎 病例 我 的 可怜 啊,2020-01-18 15:13:00,0,1,0,__label__negative,1e-05,1.00001,1e-05,1.00001,2.0,"武汉, 新增, 四例, 病例, 口罩","Wuhan, New, Four cases, Case, Mask"
324,506,-1,冠状病毒,2020-01-18,把 无知 当 荣耀 算了 走 国人 自己 都 觉得 没啥 还 着急 个 啥 呀 武汉 p 事 都 没有 好 吧 估计 只有 那个 海鲜 市场 那 一带 要 注意 一些 身边 真 没人为 这 恐慌 的 不知情 的 外省人 别 瞎说,2020-01-18 09:29:00,0,0,0,__label__negative,0.005229999999999999,0.99391,0.00942,0.99391,3.0,"武汉, 没有, 恐慌, 市场, 口罩","Wuhan, No, panic, market, Mask"
325,507,-1,冠状病毒,2020-01-18,长 点心 吧 算了 走 国人 自己 都 觉得 没啥 还 着急 个 啥 呀 武汉 p 事 都 没有 好 吧 估计 只有 那个 海鲜 市场 那 一带 要 注意 一些 身边 真 没人为 这 恐慌 的 不知情 的 外省人 别 瞎说,2020-01-18 09:29:00,0,0,0,__label__negative,0.00421,0.98361,0.02597,0.98361,3.0,"武汉, 没有, 恐慌, 市场, 口罩","Wuhan, No, panic, market, Mask"
326,508,-1,冠状病毒,2020-01-18,武汉 成 了 疫源 还 查不出 源头 有人 不断 释放,2020-01-18 09:29:00,0,0,0,__label__negative,1e-05,0.99674,0.011,0.99674,3.0,"武汉, 没有, 恐慌, 市场, 口罩","Wuhan, No, panic, market, Mask"
327,509,-1,冠状病毒,2020-01-18,母狗 不把 自己 狗命 当回事 还 想着 怎么 不给 老爷 添堵 算了 走 国人 自己 都 觉得 没啥 还 着急 个 啥 呀 武汉 p 事 都 没有 好 吧 估计 只有 那个 海鲜 市场 那 一带 要 注意 一些 身边 真 没人为 这 恐慌 的 不知情 的 外省人 别 瞎说,2020-01-18 09:29:00,0,0,0,__label__negative,0.00859,0.98595,0.02932,0.98595,3.0,"武汉, 没有, 恐慌, 市场, 口罩","Wuhan, No, panic, market, Mask"
328,512,-1,冠状病毒,2020-01-18,武汉 新增 四例 新型 冠状病毒 肺炎 病例 大城市 人口密度 高 卫生条件 差 健康 意识 差 再 加上 人口 流动性 高 传染病 容易 流行 泛滥 春运 是 个 危险期 流 到 其他 省市 的 机会 更大 大家 在 公共场所 千万 带 好 😷 口罩 😷,2020-01-18 15:07:00,0,0,0,__label__negative,0.00104,0.99921,0.004079999999999999,0.99921,3.0,"武汉, 没有, 恐慌, 市场, 口罩","Wuhan, No, panic, market, Mask"
329,514,-1,冠状病毒,2020-01-18,无语 算了 走 国人 自己 都 觉得 没啥 还 着急 个 啥 呀 武汉 p 事 都 没有 好 吧 估计 只有 那个 海鲜 市场 那 一带 要 注意 一些 身边 真 没人为 这 恐慌 的 不知情 的 外省人 别 瞎说,2020-01-18 09:29:00,0,0,0,__label__negative,0.005229999999999999,0.99446,0.008329999999999999,0.99446,3.0,"武汉, 没有, 恐慌, 市场, 口罩","Wuhan, No, panic, market, Mask"
330,515,-1,冠状病毒,2020-01-18,故 中医 现 巧兰浦泽 在 在 国内 国际 处于 过街老鼠 人人喊打 的 状态 还有 欧洲 一些 国家 竟然 因为 怀疑 中医药 会 毒害 人 的 身体 而 要 终结 每年 十几亿 华夏 币 的 订单 要是 其它 国家 也 有样学样 中医 泰国 发现 一例 新型 冠状病毒 病例,2020-01-18 15:06:00,0,0,1,__label__negative,0.0067,0.7773100000000001,0.47659,0.7773100000000001,4.0,"病例, 武汉, 新增, 四例, 感染","Case, Wuhan, New, Four cases, infection"
331,516,-1,冠状病毒,2020-01-18,第二批 国家 集中 采购 药品 三十二 种 平均 降幅 五十三 今天 第二批 国家 组织 药品 集中 采购 工作 顺利完成 三十二个 品种 采购 成功 平均 降幅 五十三 第二批 国家 组织 药品 集中 采购 药品 复盖 糖尿病 高血压 抗肿瘤 和 罕见 病 等 治疗 领域 一百二十 二家 企业 参加 投标 外资企业 二十四家 三十二个 品种 中选 价 平均 降幅 五十三 其中 外资 原研药 平均 降幅 ​ ,2020-01-18 15:05:00,0,0,4,__label__negative,0.09809,0.5775100000000001,0.31406,0.5775100000000001,2.0,"武汉, 新增, 四例, 病例, 口罩","Wuhan, New, Four cases, Case, Mask"
332,518,-1,冠状病毒,2020-01-18,微博 橱窗 武汉 新增 四例 新型 冠状病毒 肺炎 病例 芷菲 温控 变色 孕妇 可用 滋润 双唇 淡化 细纹 改善 唇色 温感 变色 千人千色 打造 你 的 专属 色彩 给 你 专属 唇情 诱惑 俘获 你 的 男神 四十元 券 微博 专享 限时 领券,2020-01-18 15:05:00,0,0,0,__label__negative,0.00079,0.95258,0.29422,0.95258,0.0,"武汉, 防护, 视频, 微博, 新增","Wuhan, Protection, video, Weibo, New"
333,520,-1,冠状病毒,2020-01-18,洗手 戴 口罩 养成 良好的 卫生习惯 用 流动 的 水流 勤洗手 避免 用手 接触 眼鼻口 处 粘膜 公共场合 佩戴 n 九 十五 之类 口罩 简易 有效 并且 许多 人 做 不到 武汉 新增 四例 新型 冠状病毒 肺炎 病例,2020-01-18 10:34:00,0,0,0,__label__negative,0.00233,0.98968,0.02845,0.98968,2.0,"武汉, 新增, 四例, 病例, 口罩","Wuhan, New, Four cases, Case, Mask"
334,525,-1,冠状病毒,2020-01-18,艺麸 诊疗室 上线 大家 出行 记得 戴 口罩 哦 武汉 不明 原因 肺炎 病原体 为 新型 冠状病毒 o,2020-01-18 15:05:00,0,0,0,__label__negative,0.02597,0.51563,0.05034,0.51563,3.0,"武汉, 没有, 恐慌, 市场, 口罩","Wuhan, No, panic, market, Mask"
335,526,-1,冠状病毒,2020-01-18,武汉 新增 四例 新型 冠状病毒 肺炎 病例 希望 能 做好 科普 和 预防 除了 上网 看到 的 知道 的 人 其他人 完全 都 没有 知道 的 快 过年 了 都 平平安安 的,2020-01-18 15:05:00,0,0,1,__label__negative,0.07808999999999999,0.43783,0.03965,0.43783,2.0,"武汉, 新增, 四例, 病例, 口罩","Wuhan, New, Four cases, Case, Mask"
336,528,-1,冠状病毒,2020-01-18,戴 口罩 吧 至少 算个 心里 安慰 要 搞清楚 是 怎么 感染,2020-01-17 16:35:00,0,0,0,__label__negative,1e-05,0.98361,0.1067,0.98361,2.0,"武汉, 新增, 四例, 病例, 口罩","Wuhan, New, Four cases, Case, Mask"
337,529,-1,冠状病毒,2020-01-18,武汉 新增 四例 新型 冠状病毒 肺炎 病例 好 可怕,2020-01-18 15:03:00,0,0,0,__label__negative,1e-05,1.00001,1e-05,1.00001,2.0,"武汉, 新增, 四例, 病例, 口罩","Wuhan, New, Four cases, Case, Mask"
338,530,-1,冠状病毒,2020-01-18,德绒 运动 背心 胸罩 br 点 下面 优惠券 浏览 商品 在 售 价 一百三十 九 九 元 券 后 价 三十九 九 元 销 量 一万 零 三百 一十六 单 意大利 进口 婴儿 肌 双面 德绒 发热 促进 血液循环 防止 乳腺 增生 随形弹 科技 聚拢 不紧绷 小胸 友好 大胸 包容 可拆卸 阿当 的 手托 胸垫 上托防 下垂 越 穿越 挺拔 ​ ,2020-01-18 15:03:00,0,0,2,__label__negative,0.0331,0.71224,0.26895,0.71224,0.0,"武汉, 防护, 视频, 微博, 新增","Wuhan, Protection, video, Weibo, New"
339,531,-1,冠状病毒,2020-01-18,武汉 新增 四例 新型 冠状病毒 肺炎 病例 今天 武汉市 卫健委 发布 关于 新型 冠状病毒 感染 的 肺炎 情况通报 称 十六日 零 二十四时 治愈 出院 三例 无 新增 死亡 病例 经 专家组 综合 研判 武汉市 新增 四例 新型 冠状病毒 感染 的 肺炎 病例 目前 已 安排 转院 救治 所有 病例 病情 稳定 截至 目前 武汉市 累计 报告 新型 冠状病毒 感染 的 肺 ​ ,2020-01-18 15:02:00,0,0,2,__label__positive,0.7982,0.0716,0.00914,0.7982,4.0,"病例, 武汉, 新增, 四例, 感染","Case, Wuhan, New, Four cases, infection"
340,532,-1,冠状病毒,2020-01-18,武汉 新增 四例 新型 冠状病毒 肺炎 病例 网上 那些 说 口口相传 的 消息 能 直接 点 嘛 现在 又 不是 猜猜看 游戏 这个 来句 我 哪个 亲戚朋友 啥 的 病 啦 那个 来句 听说 的 听过 的 都 拿出 证据 要不然 就 闭嘴 那些 拿 着 检测 单都 被 喷 着 关微博 或者 换 名字 啦 二 武汉,2020-01-18 15:02:00,0,1,5,__label__negative,1e-05,0.88721,0.7186,0.88721,2.0,"武汉, 新增, 四例, 病例, 口罩","Wuhan, New, Four cases, Case, Mask"
341,533,-1,冠状病毒,2020-01-18,武汉 肺炎 丨 中国 疾控中心 这 五大 谣言 千万别 信 中国 疾控中心 今日 澄清 关于 武汉 新型 冠状病毒 肺炎 的 五大 谣言 中心 强调 武汉 爆发 的 神秘 疾病 病原体 已 确认 为 新型 冠状病毒 并非 新型 沙士 中心 指 新型 冠状病毒 同 沙士 的 基因 排序 有 八成 相似 但 不能 等同于 病毒 的 致病 能力 相似 基因 变化 分析 显示 他们 同沙 ​ ,2020-01-18 15:02:00,28,65,200,__label__positive,0.66542,0.03211,0.1733,0.66542,3.0,"武汉, 没有, 恐慌, 市场, 口罩","Wuhan, No, panic, market, Mask"
342,534,-1,冠状病毒,2020-01-18,冠状病毒 这个 事 很 纠结 要 不要 退 飞机票 和 酒店,2020-01-18 15:01:00,0,7,0,__label__negative,1e-05,0.95115,0.80318,0.95115,3.0,"武汉, 没有, 恐慌, 市场, 口罩","Wuhan, No, panic, market, Mask"
343,535,-1,冠状病毒,2020-01-18,武汉 新增 四例 新型 冠状病毒 肺炎 病例 在 武汉 的 朋友 真的 要 重视 起来 啊 出门 一定 一定 一定 要 戴 好 口罩 保护 他人 从 自己 做起 还有 在 医院 实习 的 我 表示 真的 有 医护人员 感染 所以 大家 一定 要 做好 防护 措施 保护 好 自己 平平安安 回家 过个 好 年 二 武汉,2020-01-18 15:00:00,0,2,5,__label__negative,0.1733,0.67919,0.01745,0.67919,2.0,"武汉, 新增, 四例, 病例, 口罩","Wuhan, New, Four cases, Case, Mask"
344,536,-1,冠状病毒,2020-01-18,武汉 新增 四例 新型 冠状病毒 肺炎 病例 预防 手段 是 勤洗手 使用 洗手液 或 肥皂 洗够 十五秒 尽量避免 揉 眼睛 吃手 抠 鼻 等 手 与 眼睛 口 鼻 的 接触 科普 一下 常见 肺炎 的 发病 机制 科技 ​ l 常高俊 april 的 微博 视频,2020-01-18 15:00:00,8,0,27,__label__positive,0.35578000000000004,0.15611,0.10972,0.35578000000000004,1.0,"武汉, 美国, 机场, 旅客, 病毒","Wuhan, United States, airport, Passenger, virus"
345,538,-1,冠状病毒,2020-01-18,武汉 病毒性 肺炎 五大 谣言 一月 十八日 中国 疾控中心 微信 公号 发布 科普 文章 关于 武汉 病毒性 肺炎 这 五大 谣言 千万别 信 文章 提到 引起 武汉 病毒性 肺炎 疫情 的 病原体 不是 sars 病毒 目前 调查 显示 该 病毒 人际 间 传播 能力 和 致病性 均 较 sars 弱 全力 抗击 新型 冠状病毒 肺炎 全力 抗击 新型 冠状病毒 感染 肺炎 详情 ​ ,2020-01-18 15:00:00,41,44,154,__label__neutral,0.28778000000000004,0.01973,0.66542,0.66542,1.0,"武汉, 美国, 机场, 旅客, 病毒","Wuhan, United States, airport, Passenger, virus"
346,539,-1,冠状病毒,2020-01-18,新型 冠状 病,2020-01-17 14:57:00,0,0,0,__label__negative,1e-05,0.98551,0.73717,0.98551,4.0,"病例, 武汉, 新增, 四例, 感染","Case, Wuhan, New, Four cases, infection"
347,544,-1,冠状病毒,2020-01-18,武汉 新增 四例 新型 冠状病毒 肺炎 病例 有没有 武汉 人民 现身说法 一下 是 认真的 吗 我 也 不懂 是 心大 还是 纯 傻 b 了 ​ ​,2020-01-18 14:58:00,1,22,25,__label__negative,1e-05,1.00001,0.00914,1.00001,0.0,"武汉, 防护, 视频, 微博, 新增","Wuhan, Protection, video, Weibo, New"
348,545,-1,冠状病毒,2020-01-18,who 大众 如何 预防 新型 冠状病毒 owho 大众 如何 预防 新型 冠状病毒,2020-01-18 14:57:00,0,1,1,__label__positive,0.98968,0.09809,0.00556,0.98968,2.0,"武汉, 新增, 四例, 病例, 口罩","Wuhan, New, Four cases, Case, Mask"
349,546,-1,冠状病毒,2020-01-18,武汉 新增 四例 新型 冠状病毒 肺炎 病例 愿 平安 🙏 🏻,2020-01-18 14:56:00,0,0,0,__label__negative,1e-05,1.00001,1e-05,1.00001,2.0,"武汉, 新增, 四例, 病例, 口罩","Wuhan, New, Four cases, Case, Mask"
350,547,-1,冠状病毒,2020-01-18,武汉 新增 四例 新型 冠状病毒 肺炎 病例 武汉 新增 四例 新型 冠状病毒 肺炎 病例 中分 微卷 刘海 　 　 适合 脸型 鹅蛋脸 圆脸 　 　 中分 的 刘海 做成 内卷 的 造型 配合 整体 造型 增加 蓬松 感 俏皮 中 不失 女人味 中分 的 刘海 不能 太短 不然 会 将 脸 的 比例 弄 得 很 奇怪 而且 失去 了 修饰 脸型 的 效果 哦 如果 是 卷 烫 的 发 ​ ,2020-01-18 14:56:00,0,12,0,__label__negative,0.00134,0.98089,0.06561,0.98089,2.0,"武汉, 新增, 四例, 病例, 口罩","Wuhan, New, Four cases, Case, Mask"
