,id,label,keyword,date,content,time,forward,comment,like,predict,__label__positive,__label__negative,__label__neutral,predict_score,topic,topic_keyword,topic_keyword_en
440,720,-1,冠状病毒,2020-01-15,泰国 新型 冠状病毒 病例 为 武汉 游客 关注 关注,2020-01-15 12:30:00,0,0,0,__label__neutral,0.76066,1e-05,0.7663,0.7663,3.0,"武汉, 泰国, 病例, 传人, 发现","Wuhan, Thailand, Case, successor, Find"
441,721,-1,冠状病毒,2020-01-15,武汉 肺炎 不排除 有限 人 传人 可能   针对 早前 泰国 发现 一例 新型 冠状病毒 病例 武汉 卫健委 今天 通报 该 患者 为 武汉市 民 现在 泰国 治疗 病情 稳定 武汉 卫健委在 问答 中 表示 目前 肺炎 疫情 尚未 发现 明确 人 传人 证据 不能 排除 有限 人 传人 可能 但 持续 人 传人 风险 较 低,2020-01-15 08:13:00,0,0,0,__label__neutral,0.2069,0.1067,0.30076,0.30076,3.0,"武汉, 泰国, 病例, 传人, 发现","Wuhan, Thailand, Case, successor, Find"
442,722,-1,冠状病毒,2020-01-15,泰国 新型 冠状病毒 病例 为 武汉 游客 针对 泰国 发现 一例 新型 冠状病毒 病例 武汉 卫健委 今天 通报 该 患者 为 武汉市 民 现在 泰国 治疗 病情 稳定 截至 目前 是否 发现 人 传人 情况 是否 发现 家庭 聚集 性 病例 关闭 华南 海鲜 市场 之后 市场 内有何 发现 看 详情 ​ via 央视 新闻,2020-01-15 12:30:00,0,0,0,__label__neutral,0.05341,0.16887,0.46103,0.46103,3.0,"武汉, 泰国, 病例, 传人, 发现","Wuhan, Thailand, Case, successor, Find"
443,729,-1,冠状病毒,2020-01-15,泰国 新型 冠状病毒 病例 为 武汉 游客 快 过年 了 都 注意 防范 吧 戴个 口罩 要 保护 好 自己 啊,2020-01-15 12:29:00,0,0,1,__label__neutral,0.37024,0.00759,0.53899,0.53899,2.0,"泰国, 病例, 武汉, 游客, 发现","Thailand, Case, Wuhan, Tourist, Find"
444,731,-1,冠状病毒,2020-01-15,泰国 新型 冠状病毒 病例 为 武汉 游客 武汉 肺炎 不排除 有限 人 传人 可能 但 持续 人 传人 的 风险 较 低 世界卫生组织 十三日 发表声明 说 已 收到 在 泰国 确诊 一名 中国 旅客 感染 新型 冠状病毒 的 报告 目前 该 患者 在 泰国 一家 医院 接受 治疗 病情 稳定 今天 凌晨 武汉市 卫健委 通报 关于 此事 的 相关 情况 并 对 目前 的 疫情 特点 作 ​ ,2020-01-15 12:27:00,1,0,0,__label__positive,0.34159,0.03115,0.28778000000000004,0.34159,3.0,"武汉, 泰国, 病例, 传人, 发现","Wuhan, Thailand, Case, successor, Find"
445,732,-1,冠状病毒,2020-01-15,把 李戡 甩了 不知 多少 条街 用 泼妇骂街 都 骂 不出 的 口 的 脏话 骂 粉丝 现在 号 都 玩 没了 最大 的 问题 在于 你 不能 追责 因为 这个 责任人 其实 是 你 自己 是 你 把 混蛋 选出 来 的 而 大家 都 有责任 等于 没有 责任 然后 周而复始 四年 折腾 一次 两拨 混蛋 互相 掣肘 扯皮 啥 也 干不了 就 给 大家 画饼 ​ ​ ​ ​ ,2020-01-15 12:27:00,1,0,1,__label__negative,0.00713,0.96037,0.03515,0.96037,4.0,"武汉, 泰国, 病例, 游客, 命名","Wuhan, Thailand, Case, Tourist, name"
446,733,-1,冠状病毒,2020-01-15,泰国 新型 冠状病毒 病例 为 武汉 游客 养生 提醒 科学 证实 十 因素 有助 长寿 ① 每天 步行 三十分钟 ② 少 喝 碳酸 饮料 ③ 性格 活跃 ④ 多 喝茶 ⑤ 腿部 健壮 ⑥ 吃 紫色 食物 ⑦ 青少年 时 体重 正常 ⑧ 少 吃 红肉 ⑨ 正规 受 教育 时间 超过 十二年 ⑩ 人缘 好 不请 保姆 自制力 强,2020-01-15 12:27:00,0,0,0,__label__positive,0.72488,0.3346,0.0276,0.72488,0.0,"病例, 泰国, 武汉, 游客, 一个","Case, Thailand, Wuhan, Tourist, One"
447,735,-1,冠状病毒,2020-01-15,武汉 肺炎 不排除 有限 人 传人 可能 o 武汉 卫健委 凌晨 通报 不能 排除 有限 人 传人 的 可能   针对 早前 泰国 发现 一例 新型 冠状病毒 病例 武汉 卫健委 今天 通报 该 患者 为 武汉市 民 现在 泰国 治疗 病情 稳定 武汉 卫健委在 问答 中 表示 目前 肺炎 疫情 尚未 发现 明确 人 传人 证据 不能 排除 有限 人 传人 可能 但 持续 人 传人 风险 较 低   ​ ,2020-01-15 12:27:00,2,2,2,__label__neutral,0.0927,0.19684,0.32768,0.32768,3.0,"武汉, 泰国, 病例, 传人, 发现","Wuhan, Thailand, Case, successor, Find"
448,738,-1,冠状病毒,2020-01-15,泰国 新型 冠状病毒 病例 为 武汉 游客 在 泰国 旅游 要 注意 保护 好 自己,2020-01-15 12:24:00,0,0,0,__label__neutral,0.28142,0.0067,0.69265,0.69265,2.0,"泰国, 病例, 武汉, 游客, 发现","Thailand, Case, Wuhan, Tourist, Find"
449,739,-1,冠状病毒,2020-01-15,泰国 新型 冠状病毒 病例 为 武汉 游客,2020-01-15 12:24:00,0,0,0,__label__neutral,0.54675,1e-05,0.94968,0.94968,3.0,"武汉, 泰国, 病例, 传人, 发现","Wuhan, Thailand, Case, successor, Find"
450,740,-1,冠状病毒,2020-01-15,❤ 上品 骅成 装配 科技 每日 工地 进度 播报 🏠 战略 联盟 商杨 总 丽江市 华坪县 大兴 镇罗府 轻钢 别墅 项目 三层 轻钢 龙骨 主体 搭建 完工 工人 正在 进行 灌浆 🌎 修 轻钢 别墅 就 找 上品 骅成 装配 科技 🇨 🇳 上品 骅成 装配 科技 🇨 🇳 作为 轻钢 别墅 行业 创客 孵化 中心 是 一家 集 别墅设计 龙骨 加工 材料厂 价集 ​ ,2020-01-15 12:23:00,0,0,0,__label__positive,0.29422,0.2451,0.16028,0.29422,4.0,"武汉, 泰国, 病例, 游客, 命名","Wuhan, Thailand, Case, Tourist, name"
451,741,-1,冠状病毒,2020-01-15,转发 微,2020-01-15 11:35:00,0,0,0,__label__neutral,1e-05,0.10089,0.99898,0.99898,3.0,"武汉, 泰国, 病例, 传人, 发现","Wuhan, Thailand, Case, successor, Find"
452,742,-1,冠状病毒,2020-01-15,叠加 春节 人员 大 迁徙 是 一个 比较 大 的 问,2020-01-15 10:06:00,0,0,0,__label__negative,0.30737,0.78794,1e-05,0.78794,1.0,"泰国, 中国, 武汉, 病例, 游客","Thailand, China, Wuhan, Case, Tourist"
453,743,-1,冠状病毒,2020-01-15,泰国 新型 冠状病毒 病例 为 武汉 游客 日常 记得 做好 基本 保护措施 体质 弱 的 可以 在 家里 备 一个 紫外线 消毒 灯 每周 二 三次 消毒 一个 小时 左右 出门 记得 戴 口罩 谨慎 做好 自己 该 做 的,2020-01-15 12:22:00,1,0,3,__label__negative,0.32768,0.36298,0.0331,0.36298,0.0,"病例, 泰国, 武汉, 游客, 一个","Case, Thailand, Wuhan, Tourist, One"
454,748,-1,冠状病毒,2020-01-15,泰国 新型 冠状病毒 病例 为 武汉 游客 双鱼 的 智商 一 有关 统计 平均值 是 一百三十 左右 二 双鱼 的 记忆力 不太好 双鱼 会 通过 自己 的 小聪明 来 学习 那些 复杂的 东西 这是 所谓 的 尖子生 做 不到 的 事情 三 双鱼 的 知识 层面 很广 从 音乐 到 医学 从 死亡 到 再生 四 双鱼 有 定期 的 反思 时期 内容 是 我能 做 什么 我现 ​ ,2020-01-15 12:22:00,0,0,0,__label__neutral,0.17782,0.04469,0.43016,0.43016,1.0,"泰国, 中国, 武汉, 病例, 游客","Thailand, China, Wuhan, Case, Tourist"
455,749,-1,冠状病毒,2020-01-15,天啦噜,2020-01-15 08:53:00,0,0,0,__label__negative,1e-05,1.00001,1e-05,1.00001,3.0,"武汉, 泰国, 病例, 传人, 发现","Wuhan, Thailand, Case, successor, Find"
456,750,-1,冠状病毒,2020-01-15,泰国 新型 冠状病毒 病例 为 武汉 游客 武汉 肺炎 不排除 有限 人 传人 可能 但 持续 人 传人 风险 较 低 十五日 武汉 卫健委炎 通报 现有 的 调查 结果表明 尚未 发现 明确 的 人 传人 证据 武汉 肺炎 不排除 有限 人 传人 可能 但 持续 人 传人 的 风险 较 低 泰国 的 一例 新型 冠状病毒 病例 为 武汉 游客 现在 泰国 治疗 病情 稳定 ​ ,2020-01-15 12:22:00,0,0,2,__label__neutral,0.20182,0.05034,0.5000100000000001,0.5000100000000001,3.0,"武汉, 泰国, 病例, 传人, 发现","Wuhan, Thailand, Case, successor, Find"
457,756,-1,冠状病毒,2020-01-15,❄ 词海拾 珠 ❄ ⭐ human to human transmission 人 与 人 之间 的 传染 ⭐ rule out 排除 取消 划 去 ⭐ pneumonia nu ː ˈ mo ʊ ni ə 肺炎 ⭐ caused by 归因于 ⭐ a new strain of 新型 ⭐ coronavirus k ə r ə un ə vai ə r ə s n 冠状病毒 日冕 形 病毒 未 完见 评论 区,2020-01-15 11:58:00,1,1,3,__label__negative,0.00044,0.99684,0.03211,0.99684,4.0,"武汉, 泰国, 病例, 游客, 命名","Wuhan, Thailand, Case, Tourist, name"
458,757,-1,冠状病毒,2020-01-15,小司 关注 泰国 新型 冠状病毒 病例 为 武汉 游客 针对 泰国 发现 一例 新型 冠状病毒 病例 武汉 卫健委 通报 该 患者 为 武汉市 民 现在 泰国 治疗 病情 稳定 通报 表明 尚未 发现 明确 的 人 传人 证据 武汉 肺炎 不排除 有限 人 传人 可能 安哥 莫 慌张 病毒 高 一尺 医学 高一丈 ​ ,2020-01-15 12:17:00,0,15,3,__label__neutral,0.6076699999999999,0.0067,0.7663,0.7663,3.0,"武汉, 泰国, 病例, 传人, 发现","Wuhan, Thailand, Case, successor, Find"
459,758,-1,冠状病毒,2020-01-15,泰国 新型 冠状病毒 病例 为 武汉 游客 山是 朴素的 实习 因为 是 山 所以 父爱 朴实 慈祥 它 的 外表 并 不华丽 却 拥有 无比 之深 的 内涵 它 并 不像 母爱 一般 和蔼 父母 宽容 受人 推崇 但 它 同 母爱 一样 的 无私 不求 回报,2020-01-15 12:17:00,0,0,0,__label__positive,0.36298,0.18244,0.21735,0.36298,2.0,"泰国, 病例, 武汉, 游客, 发现","Thailand, Case, Wuhan, Tourist, Find"
460,759,-1,冠状病毒,2020-01-15,泰国 新型 冠状病毒 病例 为 武汉 游客 卫生间 的 墙壁 用 了 硅藻土 具有 除臭 和 调节 湿气 的 作用 用 木板 打造 的 收纳 架 坚固耐用 放 上 绿色植物 正好 合适 使 空气 更加 清新,2020-01-15 12:17:00,0,0,0,__label__neutral,0.22271,0.03965,0.44554,0.44554,1.0,"泰国, 中国, 武汉, 病例, 游客","Thailand, China, Wuhan, Case, Tourist"
461,760,-1,冠状病毒,2020-01-15,武汉 肺炎 不排除 有限 人 传人 可能 泰国 发现 一例 新型 冠状病毒 病例 前 几天 以为 没事 了,2020-01-15 12:17:00,0,0,0,__label__neutral,1e-05,0.21208,0.9986,0.9986,3.0,"武汉, 泰国, 病例, 传人, 发现","Wuhan, Thailand, Case, successor, Find"
462,762,-1,冠状病毒,2020-01-15,泰国 新型 冠状病毒 病例 为 武汉 游客 春节 期间 人多 注意 身体 吧 预防 感冒 出门 带个 口罩 远离 病毒,2020-01-15 12:14:00,0,0,2,__label__positive,0.95792,0.00194,0.11921,0.95792,2.0,"泰国, 病例, 武汉, 游客, 发现","Thailand, Case, Wuhan, Tourist, Find"
463,763,-1,冠状病毒,2020-01-15,世卫 组织 造谣 应该 抓起,2020-01-15 10:06:00,0,0,0,__label__positive,0.54675,0.01283,0.08757000000000001,0.54675,1.0,"泰国, 中国, 武汉, 病例, 游客","Thailand, China, Wuhan, Case, Tourist"
464,768,-1,冠状病毒,2020-01-15,泰国 新型 冠状病毒 病例 为 武汉 游客 一定 要 防患于未然 啊 还有 媒体 永远 报道 一半 留 一半 那 后续 怎么办 不说 了,2020-01-15 12:14:00,0,0,3,__label__positive,0.44554,0.0276,0.26285,0.44554,3.0,"武汉, 泰国, 病例, 传人, 发现","Wuhan, Thailand, Case, successor, Find"
465,770,-1,冠状病毒,2020-01-15,泰国 新型 冠状病毒 病例 为 武汉 游客 还是 注意 点 吧 少去 人流量 大 的 位置 希望 都 能 平平安安 的 过 一个 好 年,2020-01-15 12:12:00,0,0,3,__label__negative,0.01973,0.34159,0.1733,0.34159,2.0,"泰国, 病例, 武汉, 游客, 发现","Thailand, Case, Wuhan, Tourist, Find"
466,771,-1,冠状病毒,2020-01-15,泰国 新型 冠状病毒 病例 为 武汉 游客 感冒 了 还是 好好 休息 不要 出门 累到 了,2020-01-15 12:12:00,0,0,0,__label__negative,0.11281,0.12941,0.03734,0.12941,0.0,"病例, 泰国, 武汉, 游客, 一个","Case, Thailand, Wuhan, Tourist, One"
467,775,-1,冠状病毒,2020-01-15,泰国 新型 冠状病毒 病例 为 武汉 游客 不求 是 贵 少病 是 寿 够用 是 富 无欲 是 福 感激 是 喜,2020-01-15 12:10:00,0,0,0,__label__negative,0.05186,0.39235,0.1733,0.39235,1.0,"泰国, 中国, 武汉, 病例, 游客","Thailand, China, Wuhan, Case, Tourist"
468,777,-1,冠状病毒,2020-01-15,泰国 新型 冠状病毒 病例 为 武汉 游客 武汉 惨 真的 是 诸事 不顺,2020-01-15 12:10:00,0,0,0,__label__neutral,0.03965,0.05034,0.44554,0.44554,2.0,"泰国, 病例, 武汉, 游客, 发现","Thailand, Case, Wuhan, Tourist, Find"
469,778,-1,冠状病毒,2020-01-15,武汉 卫健委 武汉 肺炎 不排除 有人 传人 可能 针对 早前 泰国 发现 一例 新型 冠状病毒 病例 武汉 卫健委 十五日 通报 泰国 新型 冠状病毒 病例 为 武汉 游客 现在 泰国 治疗 病情 稳定 武汉 卫健委 表示 目前 肺炎 疫情 尚未 发现 明确 人 传人 证据 不能 排除 有人 传人 可能 武汉市 卫生 健康 委员会 o ​ ,2020-01-15 12:09:00,0,2,3,__label__neutral,0.08511,0.15204,0.45327,0.45327,3.0,"武汉, 泰国, 病例, 传人, 发现","Wuhan, Thailand, Case, successor, Find"
470,779,-1,冠状病毒,2020-01-15,从 未 发现 明显的 人 传人 证据 到 具 广泛传播 潜在 可能 很 宽 的 一个 范围 内 的 数据 都 可以 做出 任何 一种 暂时 论断 但是 感觉 就 不一样 了 我 还是 觉得 小心 一点 好 无据 的 恐慌 比 事后 追悔 好多 了 转,2020-01-15 10:06:00,0,0,0,__label__negative,0.02097,0.99446,0.00129,0.99446,1.0,"泰国, 中国, 武汉, 病例, 游客","Thailand, China, Wuhan, Case, Tourist"
471,780,-1,冠状病毒,2020-01-15,泰国 新型 冠状病毒 病例 为 武汉 游客 还 不知道 原因 的话 最好 带 着 口罩 出门 注意安全,2020-01-15 12:08:00,0,4,1,__label__neutral,0.16887,0.03848,0.19194,0.19194,0.0,"病例, 泰国, 武汉, 游客, 一个","Case, Thailand, Wuhan, Tourist, One"
472,781,-1,冠状病毒,2020-01-15,世卫 新型 冠状病毒 有 限度 人 传人 或 更 广泛传播 世界卫生组织 十四日 表示 引发 武汉 不明 肺炎 的 新型 冠状病毒 能够 有 限度 人 传人 主要 是 在 家庭成员 中 出现 但 警告 有 更 广泛传播 的 可能 这 也 是 武汉 爆发 不明 肺炎 以来 世卫 首次 证实 新型 病毒 可人 传人 o,2020-01-15 12:07:00,49,36,149,__label__positive,0.39235,0.16887,0.08511,0.39235,1.0,"泰国, 中国, 武汉, 病例, 游客","Thailand, China, Wuhan, Case, Tourist"
473,782,-1,冠状病毒,2020-01-15,泰国 新型 冠状病毒 病例 为 武汉 游客 如果 一个 他 开始 怠慢 女人 请 你 离开 他 不懂得 疼惜 你 的 他 不要 为 之 不舍 更 不必 继续 付出 你 的 柔情 和 爱情,2020-01-15 12:07:00,0,0,0,__label__neutral,0.07371,0.03515,0.7982,0.7982,0.0,"病例, 泰国, 武汉, 游客, 一个","Case, Thailand, Wuhan, Tourist, One"
474,783,-1,冠状病毒,2020-01-15, scs 小 怪兽 成长 计划 二千 零 二十 一 十四 今日 任务 概况 一 回家 二 四级 生词 四十 复习 四十 ❌ 三 英语听力 三十 min ❌ 明日 任务 规划 一 包 饺子 二 练字 三 四级 词汇 四十 四百 零四 英语听力 三十 min 五 friends s 三 e 二十一 二十三 新闻 打卡 一 美国 取消 对 中国 汇率 操纵 国 认定 二 泰国 发现 一例 新型 冠状病毒 病例 三 珠海 石化 厂 爆炸 四 八 k 版 ​ ,2020-01-15 12:07:00,0,0,0,__label__negative,0.03022,0.4225100000000001,0.26285,0.4225100000000001,1.0,"泰国, 中国, 武汉, 病例, 游客","Thailand, China, Wuhan, Case, Tourist"
475,784,-1,冠状病毒,2020-01-15,泰国 新型 冠状病毒 病例 为 武汉 游客 绅士 男人 l 二十四 小时 情感 回收站 的 微博 视频,2020-01-15 12:07:00,0,3,3,__label__neutral,0.08271,0.11281,0.34866,0.34866,2.0,"泰国, 病例, 武汉, 游客, 发现","Thailand, Case, Wuhan, Tourist, Find"
476,789,-1,冠状病毒,2020-01-15,武汉 卫健委 通报 新型 肺炎 情况 不排除 人 传人 可能 存在 家庭 聚集 性 病例 公开 透明 问题 问题 一 近期 一名 武汉 游客 在 泰国 被 诊断 为 新型 冠状 病例 感染 的 肺炎 患者 请 介绍 有关 情况 二千 零 二十年 一月 十三日 泰国 报道 一例 来自 武汉 的 新型 冠状病毒 感染 的 肺炎 病例 我市 高度重视 及时 进行 调查 该 患者 为 我市 市民 现在 泰国 ​ ,2020-01-15 12:07:00,0,0,0,__label__neutral,0.04744,0.0927,0.80318,0.80318,3.0,"武汉, 泰国, 病例, 传人, 发现","Wuhan, Thailand, Case, successor, Find"
477,791,-1,冠状病毒,2020-01-15,泰国 新型 冠状病毒 病例 为 武汉 游客 这些 人 是不是 都 住 的 很 近 或者说 有 其他 相似 点,2020-01-15 12:05:00,0,0,2,__label__neutral,0.12593,0.03211,0.34866,0.34866,2.0,"泰国, 病例, 武汉, 游客, 发现","Thailand, Case, Wuhan, Tourist, Find"
478,792,-1,冠状病毒,2020-01-15,泰国 新型 冠状病毒 病例 为 武汉 游客 针对 泰国 发现 一例 新型 冠状病毒 病例 武汉 卫健委 今天 通报 该 患者 为 武汉市 民 现在 泰国 治疗 病情 稳定 截至 目前 是否 发现 人 传人 情况 是否 发现 家庭 聚集 性 病例 关闭 华南 海鲜 市场 之后 市场 内有何 发现 二 黄骅市,2020-01-15 12:05:00,0,0,0,__label__neutral,0.08757000000000001,0.17782,0.31406,0.31406,3.0,"武汉, 泰国, 病例, 传人, 发现","Wuhan, Thailand, Case, successor, Find"
479,793,-1,冠状病毒,2020-01-15,住 可以 住 可 不能 叫 孙 桂枝 再供 石南 吃喝 要 知道 半大 小子 cgd 八千 零三 吃 穷 老子 呢 　 　 王美清 去 县一中 上学 王莲清 不愿意 继续 上学 就 在 家里 跟着 王爱军 一 泰国 发现 一例 新型 冠状病毒 病例,2020-01-15 12:05:00,0,0,0,__label__negative,0.00095,0.95533,0.35578000000000004,0.95533,3.0,"武汉, 泰国, 病例, 传人, 发现","Wuhan, Thailand, Case, successor, Find"
480,794,-1,冠状病毒,2020-01-15,soul 上 关注 的 绝美 辣妈 真的 太 好看 了 人家 怀孕 比 我 不怀孕 都 瘦 看到 之前 发 的 妈妈 的 照片 页 超美 一家 三代 的 合影 觉 了 果然 美人 都 是 要 基因 的 我 个人 认为 比 刘亦菲 和 她 妈妈 还 美 一张 试卷 五十多个 段子 泰国 新型 冠状病毒 病例 为 武汉 游客 为啥 罐装 可乐 比 瓶装 更好 喝 年味 越来越 淡 的 原因 是 什么 坚持 每天 自拍 二十年,2020-01-15 12:04:00,0,0,6,__label__positive,0.46103,0.30737,0.01592,0.46103,2.0,"泰国, 病例, 武汉, 游客, 发现","Thailand, Case, Wuhan, Tourist, Find"
481,795,-1,冠状病毒,2020-01-15,倒 是 成 了 两条 偶尔 交叉 大多数 时候 都 保持 平行 状态 的 线条 　 　 秦洛给 闻人 牧月 打电话 的 时候 还 有些 犹豫 昊嘉笑 柳 因为 他 还 没想 明白 要 不要 把 她 甚至 整个 闻人 家族 给 拖进 这次 争斗 中来 泰国 发现 一例 新型 冠状病毒 病例,2020-01-15 12:04:00,0,0,0,__label__negative,0.01973,0.97157,0.01973,0.97157,0.0,"病例, 泰国, 武汉, 游客, 一个","Case, Thailand, Wuhan, Tourist, One"
482,796,-1,冠状病毒,2020-01-15,泰国 新型 冠状病毒 病例 为 武汉 游客 这件 驼色 大衣 的 精妙 之处 就 在于 领子 的 设计 撞色 拼接 领 的 设计 让 这款 驼色 大衣 变得 更加 出彩 虽然 也 是 非常 的 简单 搭配 但 相当 的 有 型 特别 是 那件 彩色 印花 卫衣 更是 让 整件 驼色 大衣 变得 更加 的 青春 动感 白色 帆布鞋 出现 也 是 很 符合 意境,2020-01-15 12:03:00,0,0,0,__label__negative,0.08757000000000001,0.53122,0.11281,0.53122,0.0,"病例, 泰国, 武汉, 游客, 一个","Case, Thailand, Wuhan, Tourist, One"
483,798,-1,冠状病毒,2020-01-15,泰国 新型 冠状病毒 病例 为 武汉 游客 注意 防范 都 保护 好 自己,2020-01-15 12:03:00,0,0,0,__label__neutral,0.4225100000000001,0.00372,0.7491,0.7491,2.0,"泰国, 病例, 武汉, 游客, 发现","Thailand, Case, Wuhan, Tourist, Find"
484,799,-1,冠状病毒,2020-01-15,泰国 新型 冠状病毒 病例 为 武汉 游客 童年 好似 一 池 湖水 清澈见底 长大 以后 才 会 对 童年 有 如诗如画 般的 感悟,2020-01-15 12:03:00,0,0,0,__label__positive,0.6584300000000001,0.00396,0.4922,0.6584300000000001,1.0,"泰国, 中国, 武汉, 病例, 游客","Thailand, China, Wuhan, Case, Tourist"
485,812,-1,冠状病毒,2020-01-15,泰国 新型 冠状病毒 病例 为 武汉 游客 武汉 肺炎 不排除 有限 人 传人 可能 针对 早前 泰国 发现 一例 新型 冠状病毒 病例 武汉 卫健委 今天 通报 该 患者 为 武汉市 民 现在 泰国 治疗 病情 稳定 武汉 卫健委在 问答 中 表示 目前 肺炎 疫情 尚未 发现 明确 人 传人 证据 不能 排除 有限 人 传人 可能 但 持续 人 传人 风险 较 低 ​ ​ ​ ,2020-01-15 11:57:00,0,0,0,__label__positive,0.38492,0.04086,0.31406,0.38492,3.0,"武汉, 泰国, 病例, 传人, 发现","Wuhan, Thailand, Case, successor, Find"
486,813,-1,冠状病毒,2020-01-15,泰国 新型 冠状病毒 病例 为 武汉 游客 但是 还好 有 完美的 记忆 让 我 能够 回忆 那些 难忘的 日子 童年 真的 很 短暂 它 就 像是 一颗 糖果 让 人 怀念 它 那 甜甜的 味道,2020-01-15 11:56:00,0,0,0,__label__neutral,0.12593,0.29422,0.3346,0.3346,2.0,"泰国, 病例, 武汉, 游客, 发现","Thailand, Case, Wuhan, Tourist, Find"
487,814,-1,冠状病毒,2020-01-15,泰国 新型 冠状病毒 病例 为 武汉 游客 英语口语 要 重视 全英文 科普 常见 肺炎 发病 机制 十五日 武汉 卫健委在 问答 中 表示 目前 肺炎 疫情 尚未 发现 明确 人 传人 证据 不能 排除 有限 人 传人 可能 但 人 传人 风险 较 低 ‼ 在 此 提醒 留学 和 在外 游玩 的 小伙伴 们 要 注意 身体 安全 尤其 注意 接触 的 生活用品 卫生 问题 不​ ,2020-01-15 11:56:00,5,0,5,__label__positive,0.4688,0.055020000000000006,0.29422,0.4688,3.0,"武汉, 泰国, 病例, 传人, 发现","Wuhan, Thailand, Case, successor, Find"
488,815,-1,冠状病毒,2020-01-15,泰国 新型 冠状病毒 病例 为 武汉 游客 基石 奠定 了 人生 的 未来 童年 是 快乐 唱响 了 人生 的 乐章 童年 是 坐标 记录 着 人生 的 起点,2020-01-15 11:56:00,0,0,0,__label__neutral,0.01745,0.2451,0.5078199999999999,0.5078199999999999,4.0,"武汉, 泰国, 病例, 游客, 命名","Wuhan, Thailand, Case, Tourist, name"
489,816,-1,冠状病毒,2020-01-15,泰国 新型 冠状病毒 病例 为 武汉 游客 小 阳台 上 选择 了 简易 的 桌椅 摆放 搭配 舒服的 靠枕 和 坐垫 在 闲暇 的 下午 坐在 这里 品 一杯 茶 放松 身心 也 是 非常 好 的 选择,2020-01-15 11:56:00,0,0,0,__label__positive,0.95916,0.04086,0.00556,0.95916,2.0,"泰国, 病例, 武汉, 游客, 发现","Thailand, Case, Wuhan, Tourist, Find"
490,817,-1,冠状病毒,2020-01-15,🙏,2020-01-15 10:06:00,0,0,0,__label__negative,1e-05,0.53899,1e-05,0.53899,3.0,"武汉, 泰国, 病例, 传人, 发现","Wuhan, Thailand, Case, successor, Find"
491,818,-1,冠状病毒,2020-01-15,法治 微 课堂 武汉 肺炎 不排除 有限 人 传人 可能 十五日 凌晨 武汉 卫健委 发布 新型 冠状 病例 感染 的 肺炎 疫情 知识 问答 武汉 卫健委在 问答 中 表示 目前 肺炎 疫情 尚未 发现 明确 人 传人 证据 不能 排除 有限 人 传人 可能 但 持续 人 传人 风险 较 低 泰国 新型 冠状病毒 病例 为 武汉 游客 科普 一下 常见 肺炎 的 发病 机制 转发 ​ ,2020-01-15 11:55:00,4,3,4,__label__neutral,0.4149100000000001,0.02163,0.53899,0.53899,3.0,"武汉, 泰国, 病例, 传人, 发现","Wuhan, Thailand, Case, successor, Find"
492,821,-1,冠状病毒,2020-01-15,我爸 好惨 流感 没当回事 结果 肺部 感染 住院 了 我 好 害怕 是 那个 新型 冠状病毒,2020-01-15 11:53:00,0,0,1,__label__negative,0.05341,0.92193,0.00434,0.92193,1.0,"泰国, 中国, 武汉, 病例, 游客","Thailand, China, Wuhan, Case, Tourist"
493,824,-1,冠状病毒,2020-01-15,武汉 不明 原因 肺炎 病毒 调查 进展 如何 出院 标准 是 什么 近期 武汉 不明 原因 肺炎 疫情 引发 各界 关注 一月 九日 专家组 初步 判定 本次 不明 原因 的 病毒性 肺炎 病例 的 病原体 为 新型 冠状病毒 一月 十二日 国家 卫健委 与 世界卫生组织 分享 此次 发现 的 新型 冠状病毒 基因 序列 信息 针对 病毒 溯源 性调查 进展 患者 救治 情况 和 ​ ,2020-01-15 11:51:00,6,0,7,__label__neutral,0.02932,0.19684,0.47659,0.47659,3.0,"武汉, 泰国, 病例, 传人, 发现","Wuhan, Thailand, Case, successor, Find"
494,825,-1,冠状病毒,2020-01-15,针对 新型 冠状病毒 目前 并 无 现有 可用 疫苗 采取 科学 的 预防措施 才能 降低 疾病 感染 和 传播 的 风险 公共 健康,2020-01-13 12:00:00,0,0,1,__label__negative,0.16452999999999998,0.43783,0.01365,0.43783,2.0,"泰国, 病例, 武汉, 游客, 发现","Thailand, Case, Wuhan, Tourist, Find"
495,827,-1,冠状病毒,2020-01-15,泰国 新型 冠状病毒 病例 为 武汉 游客 靠,2020-01-15 11:50:00,0,0,0,__label__positive,0.96487,1e-05,0.96154,0.96487,3.0,"武汉, 泰国, 病例, 传人, 发现","Wuhan, Thailand, Case, successor, Find"
496,829,-1,冠状病毒,2020-01-15,泰国 新型 冠状病毒 病例 为 武汉 游客 每 一个 人 我 想 都 在 童年 的 时候 有 许多 快乐的 事 我 也 不例外 在 外婆家 奶奶家 的 一件件 童年 趣事 事 浮现 在 我 的 脑海 里 像 沙漠 中 的 沙子 数 也 数不清,2020-01-15 11:50:00,0,0,0,__label__negative,0.0237,0.68596,0.06189,0.68596,2.0,"泰国, 病例, 武汉, 游客, 发现","Thailand, Case, Wuhan, Tourist, Find"
