,id,label,keyword,date,content,time,forward,comment,like,predict,__label__positive,__label__negative,__label__neutral,predict_score,topic,topic_keyword,topic_keyword_en
543,709,-1,冠状病毒,2020-01-21,预防 新型 冠状病毒 肺炎 四川省 中医药 管理局 组织 专家 拟定 的 呼吸道 传染病 预防 建议 处方 有 条件 的 可以 口罩 中药 预防 一起 上 大家 还是 要 有 敬畏 之心 呀 少去 人 多 的 地方 凑热闹 戴好 口罩 按照 官方 建议 整上准 没错 这 不是 怕死 是 敬畏 生命 也 是 对 他人 生命 的 负责,2020-01-21 22:57:00,4,9,4,__label__positive,0.96268,0.00611,0.06189,0.96268,0.0,"🙏, 确诊, 病例, 九十, 国内","🙏, Confirmed diagnosis, Case, ninety, domestic"
544,710,-1,冠状病毒,2020-01-21,我 在 看 钟南山 十四名 医护人员 感染 新型 冠状病毒 肺炎 跟 新浪 看 热点 o,2020-01-21 22:57:00,0,0,0,__label__positive,0.9988,1e-05,0.6584300000000001,0.9988,0.0,"🙏, 确诊, 病例, 九十, 国内","🙏, Confirmed diagnosis, Case, ninety, domestic"
545,711,-1,冠状病毒,2020-01-21,二千 零 三年 sars 的 时候 台湾 大批 医护人员 临阵 辞职 脱逃 仅 台湾 长庚医院 就 有 一百多名 护士 辞职 不知道 她 的 信心 是 哪儿 来 的 这个 台湾人 在 武汉 生病 九天 不上报 不就医 非要 回 台湾 就诊 说 对 武汉 医院 没信心 这 九天 不知道 在 武汉 造成 了 什么 请 大家 自己 判断 这样 的 台湾,2020-01-21 18:28:00,1,1,0,__label__negative,0.00611,0.9906,0.00592,0.9906,1.0,"武汉, 确诊, 病例, 三百, 全国","Wuhan, Confirmed diagnosis, Case, three hundred, Nationwide"
546,712,-1,冠状病毒,2020-01-21,国内 确诊 二百 九十 一例 新型 冠状病毒 肺炎 病例 湖南 的 我 愿 平安,2020-01-21 22:57:00,0,5,4,__label__negative,1e-05,0.98758,0.14415999999999998,0.98758,4.0,"病例, 确诊, 一例, 国内, 九十","Case, Confirmed diagnosis, A case, domestic, ninety"
547,717,-1,冠状病毒,2020-01-21,沈阳 确诊 一例 新型 冠状病毒 肺炎 病历 现在 是 有 了 吗 二 沈阳,2020-01-21 22:57:00,1,2,6,__label__negative,0.00072,0.96887,0.05666,0.96887,4.0,"病例, 确诊, 一例, 国内, 九十","Case, Confirmed diagnosis, A case, domestic, ninety"
548,718,-1,冠状病毒,2020-01-21,会 是 下 一个 sars 吗 今年春节 不收礼 收礼 只收 一 口罩 相信 在 这个 春节 口罩 会 是 送礼 佳品 和 三年 的 sars 病毒 一样 这次 不知 从 何时 起 开始 在 网络 上 蔓延 进而 延伸 到 几个 主要 城市 又 恰逢 中国 的 农历年 注定 归心似箭 的 人们 将 在 担忧 与 谨慎 中 度过 这个 节日 只是 对于 一线 的 医务人员 势必 成为 一场 艰难的 防 ​ ,2020-01-21 22:57:00,0,0,0,__label__negative,0.06756000000000001,0.7773100000000001,0.0117,0.7773100000000001,2.0,"五例, 确诊, 一例, 例, 三百","Five cases, Confirmed diagnosis, A case, example, three hundred"
549,719,-1,冠状病毒,2020-01-21,国内 确诊 二百 九十 一例 新型 冠状病毒 肺炎 病例 大家 都 要 平平安安 健健康康 的,2020-01-21 22:57:00,0,0,0,__label__neutral,0.16028,0.00783,0.94816,0.94816,4.0,"病例, 确诊, 一例, 国内, 九十","Case, Confirmed diagnosis, A case, domestic, ninety"
550,720,-1,冠状病毒,2020-01-21,希望 这次 新型 冠状病毒 早点 过去 感谢 这些 专家 研究 人员 的 努力 加油 查看 图片 我 经历 过 三年 的 非典 永远 记得 他 那句 把 重病 人 都 送到 我 这里 来 十八日 傍晚 八十四岁 的 钟南山 从 广州 出发 赶往 武汉 当天 航班 已 买不到 机票 他 被 安顿 在 了 餐车 一角 刚一 落座 便 拿出 文件 研究 o 网页 链,2020-01-21 18:44:00,0,0,0,__label__neutral,0.01543,0.28778000000000004,0.55448,0.55448,0.0,"🙏, 确诊, 病例, 九十, 国内","🙏, Confirmed diagnosis, Case, ninety, domestic"
551,721,-1,冠状病毒,2020-01-21,✨ 人 总是 在 失败 中 去 寻找 生存 的 理由 总是 在 错误的 判断 中想 为 自己 寻找 一种 解脱 其实 人无完人 金无足赤 每个 人 都 有 可能 犯错 谁 都 可能 有 错误 和 失败 十九万 零 六百 零八布 里斯本 王源 国内 确诊 二百 九十 一例 新型 冠状病毒 肺炎 病例,2020-01-21 22:57:00,0,0,0,__label__negative,0.00421,0.91731,0.23372,0.91731,1.0,"武汉, 确诊, 病例, 三百, 全国","Wuhan, Confirmed diagnosis, Case, three hundred, Nationwide"
552,722,-1,冠状病毒,2020-01-21,耄耋之年 挂帅 出征 给 我们 希望 都 好好 的 🙏,2020-01-20 21:56:00,0,0,0,__label__positive,1.00001,1e-05,0.00539,1.00001,0.0,"🙏, 确诊, 病例, 九十, 国内","🙏, Confirmed diagnosis, Case, ninety, domestic"
553,725,-1,冠状病毒,2020-01-21,中科院 武汉 冠状病毒 有 很 强 感染 人 能力 世卫 组织 可能 持续 人 传人 o 中科院 武汉 冠状病毒 有 很 强 感染 人 能力 世卫 组织 可能 持续 人 传人,2020-01-21 22:57:00,0,0,0,__label__neutral,0.0223,0.26895,0.28142,0.28142,0.0,"🙏, 确诊, 病例, 九十, 国内","🙏, Confirmed diagnosis, Case, ninety, domestic"
554,726,-1,冠状病毒,2020-01-21,一定 得 保护 好 自己 希望 能 赶紧 控制 住 🙏 天天 看 新闻 看得 我 害怕 国内 确诊 二百 九十 一例 新型 冠状病毒 肺炎 病例,2020-01-21 22:57:00,0,3,9,__label__negative,0.0006799999999999999,0.9698,0.26895,0.9698,0.0,"🙏, 确诊, 病例, 九十, 国内","🙏, Confirmed diagnosis, Case, ninety, domestic"
555,727,-1,冠状病毒,2020-01-21,国内 确诊 二百 九十 一例 新型 冠状病毒 肺炎 病例 四周 都 沦陷 了 大 弗兰卡 在 中间 瑟瑟 发抖 我 的 导游 同学 正在 呼吁 大家 都 来 张家界 旅游 吧,2020-01-21 22:57:00,0,0,0,__label__neutral,0.02299,0.19684,0.5078199999999999,0.5078199999999999,0.0,"🙏, 确诊, 病例, 九十, 国内","🙏, Confirmed diagnosis, Case, ninety, domestic"
556,728,-1,冠状病毒,2020-01-21,国内 确诊 二百 九十 一例 新型 冠状病毒 肺炎 病例 我们 该 怎么办 一 正常 生活 不要 恐慌 二 尽量少 去 人口 密集 地区 如 无法 避免 请戴 好 口罩 勤洗手 三 最重要的 一点 提高 自己 的 免疫力 空气 水 食物 中 的 各类 细菌 病毒 一直 都 存在 同等 情况 下 为什么 你 会 得病 别人 不会 因为 自身 抵抗力 低 病毒 就 侵入 了 ​ ,2020-01-21 22:57:00,0,2,12,__label__negative,0.03515,0.7982,0.02443,0.7982,1.0,"武汉, 确诊, 病例, 三百, 全国","Wuhan, Confirmed diagnosis, Case, three hundred, Nationwide"
557,730,-1,冠状病毒,2020-01-21,新型 冠状病毒 肺炎 疫情 武汉 厦门航空 涉及 武汉 航班 机票 可 免费 办理 退改 一月 二十一日 厦门航空 官方 微博 发布 通知 厦门航空 现已 针对 购买 涉及 武汉 进出港 航班 客票 的 旅客 提供 免费 退改 服务 o 厦门航空 涉及 武汉 航班 机票 可 免费 办理 退改,2020-01-21 22:57:00,1,0,2,__label__positive,0.5234300000000001,0.3346,0.02163,0.5234300000000001,0.0,"🙏, 确诊, 病例, 九十, 国内","🙏, Confirmed diagnosis, Case, ninety, domestic"
558,731,-1,冠状病毒,2020-01-21,三年 我 刚刚 出生 什么 也 不懂 二十年 我 十七岁 我 对 您 充满 敬佩 钟南山 再战 防疫 最 前线 钟南山 称 有信心 不会 非典 重演 ​ 新型 冠状病毒 肺炎 纳入 法定 传染病 国内 确诊 二百 九十 一例 新型 冠状病毒 肺炎 病例 二 哈尔滨,2020-01-21 22:57:00,0,0,0,__label__negative,0.04469,0.7058,0.05341,0.7058,0.0,"🙏, 确诊, 病例, 九十, 国内","🙏, Confirmed diagnosis, Case, ninety, domestic"
559,732,-1,冠状病毒,2020-01-21,全国 确诊 三百 零九例 新型 冠状病毒 肺炎 为 众人 抱薪者 不可 使 其冻 毙于 风雪 愿 奋战 在 前线 的 医生 平安 归来,2020-01-21 22:57:00,1,4,33,__label__negative,0.03211,0.99769,1e-05,0.99769,1.0,"武汉, 确诊, 病例, 三百, 全国","Wuhan, Confirmed diagnosis, Case, three hundred, Nationwide"
560,733,-1,冠状病毒,2020-01-21,国内 确诊 二百 九十 一例 新型 冠状病毒 肺炎 病例 湖南 现在 往 哪 走 都 危险 夹缝 中 生存 瑟瑟 发抖 保佑,2020-01-21 22:57:00,0,7,1,__label__neutral,0.00421,0.23936,0.87061,0.87061,4.0,"病例, 确诊, 一例, 国内, 九十","Case, Confirmed diagnosis, A case, domestic, ninety"
561,734,-1,冠状病毒,2020-01-21,国内 确诊 二百 九十 一例 新型 冠状病毒 肺炎 病例 大家 出门 一定 要 注意 啊,2020-01-21 22:57:00,0,0,0,__label__neutral,0.01365,0.0331,0.84391,0.84391,4.0,"病例, 确诊, 一例, 国内, 九十","Case, Confirmed diagnosis, A case, domestic, ninety"
562,735,-1,冠状病毒,2020-01-21,国内 确诊 二百 九十 一例 新型 冠状病毒 肺炎 病例 辛苦 了 向 您 致敬,2020-01-21 22:57:00,0,0,0,__label__positive,0.19194,0.01497,0.01034,0.19194,4.0,"病例, 确诊, 一例, 国内, 九十","Case, Confirmed diagnosis, A case, domestic, ninety"
563,740,-1,冠状病毒,2020-01-21,国内 确诊 二百 九十 一例 新型 冠状病毒 肺炎 病例 微博 仍 是 粪坑,2020-01-21 22:57:00,0,0,0,__label__neutral,1e-05,0.90992,0.90992,0.90992,4.0,"病例, 确诊, 一例, 国内, 九十","Case, Confirmed diagnosis, A case, domestic, ninety"
564,741,-1,冠状病毒,2020-01-21,看见 柴静 本来 是 去 买 董卿 的 朗 读者 却 意外 买 回 了 这 本书 放在 现在 这个 时候 读 也 太 合适 了 都 说 九十 后 是 很 抗打 的 一代 九 十八年 的 洪水 三年 的 非典 都 赶上 了 从小 听到 大 的 非典 却 没有 真正的 了解 到 过 这 几天 在 关注 的 新型 冠状病毒 也 是 肺炎 也 是 钟南山 院士 也 是 传染 当初 对 非典 懵懵懂懂 的 九十 ​ ,2020-01-21 22:57:00,2,0,20,__label__negative,0.04604,0.90193,0.00264,0.90193,0.0,"🙏, 确诊, 病例, 九十, 国内","🙏, Confirmed diagnosis, Case, ninety, domestic"
565,742,-1,冠状病毒,2020-01-21,还有 今天 的 热 搜 只有 湾 湾 和 棒子 依然 在 营销 二千 零 三年 sars 的 时候 台湾 大批 医护人员 临阵 辞职 脱逃 台湾 长庚医院 就 有 一百多名 护士 辞职 这个 台湾人 在 武汉 生病 九天 不上报 不就医 非要 回 台湾 就诊 说 对 武汉 医院 没信心 这 九天 不知道 在 武汉 造成 了 什么 大家 自己 判断 这样 的 台湾,2020-01-21 18:28:00,0,0,0,__label__negative,0.00281,0.93441,0.22817,0.93441,1.0,"武汉, 确诊, 病例, 三百, 全国","Wuhan, Confirmed diagnosis, Case, three hundred, Nationwide"
566,743,-1,冠状病毒,2020-01-21,辛苦 了 加油 辛苦 了 同时 医护人员 也 要 注意安全 希望 医护人员 保重 加油,2020-01-21 15:37:00,0,0,0,__label__positive,0.97405,0.22817,1e-05,0.97405,0.0,"🙏, 确诊, 病例, 九十, 国内","🙏, Confirmed diagnosis, Case, ninety, domestic"
567,744,-1,冠状病毒,2020-01-21,flag 别立 那么 早 小心 打脸 动漫 国内 确诊 二百 九十 一例 新型 冠状病毒 肺炎 病例 剑网 三 l 原画 小 能手 的 微博 视频,2020-01-21 22:57:00,0,0,0,__label__negative,0.00462,0.88721,0.11921,0.88721,1.0,"武汉, 确诊, 病例, 三百, 全国","Wuhan, Confirmed diagnosis, Case, three hundred, Nationwide"
568,745,-1,冠状病毒,2020-01-21,钟南山 新型 冠状病毒 目前 刚刚开始 正在 爬坡 钟南山 与 极期 的 sars 相比 毒力 没那么 大 以后 会 怎么样 要 看 发展 情况 另外 要 看 我们 如何 控制 减少 传染,2020-01-20 22:28:00,0,0,0,__label__positive,0.46103,0.16887,0.03211,0.46103,2.0,"五例, 确诊, 一例, 例, 三百","Five cases, Confirmed diagnosis, A case, example, three hundred"
569,746,-1,冠状病毒,2020-01-21,🙏 🙏 🙏 🙏 🙏,2020-01-21 15:37:00,0,0,0,__label__negative,0.00434,0.62978,0.10972,0.62978,0.0,"🙏, 确诊, 病例, 九十, 国内","🙏, Confirmed diagnosis, Case, ninety, domestic"
570,747,-1,冠状病毒,2020-01-21,平安 平安 平安 🙏 🙏 🙏 国内 确诊 二百 九十 一例 新型 冠状病毒 肺炎 病例,2020-01-21 22:57:00,0,0,1,__label__neutral,0.03965,0.1067,0.15204,0.15204,0.0,"🙏, 确诊, 病例, 九十, 国内","🙏, Confirmed diagnosis, Case, ninety, domestic"
571,749,-1,冠状病毒,2020-01-21,una 都 看看 那 时候 我们 还有 柴静 现在 啥 都 没了 我 今天 还 在 想 这次 冠状病毒 我 最深 的 感受 就是 深度 媒体 和 媒体 人 的 缺,2020-01-21 20:03:00,0,0,0,__label__negative,0.018000000000000002,0.92415,0.00886,0.92415,3.0,"武汉, 医院, 感染, 病人, 请","Wuhan, hospital, infection, patient, please"
572,750,-1,冠状病毒,2020-01-21,国内 确诊 二百 九十 一例 新型 冠状病毒 肺炎 病例 要 保护 好 自己 啊 致敬 一线 的 医护人员,2020-01-21 22:57:00,0,0,0,__label__neutral,0.0223,0.0036,0.94336,0.94336,0.0,"🙏, 确诊, 病例, 九十, 国内","🙏, Confirmed diagnosis, Case, ninety, domestic"
573,751,-1,冠状病毒,2020-01-21,国内 确诊 二百 九十 一例 新型 冠状病毒 肺炎 病例 天佑 中华 我们 可以 的 加油 大家 做好 防护 照顾 好 自己,2020-01-21 22:57:00,0,0,0,__label__neutral,0.1733,0.0901,0.23372,0.23372,0.0,"🙏, 确诊, 病例, 九十, 国内","🙏, Confirmed diagnosis, Case, ninety, domestic"
574,752,-1,冠状病毒,2020-01-21,✊,2020-01-21 19:45:00,0,0,0,__label__negative,1e-05,0.27514,0.00055,0.27514,3.0,"武汉, 医院, 感染, 病人, 请","Wuhan, hospital, infection, patient, please"
575,753,-1,冠状病毒,2020-01-21,国内 确诊 二百 九十 一例 新型 冠状病毒 肺炎 病例 四川 都 三例 了 少去 人 多 的 地方 做好 科学 防御,2020-01-21 22:57:00,0,0,0,__label__neutral,0.00383,0.07587,0.94816,0.94816,4.0,"病例, 确诊, 一例, 国内, 九十","Case, Confirmed diagnosis, A case, domestic, ninety"
576,754,-1,冠状病毒,2020-01-21,此次 新型 冠状病毒 肺炎 中国 首发 中国 源头 中国 医生 医治 此时 放 上 这些 金发碧眼 的 外国 医护 图片 只能 说 太 不专业 了,2020-01-21 16:28:00,0,0,1,__label__positive,0.5234300000000001,0.12941,0.016919999999999998,0.5234300000000001,2.0,"五例, 确诊, 一例, 例, 三百","Five cases, Confirmed diagnosis, A case, example, three hundred"
577,755,-1,冠状病毒,2020-01-21,老 母亲 的 担忧 伴随 着 浙江 发生 新型 冠状病毒 而 消失 无论如何 都 不让 老大 出门 了 新型 冠状病毒 在 春节 后会 有 一个 大 爆发 在家 安稳 挺 好,2020-01-21 22:57:00,0,0,0,__label__negative,0.11597,0.7982,0.01283,0.7982,4.0,"病例, 确诊, 一例, 国内, 九十","Case, Confirmed diagnosis, A case, domestic, ninety"
578,756,-1,冠状病毒,2020-01-21,国家 卫健委 继续加强 新型 冠状病毒 溯源 和 变异 监测 工作 o 国家 卫健委 继续加强 新型 冠状病毒 溯源 和 变异 监测 工作,2020-01-21 22:57:00,0,0,0,__label__neutral,0.04338,0.0927,0.69265,0.69265,0.0,"🙏, 确诊, 病例, 九十, 国内","🙏, Confirmed diagnosis, Case, ninety, domestic"
579,761,-1,冠状病毒,2020-01-21,还有 一群 自以为是 的 sb 说 是 在 搞 营销 卖 口罩 真是 无语 国内 确诊 二百 九十 一例 新型 冠状病毒 肺炎 病例,2020-01-21 22:57:00,0,1,1,__label__negative,1e-05,0.84798,0.80318,0.84798,4.0,"病例, 确诊, 一例, 国内, 九十","Case, Confirmed diagnosis, A case, domestic, ninety"
580,762,-1,冠状病毒,2020-01-21,做好 防护 新型 冠状病毒 致敬 白衣天使,2020-01-21 22:57:00,0,0,4,__label__negative,0.03115,0.53122,0.0022600000000000003,0.53122,0.0,"🙏, 确诊, 病例, 九十, 国内","🙏, Confirmed diagnosis, Case, ninety, domestic"
581,763,-1,冠状病毒,2020-01-21,国内 确诊 二百 九十 一例 新型 冠状病毒 肺炎 病例 长沙 被 包围 了 二 海口,2020-01-21 22:57:00,0,0,0,__label__positive,0.98257,1e-05,0.4688,0.98257,4.0,"病例, 确诊, 一例, 国内, 九十","Case, Confirmed diagnosis, A case, domestic, ninety"
582,764,-1,冠状病毒,2020-01-21,现在 微博 的 热 搜 几乎 都 是 关于 这个 新型 冠状病毒 大概 在 十一月份 左右 我 妈妈 去 武汉 旅行 了 现在 想 起来 真的 后怕 眼看 着 患此 病毒 的 人 越来越 多 竟然 都 涉及 到 台湾 韩国 🇰 🇷 而且 已经 有 了 死亡 的 案例 在 这种 时刻 就 很 庆幸 自己 在 这个 小山 沟里 东西南北 都 是 山 我们 这座 城市 人流量 很小 看到 钟南生 八十四岁 ​ ,2020-01-21 22:57:00,0,3,9,__label__negative,0.01641,0.68596,0.26895,0.68596,1.0,"武汉, 确诊, 病例, 三百, 全国","Wuhan, Confirmed diagnosis, Case, three hundred, Nationwide"
583,768,-1,冠状病毒,2020-01-21,国内 确诊 二百 九十 一例 新型 冠状病毒 肺炎 病例 少去 人 多 的 地方 出门 带 好 口罩 希望 大家 都 能 过个 好 年,2020-01-21 22:57:00,0,0,0,__label__negative,0.0063,0.7773100000000001,0.14035,0.7773100000000001,4.0,"病例, 确诊, 一例, 国内, 九十","Case, Confirmed diagnosis, A case, domestic, ninety"
584,769,-1,冠状病毒,2020-01-21,国内 确诊 二百 九十 一例 新型 冠状病毒 肺炎 病例 一定 要 度过 难过 二千 零 二十年 要 好好 的 病毒 病毒 快 走开,2020-01-21 22:57:00,0,0,0,__label__neutral,0.17782,0.03623,0.23936,0.23936,4.0,"病例, 确诊, 一例, 国内, 九十","Case, Confirmed diagnosis, A case, domestic, ninety"
585,770,-1,冠状病毒,2020-01-21,我 在 看 全国 确诊 三百 零九例 新型 冠状病毒 肺炎 病例 跟 新浪 看 热点 o 全国 确诊 三百 零九例 新型 冠状病毒 肺炎 病例,2020-01-21 22:57:00,0,0,0,__label__neutral,0.28142,0.008329999999999999,0.87061,0.87061,1.0,"武汉, 确诊, 病例, 三百, 全国","Wuhan, Confirmed diagnosis, Case, three hundred, Nationwide"
586,771,-1,冠状病毒,2020-01-21,全国 确诊 三百 零九例 新型 冠状病毒 肺炎,2020-01-21 22:57:00,0,0,0,__label__neutral,0.01451,0.03115,0.88081,0.88081,1.0,"武汉, 确诊, 病例, 三百, 全国","Wuhan, Confirmed diagnosis, Case, three hundred, Nationwide"
587,772,-1,冠状病毒,2020-01-21,境内 确诊 二百一十 七例 新型 冠状病毒 肺炎 病例 天佑 中华 🙂,2020-01-21 22:57:00,0,0,0,__label__neutral,0.0004,0.12253,0.99653,0.99653,4.0,"病例, 确诊, 一例, 国内, 九十","Case, Confirmed diagnosis, A case, domestic, ninety"
588,773,-1,冠状病毒,2020-01-21,国内 确诊 二百 九十 一例 新型 冠状病毒 肺炎 病例 一定 要 做好 防护 措施 🙏 不要 再有 了,2020-01-21 22:57:00,0,0,1,__label__neutral,0.02597,0.01451,0.86705,0.86705,4.0,"病例, 确诊, 一例, 国内, 九十","Case, Confirmed diagnosis, A case, domestic, ninety"
589,774,-1,冠状病毒,2020-01-21,day 四百 九十九 三点 睡一觉 睡 到 十一点 可爽 了 现在 这 新型 冠状病毒 越来越 严重 了 决定 不出门 了 宅 家里 吧 吃吃喝喝 长肉 肉 所有 的 走亲戚 都 取消 都 在家 自闭 无聊 看 了 看 电影院 的 买票 情况 全是 空荡荡 要是 我 不怕死 出门 看 电影 可不是 包场 节奏 哈哈哈 希望 大家 都 好 吧 这次 有点 可怕 咯,2020-01-21 22:57:00,0,0,0,__label__negative,0.0716,0.95398,0.00318,0.95398,1.0,"武汉, 确诊, 病例, 三百, 全国","Wuhan, Confirmed diagnosis, Case, three hundred, Nationwide"
590,779,-1,冠状病毒,2020-01-21,国内 确诊 二百 九十 一例 新型 冠状病毒 肺炎 病例 忽然 翻倍,2020-01-21 22:57:00,0,2,0,__label__neutral,0.00098,0.05186,0.98029,0.98029,4.0,"病例, 确诊, 一例, 国内, 九十","Case, Confirmed diagnosis, A case, domestic, ninety"
591,780,-1,冠状病毒,2020-01-21,院士 出征 寸毒 不,2020-01-21 15:37:00,0,0,0,__label__negative,0.28778000000000004,0.96591,1e-05,0.96591,0.0,"🙏, 确诊, 病例, 九十, 国内","🙏, Confirmed diagnosis, Case, ninety, domestic"
592,781,-1,冠状病毒,2020-01-21, 贵州大学 晚安 贵大 国内 确诊 二百 九十 一例 新型 冠状病毒 肺炎 病例 疾病 预防 有 必要 希望 大家 可以 好好 记下来 晚安 啦,2020-01-21 22:57:00,3,14,25,__label__positive,0.9363,0.0022600000000000003,0.28142,0.9363,0.0,"🙏, 确诊, 病例, 九十, 国内","🙏, Confirmed diagnosis, Case, ninety, domestic"
593,782,-1,冠状病毒,2020-01-21,以后 再 回忆 今天 不知 是 什么 心,2020-01-20 23:18:00,0,0,0,__label__negative,1e-05,1.00001,1e-05,1.00001,0.0,"🙏, 确诊, 病例, 九十, 国内","🙏, Confirmed diagnosis, Case, ninety, domestic"
594,784,-1,冠状病毒,2020-01-21,回复 的 表态 安徽 与 湖北 接壤 安徽 应 立即行动 全力 检查 武汉 新型 冠状病毒 肺,2020-01-21 17:05:00,0,0,0,__label__negative,0.13297,0.51563,0.01206,0.51563,4.0,"病例, 确诊, 一例, 国内, 九十","Case, Confirmed diagnosis, A case, domestic, ninety"
595,785,-1,冠状病毒,2020-01-21,辛苦 了 加油 加油,2020-01-21 15:37:00,0,0,0,__label__negative,0.16028,0.96379,1e-05,0.96379,0.0,"🙏, 确诊, 病例, 九十, 国内","🙏, Confirmed diagnosis, Case, ninety, domestic"
596,786,-1,冠状病毒,2020-01-21,爱情 都 轮不到 我 肺炎 更 不会 国内 确诊 二百 九十 一例 新型 冠状病毒 肺炎 病例,2020-01-21 22:57:00,0,0,3,__label__negative,1e-05,0.78794,0.5000100000000001,0.78794,4.0,"病例, 确诊, 一例, 国内, 九十","Case, Confirmed diagnosis, A case, domestic, ninety"
597,787,-1,冠状病毒,2020-01-21,国内 确诊 二百 九十 一例 新型 冠状病毒 肺炎 病例 快 好 起来,2020-01-21 22:57:00,0,0,0,__label__neutral,0.9363,1e-05,0.93992,0.93992,4.0,"病例, 确诊, 一例, 国内, 九十","Case, Confirmed diagnosis, A case, domestic, ninety"
598,788,-1,冠状病毒,2020-01-21,国内 确诊 二百 九十 一例 新型 冠状病毒 肺炎 病例 武汉 新型 肺炎 患者 救治 由 政府 买单 致敬 钟老 国士无双 他 告诉 大家 不要 去 武汉 自己 却 奔赴 一线 愿 平安 🙏 🙏,2020-01-21 22:57:00,2,1,62,__label__positive,0.93246,0.0022600000000000003,0.07371,0.93246,0.0,"🙏, 确诊, 病例, 九十, 国内","🙏, Confirmed diagnosis, Case, ninety, domestic"
599,789,-1,冠状病毒,2020-01-21,大家 注意安全 少 出门 带 口罩 勤洗,2020-01-20 21:56:00,0,0,0,__label__neutral,0.00058,0.30737,0.7431800000000001,0.7431800000000001,4.0,"病例, 确诊, 一例, 国内, 九十","Case, Confirmed diagnosis, A case, domestic, ninety"
600,790,-1,冠状病毒,2020-01-21,会 的 🙏,2020-01-21 15:37:00,1,0,0,__label__negative,1e-05,0.98202,1e-05,0.98202,0.0,"🙏, 确诊, 病例, 九十, 国内","🙏, Confirmed diagnosis, Case, ninety, domestic"
601,791,-1,冠状病毒,2020-01-21,国内 确诊 二百 九十 一例 新型 冠状病毒 肺炎 病例 因为 最近 肺炎 然后 去 看 了 非典 纪录片 同样 是 前面 十二月 发现 敢 在 春运期间 爆发 有点 细思极 恐 了 希望 这次 现代医学 媒体 和 民众 意识 都 进步的 情况 下 能 尽快 能 安然无恙 的 又 跟 家人 讨论 了 当年 自己 误喝 农药 的 情节 真的 是 无限 后怕 珍惜 现在 所有 的 一切 好好 照顾 自己 ​ ,2020-01-21 22:56:00,0,0,0,__label__negative,0.01323,0.76066,0.08511,0.76066,1.0,"武汉, 确诊, 病例, 三百, 全国","Wuhan, Confirmed diagnosis, Case, three hundred, Nationwide"
602,792,-1,冠状病毒,2020-01-21,全国 确诊 三百 零九例 新型 冠状病毒 肺炎 我 的 天 哪 五个 小时 左右 又 增加 了 十八 例 心慌慌 哪 大家 都 要 平平安安 的 呀 一定 要 啊,2020-01-21 22:56:00,0,0,0,__label__neutral,0.08757000000000001,0.01244,0.95916,0.95916,1.0,"武汉, 确诊, 病例, 三百, 全国","Wuhan, Confirmed diagnosis, Case, three hundred, Nationwide"
603,793,-1,冠状病毒,2020-01-21,国内 确诊 二百 九十 一例 新型 冠状病毒 肺炎 病例 只愿 天佑 中华,2020-01-21 22:56:00,0,0,0,__label__neutral,0.0065,0.03848,0.8962600000000001,0.8962600000000001,0.0,"🙏, 确诊, 病例, 九十, 国内","🙏, Confirmed diagnosis, Case, ninety, domestic"
604,794,-1,冠状病毒,2020-01-21,转发 了解 新型 冠状病毒 肺炎 潜伏期 国家 卫健委 专家 组成员 高占成 表示 新型 冠状病毒 肺炎 的 潜伏期 平均 在 七天 左右 短 的 在 二 三天 长 的 十 十二天 如 出现 发热 干咳 呼吸衰竭 休克 等 症状 请 及时 就医 央视,2020-01-21 22:22:00,0,0,0,__label__neutral,0.1067,0.03734,0.7663,0.7663,1.0,"武汉, 确诊, 病例, 三百, 全国","Wuhan, Confirmed diagnosis, Case, three hundred, Nationwide"
605,795,-1,冠状病毒,2020-01-21,全国 确诊 三百 零九例 新型 冠状病毒 肺炎 🙏 好 难过 o ╥ ╥ o,2020-01-21 22:56:00,0,0,0,__label__positive,0.84391,0.02443,0.02932,0.84391,0.0,"🙏, 确诊, 病例, 九十, 国内","🙏, Confirmed diagnosis, Case, ninety, domestic"
606,796,-1,冠状病毒,2020-01-21,四川 确诊 首例 新型 肺炎 预防 新型 冠状病毒 戴好 口罩 保护 自己 也 对 他人 负责 和 小艺 一起 健健康康 过大年,2020-01-21 22:56:00,1,1,8,__label__negative,0.10089,0.71224,0.01365,0.71224,1.0,"武汉, 确诊, 病例, 三百, 全国","Wuhan, Confirmed diagnosis, Case, three hundred, Nationwide"
607,801,-1,冠状病毒,2020-01-21,新型 冠状病毒 真的 可怕 躲 在 被子 里 瑟瑟 发抖 祈祷 大家 都 平安 健康,2020-01-21 22:56:00,0,1,0,__label__negative,0.05034,0.8740899999999999,0.008329999999999999,0.8740899999999999,0.0,"🙏, 确诊, 病例, 九十, 国内","🙏, Confirmed diagnosis, Case, ninety, domestic"
