,id,label,keyword,date,content,time,forward,comment,like,predict,__label__positive,__label__negative,__label__neutral,predict_score,topic,topic_keyword,topic_keyword_en
0,1,-1,冠状病毒,2020-01-17,泰国 卫生部 一月 十七日 表示 已 发现 第二例 新型 冠状病毒 感染 的 肺炎 确诊 病例 患者 是 一名 来自 武汉 的 七十四岁 中国籍 女 游客 这 也 是 在 中国 境外 发现 的 第三例 新型 冠状病毒 确诊 病例,2020-01-17 22:59:00,0,1,2,__label__neutral,0.00084,0.7982,0.80808,0.80808,4.0,"发现, 患者, 泰国, 确诊, 第二例","Find, patient, Thailand, Confirmed diagnosis, Second case"
1,2,-1,冠状病毒,2020-01-17,专家 释疑 新型 冠状病毒 与 sars 相似 程度 为 八十 持续 传人 风险 较 低 截至 目前 武汉市 累计 报告 新型 冠状病毒 感染 的 肺炎 病例 四十 一例 治愈 出院 十二 例 在 治 重症 五例 死亡 二例 o,2020-01-17 22:59:00,0,0,1,__label__negative,0.23372,0.27514,0.04469,0.27514,3.0,"武汉, 口罩, 发现, 患者, 泰国","Wuhan, Mask, Find, patient, Thailand"
2,3,-1,冠状病毒,2020-01-17,日本 也 首次 确诊 了 新型 肺炎 中国籍 曾到 武汉 已经 痊愈 而且 也 无 感染 日本 确认 首例 新型 冠状病毒 病例,2020-01-17 22:58:00,1,0,3,__label__neutral,0.08037000000000001,0.14415999999999998,0.22817,0.22817,0.0,"武汉, 发现, 泰国, 患者, 第二例","Wuhan, Find, Thailand, patient, Second case"
3,5,-1,冠状病毒,2020-01-17,掌控 话语权 我 奶奶 个 腿 应该 完全 平反 因为 确确实实 是 冠状病毒 引发 的 肺炎 抓 的 八个 人 是否 按 八十 评,2020-01-16 12:35:00,1,1,1,__label__negative,1e-05,0.98089,0.14806,0.98089,3.0,"武汉, 口罩, 发现, 患者, 泰国","Wuhan, Mask, Find, patient, Thailand"
4,6,-1,冠状病毒,2020-01-17,大盘 三千 故事 多 最近 武汉 新型 冠状病毒 肺炎 的 报道 让 人 人心惶惶 过年 了 祝福 所有人 平安 吉祥,2020-01-17 09:50:00,0,0,0,__label__negative,0.03022,0.62247,0.22817,0.62247,3.0,"武汉, 口罩, 发现, 患者, 泰国","Wuhan, Mask, Find, patient, Thailand"
5,7,-1,冠状病毒,2020-01-17, 临汾 大事 小情 科普 一下 常见 肺炎 的 发病 机制 转 起来 通过 视频 让 更 多 人 了解 武汉 卫健委 发布 新型 冠状 病例 感染 的 肺炎 疫情 知识 问答 武汉 卫健委在 问答 中 表示 目前 肺炎 疫情 尚未 发现 明确 人 传人 证据 不能 排除 有限 人 传人 可能 但 持续 人 传人 风险 较 低 武汉 冠状病毒 肺炎 新增 死亡 一例 ​ ,2020-01-17 22:56:00,6,0,9,__label__neutral,0.22271,0.05341,0.4225100000000001,0.4225100000000001,0.0,"武汉, 发现, 泰国, 患者, 第二例","Wuhan, Find, Thailand, patient, Second case"
6,8,-1,冠状病毒,2020-01-17,repos,2020-01-17 16:35:00,0,0,0,__label__neutral,1e-05,1e-05,1.00001,1.00001,0.0,"武汉, 发现, 泰国, 患者, 第二例","Wuhan, Find, Thailand, patient, Second case"
7,9,-1,冠状病毒,2020-01-17,学校 就 在 华南 边上 都 不带 慌,2020-01-17 16:35:00,0,0,0,__label__neutral,0.00339,0.08271,0.73717,0.73717,1.0,"泰国, 发现, 患者, 第二例, 病毒","Thailand, Find, patient, Second case, virus"
8,10,-1,冠状病毒,2020-01-17,武汉 冠状病毒 肺炎 新增 死亡 一例 又 害怕 又 焦虑 希望 赶快 度过 今晚 和 明晚,2020-01-17 22:53:00,1,1,0,__label__neutral,0.02443,0.05666,0.30737,0.30737,3.0,"武汉, 口罩, 发现, 患者, 泰国","Wuhan, Mask, Find, patient, Thailand"
9,11,-1,冠状病毒,2020-01-17,嗯 我 都 以为 稳定下来,2020-01-17 16:35:00,0,0,0,__label__negative,1e-05,1.00001,0.00574,1.00001,4.0,"发现, 患者, 泰国, 确诊, 第二例","Find, patient, Thailand, Confirmed diagnosis, Second case"
10,12,-1,冠状病毒,2020-01-17,泰国 发现 第二例 新型 冠状病毒 肺炎 患,2020-01-17 19:16:00,0,0,0,__label__neutral,1e-05,0.08757000000000001,0.9963,0.9963,4.0,"发现, 患者, 泰国, 确诊, 第二例","Find, patient, Thailand, Confirmed diagnosis, Second case"
11,13,-1,冠状病毒,2020-01-17,给 你 转发 了 做 医学 科普 辛苦 了 传播 途径 人类 冠状病毒 最 常见 的 感染 是从 人 传播 到 其他人 通过 咳嗽 和 打喷嚏 呼吸 空气 亲密 接触 例如 触摸 或 握手 触摸 带有 病毒 的 物体 或 表面 在 洗手 之前 先 触摸 嘴巴 鼻子 或 眼睛 很少 情况 下 冠状病毒 可 通过 粪便 传播,2020-01-17 22:24:00,2,1,6,__label__negative,0.12593,0.36298,0.04338,0.36298,4.0,"发现, 患者, 泰国, 确诊, 第二例","Find, patient, Thailand, Confirmed diagnosis, Second case"
12,18,-1,冠状病毒,2020-01-17,明天 去 买 口罩 我 想 回家 过年 虽然 我要 奋斗 要 最后 一,2020-01-17 16:35:00,0,0,0,__label__negative,1e-05,0.99851,1e-05,0.99851,3.0,"武汉, 口罩, 发现, 患者, 泰国","Wuhan, Mask, Find, patient, Thailand"
13,19,-1,冠状病毒,2020-01-17,泰国 发现 第二例 新型 冠状病毒 肺炎 患者 最 严重的 是 现在 已经 开始 春运 了 如果 没控制 好 的话 很 有 可能 全国 大 爆发 啊,2020-01-17 22:46:00,0,0,42,__label__neutral,0.01451,0.37024,0.53122,0.53122,0.0,"武汉, 发现, 泰国, 患者, 第二例","Wuhan, Find, Thailand, patient, Second case"
14,20,-1,冠状病毒,2020-01-17,口罩 安排 上 了 我 看 非典 纪录片 当年 山西 一个 女生 去 广东 玩 担心 那边 的 肺炎 她 妈妈 认识 的 媒体 朋友 说 肺炎 都 是 造谣 的 爸爸 上网 查 网友 说 不用 怕 没事 最后 女生 去 了 广东 广东 的 司机 说 不怕 没事 的 我们 连 口罩 都 不带 最后 那个 女生 回 山西 后 全家 感染 除了 武汉,2020-01-17 16:35:00,0,0,0,__label__neutral,0.02932,0.18714,0.4149100000000001,0.4149100000000001,4.0,"发现, 患者, 泰国, 确诊, 第二例","Find, patient, Thailand, Confirmed diagnosis, Second case"
15,21,-1,冠状病毒,2020-01-17,分享 网易 新闻 泰国 发现 第二例 新型 冠状病毒 肺炎 患者 系 七十四岁 中国籍 女子 o 泰国 发现 第二例 新型 冠状病毒 肺炎 患者 系 七十四岁 中国籍 女子,2020-01-17 22:44:00,0,0,0,__label__neutral,0.01365,0.0421,0.98505,0.98505,4.0,"发现, 患者, 泰国, 确诊, 第二例","Find, patient, Thailand, Confirmed diagnosis, Second case"
16,22,-1,冠状病毒,2020-01-17,泰国 发现 第二例 新型 冠状病毒 肺炎 患者 勤洗手 带 口罩 不必 恐慌 但是 也 别心 大 就是 旁边 有个 普通 感冒 的 大过年 的 被 传染 也 不太好 啊,2020-01-17 22:43:00,0,0,1,__label__negative,0.00044,0.97839,0.1067,0.97839,3.0,"武汉, 口罩, 发现, 患者, 泰国","Wuhan, Mask, Find, patient, Thailand"
17,23,-1,冠状病毒,2020-01-17,泰国 发现 第二例 新型 冠状病毒 肺炎 患者 系 七十四岁 中国籍 女子 据 路透社 报道 泰国 公共 卫生部 部长 阿努丁 十七日 表示 该国 已 发现 第二例 新型 冠状病毒 确诊 病例 患者 是 一名 七十四岁 中国籍 女子 报道 称 最新 一起 确诊 患者 来自 武汉 泰国 卫生部 官员 称 这名 七十四岁 的 女性 十三日 抵达 泰国 后 即 被 隔离 后来 发现 被 感染 阿努 ​ ,2020-01-17 22:42:00,0,0,0,__label__neutral,0.08037000000000001,0.06372,0.86705,0.86705,4.0,"发现, 患者, 泰国, 确诊, 第二例","Find, patient, Thailand, Confirmed diagnosis, Second case"
18,24,-1,冠状病毒,2020-01-17,新 冠状病毒 刚好 感冒 了 咳嗽 有点 害怕,2020-01-17 22:42:00,0,0,0,__label__negative,1e-05,1.00001,1e-05,1.00001,3.0,"武汉, 口罩, 发现, 患者, 泰国","Wuhan, Mask, Find, patient, Thailand"
19,25,-1,冠状病毒,2020-01-17,泰国 发现 第二例 新型 冠状病毒 肺炎 患者 一月 十七日 泰国 公布 发现 第二例 二千 零 一十九 ncov 确诊 病例 患者 是 一名 七十四岁 中国籍 女子 这 也 是 在 中国 境外 发现 的 第三例 新型 冠状病毒 确诊 病例,2020-01-17 22:41:00,0,0,0,__label__neutral,0.00206,0.36298,0.96154,0.96154,4.0,"发现, 患者, 泰国, 确诊, 第二例","Find, patient, Thailand, Confirmed diagnosis, Second case"
20,27,-1,冠状病毒,2020-01-17,在 武汉 的 医学生 两层 口罩 坐地铁 地铁 上 却 少 有人 戴 口罩 除了 武汉 都 在 恐,2020-01-17 16:35:00,0,0,0,__label__negative,1e-05,0.95115,0.6076699999999999,0.95115,3.0,"武汉, 口罩, 发现, 患者, 泰国","Wuhan, Mask, Find, patient, Thailand"
21,28,-1,冠状病毒,2020-01-17,跟 新 冠状病毒 患者 接触 过 的 医生 竟然 还 在 一线 工作 中 我 本来 以为 他们 可以 借 隔离 的 机会 好好 给 自己 放个 假,2020-01-17 15:26:00,0,0,0,__label__negative,0.01641,0.93813,0.00759,0.93813,3.0,"武汉, 口罩, 发现, 患者, 泰国","Wuhan, Mask, Find, patient, Thailand"
22,29,-1,冠状病毒,2020-01-17,泰国 出现 第二例 新型 冠状病毒 确诊 病例 为 七十四岁 中国 女子 o 泰国 出现 第二例 新型 冠状病毒 确诊 病例 为 七十四岁 中国 女子,2020-01-17 22:39:00,0,0,0,__label__neutral,0.21208,0.0013800000000000002,0.96692,0.96692,4.0,"发现, 患者, 泰国, 确诊, 第二例","Find, patient, Thailand, Confirmed diagnosis, Second case"
23,34,-1,冠状病毒,2020-01-17,泰国 发现 第二例 新型 冠状病毒 肺炎 患者,2020-01-17 22:38:00,0,0,0,__label__neutral,0.0006,0.05836,0.99332,0.99332,4.0,"发现, 患者, 泰国, 确诊, 第二例","Find, patient, Thailand, Confirmed diagnosis, Second case"
24,35,-1,冠状病毒,2020-01-17,泰国 发现 第二例 新型 冠状病毒 肺炎 患者 希望 别 再 增加 人数 了 马上 过年 了 还是 希望 都 平平安安 吧 🙏 🙏,2020-01-17 22:38:00,0,0,0,__label__neutral,0.04469,0.14415999999999998,0.67919,0.67919,3.0,"武汉, 口罩, 发现, 患者, 泰国","Wuhan, Mask, Find, patient, Thailand"
25,37,-1,冠状病毒,2020-01-17,泰国 发现 第二例 新型 冠状病毒 肺炎 患者 系 七十四岁 中国籍 女子 据 路透社 报道 泰国 公共 卫生部 部长 阿努丁 十七日 表示 该国 已 发现 第二例 新型 冠状病毒 确诊 病例 患者 是 一名 七十四岁 中国籍 女子 报道 称 最新 一起 确诊 患者 来自 武汉 泰国 卫生部 官员 称 这名 七十四岁 的 女性 十三日 抵达 泰国 后 即 被 隔离 后来 发现 被 感染,2020-01-17 22:37:00,2,1,5,__label__neutral,0.04887,0.12593,0.8397399999999999,0.8397399999999999,4.0,"发现, 患者, 泰国, 确诊, 第二例","Find, patient, Thailand, Confirmed diagnosis, Second case"
26,38,-1,冠状病毒,2020-01-17,哈哈哈 哈哈 武汉 人 深有体会 除了 武汉 都 在 恐,2020-01-17 16:35:00,0,0,0,__label__negative,1e-05,0.99721,0.02519,0.99721,3.0,"武汉, 口罩, 发现, 患者, 泰国","Wuhan, Mask, Find, patient, Thailand"
27,39,-1,冠状病毒,2020-01-17,武汉 肺炎 疫情 泰国 发现 第二例 新型 冠状病毒 肺炎 患者 系一 七十四岁 中国籍 女子 一月 十七日 泰国 公共 卫生部 在 其 官网 公布 已 发现 第二例 二千 零 一十九 ncov 确诊 病例 患者 是 一名 七十四岁 中国籍 女子 这 也 是 在 中国 境外 发现 的 第三例 新型 冠状病毒 确诊 病例 目前 两名 确诊 患者 在 负 气压 隔离病房 中 接受 治疗 两人 之间 发病 并 无相 ​ ,2020-01-17 22:36:00,0,0,2,__label__neutral,0.02597,0.04086,0.93992,0.93992,4.0,"发现, 患者, 泰国, 确诊, 第二例","Find, patient, Thailand, Confirmed diagnosis, Second case"
28,40,-1,冠状病毒,2020-01-17,泰国 发现 第二例 新型 冠状病毒 肺炎 患者 请 大家 不要 再说 什么 没事 没影响 让 你 带个 口罩 勤洗手 不去 人流 多 的 地方 难道 是 害 你 传染病 这种 事 再 怎么 小心 也 不为过 吧 这 又 不是 什么 危言耸听 希望 大家 都 能 平平安安 吧,2020-01-17 22:35:00,1,2,5,__label__neutral,0.07587,0.04744,0.69265,0.69265,3.0,"武汉, 口罩, 发现, 患者, 泰国","Wuhan, Mask, Find, patient, Thailand"
29,41,-1,冠状病毒,2020-01-17,不明 原因 新型 冠状病毒 肺炎 希望 大家 都 身体健康 平安 过年,2020-01-17 16:35:00,0,0,0,__label__positive,0.62978,0.11281,0.03115,0.62978,0.0,"武汉, 发现, 泰国, 患者, 第二例","Wuhan, Find, Thailand, patient, Second case"
30,42,-1,冠状病毒,2020-01-17,泰国 发现 第二例 新型 冠状病毒 肺炎 患者 我 突然 觉得 我 呼吸困难 头 也 疼 了,2020-01-17 22:33:00,0,0,0,__label__negative,0.00035,0.90732,0.30737,0.90732,1.0,"泰国, 发现, 患者, 第二例, 病毒","Thailand, Find, patient, Second case, virus"
31,43,-1,冠状病毒,2020-01-17,我 是 真的 有 在 恐慌 除了 武汉 都 在 恐,2020-01-17 16:35:00,1,0,1,__label__negative,1e-05,0.99684,0.25092,0.99684,3.0,"武汉, 口罩, 发现, 患者, 泰国","Wuhan, Mask, Find, patient, Thailand"
32,44,-1,冠状病毒,2020-01-17,腾讯 新闻 泰国 发现 第二例 武汉 新型 冠状病毒 肺炎 患者 七十四岁 中国籍 女子 o 泰国 发现 第二例 武汉 新型 冠状病毒 肺炎 患者 七十四岁 中国籍 女子,2020-01-17 22:32:00,0,0,0,__label__neutral,0.16887,0.00556,0.97559,0.97559,4.0,"发现, 患者, 泰国, 确诊, 第二例","Find, patient, Thailand, Confirmed diagnosis, Second case"
33,45,-1,冠状病毒,2020-01-17,武汉 冠状病毒 肺炎 新增 死亡 一例 还是 看 政府 权威 发布 不信 谣 不传谣 相信 政府,2020-01-17 11:30:00,0,0,0,__label__positive,0.6723399999999999,0.00114,0.53122,0.6723399999999999,3.0,"武汉, 口罩, 发现, 患者, 泰国","Wuhan, Mask, Find, patient, Thailand"
34,46,-1,冠状病毒,2020-01-17,希望 可以 每日 更新 感染 数据 尽快 在 国内 除 武汉 其他 地区 医院 开启 病毒 相关 检测 程序 以及 在 安检 的 同时 为 乘客 在 火车站 和 飞机场 等 人口 密集 场所 测量体温,2020-01-17 16:35:00,1,0,0,__label__negative,0.07808999999999999,0.38492,0.05186,0.38492,4.0,"发现, 患者, 泰国, 确诊, 第二例","Find, patient, Thailand, Confirmed diagnosis, Second case"
35,51,-1,冠状病毒,2020-01-17,传播 途径 人类 冠状病毒 最 常见 的 感染 是从 人 传播 到 其他人 通过 咳嗽 和 打喷嚏 呼吸 空气 亲密 接触 例如 触摸 或 握手 触摸 带有 病毒 的 物体 或 表面 在 洗手 之前 先 触摸 嘴巴 鼻子 或 眼睛 很少 情况 下 冠状病毒 可 通过 粪便 传播,2020-01-17 22:24:00,3,2,1,__label__negative,0.03515,0.7773100000000001,0.04086,0.7773100000000001,4.0,"发现, 患者, 泰国, 确诊, 第二例","Find, patient, Thailand, Confirmed diagnosis, Second case"
36,52,-1,冠状病毒,2020-01-17,泰国 发现 第二例 新型 冠状病毒 肺炎 患者 今天 吃 了 海鲜 出门 还 没戴 口罩 我 慌 了,2020-01-17 22:32:00,0,9,2,__label__neutral,0.00942,0.055020000000000006,0.71224,0.71224,3.0,"武汉, 口罩, 发现, 患者, 泰国","Wuhan, Mask, Find, patient, Thailand"
37,53,-1,冠状病毒,2020-01-17,动画 科普 冠状病毒 做好 日常 防护 措施 不必 惊慌 冠状病毒 颗粒 就 像 一顶 帝王 的 皇冠 因此 得名 冠状病毒 那么 冠状病毒 是 什么 有 什么 特点 新型 病毒 传人 吗 在 流感 高发 季 我们 应该 如何 预防 被 感染 l 王者 君 啊 的 微博 视频 ​ ​,2020-01-17 22:30:00,1,1,0,__label__positive,0.7982,0.10089,0.03734,0.7982,3.0,"武汉, 口罩, 发现, 患者, 泰国","Wuhan, Mask, Find, patient, Thailand"
38,54,-1,冠状病毒,2020-01-17,泰国 发现 第二例 新型 冠状病毒 肺炎 患者 系 中国 女子 据 路透社 报道 泰国 公共 卫生部 部长 阿努丁 十七日 表示 该国 已 发现 第二例 新型 冠状病毒 确诊 病例 患者 是 一名 七十四岁 中国籍 女子 报道 称 最新 一起 确诊 患者 来自 武汉 泰国 卫生部 官员 称 这名 七十四岁 的 女性 十三日 抵达 泰国 后 即 被 隔离 后来 发现 被 感染 阿努丁 说 ​ ,2020-01-17 22:30:00,0,0,0,__label__neutral,0.11597,0.04086,0.85967,0.85967,4.0,"发现, 患者, 泰国, 确诊, 第二例","Find, patient, Thailand, Confirmed diagnosis, Second case"
39,55,-1,冠状病毒,2020-01-17,泰国 发现 第二例 新型 冠状病毒 肺炎 患者 再 不重视 就 不可控 了 吧 麻烦 向 群众 准确 说明 患病 认输 希望 可以 全国 措施 ​,2020-01-17 22:29:00,0,0,6,__label__positive,0.19684,0.15204,0.08271,0.19684,4.0,"发现, 患者, 泰国, 确诊, 第二例","Find, patient, Thailand, Confirmed diagnosis, Second case"
40,56,-1,冠状病毒,2020-01-17,我 在 看 武汉 卫健委 新型 冠状病毒 肺炎 新增 死亡 病例 一例 跟 新浪 看 热点 o 武汉 卫健委 新型 冠状病毒 肺炎 新增 死亡 病例 一例,2020-01-17 22:28:00,0,0,2,__label__neutral,0.0065,0.00047,0.99952,0.99952,3.0,"武汉, 口罩, 发现, 患者, 泰国","Wuhan, Mask, Find, patient, Thailand"
41,58,-1,冠状病毒,2020-01-17,泰国 发现 第二例 新型 冠状病毒 肺炎 患者 防患于未然,2020-01-17 22:28:00,0,0,0,__label__neutral,0.00942,0.00462,0.99594,0.99594,4.0,"发现, 患者, 泰国, 确诊, 第二例","Find, patient, Thailand, Confirmed diagnosis, Second case"
42,59,-1,冠状病毒,2020-01-17,我 cn,2020-01-17 16:35:00,1,0,0,__label__negative,1e-05,0.62247,0.00072,0.62247,1.0,"泰国, 发现, 患者, 第二例, 病毒","Thailand, Find, patient, Second case, virus"
43,60,-1,冠状病毒,2020-01-17,在 泰国 的 一家 杂货店 屋顶 发现 了 一条 大 蟒蛇 它 正在 慢慢 吃掉 一只 巨蜥 一米 的 巨蜥 已 丧命 实在 是 让 人 心情 胆战 怕怕 的 蟒蛇 巨蜥 泰国 发现 第二例 新型 冠状病毒 肺炎 患者 l 今天 君君 吼 你 了 吗 的 微博 视频,2020-01-17 22:27:00,1,0,0,__label__negative,0.04086,0.77185,0.07371,0.77185,1.0,"泰国, 发现, 患者, 第二例, 病毒","Thailand, Find, patient, Second case, virus"
44,61,-1,冠状病毒,2020-01-17,我 看 非典 纪录片 当年 山西 一个 女生 去 广东 玩 担心 那边 的 肺炎 她 妈妈 认识 的 媒体 朋友 说 肺炎 都 是 造谣 的 爸爸 上网 查 网友 说 不用 怕 没事 最后 女生 去 了 广东 广东 的 司机 说 不怕 没事 的 我们 连 口罩 都 不带 最后 那个 女生 回 山西 后 全家 感染 除了 武汉 都 在 恐,2020-01-17 16:35:00,1,0,0,__label__neutral,0.018000000000000002,0.25684,0.4922,0.4922,4.0,"发现, 患者, 泰国, 确诊, 第二例","Find, patient, Thailand, Confirmed diagnosis, Second case"
45,62,-1,冠状病毒,2020-01-17,泰国 发现 第二例 新型 冠状病毒 肺炎 患者 新 的 疫情 认知 科普 小 知识 二 昆明,2020-01-17 22:27:00,1,9,13,__label__positive,0.96791,1e-05,0.47659,0.96791,1.0,"泰国, 发现, 患者, 第二例, 病毒","Thailand, Find, patient, Second case, virus"
46,63,-1,冠状病毒,2020-01-17,搜狐 新闻 武汉 新型 冠状病毒 肺炎 专家 释疑 武汉 新型 冠状病毒 与 sars 相似 程度 为 八十 持续 传人 风险 较 低 o 分享 自,2020-01-17 22:26:00,0,0,0,__label__positive,0.71224,0.46103,0.0016600000000000002,0.71224,2.0,"武汉, sars, 相似, o, 专家","Wuhan, sars, similar, o, expert"
47,68,-1,冠状病毒,2020-01-17,泰国 发现 第二例 新型 冠状病毒 肺炎 患者 我 在 武汉 淡定 自若 今天 带 着 口罩 出门 但是 忘记 戴 了 勤洗手 少去 人 多 地方 注意 预防 其他 的 放平 心态 稳住 相信 医院 技术 当然 一切都是 命,2020-01-17 22:25:00,0,1,2,__label__negative,0.0237,0.69926,0.1733,0.69926,3.0,"武汉, 口罩, 发现, 患者, 泰国","Wuhan, Mask, Find, patient, Thailand"
48,69,-1,冠状病毒,2020-01-17,看到 这 条 新闻 在 地铁 上 的 我 默默 的 把 口罩 戴上,2020-01-17 16:35:00,0,0,0,__label__negative,1e-05,0.99962,1e-05,0.99962,3.0,"武汉, 口罩, 发现, 患者, 泰国","Wuhan, Mask, Find, patient, Thailand"
49,70,-1,冠状病毒,2020-01-17,泰国 发现 第二例 新型 冠状病毒 肺炎 患者 有 一 说 一 武汉 大部分 民众 都 没怎么 戴 口罩 前 几天 从 武汉站 回家 戴 口罩 的 人 也 不多 整体 防范 意识 确实 不行,2020-01-17 22:25:00,0,0,0,__label__neutral,0.00064,0.45327,0.91491,0.91491,3.0,"武汉, 口罩, 发现, 患者, 泰国","Wuhan, Mask, Find, patient, Thailand"
50,71,-1,冠状病毒,2020-01-17,好几个 同事 最近 流 感冒 超级 难,2020-01-17 16:35:00,0,0,0,__label__negative,1e-05,0.99923,0.00477,0.99923,1.0,"泰国, 发现, 患者, 第二例, 病毒","Thailand, Find, patient, Second case, virus"
51,72,-1,冠状病毒,2020-01-17,o 人类 冠状病毒  大火 医生 聊 健康,2020-01-17 22:24:00,5,1,0,__label__negative,0.00448,0.99663,1e-05,0.99663,3.0,"武汉, 口罩, 发现, 患者, 泰国","Wuhan, Mask, Find, patient, Thailand"
52,73,-1,冠状病毒,2020-01-17,出门 戴 口罩 😷 吧 小心 驶得 万年,2020-01-17 16:35:00,0,0,0,__label__negative,0.00539,0.8267200000000001,0.02163,0.8267200000000001,3.0,"武汉, 口罩, 发现, 患者, 泰国","Wuhan, Mask, Find, patient, Thailand"
53,74,-1,冠状病毒,2020-01-17,泰国 发现 第二例 新型 冠状病毒 肺炎 患者 再 不重视 就 不可控 了 吧 麻烦 向 群众 准确 说明 患病 认输 希望 可以 全国 措施,2020-01-17 22:23:00,0,0,1,__label__negative,0.07808999999999999,0.40734,0.06561,0.40734,4.0,"发现, 患者, 泰国, 确诊, 第二例","Find, patient, Thailand, Confirmed diagnosis, Second case"
54,75,-1,冠状病毒,2020-01-17,我 也 希望 有关 部门 的 公告 是 准确的 武汉 已经 十几天 没有 新 病例 了 全国 各地 也 没有 可是 在 国外 接二连三 发现 新 病例 心里 还是 有点,2020-01-17 16:35:00,0,0,0,__label__positive,0.22271,0.19194,0.016919999999999998,0.22271,0.0,"武汉, 发现, 泰国, 患者, 第二例","Wuhan, Find, Thailand, patient, Second case"
55,76,-1,冠状病毒,2020-01-17,新闻 没报道 也许 是 为了 维稳 但是 大家 注意 卫生 避开 人群 密集 区域 记得 戴 口罩 都 到 外国 了 国内 其他 城市 都 安全,2020-01-17 16:35:00,0,0,0,__label__negative,0.00219,0.97157,0.08271,0.97157,3.0,"武汉, 口罩, 发现, 患者, 泰国","Wuhan, Mask, Find, patient, Thailand"
56,81,-1,冠状病毒,2020-01-17,五 都 到 外国 了 国内 其他 城市 都 安全,2020-01-17 16:35:00,0,0,0,__label__negative,1e-05,0.99921,0.00176,0.99921,3.0,"武汉, 口罩, 发现, 患者, 泰国","Wuhan, Mask, Find, patient, Thailand"
57,82,-1,冠状病毒,2020-01-17,还是 希望 大家 平时 多 注意 一,2020-01-17 16:35:00,0,0,0,__label__negative,0.19684,0.9363,1e-05,0.9363,3.0,"武汉, 口罩, 发现, 患者, 泰国","Wuhan, Mask, Find, patient, Thailand"
58,83,-1,冠状病毒,2020-01-17,大家 出门 戴 口罩 新型 冠状病毒 又 出来 了 注意安全 保护 好 自己 呀,2020-01-17 16:35:00,0,0,0,__label__neutral,0.00055,0.3346,0.95533,0.95533,3.0,"武汉, 口罩, 发现, 患者, 泰国","Wuhan, Mask, Find, patient, Thailand"
59,84,-1,冠状病毒,2020-01-17,艹 我 三月 还有 考试 根本 不敢 出,2020-01-17 16:35:00,0,0,0,__label__neutral,1e-05,0.5078199999999999,0.8991299999999999,0.8991299999999999,2.0,"武汉, sars, 相似, o, 专家","Wuhan, sars, similar, o, expert"
60,85,-1,冠状病毒,2020-01-17,泰 当局 发现 第二例 新型 冠状病毒 肺炎 患者 系 中国 女子 泰国 卫生部 o,2020-01-17 22:13:00,0,0,0,__label__neutral,0.12593,0.03211,0.78794,0.78794,4.0,"发现, 患者, 泰国, 确诊, 第二例","Find, patient, Thailand, Confirmed diagnosis, Second case"
61,86,-1,冠状病毒,2020-01-17,轻松 筹 石 婷婷 你 要 坚强 一切 都 会 好 起来 的 个人 求助 o 泰国 发现 第二例 新型 冠状病毒 肺炎 患者,2020-01-17 22:10:00,0,0,0,__label__neutral,0.14415999999999998,0.0901,0.16028,0.16028,1.0,"泰国, 发现, 患者, 第二例, 病毒","Thailand, Find, patient, Second case, virus"
62,87,-1,冠状病毒,2020-01-17,泰国 发现 第二例 新型 冠状病毒 肺炎 患者 一月 十七日 泰国 公共 卫生部 在 其 官网 公布 已 发现 第二例 二千 零 一十九 ncov 确诊 病例 患者 是 一名 七十四岁 中国籍 女子 这 也 是 在 中国 境外 发现 的 第三例 新型 冠状病毒 确诊 病例 目前 两名 确诊 患者 在 负 气压 隔离病房 中 接受 治疗 两人 之间 发病 并 无 相关性 o 泰国 发现 第二例 武汉 新型 冠状病毒 肺炎 患者 ​ ,2020-01-17 22:10:00,0,0,1,__label__neutral,0.07808999999999999,0.0276,0.8962600000000001,0.8962600000000001,4.0,"发现, 患者, 泰国, 确诊, 第二例","Find, patient, Thailand, Confirmed diagnosis, Second case"
63,88,-1,冠状病毒,2020-01-17,武汉 冠状病毒 肺炎 新增 死亡 一例 武汉 卫健委 通报 不明 原因 肺炎 我 就 想 知道 现在 啥 情况 卧槽 o,2020-01-17 22:10:00,1,14,13,__label__neutral,0.01244,0.09536,0.56986,0.56986,3.0,"武汉, 口罩, 发现, 患者, 泰国","Wuhan, Mask, Find, patient, Thailand"
64,89,-1,冠状病毒,2020-01-17,武汉 冠状病毒 肺炎 新增 死亡 一例 回复 对 n 九 十五 不要 带阀 的 而且 给 各位 一个 科普 一次性 口罩 的 防御 有限 时间 是 四 小时 佩戴 四 小时 后 病毒 防御 率 就 会 下降 我发 不了 图片 不然 我 把 医院 的 说明 发上来 所以 不建议 没太贵 的 土豪 另 说 我 是 在 医院 工作 的 我 不能 说 太 ​ ,2020-01-17 22:09:00,2,5,11,__label__negative,0.08271,0.16452999999999998,0.06372,0.16452999999999998,2.0,"武汉, sars, 相似, o, 专家","Wuhan, sars, similar, o, expert"
