,id,label,keyword,date,content,time,forward,comment,like,predict,__label__positive,__label__negative,__label__neutral,predict_score,topic,topic_keyword,topic_keyword_en
0,1,__label__negative,新冠,2020-03-14,安倍晋三 再次 强调 东京 奥运会 将 如期举行 欧美国家 已经 为 新冠 疫情 焦头烂额 几乎 所有 体育赛事 都 停 了 谁 还有 心思 考虑 奥运会 国际 疫情 动态 ​ ​ ​ ​ 意大利 一 医院 太平间 超负荷,2020-03-14 23:00:00,0,0,6,__label__negative,0.75493,0.81758,1e-05,0.81758,4.0,"中国, 国家, 病毒, 全球, 境外","China, country, virus, global, Overseas"
1,3,__label__positive,新冠,2020-03-14,中医药 出口 荷兰 和 意大利 抗疫 科创板 日报 十四日 讯 据 中国日报 根据 湖北省 卫健委 提供 的 药方 生产 的 新冠 肺炎 湖北 预防 方 颗粒 在 继 三月 八日 第一批 七 百五十 盒 出口 到 荷兰 和 意大利 在 当地 证明 有 疗效 后 下周 又 将 有 五千 盒 出口 到 这 两个 国家 与 传统 中药 不同 患者 不需要 复杂的 熬药 过程 只要 把 它 放在 开水 里 ​ ,2020-03-14 22:59:00,1,0,2,__label__positive,0.94166,0.04744,0.01206,0.94166,3.0,"中国, 病例, 确诊, 五万, 以外","China, Case, Confirmed diagnosis, fifty thousand, other than"
2,7,__label__negative,新冠,2020-03-14,回复 我 觉得 好笑的 一点 是 他们 真 以为 明星 出名 了 就 会 帮助 受到 伤害的 创作者 了 且不说 同 人 作者 未必 还 真的 需要 帮助 疫情 至今 许多 拥有 关注度 和 流量 的 那些 人 帮助 了 多少 嚎泣 求助 的 人 呢 全微博 的 网友 接力 悼念 转存 帖子 的 有些 人 又 在 哪里 可收 了 吧 新冠 之后,2020-03-13 16:21:00,0,0,0,__label__negative,0.00151,0.86705,0.22817,0.86705,2.0,"例, 患者, 三月, 一例, 症状","example, patient, March, A case, symptom"
3,11,__label__neutral,新冠,2020-03-14,全球 最小 新冠 病毒感染者 英国 一 婴儿 出生 几分钟 后 确诊 新冠 肺炎 系 全球 最小 感染者 英国伦敦 一名 婴儿 在 出生 几分钟 之后 被 确诊 感染 新冠 病毒 成为 全世界 最小 的 感染者 据 英国 太阳报 十三日 报道 几天 前 英国 一名 怀孕 的 母亲 因 疑似 感染 新冠 肺炎 被 紧急 送往 伦敦 一家 医院 接受 检测 并 于 日前 生产 在 婴 ​ ,2020-03-14 22:59:00,2,6,10,__label__neutral,0.01323,0.06955,0.62978,0.62978,2.0,"例, 患者, 三月, 一例, 症状","example, patient, March, A case, symptom"
4,18,__label__positive,新冠,2020-03-14,九 十八岁 天文学 泰斗 治愈 出院 将 转院 进行 隔离 调养 三月 十四日 备受 关注 的 九 十八岁 天文学 泰斗 韩天 芑 及 妻子 感染 新冠 肺炎 治愈 后 出院 并 将 转院 进行 十四天 的 隔离 调养 二月 二十三日 其 孙女 韩时珺 发文 求助 称 爷爷 病危 希望 能 找到 康复者 血浆 引 关注 后 二人 被 转入 icu 当时 均 属 重症 患者 韩天 芑 是 我国 著名 的 大地 天文学家 和 ​ ,2020-03-14 22:59:00,0,1,5,__label__positive,0.99761,0.0029,0.00134,0.99761,2.0,"例, 患者, 三月, 一例, 症状","example, patient, March, A case, symptom"
5,22,__label__positive,新冠,2020-03-14,九 十八岁 天文学 泰斗 治愈 出院 将 转院 进行 隔离 调养 三月 十四日 备受 关注 的 九 十八岁 天文学 泰斗 韩天 芑 及 妻子 感染 新冠 肺炎 治愈 后 出院 并 将 转院 进行 十四天 的 隔离 调养 二月 二十三日 其 孙女 韩时珺 发文 求助 称 爷爷 病危 希望 能 找到 康复者 血浆 引 关注 后 二人 被 转入 icu 当时 均 属 重症 患者 韩天 芑 是 我国 著名 的 大地 天文学家 和 ​ ,2020-03-14 22:59:00,0,1,5,__label__positive,0.99761,0.0029,0.00134,0.99761,2.0,"例, 患者, 三月, 一例, 症状","example, patient, March, A case, symptom"
6,30,__label__negative,新冠,2020-03-14,面对 新冠 很 精明 很 邪恶的 英国 新冠 病毒 实际上 已经 在 英国 国内 广泛 流行 虽然 英国 官方 统计 只有 八百 例 例如 十一日 和 十二日 两天 时间 英国 各 俱乐部 就 有 近 十名 英超 球员 确诊 英超 俱乐部 有 最 顶级 的 医疗 团队 和 最 先进 的 伤病 管理机制 三月 十二日 英国首相 宣布 不停课 不取消 大型 集会 不检测 疑似 轻症 患者 疑似 ​ ,2020-03-14 22:59:00,2,3,1,__label__negative,0.00072,0.81288,0.55448,0.81288,1.0,"全国, 法令, 西班牙政府, 封锁, 确诊","Nationwide, decree, Spanish government, blockade, Confirmed diagnosis"
7,44,__label__negative,新冠,2020-03-14,美国 亚裔 社区 枪支 销量 翻倍 担忧 疫情 与 种族歧视 美国 新冠 疫情 蔓延 出于 担心 不少 人 选择 囤 枪支 导致 枪支 销量 剧增 媒体 探访 美国 枪店 南加州 某枪店 的 销量 几乎 是 平时 的 两倍 店主 称 可能 是因为 他 的 店开 在 亚裔 群体 较 多 的 地区 人们 处于 对 新冠 病毒 的 恐惧 对 歧视 情况 的 不安 而 购买 枪支 ​ ,2020-03-14 22:59:00,0,0,0,__label__neutral,0.25684,0.04604,0.6151,0.6151,1.0,"全国, 法令, 西班牙政府, 封锁, 确诊","Nationwide, decree, Spanish government, blockade, Confirmed diagnosis"
8,53,__label__negative,新冠,2020-03-14,这 家伙 太 狡猾 还变 着 花样 跳跃 滑行 找 不到 回家 的 路 就 盯 着重点 去 知道 主攻 方向 了,2020-03-14 22:50:00,0,0,0,__label__neutral,0.00107,0.51563,0.66542,0.66542,3.0,"中国, 病例, 确诊, 五万, 以外","China, Case, Confirmed diagnosis, fifty thousand, other than"
9,68,__label__negative,新冠,2020-03-14,西班牙 新增 一千五百 四十四 例新冠 肺炎 病例 累计 确诊 病例 五千 七百 五十三 例 西班牙 卫生部 十四日 宣布 截至 当地 时间 十四日 中午 西班牙 新冠 肺炎 累计 确诊 病例 五千 七百 五十三 例 单日 新增 一千五百 四十四 例 全球 疫情 西班牙 疫情,2020-03-14 22:59:00,0,0,0,__label__neutral,1e-05,0.00972,0.99952,0.99952,0.0,"意大利, 病例, 确诊, 三月, 中国","Italy, Case, Confirmed diagnosis, March, China"
10,71,__label__negative,新冠,2020-03-14,美 民众 为 抢购 商品 大打出手 疫情 严峻 美国 民众 抢购 商品 时 在 超市 抄起 酒瓶 大打出手 随着 新冠 肺炎 疫情 在 美国 蔓延 不少 民众 开始 涌进 超市 囤积 商品 英国 每日 邮报 三月 十四日 发布 了 两段 在 美国 超市 民众 抢购 商品 时 发生冲突 的 视频 并 形容 说 这些 画面 令人担忧 据 报道 介绍 这 两起 冲突 事件 发生 于 三 ​ ,2020-03-14 22:59:00,0,0,0,__label__neutral,0.0067,0.10972,0.8267200000000001,0.8267200000000001,2.0,"例, 患者, 三月, 一例, 症状","example, patient, March, A case, symptom"
11,77,__label__negative,新冠,2020-03-14,原本 米兰 在 二月 二十四日 宣布 了 宵禁 的 措施 三天 后 又 迫于 多方 压力 而 取消 米兰 市长 朱塞佩 萨拉 甚至 在 网络 上 发起 了 milanononsiferma 米兰 不停歇 的 活动 意大利 民主党 领袖 津加 雷蒂应 萨拉 之邀 和 年轻人 在 米兰 的 街头 喝酒 吃 披萨 以 彰显 米兰 非常 安全 如今 津加 雷蒂 被 确认 感染 新冠 病毒,2020-03-14 13:28:00,0,0,0,__label__neutral,0.02677,0.02163,0.97632,0.97632,3.0,"中国, 病例, 确诊, 五万, 以外","China, Case, Confirmed diagnosis, fifty thousand, other than"
12,78,__label__neutral,新冠,2020-03-14,比利时 新增 新冠 肺炎 确诊 病例 一百三十 三例 十四日 比利时 共 新增 一百三十 三例 新冠 肺炎 感染 病例 这 让 比利时 的 确诊 病例 达到 六百 八十九 人 比利时 也 出现 了 第四例 感染 新冠 肺炎 死亡 病例 该 病例 是 一位 八十岁 的 老人 央视 新闻 o,2020-03-14 22:59:00,0,0,0,__label__neutral,0.02034,0.02299,0.92415,0.92415,0.0,"意大利, 病例, 确诊, 三月, 中国","Italy, Case, Confirmed diagnosis, March, China"
13,82,__label__neutral,新冠,2020-03-14,各国 政要 社会名流 中 确诊 感染 新冠 肺炎 情况 意大利 两位 大区 主席 陆军 总参谋长 卫生部 副部长 教育部 副部长 尤文图斯队 鲁加尼 桑普多利亚队 四名 球员 科莱 埃克 达尔 拉古 米纳 托斯 比瓦雷泽 医学会 主席 病故 西班牙 领土 政策 和 公共 职能 部长 内阁 成员 平等 部长 内阁 成员 呼声 党 主席 众 ​ ,2020-03-14 22:59:00,0,0,0,__label__neutral,0.11281,0.3346,0.36298,0.36298,0.0,"意大利, 病例, 确诊, 三月, 中国","Italy, Case, Confirmed diagnosis, March, China"
14,85,__label__negative,新冠,2020-03-14,等 日本 新冠 疫情 明朗 想 再寄 一次 明信片 依旧 刀 相关 柄 未定 大概 是 今年 本丸博 or 以前 旧 柄 欢迎 同事 们 来 讨要 特别 是 上次 没收 到 的 真的 是 史 上 最 惨烈 的 一次 以前 丢率 大概 一 八 一 十 没有 收到 就 寄 到 收到 为止 两次 收不到 就 三次 五次 十次 堂堂正正 地 抵抗 下去 帅气 地说 一次 笑,2020-03-14 22:59:00,0,6,4,__label__negative,0.00156,0.99891,0.00147,0.99891,4.0,"中国, 国家, 病毒, 全球, 境外","China, country, virus, global, Overseas"
15,86,__label__negative,新冠,2020-03-14,等 日本 新冠 疫情 明朗 想 再寄 一次 明信片 依旧 刀 相关 柄 未定 大概 是 今年 本丸博 or 以前 旧 柄 欢迎 同事 们 来 讨要 特别 是 上次 没收 到 的 真的 是 史 上 最 惨烈 的 一次 以前 丢率 大概 一 八 一 十 没有 收到 就 寄 到 收到 为止 两次 收不到 就 三次 五次 十次 堂堂正正 地 抵抗 下去 帅气 地说 一次 笑,2020-03-14 22:59:00,0,6,4,__label__negative,0.00156,0.99891,0.00147,0.99891,4.0,"中国, 国家, 病毒, 全球, 境外","China, country, virus, global, Overseas"
16,88,__label__positive,新冠,2020-03-14,国际 时讯 一 海外 网 消息 据 美国有线电视新闻网 cnn 报道 意大利 民航局 十四日 表示 将 暂停 该国 多个 主要 机场 的 所有 民用 航班 包括 罗马 钱皮诺 机场 这是 意大利 为 控制 新冠 肺炎 疫情 蔓延 而 采取 的 紧急 禁飞 措施 之一 o 二 海外 网 三月 十四日 消息 截至 北京 时间 三月 十四日 十二时 三十分 西班牙 累 ​ ,2020-03-14 22:59:00,0,0,0,__label__positive,0.47659,0.04604,0.06756000000000001,0.47659,4.0,"中国, 国家, 病毒, 全球, 境外","China, country, virus, global, Overseas"
17,91,__label__positive,新冠,2020-03-14,云南 疫情 最新 通报 快讯 曲靖 最后 一例 确诊 患者 治愈 出院 十三例 全部 治愈 三月 十四日 曲靖市 最后 一例 确诊 新冠 肺炎 患者 治愈 出院 至此 曲靖 十三例 确诊 患者 全部 治愈 出院 实现 清零 抗击 新冠 肺炎 疫情 工作 取得 阶段 成效 患者 李某 十六岁 女 曲靖市 麒麟区 人 一月 二十三日 从 武汉 乘 高铁 回 曲靖 并 开始 居家 医学观察 ​ ,2020-03-14 22:59:00,0,0,1,__label__positive,0.93441,0.00188,0.03848,0.93441,0.0,"意大利, 病例, 确诊, 三月, 中国","Italy, Case, Confirmed diagnosis, March, China"
18,96,__label__neutral,新冠,2020-03-14,川 大爷 你 胡说 没有 人比 我 更 懂 潜伏期 三 噩耗 我们 亲爱的 床 总 敌不过 流感 的 侵袭 与世长辞 了 一 有 解药 二 没有 立即 犯病 就 不是 新,2020-03-14 21:27:00,0,1,0,__label__neutral,0.04604,0.04604,0.39235,0.39235,3.0,"中国, 病例, 确诊, 五万, 以外","China, Case, Confirmed diagnosis, fifty thousand, other than"
19,98,__label__negative,新冠,2020-03-14,加拿大 总理 隔离 后首 露面 家门口 开 新闻 发布会 称 在家 办公 很难 妻子 症状 轻微 新冠 肺炎 防控 抗击 新型 肺炎 进行 时 三月 十三日 加拿大 总理 特鲁多 在 渥太华 的 别墅 rideau cottage 外 举行 了 新闻 发布会 他离 记者 和 摄影师 几 英尺 远 特鲁多 建议 所有 加拿大人 不要 做 非必要 的 旅行 邮轮 季节 已经 延迟 到 七月 特 ​ ,2020-03-14 22:59:00,0,1,0,__label__negative,0.0331,0.9363,0.01641,0.9363,1.0,"全国, 法令, 西班牙政府, 封锁, 确诊","Nationwide, decree, Spanish government, blockade, Confirmed diagnosis"
20,105,__label__negative,新冠,2020-03-14,哈哈哈哈 哈哈哈 哈哈哈 哈哈哈 哈哈哈,2020-03-14 17:12:00,0,0,0,__label__negative,1e-05,0.8962600000000001,0.00383,0.8962600000000001,4.0,"中国, 国家, 病毒, 全球, 境外","China, country, virus, global, Overseas"
21,111,__label__neutral,新冠,2020-03-14,香港 新冠 肺炎 确诊 病例 累计 增至 一百四十 例 希望 香港 也 能 重视 疫情 做好 隔离 防护 工作 迪士尼 关闭 最后 一天 数千 游客 冒雨 涌入 还是 等 疫情 过后 再 出去 游玩 吧 特殊 时期 还是 乖乖 在家 待 着 比较好 ​ ​,2020-03-14 22:58:00,0,0,0,__label__neutral,0.0029,0.00339,0.99243,0.99243,2.0,"例, 患者, 三月, 一例, 症状","example, patient, March, A case, symptom"
22,118,__label__negative,新冠,2020-03-14,ecmo 抢救 全程 首次 公开 一 开机 就 五万 运转 一天 三万 还好 国家 给 新冠 病人 免费 治疗 唉 生命 无价 致敬 所有 的 医护人员 您们 辛苦 了,2020-03-14 22:58:00,0,0,0,__label__positive,1.00001,1e-05,0.0005,1.00001,3.0,"中国, 病例, 确诊, 五万, 以外","China, Case, Confirmed diagnosis, fifty thousand, other than"
23,129,__label__negative,新冠,2020-03-14,防抗 新冠 肺炎 疫情,2020-03-14 21:52:00,1,1,3,__label__negative,1e-05,0.99653,0.00111,0.99653,1.0,"全国, 法令, 西班牙政府, 封锁, 确诊","Nationwide, decree, Spanish government, blockade, Confirmed diagnosis"
24,133,__label__positive,新冠,2020-03-14,西班牙政府 宣布 将 封锁 全国 要求 居民 待 家中 路透社 十四日 报道 称 西班牙政府 为 应对 新冠 疫情 计划 颁布 法令 进行 全国 范围 内 的 封锁 根据 法令 西班牙 居民 除 购买 食物 和 医疗 用品 去 医院 工作 或 其他 紧急情况 外 必须 待 在 家中 该 措施 将 于 当地 时间 o 三月 十六日 八 时 生效 l 时差 视频 的 微博 视频 ​ ​ ​ ,2020-03-14 22:58:00,2,0,0,__label__positive,0.99594,0.00256,0.00592,0.99594,1.0,"全国, 法令, 西班牙政府, 封锁, 确诊","Nationwide, decree, Spanish government, blockade, Confirmed diagnosis"
25,136,__label__negative,新冠,2020-03-14,腾讯 新闻 新冠 病毒 能 活多久 气溶胶 中 最 多 三 小时 塑料 不锈钢 表面 二 三天 o,2020-03-14 22:58:00,0,0,0,__label__neutral,0.01592,0.0716,0.6442399999999999,0.6442399999999999,3.0,"中国, 病例, 确诊, 五万, 以外","China, Case, Confirmed diagnosis, fifty thousand, other than"
26,138,__label__neutral,新冠,2020-03-14,中国 驰援 意大利 二月 下 意大利 国新冠 肺疫 告急 举国皆陷 凄苦 无措 求助 欧美 友邦 皆曰 自顾不暇 拒 之 并 扣 其 物资 自保 意大利 无奈 转求 中国 我 慨然 应 之 盖 仁义 者 天下 大道 也 况 昔年 汶川 地震 意大利 尝遣 救援队 来华 今 彼 国有 难 何忍 坐视 于是 专家 集结 携 物资 无 计 奔 罗马 驰援 意大利 官 ​ ,2020-03-14 22:58:00,0,0,0,__label__negative,0.27514,0.55448,0.04744,0.55448,0.0,"意大利, 病例, 确诊, 三月, 中国","Italy, Case, Confirmed diagnosis, March, China"
27,140,__label__negative,新冠,2020-03-14,欧洲 新冠 动态 charit é 夏利 特 首席 病毒学家 christan drosten 敏感 职业 父母 的 孩子 们 在 应急 看护 时 不要 被 重新 分组 这样 会 建立 新 的 一级 和 次级 联系 接触网 父母 之间 从而 引发 感染 德国 疫情 全球 疫情,2020-03-14 01:49:00,1,4,1,__label__neutral,0.06189,0.0927,0.55448,0.55448,3.0,"中国, 病例, 确诊, 五万, 以外","China, Case, Confirmed diagnosis, fifty thousand, other than"
28,144,__label__negative,新冠,2020-03-14,新冠 不解决 还要 坚持 开 奥运 安倍 这 是 疯 了 吗 难怪 昨天 二十几度 今天 飘雪 这 是 要 作怪 咯,2020-03-14 22:58:00,0,0,0,__label__negative,0.00122,0.99855,0.00095,0.99855,3.0,"中国, 病例, 确诊, 五万, 以外","China, Case, Confirmed diagnosis, fifty thousand, other than"
29,156,__label__negative,新冠,2020-03-14,国外 制作 视频 新冠 病毒传播 经过 传染 速度 之快 恐怖 这 仅仅 是 接触性 传染 还 不包括 飞沫传染 二 金华 l 猴要 加油 的 微博 视频,2020-03-14 22:58:00,0,0,0,__label__negative,0.39982,0.7491,0.00434,0.7491,3.0,"中国, 病例, 确诊, 五万, 以外","China, Case, Confirmed diagnosis, fifty thousand, other than"
30,159,__label__negative,新冠,2020-03-14,美国 犹他州 议会 通过 决议 支持 中国 人民 抗击 疫情 美国 犹他州 议会 十二日 通过 决议 对 中国 人民 抗击 新冠 肺炎 疫情 表示 支持 该 决议 得到 犹他州 众议院 参议院 以及 州长 加里 赫伯特 一致 支持 这项 决议 的 通过 表明 我们 非常 关注 中国 人民 抗击 疫情 的 努力 我们 与 他们 站 在 一起,2020-03-14 22:58:00,0,0,0,__label__positive,0.98029,0.01497,0.0073599999999999985,0.98029,2.0,"例, 患者, 三月, 一例, 症状","example, patient, March, A case, symptom"
31,160,__label__negative,新冠,2020-03-14,世界卫生组织 中国 以外 新冠 肺炎 确诊 病例 达 五万 一千七百 六十七 例 o 世界卫生组织 中国 以外 新冠 肺炎 确诊 病例 达 五万 一千七百 六十七 例,2020-03-14 22:58:00,0,0,0,__label__neutral,1e-05,0.02443,0.98505,0.98505,3.0,"中国, 病例, 确诊, 五万, 以外","China, Case, Confirmed diagnosis, fifty thousand, other than"
32,161,__label__negative,新冠,2020-03-14,捂 不住 了 终于 要 开始 检测 了 预测 接下来 一周 是 美国 新冠 感染 人数 疯狂 增长 的 一周 利好 检测 试剂 概念股,2020-03-14 21:30:00,0,0,3,__label__neutral,0.00318,0.05186,0.94166,0.94166,2.0,"例, 患者, 三月, 一例, 症状","example, patient, March, A case, symptom"
33,169,__label__neutral,新冠,2020-03-14,十几 款 游戏 畅玩 注册 就 送 六十六 － 六百六十 六 体验 金 赢 到 一百 就 可 提现 o 委内瑞拉 全国 进入 警戒 状态 关注 新冠 肺炎 委内瑞拉 确诊 两例 新冠 肺炎 病例 后 总统 马杜罗 十三日 晚 发表 电视讲话 宣布 全国 进入 警戒 状态 马杜罗说 在 警戒 状态 下 他 已 下令 关闭 全国 所有 餐馆 酒吧 和 夜总会 并 要求 民众 不要 举 ​ ,2020-03-14 22:58:00,0,0,0,__label__negative,0.10972,0.34159,0.06189,0.34159,2.0,"例, 患者, 三月, 一例, 症状","example, patient, March, A case, symptom"
34,171,__label__negative,新冠,2020-03-14,马仔 隔离 老大 也 要 新冠 检测,2020-03-13 12:20:00,0,0,0,__label__negative,0.02163,0.1733,0.00448,0.1733,4.0,"中国, 国家, 病毒, 全球, 境外","China, country, virus, global, Overseas"
35,179,__label__negative,新冠,2020-03-14,二千 零 二十万 零 三百 一 十四 最近 全网 都 是 新冠 疫情 一篇 是 疫情 下 的 中国 农业 一篇 是 企业 病假 今天 学会 安装 好多 插件 都 好好看 竟然 有 forest 插件 可以 和 手机 同步 但是 我 这个 猪脑子 又 忘 了 账号密码 我 再 重新 改 就 好 麻烦 不过 可以 控制 我用 电脑 刷 微博 然后 本来 想 看看 那个 wait but why 我 发现自己 的 英文 长 文章 阅读 能力 很 ​ ,2020-03-14 22:58:00,0,0,1,__label__negative,0.00434,0.8933200000000001,0.09809,0.8933200000000001,4.0,"中国, 国家, 病毒, 全球, 境外","China, country, virus, global, Overseas"
36,185,__label__neutral,新冠,2020-03-14,香港 新冠 肺炎 确诊 病例 累计 增至 一百四十 例 中国 病情 已经 稳住 了 香港 也 一定 行 的 宁夏 一 境外 输入 病例 被 立案侦查 有 个人 太 搞笑 了 家乡 建设 你 不在 千里 投毒 你 第一 ​ ​ ​,2020-03-14 22:00:00,0,0,1,__label__neutral,0.00349,0.00539,0.98595,0.98595,2.0,"例, 患者, 三月, 一例, 症状","example, patient, March, A case, symptom"
37,186,__label__neutral,新冠,2020-03-14,香港 新冠 肺炎 确诊 病例 累计 增至 一百四十 例 中国 病情 已经 稳住 了 香港 也 一定 行 的 宁夏 一 境外 输入 病例 被 立案侦查 有 个人 太 搞笑 了 家乡 建设 你 不在 千里 投毒 你 第一 ​ ​ ​,2020-03-14 22:00:00,0,0,1,__label__neutral,0.00349,0.00539,0.98595,0.98595,2.0,"例, 患者, 三月, 一例, 症状","example, patient, March, A case, symptom"
38,189,__label__negative,新冠,2020-03-14,中国 五十三 天才 到 八万多 而且 现在 控制 住 了 境外 两周 刷到 六万多 而且 还 在 继续 拔升 各种 么 蛾子 频出 这是 信息 传播 的 问题 中国 那 八万 未来 还 得 核 减掉 ct 确认 那 一万多 里面 非新冠 的 病例 吧,2020-03-14 22:38:00,0,0,0,__label__neutral,0.008329999999999999,0.1067,0.8267200000000001,0.8267200000000001,4.0,"中国, 国家, 病毒, 全球, 境外","China, country, virus, global, Overseas"
39,190,__label__neutral,新冠,2020-03-14,北京 身边 事 北京 身边 事 罗马教皇 新冠 病毒检测 呈 阴性 教皇 方济各 因 身体 抱恙 接受 新冠 肺炎 检测 结果 呈 阴性 英国 卫报 援引 意大利 信使 报 三月 二日 的 报道 称 因 身体 不适 罗马教皇 方济各 接受 了 新型 冠状病毒 检测 检测 结果 呈 阴性 目前 梵蒂冈 新闻 发言人 布鲁尼 并未 对此 置评 ​ ,2020-03-14 22:58:00,0,1,1,__label__neutral,0.11597,0.01365,0.83115,0.83115,0.0,"意大利, 病例, 确诊, 三月, 中国","Italy, Case, Confirmed diagnosis, March, China"
40,191,__label__negative,新冠,2020-03-14,美国 人 怎么 好像 大脑 都 被 门 挤过,2020-03-13 13:33:00,0,0,1,__label__neutral,1e-05,0.6002,0.99936,0.99936,2.0,"例, 患者, 三月, 一例, 症状","example, patient, March, A case, symptom"
41,192,__label__positive,新冠,2020-03-14,今年 清明 倡导 市民 群众 不进行 现场 祭扫 沪 推出 集体 祭扫 网络 祭扫 代客 祭扫 等 服务 在 今天下午 举行 的 市新冠 肺炎 疫情 防控 工作 领导小组 新闻 发布会 上 市 民政局 说 殡葬 场所 人员 聚集 是 疫情 防控 的 重点 场所 倡导 广大 市民 群众 在 今年 清明 期间 三月 二十八日 至 四月 十二日 不要 前往 公墓 骨灰堂 进行 现场 祭扫 ​ ,2020-03-14 22:58:00,1,0,1,__label__positive,0.71224,0.21208,0.00539,0.71224,0.0,"意大利, 病例, 确诊, 三月, 中国","Italy, Case, Confirmed diagnosis, March, China"
42,193,__label__positive,新冠,2020-03-14,意大利 两副 部长 确诊 新冠 肺炎 已 居家 隔离 意大利 卫生部 副部长 pierpaolo sileri 十四日 在 个人 facebook 主页 上 表示 自己 确诊 新冠 病毒 肺炎 他 表示 自己 此前 曾 接触 一名 疑似 患者 刚 发现自己 有 症状 后 就 进行 了 自觉 隔离 并 开展 远程 工作 目前 在 家中 隔离 与 妻子 孩子 分房 同日 意大利 教育部 副部长 也 证实 ​ ,2020-03-14 22:58:00,0,0,0,__label__neutral,0.02677,0.0029,0.99219,0.99219,0.0,"意大利, 病例, 确诊, 三月, 中国","Italy, Case, Confirmed diagnosis, March, China"
43,194,__label__negative,新冠,2020-03-14,中国 那 八万 未来 还 得 核 减掉 ct 确认 那 一万多 里面 非新冠 的 病例 吧,2020-03-14 22:38:00,0,0,0,__label__negative,0.00248,0.99846,1e-05,0.99846,3.0,"中国, 病例, 确诊, 五万, 以外","China, Case, Confirmed diagnosis, fifty thousand, other than"
44,200,__label__neutral,新冠,2020-03-14,世界卫生组织 中国 以外 新冠 肺炎 确诊 病例 达 五万 一千七百 六十七 例 o 世界卫生组织 中国 以外 新冠 肺炎 确诊 病例 达 五万 一千七百 六十七 例,2020-03-14 22:57:00,0,0,0,__label__neutral,1e-05,0.02443,0.98505,0.98505,3.0,"中国, 病例, 确诊, 五万, 以外","China, Case, Confirmed diagnosis, fifty thousand, other than"
45,201,__label__negative,新冠,2020-03-14,新浪 军事 新浪 军,2020-03-14 22:38:00,0,0,0,__label__negative,0.53122,0.9363,1e-05,0.9363,3.0,"中国, 病例, 确诊, 五万, 以外","China, Case, Confirmed diagnosis, fifty thousand, other than"
46,206,__label__negative,新冠,2020-03-14,一图 了解 新冠 肺炎 世界 疫情 形势 转 起 关注 严防 境外 输入 ​ ​,2020-03-14 20:24:00,0,0,0,__label__negative,0.00104,0.945,0.04744,0.945,4.0,"中国, 国家, 病毒, 全球, 境外","China, country, virus, global, Overseas"
47,210,__label__neutral,新冠,2020-03-14,🙏 意大利 卫生部 和 教育部 副部长 分别 确诊 感染 新冠 病毒 据 央视 意大利 卫生部 副部长 西 莱里 十四日 测出 新冠 病毒 呈 阳性 他 表示 几天 前 曾 接触 过 一名 疑似 患者 目前 其 本人 已 自我 隔离 同日 意大利 教育 大学 和 科研 部副 部长 阿 斯卡尼 也 在 社交 媒体 上 宣布 确诊 感染 新冠 病毒,2020-03-14 08:23:00,0,0,0,__label__neutral,0.01206,0.06372,0.87061,0.87061,0.0,"意大利, 病例, 确诊, 三月, 中国","Italy, Case, Confirmed diagnosis, March, China"
