,id,label,keyword,date,content,time,forward,comment,like,predict,__label__positive,__label__negative,__label__neutral,predict_score,topic,topic_keyword,topic_keyword_en
272,452,-1,冠状病毒,2020-01-15,卫生工作者 是否 有 感染 的 风险 是 的 由于 卫生工作者 与 患者 的 接触 多于 一般 人 与 患者 的 接触 卫生工作者 有 感染 新型 冠状病毒 的 风险 世卫 组织 建议 卫生工作者 坚持 采取 适当 感染 防控 措施,2020-01-15 14:41:00,3,0,0,__label__negative,0.17782,0.8903,0.00101,0.8903,3.0,"武汉, 泰国, 病例, 传人, 发现","Wuhan, Thailand, Case, successor, Find"
273,453,-1,冠状病毒,2020-01-15,有 针对 新型 冠状病毒 的 疫苗 吗 针对 新 疾病 并 无 现有 可用 疫苗 开发 一种 新型 疫苗 可能 需要 若干年 时间,2020-01-15 14:41:00,1,0,0,__label__negative,0.01134,0.7773100000000001,0.14806,0.7773100000000001,2.0,"泰国, 病例, 武汉, 游客, 发现","Thailand, Case, Wuhan, Tourist, Find"
274,454,-1,冠状病毒,2020-01-15,冠状病毒 能够 在 人际 传播 吗 是 的 一些 冠状病毒 可以 在 人际 传播 人们 通常 是 在 居所 工作 场所 或 医疗机构 等 场所 与 感染者 密切接触 后 被 感染,2020-01-15 14:40:00,1,0,0,__label__negative,0.00556,0.96268,0.01134,0.96268,2.0,"泰国, 病例, 武汉, 游客, 发现","Thailand, Case, Wuhan, Tourist, Find"
275,455,-1,冠状病毒,2020-01-15,人 感染 了 冠状病毒 后会 有 哪些 症状 症状 因 病毒 而异 常见 体征 有 呼吸道 症状 发热 咳嗽 气促 和 呼吸困难 等 在 较 严重 病例 中 感染 可 导致 肺炎 严重 急性 呼吸 综合征 肾衰竭 甚至 死亡,2020-01-15 14:40:00,1,0,1,__label__neutral,0.0036,0.21735,0.78794,0.78794,1.0,"泰国, 中国, 武汉, 病例, 游客","Thailand, China, Wuhan, Case, Tourist"
276,456,-1,冠状病毒,2020-01-15,人 可能 会 感染 新型 的 动物 源 冠状病毒 吗 详细 调查 结果显示 中国 在 二千 零 二年 发生 了 从 果子狸 传至 人 的 sars 冠状病毒 疫情 沙特阿拉伯 在 二千 零 一十二年 发生 了 从 单峰骆驼 传至 人 的 mers 冠状病毒 疫情 一些 已知 的 冠状病毒 在 动物 中 传播 但 尚未 感染 人类 随着 全球 监测 工作 的 改善 可能 会 发现 更 多 冠状病毒,2020-01-15 14:40:00,3,0,0,__label__negative,0.03848,0.56219,0.10376,0.56219,1.0,"泰国, 中国, 武汉, 病例, 游客","Thailand, China, Wuhan, Case, Tourist"
277,457,-1,冠状病毒,2020-01-15,什么 是 新型 冠状病毒 新型 冠状病毒 是 以前 从未 在 人类 中 发现 的 冠状病毒 新 毒株,2020-01-15 14:39:00,1,0,0,__label__negative,0.018000000000000002,0.22817,0.1733,0.22817,4.0,"武汉, 泰国, 病例, 游客, 命名","Wuhan, Thailand, Case, Tourist, name"
278,458,-1,冠状病毒,2020-01-15,我天 不是 吧 人 传人 一 看到 世卫 有点,2020-01-15 08:53:00,0,0,0,__label__negative,1e-05,0.99796,0.016919999999999998,0.99796,4.0,"武汉, 泰国, 病例, 游客, 命名","Wuhan, Thailand, Case, Tourist, name"
279,459,-1,冠状病毒,2020-01-15,什么 是 冠状病毒 冠状病毒 是 一个 大型 病毒 家族 严重 程度 从 感冒 到 重症 疾病 不等 如 中东 呼吸 综合征 mers 和 严重 急性 呼吸 综合征 sars,2020-01-15 14:38:00,2,1,0,__label__negative,0.005229999999999999,0.95533,0.02932,0.95533,1.0,"泰国, 中国, 武汉, 病例, 游客","Thailand, China, Wuhan, Case, Tourist"
280,461,-1,冠状病毒,2020-01-15,武汉 肺炎 的 新型 冠状病毒 从 哪来 以后 会 不会 有人 传染 人 的 风险 我们 该 如何 预防 该 病毒感染 o 武汉 肺炎 的 新型 冠状病毒 从 哪来 以后 会 不会 有人 传染 人 的 风险 我们 该 如何 预防 该 病毒感染,2020-01-15 14:38:00,1,1,0,__label__positive,0.68596,0.02677,0.0073599999999999985,0.68596,3.0,"武汉, 泰国, 病例, 传人, 发现","Wuhan, Thailand, Case, successor, Find"
281,462,-1,冠状病毒,2020-01-15,泰国 新型 冠状病毒 病例 为 武汉 游客 给 一位 熟人 发 一封 问候 的 邮件 根据 近来 的 研究 表示 非正式的 接触 比起 好 朋友 是 更好 的 发展 人脉 和 职业 机会 的 资源 需要 适时 的 联系,2020-01-15 14:37:00,0,0,0,__label__negative,0.32768,0.47659,0.01592,0.47659,3.0,"武汉, 泰国, 病例, 传人, 发现","Wuhan, Thailand, Case, successor, Find"
282,467,-1,冠状病毒,2020-01-15,新华网 看似 已经 突破 了 去年 四月份 的 高点 人民网 才 刚刚 有 向上 突破 去年 九月份 高点 的 趋势 因为 人民网 去年 那波 行情 涨幅 太 大 足足 翻 了 六倍 上方 套牢 获利 筹码 形成 了 一股 强大的 压力 而 新华网 翻 了 三倍 不到 相对来说 抛压 较 少 何况 新华网 股本 市值 都 比 人民网 小太多 所以 今年 从 炒作 角度看 大 资金 今年 选择 ​ ,2020-01-15 14:37:00,0,13,106,__label__negative,0.0901,0.5234300000000001,0.25684,0.5234300000000001,2.0,"泰国, 病例, 武汉, 游客, 发现","Thailand, Case, Wuhan, Tourist, Find"
283,469,-1,冠状病毒,2020-01-15,一定 要 重视 起来 不制造 恐慌 但 也 要 严加防范 普及 医护 知识 远离 病毒传播,2020-01-15 14:23:00,0,0,0,__label__negative,0.28142,0.58511,0.00492,0.58511,2.0,"泰国, 病例, 武汉, 游客, 发现","Thailand, Case, Wuhan, Tourist, Find"
284,470,-1,冠状病毒,2020-01-15,发布 了 头条 文章 泰国 确诊 一名 感染者 武汉 新型 冠状病毒 首例 海外 患者 出现 o 泰国 确诊 一名 感染者 武汉 新型 冠状病毒 首例 海外 患者 出现,2020-01-15 14:35:00,0,0,0,__label__positive,0.6076699999999999,0.00339,0.4922,0.6076699999999999,1.0,"泰国, 中国, 武汉, 病例, 游客","Thailand, China, Wuhan, Case, Tourist"
285,471,-1,冠状病毒,2020-01-15,健康 中国 二千 零 三十 春节 健康 攻略 科普 贴 新型 冠状病毒 该 如何 预防 据 报道 武汉 不明 原因 肺炎 病原体 为 新型 冠状病毒 什么 是 冠状病毒 它 与 引起 的 sars 的 冠状病毒 有何 区别 普通人 应该 如何 防范 了解 一下 泰国 新 冠状病毒 患者 已 康复,2020-01-15 14:34:00,3,2,6,__label__negative,0.15611,0.88081,0.00125,0.88081,1.0,"泰国, 中国, 武汉, 病例, 游客","Thailand, China, Wuhan, Case, Tourist"
286,472,-1,冠状病毒,2020-01-15,新乡 气象 生活 show 如何 防护 冠状病毒 感染 据 世卫 中国 出现 的 新型 冠状病毒 目前 已 出现 有 限度 的 人 与 人 传播 主要 以 家庭 群聚 为主 但 仍然 具备 广泛传播 的 潜在 可能 春节 走亲访友 一定 要 做好 防护 一 保持 手 卫生 二 咳嗽 或 打喷嚏 时 捂住 口 鼻 三 安全 饮食 肉 蛋类 彻底 做熟 四 尽量避免 与 任何 表现 出 有 呼吸 ​ ,2020-01-15 14:34:00,0,0,2,__label__negative,0.08511,0.34866,0.11281,0.34866,1.0,"泰国, 中国, 武汉, 病例, 游客","Thailand, China, Wuhan, Case, Tourist"
287,473,-1,冠状病毒,2020-01-15,天下 万象 世卫 组织 表示 新 冠状病毒 具 广泛传播 潜在 可能 泰国 新型 冠状病毒 病例 为 武汉 游客 近日 泰国 在 机场 截查 一名 中国 武汉 游客 确认 感染 新型 冠状病毒 成为 中国 境外 首 起 病例 这名 六十一岁 的 妇女 现已 康复 世界卫生组织 十四日 表示 中国 出现 的 新型 冠状病毒 目前 已经 出现 了 有 限度 的 人 与 人 传播 主要 以 ​ ,2020-01-15 14:34:00,0,6,3,__label__positive,0.5078199999999999,0.01034,0.48439,0.5078199999999999,1.0,"泰国, 中国, 武汉, 病例, 游客","Thailand, China, Wuhan, Case, Tourist"
288,474,-1,冠状病毒,2020-01-15,泰国 新型 冠状病毒 病例 为 武汉 游客 父爱 是 宽阔的 海洋 即使 在 我 一事无成 的 时刻 父母 也 会 包容 我 把 我 纳入 他 温暖的 胸膛,2020-01-15 14:33:00,0,0,0,__label__negative,0.05034,0.69265,0.02597,0.69265,2.0,"泰国, 病例, 武汉, 游客, 发现","Thailand, Case, Wuhan, Tourist, Find"
289,475,-1,冠状病毒,2020-01-15,第一天 就 结束 了 　 　 王莲清 已经 上 初中 了 初中 跟 小学 不在 一个 地儿 也 不是 一个 点儿 放学 孙 桂枝 不放心 石南 一个 孩子 带 着 cgd 八千 零三 俩 五六岁 的 小姑娘 回家 就 跟 石国强 说好 了 石国强 要是 能 按时 放学 就让 石国强 带 着 仨 孩子 泰国 发现 一例 新型 冠状病毒 病例,2020-01-15 14:33:00,0,0,0,__label__neutral,0.00064,0.7186,0.91731,0.91731,0.0,"病例, 泰国, 武汉, 游客, 一个","Case, Thailand, Wuhan, Tourist, One"
290,476,-1,冠状病毒,2020-01-15,七色 蝌蚪 婴儿 洗衣 皂 十 九元 需用 券 天猫 精选 目前 报价 三十六 九元 使用 二十六元 优惠券 后 实付 十 九元 近期 好价 刚需 可入 叠加 优惠券 二十六元 优惠券 新世界 花木兰 电视 预告 泰国 新 冠状病毒 患者 已 康复 二十五元 券 微博 专享 限时 领券,2020-01-15 14:32:00,0,0,0,__label__neutral,0.02845,0.14415999999999998,0.67919,0.67919,1.0,"泰国, 中国, 武汉, 病例, 游客","Thailand, China, Wuhan, Case, Tourist"
291,477,-1,冠状病毒,2020-01-15,泰国 新型 冠状病毒 病例 为 武汉 游客 美玉 桃源 原生态 旅游区 少林寺 与 美玉 桃源 同处 中岳 嵩山 仙境 如果说 少林功夫 给 人 的 是 视觉 上 的 震撼 美玉 桃源 给 人 的 则 是 心灵 上 的 理想国 如果 美玉 有 故乡 那 一定 是 桃源 美玉 桃源 原生态 旅游区 是 世界 上 唯一 以 玉石 为 主题 的 旅游 度假区 这里 景色 秀美 物产丰富 因 ​ ,2020-01-15 14:32:00,0,0,0,__label__positive,0.44554,0.07371,0.16887,0.44554,3.0,"武汉, 泰国, 病例, 传人, 发现","Wuhan, Thailand, Case, successor, Find"
292,478,-1,冠状病毒,2020-01-15,samzhe 山泽 六类 网线 零 五米 三 九元 需用 券 天猫 精选 目前 报价 五 九元 使用 二元 优惠券 后 实付 三 九元 有 需要 的 可以 去 看看 叠加 优惠券 二元 优惠券 刘亦菲 马上 翻跟头 美国 太 空军 首任 司令 宣誓就职 泰国 新 冠状病毒 患者 已 康复 二元 券 微博 专享 限时 领券,2020-01-15 14:32:00,0,0,0,__label__neutral,0.01745,0.11281,0.7663,0.7663,1.0,"泰国, 中国, 武汉, 病例, 游客","Thailand, China, Wuhan, Case, Tourist"
293,479,-1,冠状病毒,2020-01-15,发布 了 头条 文章 泰国 新 冠状病毒 患者 已 康复 o 泰国 新 冠状病毒 患者 已 康复,2020-01-15 14:31:00,0,0,0,__label__positive,1.00001,1e-05,0.00111,1.00001,1.0,"泰国, 中国, 武汉, 病例, 游客","Thailand, China, Wuhan, Case, Tourist"
294,480,-1,冠状病毒,2020-01-15,总是 疲倦 容易 感冒 过敏 还有 慢性 疼痛 等 症状 出现 可能 是 你 的 免疫力 下降 了 七个 简单 的 步骤 帮助 你 增强 免疫系统 ​ 泰国 新 冠状病毒 患者 已 康复,2020-01-15 14:31:00,7,0,12,__label__neutral,0.39982,0.0065,0.4225100000000001,0.4225100000000001,0.0,"病例, 泰国, 武汉, 游客, 一个","Case, Thailand, Wuhan, Tourist, One"
295,486,-1,冠状病毒,2020-01-15,硕世 生物 六十三 一百 零 零 零 零 新 产品 仅 用于 对 新型 冠状病毒 以及 其他 冠状病毒 的 检测 不用于 治疗 　 　 硕世 生物 六十八 万八千 三百 九十九 一月 十四日 晚间 公告 针对 武汉 新型 冠状病毒 引发 的 疫情 公司 基于 荧光 pcr 的 技术 于 二千 零 二十年 一月 十三日 开发 了 新型 冠状病毒 核酸 检测 试剂盒 以及 冠状病毒 通用型 核酸 检测 试剂盒 上述 产品 仅 用于 ​ ,2020-01-15 14:30:00,0,0,0,__label__positive,0.8962600000000001,0.00807,0.13662,0.8962600000000001,2.0,"泰国, 病例, 武汉, 游客, 发现","Thailand, Case, Wuhan, Tourist, Find"
296,487,-1,冠状病毒,2020-01-15,你 的 肺 还好 吗 肺 是 人体 最 娇嫩 的 器官 很多 传染性 疾病 首先 侵入 肺部 肺炎 是 全世界 五岁 以下 儿童 的 头号 杀手 我国 每年 约 有 六 二万名 儿童 死 于 肺炎 肺有 六怕 怕 燥 怕 寒 怕热 怕 悲忧 雾 霾 怕 大便 不通 如何 自测 肺 功能 哪些 简单 的 方法 能养 肺 今天 送 你 养 肺经 科普 周知 ​ ,2020-01-15 14:30:00,0,33,10,__label__negative,0.19194,0.90732,0.00492,0.90732,1.0,"泰国, 中国, 武汉, 病例, 游客","Thailand, China, Wuhan, Case, Tourist"
297,488,-1,冠状病毒,2020-01-15,武汉 卫健委 通报 新型 肺炎 情况 不能 排除 有限 人 传人 可能 世界卫生组织 十三日 发表 一份 声明 说 已 收到 在 泰国 确诊 一名 中国 旅客 感染 新型 冠状病毒 的 报告 并 援引 泰国 官员 的 消息 表示 这名 患者 已经 在 泰国 一家 医院 接受 治疗 病情 稳定 预计 将 在 未来 数天 痊愈 出院 o 武汉 卫健委 通报 新型 肺炎 情况 不能 排除 有限 人 传人 可能,2020-01-15 14:29:00,0,0,1,__label__negative,0.07587,0.4922,0.15611,0.4922,1.0,"泰国, 中国, 武汉, 病例, 游客","Thailand, China, Wuhan, Case, Tourist"
298,489,-1,冠状病毒,2020-01-15,世卫 和 武汉 发布 感觉 重要性 不在 一个 等,2020-01-15 08:53:00,0,0,0,__label__negative,0.12253,0.13297,0.008329999999999999,0.13297,1.0,"泰国, 中国, 武汉, 病例, 游客","Thailand, China, Wuhan, Case, Tourist"
299,492,-1,冠状病毒,2020-01-15,一定 要 重视 起来 不制造 恐慌 但 也 要 严加防范 普及 医护 知识 远离 病毒传播,2020-01-15 14:23:00,1,0,0,__label__negative,0.28142,0.58511,0.00492,0.58511,2.0,"泰国, 病例, 武汉, 游客, 发现","Thailand, Case, Wuhan, Tourist, Find"
300,493,-1,冠状病毒,2020-01-15,总是 疲倦 容易 感冒 过敏 还有 慢性 疼痛 等 症状 出现 可能 是 你 的 免疫力 下降 了 七个 简单 的 步骤 帮助 你 增强 免疫系统 ​ 泰国 新 冠状病毒 患者 已 康复,2020-01-15 14:26:00,0,0,7,__label__neutral,0.39982,0.0065,0.4225100000000001,0.4225100000000001,0.0,"病例, 泰国, 武汉, 游客, 一个","Case, Thailand, Wuhan, Tourist, One"
301,494,-1,冠状病毒,2020-01-15,近日 泰国 在 机场 截查 一名 中国 武汉 游客 确认 感染 新型 冠状病毒 成为 中国 境外 首 起 病例 这名 六十一岁 的 妇女 现已 康复 世界卫生组织 十四日 表示 中国 出现 的 新型 冠状病毒 目前 已经 出现 了 有 限度 的 人 与 人 传播 主要 以 家庭 群聚 为主 但 仍然 具备 广泛传播 的 潜在 可能 世界卫生组织 正在 准备 应对 可能 发生 的 广泛 爆发 ​ ,2020-01-15 14:26:00,0,2,2,__label__neutral,0.20182,0.09809,0.23372,0.23372,1.0,"泰国, 中国, 武汉, 病例, 游客","Thailand, China, Wuhan, Case, Tourist"
302,495,-1,冠状病毒,2020-01-15,泰国 新型 冠状病毒 病例 为 武汉 游客 能 牵手 的 时候 请别 肩并肩 能 拥抱 的 时候 请别 手牵手 能 相爱 的 时候 请 别说 分开 拥有 了 爱情 请别 去 碰 暧昧,2020-01-15 14:25:00,0,0,0,__label__negative,0.03022,0.71224,0.05666,0.71224,0.0,"病例, 泰国, 武汉, 游客, 一个","Case, Thailand, Wuhan, Tourist, One"
303,496,-1,冠状病毒,2020-01-15,泰国 新型 冠状病毒 病例 为 武汉 游客 将近 钓鱼 旺季 钓鱼 的 果报 非常 惨烈 很多 人 喜欢 钓鱼 认为 工作 之 馀 钓钓鱼 能 修身养性 但是 殊不知 这 可是 犯 了 大罪 看似 有 诸多 好处 的 钓鱼 其实 是 一项 极其 残忍的 活动 而且 报应 会 来得 非常 快 钓鱼 是 极残忍 的 活动 试想 如果 把 尖锐的 钓勾 进入 自己 的 嘴唇 ​ ,2020-01-15 14:25:00,0,0,0,__label__positive,0.69265,0.01206,0.37024,0.69265,4.0,"武汉, 泰国, 病例, 游客, 命名","Wuhan, Thailand, Case, Tourist, name"
304,499,-1,冠状病毒,2020-01-15,转,2020-01-15 10:06:00,1,0,0,__label__neutral,1e-05,1e-05,1.00001,1.00001,0.0,"病例, 泰国, 武汉, 游客, 一个","Case, Thailand, Wuhan, Tourist, One"
305,501,-1,冠状病毒,2020-01-15,泰国 新 冠状病毒 患者 已 康复 武汉 肺炎 病原体 为 新型 冠状病毒   科普 贴 我们 该 如何 预防 据 报道 武汉 不明 原因 肺炎 病原体 为 新型 冠状病毒 什么 是 冠状病毒 它 与 引起 的 sars 的 冠状病毒 有何 区别 普通人 应该 如何 防范 了解 一下,2020-01-15 14:23:00,7,4,20,__label__negative,0.08757000000000001,0.94816,0.00058,0.94816,4.0,"武汉, 泰国, 病例, 游客, 命名","Wuhan, Thailand, Case, Tourist, name"
306,506,-1,冠状病毒,2020-01-15,让 大家 多 注意 一下 有错 吗 肆无忌惮 流动 的 人群 就是 潜在 感染 源 宣传 一点 事 都 没有 一切 尽 在 掌握 之中 与 危害 医护人员 安全 危害 公共安全 有何 差别 直到 今天 病房 才 通知 强制 戴 口罩 帽子 今天 在 门诊 发现 医护 以外 大部分 人 没有 任何 防护 措施 武汉 人 果然 是 没有 被 重大 疫情 锤过 不信,2020-01-15 08:53:00,0,0,1,__label__negative,0.05836,0.40734,0.12941,0.40734,2.0,"泰国, 病例, 武汉, 游客, 发现","Thailand, Case, Wuhan, Tourist, Find"
307,507,-1,冠状病毒,2020-01-15,泰国 新型 冠状病毒 病例 为 武汉 游客 十五日 凌晨 武汉 卫健委 发布 新型 冠状 病例 感染 的 肺炎 疫情 知识 问答 武汉 卫健委在 问答 中 表示 目前 肺炎 疫情 尚未 发现 明确 人 传人 证据 不能 排除 有限 人 传人 可能 但 持续 人 传人 风险 较 低 肺炎 的 发病 机制 是怎样 的 mark 一下 生命 时报 l 医 视频 的 微博 视频,2020-01-15 14:21:00,1,1,1,__label__positive,0.5078199999999999,0.03623,0.32768,0.5078199999999999,3.0,"武汉, 泰国, 病例, 传人, 发现","Wuhan, Thailand, Case, successor, Find"
308,509,-1,冠状病毒,2020-01-15,泰国 新型 冠状病毒 病例 为 武汉 游客 泰国 新 冠状病毒 患者 已 康复 近日 在 泰国 发现 了 一位 感染 新型 冠状病毒 的 游客 这名 六十一岁 的 妇女 是 来自 武汉 的 游客 现已 康复 虽然 在 武汉 的 病例 中 尚未 确切 的 证据 表明 有 传染性 但 世卫 组织 表示 新型 冠状病毒 有 广泛传播 的 可能 仍 需 防范,2020-01-15 08:53:00,0,0,1,__label__positive,0.7186,0.00213,0.71224,0.7186,1.0,"泰国, 中国, 武汉, 病例, 游客","Thailand, China, Wuhan, Case, Tourist"
309,512,-1,冠状病毒,2020-01-15,又 让 我 害怕 了 具有 广泛传播 的 可,2020-01-15 08:53:00,0,0,0,__label__negative,1e-05,0.99495,0.00194,0.99495,1.0,"泰国, 中国, 武汉, 病例, 游客","Thailand, China, Wuhan, Case, Tourist"
310,513,-1,冠状病毒,2020-01-15,我 发表 了 头条 文章 science 发文 密切 关注 我国 发现 的 新型 冠状病毒 o science 发文 密切 关注 我国 发现 的 新型 冠状病毒,2020-01-15 14:19:00,0,0,0,__label__positive,0.96887,0.27514,1e-05,0.96887,3.0,"武汉, 泰国, 病例, 传人, 发现","Wuhan, Thailand, Case, successor, Find"
311,514,-1,冠状病毒,2020-01-15,生活 资讯 如何 防护 冠状病毒 感染 据 世卫 中国 出现 的 新型 冠状病毒 目前 已 出现 有 限度 的 人 与 人 传播 主要 以 家庭 群聚 为主 但 仍然 具备 广泛传播 的 潜在 可能 春节 走亲访友 一定 要 做好 防护 一 保持 手 卫生 二 咳嗽 或 打喷嚏 时 捂住 口 鼻 三 安全 饮食 肉 蛋类 彻底 做熟 四 尽量避免 与 任何 表现 出 有 呼吸道 疾病症状 ​ ,2020-01-15 14:18:00,0,0,1,__label__negative,0.06372,0.4225100000000001,0.10972,0.4225100000000001,1.0,"泰国, 中国, 武汉, 病例, 游客","Thailand, China, Wuhan, Case, Tourist"
312,515,-1,冠状病毒,2020-01-15,泰国 新型 冠状病毒 病例 为 武汉 游客 德国 柏林 病毒 研究 专家 德罗斯 滕 认为 武汉 的 肺炎 病毒 依然 是 sars 病毒 只不过 形态 不同 二千 零 三年 的 sars 大 爆发 从 sars 发病 到 找到 确切 的 病因 研究 人员 用 了 十五年 用到 了 现代医学 绝大多数 技术手段 才 彻底 搞清楚 第一步 找 发病 部位 这个 过程 相对 容易 给 患者 拍 的 x 光片 ​ ,2020-01-15 14:17:00,81,27,188,__label__negative,0.12941,0.22817,0.21208,0.22817,1.0,"泰国, 中国, 武汉, 病例, 游客","Thailand, China, Wuhan, Case, Tourist"
313,516,-1,冠状病毒,2020-01-15,声音 观点 武汉 卫健委 武汉 肺炎 出现 家庭 聚集 性 病例   不排除 有限 人 传人 可能 一月 十五日 凌晨 武汉 卫健委 发布 新型 冠状 病例 感染 肺炎 相关 情况 尚未 发现 明确 人 传人 证据 武汉 肺炎 不排除 有限 人 传人 可能   但 持续 人 传人 风险 较 低 武汉 卫健委称 四十 一例 肺炎 病例 以 男性 为主 中老年 发病 人数 较 多 年龄 较大 ​ ,2020-01-15 14:17:00,15,11,48,__label__neutral,0.01365,0.06756000000000001,0.96154,0.96154,3.0,"武汉, 泰国, 病例, 传人, 发现","Wuhan, Thailand, Case, successor, Find"
314,517,-1,冠状病毒,2020-01-15,关于 新型 冠状病毒 的 解读,2020-01-15 00:19:00,0,0,2,__label__neutral,0.0007,1e-05,1.00001,1.00001,3.0,"武汉, 泰国, 病例, 传人, 发现","Wuhan, Thailand, Case, successor, Find"
315,518,-1,冠状病毒,2020-01-15,摘 世界卫生组织 十三日 发表声明 称 在 中国 以外 国家 发现 病例 并 不意外 要求 各国 及时 持续 开展 检测 和 预防 工作 十四日 该 组织 确认 检测 出 新型 冠状病毒 中国 最大 的 旅游 网站 携程 旅行网 预计 二千 零 二十年 春节 的 人气 出境游 目的地 方面 日本 位居 榜首 泰国 位列 第二,2020-01-15 10:30:00,6,0,5,__label__negative,0.11921,0.43783,0.10972,0.43783,2.0,"泰国, 病例, 武汉, 游客, 发现","Thailand, Case, Wuhan, Tourist, Find"
316,519,-1,冠状病毒,2020-01-15,泰国 新型 冠状病毒 病例 为 武汉 游客 成功 有 很 多种 事业 的 成功 是 小成 人生 的 成功 才 是 大成 先要 有 追求 事业成功 的 想法 和 行动 将来 才 可能 有 人生 的 成功 无论 追求 哪 种 成功 都 需要 作出 明智的 取舍,2020-01-15 14:16:00,0,0,0,__label__positive,0.96379,0.13662,1e-05,0.96379,4.0,"武汉, 泰国, 病例, 游客, 命名","Wuhan, Thailand, Case, Tourist, name"
317,520,-1,冠状病毒,2020-01-15,泰国 新型 冠状病毒 病例 为 武汉 游客 虽然 我 一天天 地 长大 但 童年 的 趣事 像 一颗颗 明珠 快乐 永远 洋溢 在 我 的 心田,2020-01-15 14:15:00,0,0,0,__label__negative,0.11281,0.27514,0.05836,0.27514,0.0,"病例, 泰国, 武汉, 游客, 一个","Case, Thailand, Wuhan, Tourist, One"
318,521,-1,冠状病毒,2020-01-15,昨晚 何君尧 和 黄秋生 对话 黄未 到场 自然 变成 对何 君尧 的 单访 结果 变成 何生 与 利女尬 聊 泰国 新型 冠状病毒 病例 为 武汉 游客 泰国 新 冠状病毒 患者 已 康复 l 茂哥 日记 的 微博 视频,2020-01-15 14:14:00,9,35,152,__label__negative,0.30076,0.37755,0.018000000000000002,0.37755,4.0,"武汉, 泰国, 病例, 游客, 命名","Wuhan, Thailand, Case, Tourist, name"
319,526,-1,冠状病毒,2020-01-15,泰国 新型 冠状病毒 病例 为 武汉 游客 曾经 稚嫩 的 心灵 已 变得 成熟 曾经 娇小 的 幼苗 已 长成 小树 成长 的 过程 中 变 了 许多 也 忘 了 许多 但 那些 充满 童趣 的 话语 和 事情 依然 铭记在心,2020-01-15 14:14:00,0,0,0,__label__positive,0.9363,0.00272,0.26895,0.9363,4.0,"武汉, 泰国, 病例, 游客, 命名","Wuhan, Thailand, Case, Tourist, name"
320,527,-1,冠状病毒,2020-01-15,泰国 新型 冠状病毒 病例 为 武汉 游客 一个 女人 如果 没空 那 是因为 他 不想 有空 一个 人 如果 走不开 那 是因为 不想 走开 一个 人 对 你 借口 太 多 那 是因为 不想 在乎,2020-01-15 14:13:00,0,0,0,__label__neutral,0.37755,0.00434,0.90466,0.90466,0.0,"病例, 泰国, 武汉, 游客, 一个","Case, Thailand, Wuhan, Tourist, One"
321,528,-1,冠状病毒,2020-01-15,武汉 肺炎 不排除 有限 人 传人 可能 十五日 凌晨 武汉 卫健委 发布 新型 冠状 病例 感染 的 肺炎 疫情 知识 问答 武汉 卫健委在 问答 中 表示 目前 肺炎 疫情 尚未 发现 明确 人 传人 证据 不能 排除 有限 人 传人 可能 但 持续 人 传人 风险 较 低 泰国 新型 冠状病毒 病例 为 武汉 游客 l 医 视频 的 微博 视频,2020-01-15 14:12:00,0,0,1,__label__neutral,0.14806,0.03022,0.73107,0.73107,3.0,"武汉, 泰国, 病例, 传人, 发现","Wuhan, Thailand, Case, successor, Find"
322,529,-1,冠状病毒,2020-01-15,气候异常 很 容易 发生 流行性 疫病,2020-01-15 08:53:00,0,0,0,__label__positive,0.62247,0.00299,0.11597,0.62247,3.0,"武汉, 泰国, 病例, 传人, 发现","Wuhan, Thailand, Case, successor, Find"
323,532,-1,冠状病毒,2020-01-15,盘间 动态 午后 市场 炸板率 走高 资金 观望 情绪 提升 并且 不断 的 缩量 说明 有 规模 不小 的 活跃 资金 产生 了 离场 需求 从 历史 情况 来看 几乎 每年 春节 前 的 一周 左右 市场 在 走势 和 成交 规模 上 都 会 有 萎缩 再加之 募资 高达 三百 亿 的 京沪 高铁 即将 在 明天 正式 上市 交易 市场 在 面对 这种 巨无霸 个股 落地 之 时 多多少少 会 ​ ,2020-01-15 14:09:00,2,14,113,__label__negative,0.04744,0.62978,0.06189,0.62978,3.0,"武汉, 泰国, 病例, 传人, 发现","Wuhan, Thailand, Case, successor, Find"
