,id,label,keyword,date,content,time,forward,comment,like,predict,__label__positive,__label__negative,__label__neutral,predict_score,topic,topic_keyword,topic_keyword_en
457,701,-1,冠状病毒,2020-01-17,从 武汉 飞 曼谷 的 游客 这 几天 就 查出 两例 了 泰国 发现 第二例 新型 冠状病毒 肺炎 患者,2020-01-17 12:41:00,0,0,0,__label__neutral,0.01973,0.01497,0.95258,0.95258,4.0,"发现, 患者, 泰国, 确诊, 第二例","Find, patient, Thailand, Confirmed diagnosis, Second case"
458,706,-1,冠状病毒,2020-01-17,植发 脱发 发际 线 九十 后 已经 开始 植发 泰国 发现 第二例 新型 冠状病毒 肺炎 患者 零后 还 会 远 吗 关于 植发 脱发 发际 线高 有 什么 想 问 的 吗 可以 在 下方 评论 或 私信 我 有问必答 周一,2020-01-17 19:18:00,0,0,0,__label__neutral,0.02299,0.34866,0.53899,0.53899,1.0,"泰国, 发现, 患者, 第二例, 病毒","Thailand, Find, patient, Second case, virus"
459,707,-1,冠状病毒,2020-01-17,到底 有没有 事 啊 日 了 担,2020-01-17 16:35:00,0,0,0,__label__negative,1e-05,0.97632,0.71224,0.97632,0.0,"武汉, 发现, 泰国, 患者, 第二例","Wuhan, Find, Thailand, patient, Second case"
460,708,-1,冠状病毒,2020-01-17,期待 最新 的 反馈 有 更 多 信息 要 搞清楚 是 怎么 感染,2020-01-17 16:35:00,0,0,0,__label__negative,0.00434,0.97968,0.01134,0.97968,0.0,"武汉, 发现, 泰国, 患者, 第二例","Wuhan, Find, Thailand, patient, Second case"
461,710,-1,冠状病毒,2020-01-17,武汉 冠状病毒 肺炎 新增 死亡 一例 最近 感冒 了 好 怕怕,2020-01-17 19:17:00,0,0,0,__label__negative,1e-05,0.85196,0.15204,0.85196,3.0,"武汉, 口罩, 发现, 患者, 泰国","Wuhan, Mask, Find, patient, Thailand"
462,711,-1,冠状病毒,2020-01-17,看 视频 里面 说 泰国 发现 的 第二例 也 是 来 着 中国 武汉 的 泰国 公共 卫生部 在 其 官网 公布 已 发现 第二例 二千 零 一十九 ncov 确诊 病例 患者 是 一名 七十四岁 中国籍 女子 这 也 是 在 中国 境外 发现 的 第三例 新型 冠状病毒 确诊 病例,2020-01-17 16:35:00,0,0,0,__label__negative,0.004079999999999999,0.5775100000000001,0.55448,0.5775100000000001,4.0,"发现, 患者, 泰国, 确诊, 第二例","Find, patient, Thailand, Confirmed diagnosis, Second case"
463,713,-1,冠状病毒,2020-01-17,康师傅 美食 搭 搭 搭 明星 饭局 发起人 杜 海涛 邀请 大家 开启 新年 饭局 啦 红红火火 的 火锅 泰国 发现 第二例 新型 冠状病毒 肺炎 患者 就要 搭配 清爽 解腻 的 康师傅 酸梅汤 更 多 饭局 美食 滋味 快 来 跟着 海涛 一起 吃吃喝喝 尽情 享受 吧 转发 带 话题 饭局 邀 你 来 好友 加入 饭局 一月 十六日 一,2020-01-17 19:17:00,0,0,0,__label__negative,0.1067,0.65136,0.19684,0.65136,4.0,"发现, 患者, 泰国, 确诊, 第二例","Find, patient, Thailand, Confirmed diagnosis, Second case"
464,715,-1,冠状病毒,2020-01-17,康师傅 美食 搭 搭 搭 明星 饭局 发起人 杜 海涛 邀请 大家 开启 新年 饭局 啦 红红火火 的 火锅 泰国 发现 第二例 新型 冠状病毒 肺炎 患者 就要 搭配 清爽 解腻 的 康师傅 酸梅汤 更 多 饭局 美食 滋味 快 来 跟着 海涛 一起 吃吃喝喝 尽情 享受 吧 转发 带 话题 饭局 邀 你 来 好友 加入 饭局 一月 十六日 十二 零 由 微博,2020-01-17 19:16:00,0,0,0,__label__negative,0.09536,0.67919,0.17782,0.67919,4.0,"发现, 患者, 泰国, 确诊, 第二例","Find, patient, Thailand, Confirmed diagnosis, Second case"
465,717,-1,冠状病毒,2020-01-17,爱 guo 病毒,2020-01-17 16:35:00,0,0,0,__label__positive,1.00001,1e-05,1e-05,1.00001,2.0,"武汉, sars, 相似, o, 专家","Wuhan, sars, similar, o, expert"
466,718,-1,冠状病毒,2020-01-17,冠状病毒,2020-01-17 19:16:00,0,0,0,__label__neutral,1e-05,0.00942,0.97559,0.97559,0.0,"武汉, 发现, 泰国, 患者, 第二例","Wuhan, Find, Thailand, patient, Second case"
467,719,-1,冠状病毒,2020-01-17,泰国 发现 第二例 新型 冠状病毒 肺炎 患者 on friday morning thailand said that a 七十四 year old chinese woman had been confirmed to be infected with pneumonia after arriving from the chinese city of wuhan the second case found in the country following the discovery of the first ​ ,2020-01-17 19:16:00,0,0,1,__label__negative,0.28142,0.39982,0.21208,0.39982,3.0,"武汉, 口罩, 发现, 患者, 泰国","Wuhan, Mask, Find, patient, Thailand"
468,720,-1,冠状病毒,2020-01-17,泰国 发现 第二例 新型 冠状病毒 肺炎 患者,2020-01-17 17:54:00,0,0,0,__label__neutral,0.0006,0.05836,0.99332,0.99332,4.0,"发现, 患者, 泰国, 确诊, 第二例","Find, patient, Thailand, Confirmed diagnosis, Second case"
469,721,-1,冠状病毒,2020-01-17,了解 冠状病毒 的 知识,2020-01-17 07:40:00,0,0,0,__label__negative,1e-05,0.85196,0.0005099999999999999,0.85196,0.0,"武汉, 发现, 泰国, 患者, 第二例","Wuhan, Find, Thailand, patient, Second case"
470,722,-1,冠状病毒,2020-01-17,说 一下 我 的 上妆 工具 tips 泰国 发现 第二例 新型 冠状病毒 肺炎 患者 都 是 最近 很 爱 的 便宜 好用 木有 广 看个 爽,2020-01-17 19:16:00,0,0,0,__label__negative,0.02519,0.7431800000000001,0.15204,0.7431800000000001,3.0,"武汉, 口罩, 发现, 患者, 泰国","Wuhan, Mask, Find, patient, Thailand"
471,723,-1,冠状病毒,2020-01-17,泰国 发现 第二例 新型 冠状病毒 肺炎 患者 跟 我们 较劲 呢,2020-01-17 19:15:00,0,0,0,__label__neutral,0.0223,0.00807,0.99116,0.99116,4.0,"发现, 患者, 泰国, 确诊, 第二例","Find, patient, Thailand, Confirmed diagnosis, Second case"
472,728,-1,冠状病毒,2020-01-17,国外 第三例 请 周知,2020-01-17 16:35:00,0,0,0,__label__negative,1e-05,1.00001,0.00036,1.00001,3.0,"武汉, 口罩, 发现, 患者, 泰国","Wuhan, Mask, Find, patient, Thailand"
473,729,-1,冠状病毒,2020-01-17,了 钱 宏量 终于 给 秦洛给 刺 的 坐不住 了 阴沉 着 脸 说道 谁 做 团长 是 组织 讨论 决定 的 怎么 能 让 来 让 去 的 这 不是 过家家 吗 　 　 秦洛撇 巧兰浦泽 撇嘴 说道 争 你 争不来 泰国 发现 一例 新型 冠状病毒 病例,2020-01-17 19:15:00,0,0,0,__label__negative,0.00111,0.93813,0.19194,0.93813,4.0,"发现, 患者, 泰国, 确诊, 第二例","Find, patient, Thailand, Confirmed diagnosis, Second case"
474,730,-1,冠状病毒,2020-01-17,这 就是 大量 偷渡 黑鬼 带来 的 危害 之一 不仅仅 是 艾滋 各种 传染病 大多 来自 这些 黑鬼 为什么 发生 在 武汉 因为 这 几年 广州 管理 比 以前 严了 很多 偷渡 黑鬼 都 往 其它 地区 跑 武汉 就是 其中 之一 没发现 武汉 的 黑鬼 越来越 多 了 吗 武汉 不明 原因 肺炎 病原体 为 新型 冠状病毒,2020-01-17 19:14:00,0,0,0,__label__negative,0.01745,0.93992,0.03115,0.93992,2.0,"武汉, sars, 相似, o, 专家","Wuhan, sars, similar, o, expert"
475,732,-1,冠状病毒,2020-01-17,第一 感觉 这是 sars 病毒 变异 的 新型 病毒 出现 在 春运 前夕 在 全国 都 排名 居前 的 火车站 附近 👿 专家 释疑 新型 冠状病毒 与 sars 相似 程度 为 八十 持续 传人 风险 较 低 截至 目前 武汉市 累计 报告 新型 冠状病毒 感染 的 肺炎 病例 四十 一例 治愈 出院 十二 例 在 治 重症 五例 死亡 二例 o,2020-01-17 19:14:00,0,0,1,__label__negative,0.08511,0.5775100000000001,0.06189,0.5775100000000001,3.0,"武汉, 口罩, 发现, 患者, 泰国","Wuhan, Mask, Find, patient, Thailand"
476,733,-1,冠状病毒,2020-01-17,春节 走亲访友 做好 病毒感染 防护 一 保持 手 卫生 二 咳嗽 或 打喷嚏 时 捂住 口 鼻 三 安全 饮食 肉 蛋类 彻底 做熟 四 尽量避免 与 任何 表现 出 有 呼吸道 疾病症状 如 咳嗽 和 打喷嚏 等 的 人 密切接触 避免 近距离 接触 野生动物 或活 牲畜 五 不要 随地吐痰 ​ ​ ​ 新型 冠状病毒,2020-01-17 19:14:00,0,0,0,__label__negative,0.07371,0.32768,0.27514,0.32768,2.0,"武汉, sars, 相似, o, 专家","Wuhan, sars, similar, o, expert"
477,734,-1,冠状病毒,2020-01-17,泰国 发现 第二例 新型 冠状病毒 肺炎 患者 一月 十七日 泰国 公共 卫生部 在 其 官网 公布 已 发现 第二例 二千 零 一十九 ncov 确诊 病例 患者 是 一名 七十四岁 中国籍 女子 这 也 是 在 中国 境外 发现 的 第三例 新型 冠状病毒 确诊 病例 目前 两名 确诊 患者 在 负 气压 隔离病房 中 接受 治疗 两人 之间 发病 并 无 相关性 ​ ,2020-01-17 19:14:00,0,0,0,__label__neutral,0.04744,0.03965,0.90466,0.90466,4.0,"发现, 患者, 泰国, 确诊, 第二例","Find, patient, Thailand, Confirmed diagnosis, Second case"
478,735,-1,冠状病毒,2020-01-17,已经 上 口罩,2020-01-17 16:35:00,0,0,0,__label__negative,1e-05,0.91965,0.00691,0.91965,3.0,"武汉, 口罩, 发现, 患者, 泰国","Wuhan, Mask, Find, patient, Thailand"
479,736,-1,冠状病毒,2020-01-17,为啥 国内 如此 平静 😐 武汉 的 网友 们 还 以 不戴 口罩 出门 为,2020-01-17 16:35:00,0,0,0,__label__neutral,0.01543,0.01543,0.69926,0.69926,3.0,"武汉, 口罩, 发现, 患者, 泰国","Wuhan, Mask, Find, patient, Thailand"
480,737,-1,冠状病毒,2020-01-17,泰国 发现 第二例 新型 冠状病毒 肺炎 患者 瑟瑟 发抖 我 机票 酒店 都 订 完了 分割线 退 了 不要 去 了 钱 不要 了 我 要命 🙃,2020-01-17 19:13:00,0,17,1,__label__neutral,0.00134,0.55448,0.6723399999999999,0.6723399999999999,4.0,"发现, 患者, 泰国, 确诊, 第二例","Find, patient, Thailand, Confirmed diagnosis, Second case"
481,745,-1,冠状病毒,2020-01-17,泰国 发现 第二例 新型 冠状病毒 肺炎 患者 除了 武汉 都 在 慌,2020-01-17 19:12:00,0,3,1,__label__neutral,0.00914,0.00156,0.99907,0.99907,4.0,"发现, 患者, 泰国, 确诊, 第二例","Find, patient, Thailand, Confirmed diagnosis, Second case"
482,746,-1,冠状病毒,2020-01-17,年度 爱 用品 分享 十九年 使用 频率 较 高 的 产品 拖 到 现在 才 发出 来 哈哈 泰国 发现 第二例 新型 冠状病毒 肺炎 患者 实在 是 太懒 了 阳光 和 灯光 结合 下 拍摄 会 有 色差 看爱 用物 本身 就 好 不要 纠结 色差 我 是 混油 冬天 内油外 干 夏天 哪 哪 都 油 爱用物 分享 美妆爱 用品,2020-01-17 19:11:00,0,0,0,__label__negative,0.07587,0.45327,0.2451,0.45327,0.0,"武汉, 发现, 泰国, 患者, 第二例","Wuhan, Find, Thailand, patient, Second case"
483,747,-1,冠状病毒,2020-01-17,泰国 发现 第二例 新型 冠状病毒 肺炎 患者 大家 注意 防护 吧 体温计 口罩 板蓝根 抗病毒 药 走 起 💪 🏻,2020-01-17 19:10:00,0,5,4,__label__neutral,0.31406,0.01134,0.46103,0.46103,0.0,"武汉, 发现, 泰国, 患者, 第二例","Wuhan, Find, Thailand, patient, Second case"
484,748,-1,冠状病毒,2020-01-17,泰国 发现 第二例 新型 冠状病毒 肺炎 患者 现在 在 武汉 每 听到 一声 咳嗽 就 心惊胆颤 春运 已经 开始 了 消息 真的 得 更 准确 真实 一些 否则 大家 只会 更 害怕 如果 传染 倒不如 呼吁 大家 带 口罩 加强 防护 希望 肺炎 不要 大面积 爆发 希望 武汉 和 全国 都 能 健康 过个 好 年,2020-01-17 19:10:00,0,11,39,__label__negative,0.11597,0.6002,0.05186,0.6002,3.0,"武汉, 口罩, 发现, 患者, 泰国","Wuhan, Mask, Find, patient, Thailand"
485,749,-1,冠状病毒,2020-01-17,拒绝 千篇一律 的 游客 照 旅行 拍照 姿势 get ​ 泰国 发现 第二例 新型 冠状病毒 肺炎 患者,2020-01-17 19:09:00,0,0,0,__label__neutral,0.0063,0.26895,0.8267200000000001,0.8267200000000001,1.0,"泰国, 发现, 患者, 第二例, 病毒","Thailand, Find, patient, Second case, virus"
486,751,-1,冠状病毒,2020-01-17,又 出国,2020-01-17 16:35:00,0,0,0,__label__negative,1e-05,1.00001,1e-05,1.00001,2.0,"武汉, sars, 相似, o, 专家","Wuhan, sars, similar, o, expert"
487,753,-1,冠状病毒,2020-01-17,男子 插针 杀女 刑满 出狱 泰国 发现 第二例 新型 冠状病毒 肺炎 患者 病重 妻子 索要 儿女 抚养费 遭拒 亲生女儿 刚出生 三天 他 将 一枚 长约 五 厘米 的 针 插入 女儿 的 脑门 直到 女儿 十一岁 才 发现 十年 前 四川 安岳 男子 曾 某全 的 恶劣行径 经 媒体报道 后 震惊 一时 他 因犯 故意杀人罪 被判 有期徒刑 一,2020-01-17 19:08:00,0,0,0,__label__neutral,0.01497,0.31406,0.80318,0.80318,0.0,"武汉, 发现, 泰国, 患者, 第二例","Wuhan, Find, Thailand, patient, Second case"
488,754,-1,冠状病毒,2020-01-17,泰国 发现 第二例 新型 冠状病毒 肺炎 患者 适合 情侣 的 拍照 姿势 秀 的 一手 好 恩爱     马住,2020-01-17 19:08:00,0,0,0,__label__negative,0.0016600000000000002,0.8991299999999999,0.47659,0.8991299999999999,1.0,"泰国, 发现, 患者, 第二例, 病毒","Thailand, Find, patient, Second case, virus"
489,755,-1,冠状病毒,2020-01-17,舒服 吗 泰国 发现 第二例 新型 冠状病毒 肺炎 患者 办卡 吗 t cn a 六 vavejb,2020-01-17 19:07:00,0,0,0,__label__neutral,0.055020000000000006,0.02597,0.90732,0.90732,1.0,"泰国, 发现, 患者, 第二例, 病毒","Thailand, Find, patient, Second case, virus"
490,763,-1,冠状病毒,2020-01-17,太 可怕 了 两例 死亡 境外 患者 不是 武汉 就是 去过 武汉 的 春节 人员 流动 这么 大 出行 真的 要 戴 口罩,2020-01-17 16:35:00,0,0,0,__label__negative,0.00318,0.99693,1e-05,0.99693,3.0,"武汉, 口罩, 发现, 患者, 泰国","Wuhan, Mask, Find, patient, Thailand"
491,765,-1,冠状病毒,2020-01-17,有 一个 逻辑 问题,2020-01-17 16:35:00,0,0,0,__label__negative,1e-05,0.47659,0.13297,0.47659,2.0,"武汉, sars, 相似, o, 专家","Wuhan, sars, similar, o, expert"
492,767,-1,冠状病毒,2020-01-17,有 哪些 好看 的 恐 怖 惊 悚类 电影 泰国 发现 第二例 新型 冠状病毒 肺炎 患者 电影,2020-01-17 19:06:00,0,0,0,__label__negative,1e-05,0.96791,0.5000100000000001,0.96791,4.0,"发现, 患者, 泰国, 确诊, 第二例","Find, patient, Thailand, Confirmed diagnosis, Second case"
493,768,-1,冠状病毒,2020-01-17,出门 带 口罩 泡腾片 吃 起来 我 真的 不想 再 被 传染 感冒 了 头重脚轻 感觉 飘飘 的 浑浑噩噩 的 一天 谁 都 也 不想 搭理 真的 难过 感冒 的 人 么 出门 自觉 点 口罩 带 起来 传染,2020-01-17 16:35:00,0,0,0,__label__negative,0.0073599999999999985,0.99525,1e-05,0.99525,0.0,"武汉, 发现, 泰国, 患者, 第二例","Wuhan, Find, Thailand, patient, Second case"
494,769,-1,冠状病毒,2020-01-17,泰国 发现 第二例 新型 冠状病毒 肺炎 患者 这 是 种 什么 病 啊 大家 这么 恐慌 我 想 也 没有 这么 怕 的 吧 只要 做好 预防措施 应该 就 会 没事 的,2020-01-17 19:06:00,0,3,1,__label__negative,0.01244,0.48439,0.34159,0.48439,3.0,"武汉, 口罩, 发现, 患者, 泰国","Wuhan, Mask, Find, patient, Thailand"
495,770,-1,冠状病毒,2020-01-17,国外 第三例 请 周知,2020-01-17 16:35:00,5,1,9,__label__negative,1e-05,1.00001,0.00036,1.00001,3.0,"武汉, 口罩, 发现, 患者, 泰国","Wuhan, Mask, Find, patient, Thailand"
496,771,-1,冠状病毒,2020-01-17,投稿 图一是 割完 双眼皮 第一周 泰国 发现 第二例 新型 冠状病毒 肺炎 患者 真的 太惨 了 还好 过 了 第一个 月 就 慢慢 恢复 了 时间 越久越 自然,2020-01-17 19:05:00,0,0,0,__label__negative,0.00539,0.93992,0.02845,0.93992,1.0,"泰国, 发现, 患者, 第二例, 病毒","Thailand, Find, patient, Second case, virus"
497,772,-1,冠状病毒,2020-01-17,泰国 发现 第二例 新型 冠状病毒 肺炎 患者 唉 明天 飞 泰国 这 让 我 很 恐慌,2020-01-17 19:05:00,0,9,4,__label__neutral,0.0601,0.1733,0.23372,0.23372,3.0,"武汉, 口罩, 发现, 患者, 泰国","Wuhan, Mask, Find, patient, Thailand"
498,778,-1,冠状病毒,2020-01-17,关于 武汉 肺炎 什么 叫 有限 人 传人 该 如何 预防 文 唐小糖 二千 零一 十九年 十二月 八日 武汉 第一位 不明 原因 肺炎 患者 出现 症状 呼吸困难 和 发烧 二千 零 二十年 一月 七日 病原体 初步判断 是 一种 新型 冠状病毒 二千 零 二十年 一月 十五日 武汉 卫健委 表示 目前 肺炎 疫情 尚未 发现 明确 人 传人 证据 不能 排除 有限 人 传人 可 ​ ,2020-01-17 19:05:00,20,2,20,__label__neutral,0.02163,0.03022,0.95533,0.95533,0.0,"武汉, 发现, 泰国, 患者, 第二例","Wuhan, Find, Thailand, patient, Second case"
499,779,-1,冠状病毒,2020-01-17,注意 防范 就 好 了 传染病 总归 是 那么 几个 途径 要 搞清楚 是 怎么 感染,2020-01-17 16:35:00,0,0,0,__label__negative,1e-05,0.99712,0.0065,0.99712,3.0,"武汉, 口罩, 发现, 患者, 泰国","Wuhan, Mask, Find, patient, Thailand"
500,781,-1,冠状病毒,2020-01-17,泰国 发现 第二例 新型 冠状病毒 肺炎 患者 𝐎 𝐨 𝐭 𝐝 一百六十 一 🥛 🍊 又 是 优衣库 女孩 哦 鞋子 是 我 高一 买 的 大家 没有 听错 当年 买 了 可能 穿 了 三四次 然后 被 我 放到 鞋盒 里 忘记 了 一放 就是 五六年 今年 回家 整理 鞋子 被 我 找 了 出来 我 竟然 还 以为 是 我 妈 买 的 新鞋 我 还,2020-01-17 19:05:00,0,0,0,__label__neutral,1e-05,0.81758,0.8903,0.8903,3.0,"武汉, 口罩, 发现, 患者, 泰国","Wuhan, Mask, Find, patient, Thailand"
501,782,-1,冠状病毒,2020-01-17,泰国 发现 第二例 新型 冠状病毒 肺炎 患者 我 表示 我 在 武汉 我 家里人 还有 周围 的 人 出门 都 开始 戴 口罩 啦 慌 的 一批 好 嘛 怎么 看好 多 评论 都 说 全国 慌 就 武汉 不慌,2020-01-17 19:04:00,0,0,0,__label__neutral,0.01283,0.38492,0.56986,0.56986,3.0,"武汉, 口罩, 发现, 患者, 泰国","Wuhan, Mask, Find, patient, Thailand"
502,784,-1,冠状病毒,2020-01-17,慌得 一批 戴上 了 口罩 泰国 发现 第二例 新型 冠状病毒 肺炎 患者,2020-01-17 19:04:00,0,0,0,__label__neutral,0.00248,0.0117,0.99721,0.99721,1.0,"泰国, 发现, 患者, 第二例, 病毒","Thailand, Find, patient, Second case, virus"
503,785,-1,冠状病毒,2020-01-17,泰国 发现 第二例 新型 冠状病毒 肺炎 患者 患者 是 一名 七十四岁 中国籍 女子 目前 泰国 发现 的 两名 确诊 患者 在 负 气压 隔离病房 接受 治疗 有 了 二千 零 三年 sars 的 经验教训 世界 各国 防治 此类 肺炎 有 了 成熟的 治疗 方法 所以 不可能 大面积 扩散,2020-01-17 19:04:00,32,29,110,__label__negative,0.11281,0.45327,0.13662,0.45327,4.0,"发现, 患者, 泰国, 确诊, 第二例","Find, patient, Thailand, Confirmed diagnosis, Second case"
504,786,-1,冠状病毒,2020-01-17,泰国 发现 第二例 新型 冠状病毒 肺炎 患者 一 月 十七 日 泰国 公共 卫生部 发布 消息 称 发现 第二例 新型 冠状病毒 病例 患者 是 一名 七十四 岁 中国 女子 从 武汉 搭乘 飞机 前往 曼谷 泰国 卫生部 发言人 称该 女子 病情 稳定 情况 良好 这是 中国 境外 发现 的 第三例 新型 冠状病毒 确诊 病例,2020-01-17 19:04:00,2,3,3,__label__neutral,0.07808999999999999,0.04887,0.78267,0.78267,4.0,"发现, 患者, 泰国, 确诊, 第二例","Find, patient, Thailand, Confirmed diagnosis, Second case"
505,787,-1,冠状病毒,2020-01-17,泰国 发现 第二例 新型 冠状病毒 肺炎 患者 爆发 病毒 的 华南 就 在 汉口 火车站 一 里 以内 而 武汉 作为 中部 一大 交通枢纽 每天 南来北往 的 人流量 不敢 想象 而 感染 病毒 的 人 居然 统一 户口 全是 武汉 人 这 就 非常 令人 恐慌 了 病毒 还 挑人 感染 的 吗,2020-01-17 19:03:00,0,3,0,__label__negative,0.011,0.56219,0.32768,0.56219,1.0,"泰国, 发现, 患者, 第二例, 病毒","Thailand, Find, patient, Second case, virus"
506,788,-1,冠状病毒,2020-01-17,勤洗手 多 通风,2020-01-17 16:35:00,0,0,0,__label__positive,0.5234300000000001,1e-05,0.08511,0.5234300000000001,3.0,"武汉, 口罩, 发现, 患者, 泰国","Wuhan, Mask, Find, patient, Thailand"
507,789,-1,冠状病毒,2020-01-17,随酱 你 也 是 啊 看热 搜 还有 一例 在 日本 被 发现 的 中国 患者 春节 外出 要 多 注意,2020-01-17 16:35:00,0,0,0,__label__negative,0.19194,0.28142,0.00691,0.28142,0.0,"武汉, 发现, 泰国, 患者, 第二例","Wuhan, Find, Thailand, patient, Second case"
508,790,-1,冠状病毒,2020-01-17,泰国 发现 第二例 新型 冠状病毒 肺炎 患者 要 记住 不论是 对 孩子 也好 对 长辈 也好 如果 你 孝顺 长辈 敬老爱幼 将来 你 的 孩子 也 会 孝顺 你 这 就 叫 报应 这 叫 人间 报应 很多 人 以为 报应 是 死了 以后 才 有 的 其实 活着的 时候 就 已经 开始 现世报 了 你们 看看 马路边 上 那些 躺 着 要饭的 人 身上 肮脏 的 样子 这 不是 现世报 吗 ​ ,2020-01-17 19:03:00,0,0,0,__label__negative,0.00942,0.45327,0.43016,0.45327,4.0,"发现, 患者, 泰国, 确诊, 第二例","Find, patient, Thailand, Confirmed diagnosis, Second case"
509,792,-1,冠状病毒,2020-01-17,比得 兔二新 预告 比得 兔 二 逃跑 计划 发布 新 预告 贱萌 的 兔子 们 归来 泰国 发现 第二例 新型 冠状病毒 肺炎 患者 和 各种 动物 与 人类 其乐融融 但 也 要 展开 新 的 冒险 电影 主演 萝丝 拜恩 多姆 纳尔 格里森 大卫 奥伊 罗 詹姆斯 柯登 黛西 雷德 利 玛格 特 罗,2020-01-17 19:03:00,0,0,0,__label__negative,0.16452999999999998,0.6584300000000001,0.03515,0.6584300000000001,1.0,"泰国, 发现, 患者, 第二例, 病毒","Thailand, Find, patient, Second case, virus"
510,793,-1,冠状病毒,2020-01-17,回复 前 几个 星期 我们 还 在 嘲笑 毒港 抢 口罩 导致 缺货 看来 他们 先知先觉 个人 防护 措施 还是 挺足 的 除了 武汉 都 在 恐,2020-01-17 16:35:00,0,0,0,__label__negative,1e-05,0.96379,0.4922,0.96379,3.0,"武汉, 口罩, 发现, 患者, 泰国","Wuhan, Mask, Find, patient, Thailand"
511,798,-1,冠状病毒,2020-01-17,我 又 在 害怕 真的 除了 武汉 都 在 恐,2020-01-17 16:35:00,0,0,0,__label__negative,1e-05,1.00001,0.00058,1.00001,3.0,"武汉, 口罩, 发现, 患者, 泰国","Wuhan, Mask, Find, patient, Thailand"
512,799,-1,冠状病毒,2020-01-17,泰国 发现 第二例 新型 冠状病毒 肺炎 患者 南京 邓煌 灯光 秀 江苏 音乐台 九十七 五 阳光 倾城 主播 邓煌 公然 炫富 炫腐 是 在 挑战 中央 吗 望 中央 彻查 邓煌 背后 的 腐败 利益集团,2020-12-15 22:46:00,0,0,0,__label__neutral,0.0223,0.02677,0.96692,0.96692,3.0,"武汉, 口罩, 发现, 患者, 泰国","Wuhan, Mask, Find, patient, Thailand"
513,803,-1,冠状病毒,2020-01-17,泰国 发现 第二例 新型 冠状病毒 肺炎 患者 多 吃 大蒜 预防 病毒 🦠 二 重庆,2020-01-17 19:01:00,0,0,0,__label__neutral,0.0067,0.2069,0.7773100000000001,0.7773100000000001,1.0,"泰国, 发现, 患者, 第二例, 病毒","Thailand, Find, patient, Second case, virus"
514,804,-1,冠状病毒,2020-01-17,泰国 发现 第二例 新型 冠状病毒 肺炎 患者 好 慌,2020-01-17 19:01:00,0,0,0,__label__neutral,0.02163,0.0022600000000000003,0.98719,0.98719,4.0,"发现, 患者, 泰国, 确诊, 第二例","Find, patient, Thailand, Confirmed diagnosis, Second case"
515,805,-1,冠状病毒,2020-01-17,泰国 发现 第二例 新型 冠状病毒 肺炎 患者 希望 各国 都 好好 努力 叭 🙏 🙏 马上 要 新年 了,2020-01-17 19:01:00,0,0,1,__label__neutral,0.48439,0.02932,0.5000100000000001,0.5000100000000001,3.0,"武汉, 口罩, 发现, 患者, 泰国","Wuhan, Mask, Find, patient, Thailand"
516,806,-1,冠状病毒,2020-01-17,出门 戴个 口罩 总 没,2020-01-17 16:35:00,0,0,0,__label__negative,1e-05,0.7663,0.2069,0.7663,3.0,"武汉, 口罩, 发现, 患者, 泰国","Wuhan, Mask, Find, patient, Thailand"
517,807,-1,冠状病毒,2020-01-17,泰国 发现 第二例 新型 冠状病毒 肺炎 患者 注意 防范 个人卫生,2020-01-17 19:00:00,0,0,0,__label__neutral,0.11921,0.00256,0.98029,0.98029,3.0,"武汉, 口罩, 发现, 患者, 泰国","Wuhan, Mask, Find, patient, Thailand"
518,808,-1,冠状病毒,2020-01-17,泰国 发现 第二例 新型 冠状病毒 肺炎 患者 为什么 去 泰国 就 被 确诊 我 看不懂 也 不敢 乱 猜测 我 本来 计划 去 泰国 玩一玩 但是 不敢 去 了 还是 留在 三亚 安全,2020-01-17 19:00:00,0,14,1,__label__negative,1e-05,0.97559,0.6002,0.97559,4.0,"发现, 患者, 泰国, 确诊, 第二例","Find, patient, Thailand, Confirmed diagnosis, Second case"
519,809,-1,冠状病毒,2020-01-17,心知肚明 我 也 希望 有关 部门 的 公告 是 准确的 武汉 已经 十几天 没有 新 病例 了 全国 各地 也 没有 可是 在 国外 接二连三 发现 新 病例 心里 还是 有点,2020-01-17 16:35:00,0,0,0,__label__negative,0.2069,0.23936,0.01543,0.23936,0.0,"武汉, 发现, 泰国, 患者, 第二例","Wuhan, Find, Thailand, patient, Second case"
520,810,-1,冠状病毒,2020-01-17,这 是 个 什么 神奇 病毒 要 搞清楚 是 怎么 感染,2020-01-17 16:35:00,0,2,0,__label__negative,0.0022600000000000003,0.95664,0.02097,0.95664,3.0,"武汉, 口罩, 发现, 患者, 泰国","Wuhan, Mask, Find, patient, Thailand"
521,811,-1,冠状病毒,2020-01-17,想见 你 热播 泰国 发现 第二例 新型 冠状病毒 肺炎 患者 好 剧本 高质量 俨然 成为 近年来 台剧 的 新 标签 推荐 九部 题材 各异 的 高分 台剧 剧荒 的 快 马住 ​ ​ ​,2020-01-17 18:59:00,0,0,0,__label__negative,0.05341,0.84798,0.0237,0.84798,0.0,"武汉, 发现, 泰国, 患者, 第二例","Wuhan, Find, Thailand, patient, Second case"
