,id,label,keyword,date,content,time,forward,comment,like,predict,__label__positive,__label__negative,__label__neutral,predict_score,topic,topic_keyword,topic_keyword_en
477,738,-1,冠状病毒,2020-01-18,看来 还 挺 麻烦 武汉 新增 四例 新型 冠状病毒 肺炎 病例 治愈 出院 三例 十八日 武汉市 卫健委在 官网 发布 关于 新型 冠状病毒 感染 的 肺炎 防控 工作 情况通报 一月 十六日 治愈 出院 三例 无 新增 死亡 病例 经 专家组 综合 研判 我市 新增 四例 新型 冠状病毒 感染 的 肺炎 病例 所有 病例 病情 稳定 无 危重症 截至 目前 我市 累计 报告 ​ ,2020-01-18 13:52:00,0,1,2,__label__positive,0.95398,0.01283,0.01973,0.95398,4.0,"病例, 武汉, 新增, 四例, 感染","Case, Wuhan, New, Four cases, infection"
478,739,-1,冠状病毒,2020-01-18,武汉 新增 四例 新型 冠状病毒 肺炎 病例 没有 过多的 装饰 卫浴 空间 里 简单 有序 就 能 打造出 简约 的 美 洗手台 的 凹槽 避免 了 水渍 飞溅 整体 搭配 和 细节 设计 都 从 最 人性化 的 角度 出发 让 人 感到 舒适 方便,2020-01-18 13:52:00,0,0,0,__label__negative,0.00272,0.95533,0.055020000000000006,0.95533,0.0,"武汉, 防护, 视频, 微博, 新增","Wuhan, Protection, video, Weibo, New"
479,740,-1,冠状病毒,2020-01-18,武汉 新增 四例 新型 冠状病毒 肺炎 病例 还是 要 提高警惕 防患于未然,2020-01-18 13:14:00,0,0,0,__label__negative,1e-05,0.99946,0.00309,0.99946,4.0,"病例, 武汉, 新增, 四例, 感染","Case, Wuhan, New, Four cases, infection"
480,741,-1,冠状病毒,2020-01-18,武汉 新增 四例 新型 冠状病毒 肺炎 病例 大家 要 平安 啊,2020-01-18 13:50:00,0,0,0,__label__negative,1e-05,0.91965,0.5078199999999999,0.91965,2.0,"武汉, 新增, 四例, 病例, 口罩","Wuhan, New, Four cases, Case, Mask"
481,742,-1,冠状病毒,2020-01-18,病毒 有没有 我 不知道 媒体 肯定 有 重点 盯 从 武汉 地区 来 的 人 老外 怎么 查出来 的 可能 其他 省区 的 人 生了病 不会 第一 时间 考虑 是 感染 了 这种 新型 冠状病毒,2020-01-18 11:03:00,0,0,0,__label__negative,0.00328,0.90193,0.04604,0.90193,4.0,"病例, 武汉, 新增, 四例, 感染","Case, Wuhan, New, Four cases, infection"
482,743,-1,冠状病毒,2020-01-18,国外 第三例 请 周知,2020-01-17 16:35:00,0,0,0,__label__negative,1e-05,1.00001,0.00036,1.00001,4.0,"病例, 武汉, 新增, 四例, 感染","Case, Wuhan, New, Four cases, infection"
483,744,-1,冠状病毒,2020-01-18,武汉 新增 四例 新型 冠状病毒 肺炎 病例 大家 出行 做好 防护 吧,2020-01-18 13:50:00,0,0,0,__label__negative,1e-05,0.99332,0.0117,0.99332,2.0,"武汉, 新增, 四例, 病例, 口罩","Wuhan, New, Four cases, Case, Mask"
484,745,-1,冠状病毒,2020-01-18,武汉 新增 四例 新型 冠状病毒 肺炎 病例 做 善事 做到 后来 要 变成 自然 修心 一定 要 修 在 自然 当中 对于 这个 世界 上 的 一切 师父 为什么 叫 你们 不要 去争 不要 去 吵 你们 真的 不知道 因为 一切都在 缘分 当中 要 记住 我们 做 什么 事情 都 是 有缘分 的 因为 缘分 有时候 会 聚集 资粮 就是 你 有 功德 了 你 一直 在 缘分 当中 好好 地 ​ ,2020-01-18 13:49:00,0,0,0,__label__neutral,0.02034,0.32083,0.37755,0.37755,1.0,"武汉, 美国, 机场, 旅客, 病毒","Wuhan, United States, airport, Passenger, virus"
485,750,-1,冠状病毒,2020-01-18,大众 如何 预防 新型 冠状病毒 who 大众 如何 预防 新型 冠状病毒 o,2020-01-18 13:48:00,0,0,0,__label__positive,1.00001,0.00507,1e-05,1.00001,2.0,"武汉, 新增, 四例, 病例, 口罩","Wuhan, New, Four cases, Case, Mask"
486,751,-1,冠状病毒,2020-01-18,武汉 新增 四例 新型 冠状病毒 肺炎 病例 我 二月份 要 去 武汉 千万别 这样 啊,2020-01-18 13:48:00,0,1,1,__label__negative,1e-05,0.98202,0.01641,0.98202,4.0,"病例, 武汉, 新增, 四例, 感染","Case, Wuhan, New, Four cases, infection"
487,753,-1,冠状病毒,2020-01-18,武汉 新增 四例 新型 冠状病毒 肺炎 病例 出门 请带 口罩 关爱 自己 和 他人,2020-01-18 13:47:00,0,3,4,__label__negative,0.00942,0.94336,0.00241,0.94336,2.0,"武汉, 新增, 四例, 病例, 口罩","Wuhan, New, Four cases, Case, Mask"
488,755,-1,冠状病毒,2020-01-18,武汉 通报 新型 冠状病毒 肺炎 最新 疫情 新增 四例 十八日 凌晨 武汉市 卫生 健康 委员会 发布 关于 新型 冠状病毒 感染 的 肺炎 情况通报 新 认定 肺炎 病例 四例 经 治疗 后 症状 好转 目前 病情 稳定 其 相关 流行病学 调查 和 密切接触 者 追踪 正在 进行 此外 泰国 诊断 病例 正在 住院治疗 中 日本 诊断 病例 已 康复 出院 ​ ​ ​ ​ ,2020-01-18 13:47:00,4,5,7,__label__neutral,0.90193,1e-05,0.98029,0.98029,4.0,"病例, 武汉, 新增, 四例, 感染","Case, Wuhan, New, Four cases, infection"
489,756,-1,冠状病毒,2020-01-18,武汉 新增 四例 新型 冠状病毒 肺炎 病例 职场 事业 真言 头脑 醒目 一点 处世 低调 一点 为 人 谦逊 一点 做事 积极 一点 待人 和善 一点,2020-01-18 13:46:00,0,0,0,__label__positive,0.99391,0.04887,0.00156,0.99391,2.0,"武汉, 新增, 四例, 病例, 口罩","Wuhan, New, Four cases, Case, Mask"
490,757,-1,冠状病毒,2020-01-18,武汉 新增 四例 新型 冠状病毒 肺炎 病例 听 起来 好 可怕的 样子,2020-01-18 13:46:00,0,0,0,__label__negative,1e-05,1.00001,1e-05,1.00001,4.0,"病例, 武汉, 新增, 四例, 感染","Case, Wuhan, New, Four cases, infection"
491,758,-1,冠状病毒,2020-01-18,武汉 新增 四例 新型 冠状病毒 肺炎 病例 又 增加 了 四例 吗 大家 请 注意 完全 出门 最好 戴上 口罩,2020-01-18 13:46:00,0,3,1,__label__negative,1e-05,1.00001,0.00713,1.00001,2.0,"武汉, 新增, 四例, 病例, 口罩","Wuhan, New, Four cases, Case, Mask"
492,759,-1,冠状病毒,2020-01-18,武汉 新增 四例 新型 冠状病毒 肺炎 病例 不是 已经 得到 控制 了 吗 怎么 又 有 新增 的 二 武汉,2020-01-18 13:44:00,0,0,2,__label__negative,1e-05,0.99907,0.00309,0.99907,2.0,"武汉, 新增, 四例, 病例, 口罩","Wuhan, New, Four cases, Case, Mask"
493,760,-1,冠状病毒,2020-01-18,武汉 新增 四例 新型 冠状病毒 肺炎 病例 其他 省份 到底 有没有 其他 省份 是 装死 呢 还是 技术 不够 检测 不出,2020-01-18 13:44:00,0,0,24,__label__negative,1e-05,0.97839,0.0716,0.97839,2.0,"武汉, 新增, 四例, 病例, 口罩","Wuhan, New, Four cases, Case, Mask"
494,761,-1,冠状病毒,2020-01-18,新型 冠状病毒 医生 只能 这样 接诊 了,2020-01-18 13:44:00,0,0,0,__label__neutral,0.00129,0.06189,0.93813,0.93813,0.0,"武汉, 防护, 视频, 微博, 新增","Wuhan, Protection, video, Weibo, New"
495,763,-1,冠状病毒,2020-01-18,用 流动 的 水流 勤洗手 避免 用手 接触 眼鼻口 处 粘膜 公共场合 佩戴 n 九 十五 之类 口罩 简易 有效 并且 许多 人 做 不到 武汉 新增 四例 新型 冠状病毒 肺炎 病例,2020-01-18 10:34:00,2,0,1,__label__negative,0.0004,0.99826,0.01641,0.99826,2.0,"武汉, 新增, 四例, 病例, 口罩","Wuhan, New, Four cases, Case, Mask"
496,768,-1,冠状病毒,2020-01-18,武汉 新增 四例 新型 冠状病毒 肺炎 病例 到底 传染 吗,2020-01-18 13:43:00,0,0,0,__label__negative,1e-05,1.00001,0.00507,1.00001,4.0,"病例, 武汉, 新增, 四例, 感染","Case, Wuhan, New, Four cases, infection"
497,769,-1,冠状病毒,2020-01-18,武汉 新增 四例 新型 冠状病毒 肺炎 病例 希望 能 尽快 查明 原因 找到 源头 出行 的 人 也 多 加强 防护 带 口罩 两处 世界 自然遗产 山火 中 被 毁 过半 唉 真是 极大 影响 生物 多样性,2020-01-18 13:43:00,0,0,2,__label__neutral,0.01244,0.31406,0.5000100000000001,0.5000100000000001,2.0,"武汉, 新增, 四例, 病例, 口罩","Wuhan, New, Four cases, Case, Mask"
498,771,-1,冠状病毒,2020-01-18,武汉 新增 四例 新型 冠状病毒 肺炎 病例 一只 昆虫 一个 玩具 一次 发现 一场 争执 微不足道 却 饱含 着 我们 的 快乐 梦想 和 追求 童年 是 纯真 难忘的 岁月,2020-01-18 13:42:00,0,0,0,__label__negative,0.00098,0.98832,0.06189,0.98832,4.0,"病例, 武汉, 新增, 四例, 感染","Case, Wuhan, New, Four cases, infection"
499,772,-1,冠状病毒,2020-01-18,什么 症状 谁 能 普及,2020-01-17 16:35:00,0,0,0,__label__neutral,1e-05,0.1067,0.9698,0.9698,4.0,"病例, 武汉, 新增, 四例, 感染","Case, Wuhan, New, Four cases, infection"
500,773,-1,冠状病毒,2020-01-18,武汉 新增 四例 新型 冠状病毒 肺炎 病例 山是 朴素的 因为 是 山 所以 父爱 朴实 慈祥 它 的 外表 并 不华丽 却 拥有 无比 之深 的 内涵 它 并 不像 母爱 一般 和蔼 父母 宽容 受人 推崇 但 它 同 母爱 一样 的 无私 不求 回报,2020-01-18 13:42:00,0,0,0,__label__negative,0.05034,0.8903,0.03848,0.8903,1.0,"武汉, 美国, 机场, 旅客, 病毒","Wuhan, United States, airport, Passenger, virus"
501,774,-1,冠状病毒,2020-01-18,武汉 新增 四例 新型 冠状病毒 肺炎 病例 咋 回事 啊 还 挺 吓人的 现在 出门 都 要 戴 口罩 了,2020-01-18 13:42:00,0,0,0,__label__negative,0.00759,0.85967,0.04086,0.85967,2.0,"武汉, 新增, 四例, 病例, 口罩","Wuhan, New, Four cases, Case, Mask"
502,775,-1,冠状病毒,2020-01-18,武汉 新增 四例 新型 冠状病毒 肺炎 病例 我 说 买点 口罩 怕 过年 一 流行起来 口罩 断货 我们 科 的 口罩 一直 定量供应 也 没法 薅 羊毛 问问 快递 速度 结果 告诉 我要 看 脸型 这 客服 真是 专业,2020-01-18 13:41:00,0,17,9,__label__negative,0.01407,0.97968,0.00272,0.97968,2.0,"武汉, 新增, 四例, 病例, 口罩","Wuhan, New, Four cases, Case, Mask"
503,776,-1,冠状病毒,2020-01-18,cp 武汉 新增 四例 新型 冠状病毒 肺炎 病例 治愈 出院 三例 十八日 武汉市 卫健委在 官网 发布 关于 新型 冠状病毒 感染 的 肺炎 防控 工作 情况通报 一月 十六日 治愈 出院 三例 无 新增 死亡 病例 经 专家组 综合 研判 我市 新增 四例 新型 冠状病毒 感染 的 肺炎 病例 所有 病例 病情 稳定 无 危重症 截至 目前 我市 累计 报告 新型 冠状 病 ​ ,2020-01-18 13:41:00,1,3,1,__label__positive,0.97703,0.01206,0.01002,0.97703,4.0,"病例, 武汉, 新增, 四例, 感染","Case, Wuhan, New, Four cases, infection"
504,778,-1,冠状病毒,2020-01-18,武汉 新增 四例 新型 冠状病毒 肺炎 病例 最好 的 感情 就是 两人 在 一起 互相 降得 住 正 所谓 一 物 自有 一物降 刁蛮 任性的 人 也 会 遇上 让 他们 忘记 了 耍 浑 的 人 高贵 抑或 犯贱 爱情 都 需 心甘情愿,2020-01-18 13:41:00,0,0,0,__label__negative,0.0065,0.69926,0.30076,0.69926,3.0,"武汉, 没有, 恐慌, 市场, 口罩","Wuhan, No, panic, market, Mask"
505,779,-1,冠状病毒,2020-01-18,武汉 新增 四例 新型 冠状病毒 肺炎 病例 女人爱 自己 就 会 千方万计 地 善待 自己,2020-01-18 13:40:00,0,0,0,__label__negative,0.00107,0.98832,0.00914,0.98832,4.0,"病例, 武汉, 新增, 四例, 感染","Case, Wuhan, New, Four cases, infection"
506,780,-1,冠状病毒,2020-01-18,武汉 新增 四例 新型 冠状病毒 肺炎 病例 春天里 的 一缕 阳光 和煦 地 照耀 在 我 的 身上 是 夏日 里 的 一丝 凉风 吹散 了 我 心中 的 烦热 是 秋日 里 的 一串串 硕果 指引 着 我 走向 成功 是 冬天 里 的 一把 火 温暖 着 我 那颗 冰冷 的 心 父母 的 爱 无处不在,2020-01-18 13:39:00,0,0,0,__label__negative,0.011,0.99088,0.00107,0.99088,3.0,"武汉, 没有, 恐慌, 市场, 口罩","Wuhan, No, panic, market, Mask"
507,786,-1,冠状病毒,2020-01-18,武汉 新增 四例 新型 冠状病毒 肺炎 病例 反正 您 只要 表示 担忧 害怕 扩大 焦虑 春运 造成 传播 肯定 会不轻 自来 一堆 微博 网友 骂 你 造谣 传谣 营销 号 巴拉巴 拉 所以 爱 咋 咋 吧 大家 照顾 好 自己 自求多福,2020-01-18 13:38:00,0,0,0,__label__negative,0.03211,0.8991299999999999,0.06372,0.8991299999999999,2.0,"武汉, 新增, 四例, 病例, 口罩","Wuhan, New, Four cases, Case, Mask"
508,788,-1,冠状病毒,2020-01-18,微博 直播 泰国 发现 第二例 新型 冠状病毒 肺炎 患者 一月 十七日 泰国 公共 卫生部 在 其 官网 公布 已 发现 第二例 二千 零 一十九 ncov 确诊 病例 患者 是 一名 七十四岁 中国籍 女子 这 也 是 在 中国 境外 发现 的 第三例 新型 冠状病毒 确诊 病例 目前 两名 确诊 患者 在 负 气压 隔离病房 中 接受 治疗 两人 之间 发病 并 无 相关性 ​ ,2020-01-18 13:37:00,0,2,0,__label__neutral,0.05186,0.06372,0.83549,0.83549,4.0,"病例, 武汉, 新增, 四例, 感染","Case, Wuhan, New, Four cases, infection"
509,789,-1,冠状病毒,2020-01-18,武汉 新增 四例 新型 冠状病毒 肺炎 病例 提醒 国民 注意事项 一 少 吃 野味 二 腐烂 水果 不能 吃 特别 是 库存 的 三 人群 特多 的 地方 少去 必须 去 就 必须 戴 口罩 四 不要 随地吐痰 五 发烧 感冒 咳嗽 的 即使 就医 自觉 戴 口罩 和 朋友 保持 距离 六 平时 多 吃 新鲜 蔬菜水果 多 喝 养生茶 比如 沉香 金银花 茶 等等 七 发现 ​ ,2020-01-18 13:36:00,0,1,6,__label__negative,0.00219,0.98758,0.02845,0.98758,2.0,"武汉, 新增, 四例, 病例, 口罩","Wuhan, New, Four cases, Case, Mask"
510,790,-1,冠状病毒,2020-01-18,武汉 新增 四例 新型 冠状病毒 肺炎 病例 人命关天 需要 公平 公开 纸里 总是 包 不住 🔥 的,2020-01-18 13:36:00,0,1,9,__label__negative,0.04604,0.91491,0.0065,0.91491,2.0,"武汉, 新增, 四例, 病例, 口罩","Wuhan, New, Four cases, Case, Mask"
511,791,-1,冠状病毒,2020-01-18,与 您 分享 二千 零 二十年 的 小 秘密 秘密 一 二千 零 二十年 是 闰年 全年 三百 六十六天 二月 有 二十九 天 秘密 二 即将 到来 的 农历 庚子 鼠年 也 是 闰年 有个 闰 四月 全年 共有 三百八十四 天 秘密 三 二千 零 二十年 有 五个 神奇 的 星期六 四月 四日 六月 六日 八月八 日 十月十日 十二月 十二日 秘密 四 即将 到来 的 鼠年 ​ ,2020-01-18 13:34:00,2,0,7,__label__negative,0.07371,0.72488,0.05034,0.72488,2.0,"武汉, 新增, 四例, 病例, 口罩","Wuhan, New, Four cases, Case, Mask"
512,792,-1,冠状病毒,2020-01-18,武汉 新增 四例 新型 冠状病毒 肺炎 病例 干净 简洁 的 卫生间 装饰 搭配 绿色植物 一个 较大 的 照明灯 让 房间 很 明亮,2020-01-18 13:34:00,0,0,0,__label__negative,0.0029,0.98719,0.01451,0.98719,2.0,"武汉, 新增, 四例, 病例, 口罩","Wuhan, New, Four cases, Case, Mask"
513,793,-1,冠状病毒,2020-01-18,武汉 新增 四例 新型 冠状病毒 肺炎 病例 如果 有 一天 我们 突然 发现 投身 再 大 的 事业 也 不如 把 自己 的 人生 当做 一个 事业 聆听 再 好 的 故事 也 不如 把 自己 的 人生 当做 一个 故事 我们 一定 会 动手 动笔 做 一点 有意思 的 事情,2020-01-18 13:33:00,0,0,0,__label__negative,0.0276,0.67919,0.04887,0.67919,4.0,"病例, 武汉, 新增, 四例, 感染","Case, Wuhan, New, Four cases, infection"
514,794,-1,冠状病毒,2020-01-18,武汉 新增 四例 新型 冠状病毒 肺炎 病例 我 瑟瑟 发抖 武汉 的 宝贝 们 出门 记得 戴 口罩,2020-01-18 13:33:00,0,2,2,__label__negative,1e-05,0.99808,0.04338,0.99808,2.0,"武汉, 新增, 四例, 病例, 口罩","Wuhan, New, Four cases, Case, Mask"
515,795,-1,冠状病毒,2020-01-18,武汉 新增 四例 新型 冠状病毒 肺炎 病例 ⊙ o ⊙ 哇,2020-01-18 13:32:00,0,0,0,__label__negative,1e-05,0.97632,0.03623,0.97632,4.0,"病例, 武汉, 新增, 四例, 感染","Case, Wuhan, New, Four cases, infection"
516,798,-1,冠状病毒,2020-01-18,武汉 新增 四例 新型 冠状病毒 肺炎 病例 多少 座山 的 崔嵬 也 不能 勾勒 出 您 的 伟岸 多少 个 超凡 的 岁月 也 不能 刻画出 您 面容 的 风霜 父母 多谢您 为 我 做 的 一切,2020-01-18 13:31:00,0,0,0,__label__negative,0.00045,0.99949,0.00129,0.99949,2.0,"武汉, 新增, 四例, 病例, 口罩","Wuhan, New, Four cases, Case, Mask"
517,799,-1,冠状病毒,2020-01-18,武汉 新增 四例 新型 冠状病毒 肺炎 病例 您们 是 我 生命 中 的 太阳 父母 不但 给 了 我 生命 也 指引 了 我 成长 的 方向 请 接受 我 对 您们 深深 感谢 和 炙热 的 爱,2020-01-18 13:30:00,0,0,0,__label__negative,0.00592,0.93441,0.01323,0.93441,4.0,"病例, 武汉, 新增, 四例, 感染","Case, Wuhan, New, Four cases, infection"
518,804,-1,冠状病毒,2020-01-18,台湾 发现 四宗 疑似 武汉 肺炎 病例 两例 为 武汉 直航 登机 检疫 发现 另 两例 到访 过 武汉 武汉 新型 冠状病毒 感染 的 肺炎 疫情 升温 台湾 发布 警示 从 二千 零一 十九年 十二月 三十一 号 起 针对 武汉 直航机 严格 实施 登机 检疫 目前 已有 四名 通报 个案 台湾 疾病 管制 署 副 署长 庄人祥 介绍 这 四例 里面 有 两例 是 登机 检疫 被 发觉 出来 符 ​ ,2020-01-18 13:30:00,1,1,0,__label__neutral,0.02519,0.37755,0.4922,0.4922,1.0,"武汉, 美国, 机场, 旅客, 病毒","Wuhan, United States, airport, Passenger, virus"
519,805,-1,冠状病毒,2020-01-18,武汉 新增 四例 新型 冠状病毒 肺炎 病例 害 年 后 我 都 不敢 往 武汉 跑 了 感觉 也 太 危险 惹,2020-01-18 13:29:00,0,10,1,__label__negative,1e-05,1.00001,0.0008900000000000002,1.00001,2.0,"武汉, 新增, 四例, 病例, 口罩","Wuhan, New, Four cases, Case, Mask"
520,806,-1,冠状病毒,2020-01-18,武汉 新增 四例 新型 冠状病毒 肺炎 病例 出门 戴 口罩 尽量少 去 人群 密集 场所 平安 过年 🙏,2020-01-18 13:29:00,0,0,0,__label__negative,0.0063,0.96268,0.00539,0.96268,2.0,"武汉, 新增, 四例, 病例, 口罩","Wuhan, New, Four cases, Case, Mask"
521,808,-1,冠状病毒,2020-01-18,冠状病毒 百度 百科 冠状病毒 在 系统分类 上 属 冠状病毒 科 coronaviridae 冠状病毒 属 coronavirus 冠状病毒 属 的 病毒 是 具 外套膜 envelope 的 正链 单股 rna 病毒 直径约 八十 一百二十 nm 其 遗传物质 是 所有 rna 病毒 中 最大 的 只 感染 人 鼠 猪 猫 犬 o,2020-01-18 13:26:00,0,0,0,__label__negative,0.00111,0.98361,0.03848,0.98361,3.0,"武汉, 没有, 恐慌, 市场, 口罩","Wuhan, No, panic, market, Mask"
522,809,-1,冠状病毒,2020-01-18,kok 体育 上线 武汉 新增 四例 新型 冠状病毒 肺炎 病例 c 罗 随着 c 罗 出走 皇马 连续 引援 球队 成绩 却 未 见 起色 直到 齐达内 回归 皇马 仍然 是 原班人马 只是 少 了 进球 的 c 罗 近日 关于 为何 弗洛伦蒂 诺 拒绝 续约 c 罗 的 原因 再次 成为 议论 的 焦点 其实 近日 弗洛伦蒂 诺 的 一 举动 给出 了 答案 前几日 弗洛伦蒂 诺 公开 ​ ,2020-01-18 13:26:00,0,0,0,__label__negative,0.04744,0.81288,0.02845,0.81288,4.0,"病例, 武汉, 新增, 四例, 感染","Case, Wuhan, New, Four cases, infection"
523,810,-1,冠状病毒,2020-01-18,武汉 新增 四例 新型 冠状病毒 肺炎 病例 赶上 过年 希望 大家 都 平平安安 的,2020-01-18 13:24:00,0,0,3,__label__negative,0.00084,0.9951,0.03211,0.9951,2.0,"武汉, 新增, 四例, 病例, 口罩","Wuhan, New, Four cases, Case, Mask"
524,811,-1,冠状病毒,2020-01-18,泰国 发现 第二例 武汉 新型 冠状病毒 肺炎 患者 大家 出门 务必 戴 口罩,2020-01-17 16:35:00,0,0,0,__label__neutral,0.12253,0.08271,0.4688,0.4688,4.0,"病例, 武汉, 新增, 四例, 感染","Case, Wuhan, New, Four cases, infection"
525,812,-1,冠状病毒,2020-01-18,武汉 新增 四例 新型 冠状病毒 肺炎 病例 美好 时刻 使 我 无法 忘怀 我 一定 会 好好 丰富 我 的 童年 让 童年 的 相册 一张 接 一张 开启 我 美好的 人生,2020-01-18 13:21:00,0,0,0,__label__negative,0.00066,0.9906,0.01002,0.9906,2.0,"武汉, 新增, 四例, 病例, 口罩","Wuhan, New, Four cases, Case, Mask"
526,814,-1,冠状病毒,2020-01-18,武汉 新增 四例 新型 冠状病毒 肺炎 病例 希望 大家 都 能 平平安安 的 回家 过年 在外 做好 预防 防护 措施 不到 人群 密集 场所 出门 多带 口罩 多 开窗 通风 不吃 野生动物 打喷嚏 一定 注意 遮掩 口 鼻,2020-01-18 13:21:00,0,0,1,__label__negative,0.06756000000000001,0.6723399999999999,0.10376,0.6723399999999999,2.0,"武汉, 新增, 四例, 病例, 口罩","Wuhan, New, Four cases, Case, Mask"
527,816,-1,冠状病毒,2020-01-18,武汉 新增 四例 新型 冠状病毒 肺炎 病例 浴室 顶部 置顶 的 淋浴 从 方形 柱子 的 小孔 中 放出 水 泡澡 让 人 感叹 设计者 的 创意 浴池 边 的 扶手 方便 抓 扶 避免 了 滑倒,2020-01-18 13:20:00,0,0,0,__label__negative,0.0223,0.93441,0.01283,0.93441,2.0,"武汉, 新增, 四例, 病例, 口罩","Wuhan, New, Four cases, Case, Mask"
528,822,-1,冠状病毒,2020-01-18,帝国 理工学院 研究者 对 武汉 冠状病毒 疫情 的 预估,2020-01-18 13:20:00,2,1,0,__label__neutral,0.0117,0.00114,0.98796,0.98796,0.0,"武汉, 防护, 视频, 微博, 新增","Wuhan, Protection, video, Weibo, New"
529,823,-1,冠状病毒,2020-01-18,武汉 新增 四例 新型 冠状病毒 肺炎 病例 我 他妈 好 慌 啊 飞速 滚去 买 口罩,2020-01-18 13:20:00,0,4,1,__label__negative,1e-05,0.99693,0.04086,0.99693,2.0,"武汉, 新增, 四例, 病例, 口罩","Wuhan, New, Four cases, Case, Mask"
530,824,-1,冠状病毒,2020-01-18,这个 时点 给 首页 推荐 本超棒 科普读物 卡尔 齐默 的 病毒 星球 好 的 科普读物 真的 是 艺术品 篇幅 非常 短 但是 故事 讲得 引人入胜 提出 的 很多 思考 也 挺 妙 的 作为 一个 rna 派读 得 很 嗨 如果 你 熟悉 现代 生物学 那 一套 遗传物质 相关 概念 大概 一个 小时 出头 就 能 读完 不大 熟悉 的话 我 相信 一个 下午 也 能 轻松 愉 ​ ,2020-01-18 13:20:00,6,1,11,__label__negative,0.0237,0.96268,0.00914,0.96268,3.0,"武汉, 没有, 恐慌, 市场, 口罩","Wuhan, No, panic, market, Mask"
531,825,-1,冠状病毒,2020-01-18,武汉 新增 四例 新型 冠状病毒 感染 的 肺炎 病例 一月 十八日 更新 武汉 新增 四例 二千 零 二十年 一月 十六日 省 市 专家 依据 患者 的 临床表现 流行病学 史 以及 利用 国家 刚 下发 的 诊断 试剂盒 检测 出 的 结果 新 认定 新型 冠状病毒 感染 的 肺炎 病例 四例 四名 患者 均 为 男性 于 二千 零 二十年 一月 五日 至 八日 期间 发病 一月 八日 至 十三日 入院 治疗 ​ ,2020-01-18 13:19:00,1,0,0,__label__neutral,0.00477,0.06372,0.96591,0.96591,4.0,"病例, 武汉, 新增, 四例, 感染","Case, Wuhan, New, Four cases, infection"
532,826,-1,冠状病毒,2020-01-18,日本 确认 首例 新型 冠状病毒 病例 患者 曾 前往 武汉 l 世间 百态 擂台 的 微博 视频,2020-01-18 13:19:00,0,0,0,__label__neutral,0.32768,0.01592,0.37755,0.37755,4.0,"病例, 武汉, 新增, 四例, 感染","Case, Wuhan, New, Four cases, infection"
533,827,-1,冠状病毒,2020-01-18,动画 科普 冠状病毒 做好 日常 防护 措施 不必 惊慌 武汉 新增 四例 新型 冠状病毒 肺炎 病例 冠状病毒 是 什么 有 什么 特点 新型 病毒 传人 吗 在 流感 高发 季 我们 应该 如何 预防 被 感染 ln 视频 的 微博 视频,2020-01-18 13:17:00,10,5,21,__label__positive,0.34159,0.11281,0.18244,0.34159,0.0,"武汉, 防护, 视频, 微博, 新增","Wuhan, Protection, video, Weibo, New"
534,828,-1,冠状病毒,2020-01-18,他们 会 不会 走 到 一起 昊天 念薇 那个 秦洛会 不会 成为 自己 的 便宜 父亲 　 　 洛 泰国 发现 一例 新型 冠状病毒 病例,2020-01-18 13:17:00,0,0,0,__label__negative,1e-05,0.9363,0.5078199999999999,0.9363,4.0,"病例, 武汉, 新增, 四例, 感染","Case, Wuhan, New, Four cases, infection"
535,829,-1,冠状病毒,2020-01-18,武汉 新增 四例 新型 冠状病毒 肺炎 病例 今天 武汉市 卫健委 发布 关于 新型 冠状病毒 感染 的 肺炎 情况通报 称 十六日 零 二十四时 治愈 出院 三例 无 新增 死亡 病例 经 专家组 综合 研判 武汉市 新增 四例 新型 冠状病毒 感染 的 肺炎 病例 目前 已 安排 转院 救治 所有 病例 病情 稳定 截至 目前 武汉市 累计 报告 新型 冠状病毒 感 ​ ,2020-01-18 13:16:00,0,0,0,__label__positive,0.77185,0.06561,0.01002,0.77185,4.0,"病例, 武汉, 新增, 四例, 感染","Case, Wuhan, New, Four cases, infection"
536,830,-1,冠状病毒,2020-01-18,武汉 新增 四例 新型 冠状病毒 肺炎 病例 女人 不要 和 他 动手 第一 你动 不过 他 第二 和 你 动手 的 他 一定 是 个 疯子 所以 不如 不动,2020-01-18 13:16:00,0,0,0,__label__negative,0.00507,0.83549,0.09809,0.83549,2.0,"武汉, 新增, 四例, 病例, 口罩","Wuhan, New, Four cases, Case, Mask"
537,831,-1,冠状病毒,2020-01-18,武汉 新增 四例 新型 冠状病毒 肺炎 病例 肚量 多大 事业 就 有 多 大 要 空出 所有 才能 建设 一切 从 管理 上 来说 我们 的 心能 包容 多大 就 可以 领导 多少 人,2020-01-18 13:14:00,0,0,0,__label__negative,0.0117,0.98758,0.00104,0.98758,3.0,"武汉, 没有, 恐慌, 市场, 口罩","Wuhan, No, panic, market, Mask"
