,id,label,keyword,date,content,time,forward,comment,like,predict,__label__positive,__label__negative,__label__neutral,predict_score,topic,topic_keyword,topic_keyword_en
154,775,__label__negative,新冠,2020-02-20,扩 急求 o 型 血 康复者 血浆 求助 武大 资环 学院 赵玉华 教授 不幸 罹患 新冠 其 全家 感染 爱人 已 不幸 离世 目前 在 中南 医院 icu 抢救 急需 o 型 血 康复者 捐献 血浆 救命,2020-02-20 21:25:00,0,0,0,__label__negative,1e-05,0.99332,0.00219,0.99332,3.0,"o, 血浆, 不幸, 康复者, 型","o, plasma, unfortunately, Rehabilitation person, type"
155,784,__label__positive,新冠,2020-02-20,我 在 看 全国 第一例 第二例 由 遗体 解剖 获得 的 新冠 肺炎 病理 今日 被 送检 跟 新浪 看 热点 o 全国 第一例 第二例 由 遗体 解剖 获得 的 新冠 肺炎 病理 今日 被 送检,2020-02-20 22:52:00,0,0,0,__label__positive,0.99946,1e-05,0.00151,0.99946,3.0,"o, 血浆, 不幸, 康复者, 型","o, plasma, unfortunately, Rehabilitation person, type"
156,785,__label__negative,新冠,2020-02-20,道 说 我 插 hujn 一千二百 三十四 手侯府 的 事情 了 前 些 日子 求 我 让 侯府 恢复 国 公爵 位时 怎么 没见 你们 说 我 不能 插手 侯府 的 事 早 知道 在家 待 这么久 全国 新增 二千 零九例 新冠 肺炎,2020-02-20 22:52:00,0,0,0,__label__negative,0.02097,0.91491,0.00556,0.91491,4.0,"防控, 李兰娟, 二十日, 确诊, 患者","Prevention and control, Li Lanjuan, 20th, Confirmed diagnosis, patient"
157,789,__label__negative,新冠,2020-02-20,老药 磷酸 氯喹 对 新冠 肺炎 有 很好的 疗效 来个 课代,2020-02-20 20:32:00,0,0,0,__label__positive,0.92842,0.03211,0.00611,0.92842,2.0,"韩国, 病例, 死亡, 二十, 感染","Korea, Case, death, twenty, infection"
158,795,__label__negative,新冠,2020-02-20,看 标题 就 知道 是 s 蛋白 所有 冠状病毒 的 靶点 都 是 s 蛋白 so whateve,2020-02-20 21:40:00,0,0,0,__label__negative,1e-05,1.00001,0.00092,1.00001,2.0,"韩国, 病例, 死亡, 二十, 感染","Korea, Case, death, twenty, infection"
159,804,__label__positive,新冠,2020-02-20,新型 冠状病毒 感染 肺炎 宣誓 出发 二十日 福建省 第十一 批 支援 抗击 新冠 肺炎 疫情 医疗队 共 一百七十 二人 从 福州 出发 驰援 武汉 截至 二月 二十日 福建省 共 派出 支援 工作人员 一千 三百八十四 名 福建 战疫,2020-02-20 20:59:00,0,0,1,__label__positive,0.99332,0.05666,1e-05,0.99332,3.0,"o, 血浆, 不幸, 康复者, 型","o, plasma, unfortunately, Rehabilitation person, type"
160,806,__label__positive,新冠,2020-02-20,武汉市 公布 非新冠 肺炎 特殊 患者 医疗 救治 医院 名单 o 武汉市 公布 非新冠 肺炎 特殊 患者 医疗 救治 医院 名单,2020-02-20 22:51:00,0,0,0,__label__negative,0.2451,0.5775100000000001,1e-05,0.5775100000000001,0.0,"医院, 患者, 武汉市, 特殊, 救治","hospital, patient, Wuhan, special, Cure"
161,811,__label__negative,新冠,2020-02-20,截至 二月 十九日 二十四时 河南省 新冠 肺炎 疫情 最新 情况 o 截至 二月 十九日 二十四时 河南省 新冠 肺炎 疫情 最新 情况,2020-02-20 22:51:00,0,0,0,__label__negative,0.004079999999999999,0.99904,1e-05,0.99904,0.0,"医院, 患者, 武汉市, 特殊, 救治","hospital, patient, Wuhan, special, Cure"
162,817,__label__positive,新冠,2020-02-20,北京市 新冠 肺炎 疫情 防控 工作 领导小组 召开 第二十七次 和 第二十八 次 会议 o 北京市 新冠 肺炎 疫情 防控 工作 领导小组 召开 第二十七次 和 第二十八 次 会议,2020-02-20 22:51:00,0,0,0,__label__positive,0.91491,0.07808999999999999,0.00328,0.91491,4.0,"防控, 李兰娟, 二十日, 确诊, 患者","Prevention and control, Li Lanjuan, 20th, Confirmed diagnosis, patient"
163,823,__label__positive,新冠,2020-02-20,李兰娟 脸上 的 压痕 李兰娟 重症 icu 查房 二十日 中国工程院 院士 国家 卫健委 高级别 专家 组成员 李兰娟 走进 武汉大学 人民 医院 东 院区 icu 病房 问诊 新冠 肺炎 危重症 患者 为 鼓励 士气 她 让 助手 在 防护服 写 上 加油 当 她 脱下 防护服 脸上 压痕 清晰可见 网友 李 奶奶 辛苦 了,2020-02-20 22:51:00,0,0,0,__label__positive,0.97242,0.0237,0.00339,0.97242,4.0,"防控, 李兰娟, 二十日, 确诊, 患者","Prevention and control, Li Lanjuan, 20th, Confirmed diagnosis, patient"
164,837,__label__positive,新冠,2020-02-20,黄冈 新鲜事 李宇春 玉米 爱心 基金 捐赠 的 负压 救护车 今日 抵达 黄冈 二月 二十日 上午 由 玉米 爱心 基金 捐赠 的 负压 救护车 已 顺利 抵达 黄冈市 第三 人民 医院 黄州区 人民 医院 正式 投入 新冠 肺炎 患者 转运 工作 负压 救护车 利用 技术手段 使车 内 气压 低于 外界 大气压 气流 只由车 外向 车 内 流动 同时 车内 的 空气 进行 无害 ​ ,2020-02-20 22:51:00,0,0,0,__label__positive,1.00001,1e-05,0.00147,1.00001,3.0,"o, 血浆, 不幸, 康复者, 型","o, plasma, unfortunately, Rehabilitation person, type"
165,845,__label__negative,新冠,2020-02-20,扩 急求 o 型 血 康复者 血浆 求助 武大 资环 学院 赵玉华 教授 不幸 罹患 新冠 其 全家 感染 爱人 已 不幸 离世 目前 在 中南 医院 icu 抢救 急需 o 型 血 康复者 捐献 血浆 救命,2020-02-20 21:25:00,0,0,0,__label__negative,1e-05,0.99332,0.00219,0.99332,3.0,"o, 血浆, 不幸, 康复者, 型","o, plasma, unfortunately, Rehabilitation person, type"
166,847,__label__negative,新冠,2020-02-20,扩 急求 o 型 血 康复者 血浆 求助 武大 资环 学院 赵玉华 教授 不幸 罹患 新冠 其 全家 感染 爱人 已 不幸 离世 目前 在 中南 医院 icu 抢救 急需 o 型 血 康复者 捐献 血浆 救命,2020-02-20 21:25:00,0,0,0,__label__negative,1e-05,0.99332,0.00219,0.99332,3.0,"o, 血浆, 不幸, 康复者, 型","o, plasma, unfortunately, Rehabilitation person, type"
167,850,__label__negative,新冠,2020-02-20,刘智明 白衣战士 英雄 院长 二月 十八日 上午 十 时 五十八 分 一个 在 新冠 病毒 疫情 一线 不懈 抗争 的 白衣战士 停止 了 心跳 他 就是 武汉市 武昌 医院院长 刘智明 疫情 发生 以来 他 带领 全院 医务人员 奋战 在 抗击 疫情 的 最 前线 即使 在 不幸 感染 新冠 肺炎 之后 他 依然 在 病房 内 从早到晚 不停 地 处理 各种 工作 直到 生命 的 最后 一刻 ​ ,2020-02-20 22:51:00,0,0,1,__label__negative,0.23372,0.23936,0.02597,0.23936,2.0,"韩国, 病例, 死亡, 二十, 感染","Korea, Case, death, twenty, infection"
168,856,__label__negative,新冠,2020-02-20,再 转 本人 患 乳腺癌 已 做 完 手术 和 四期 化疗 本应于 一月 三十日 第五期 化疗 但 因 疫情 中断 原 就诊 的 武汉市 中心医院 是 新冠 定点医院 无法 对 患者 化疗 目前 情况 非常 严重 请 有 化疗 条件 的 医院 进行 收治,2020-02-20 10:25:00,0,0,0,__label__negative,0.02677,0.94968,0.00556,0.94968,0.0,"医院, 患者, 武汉市, 特殊, 救治","hospital, patient, Wuhan, special, Cure"
169,859,__label__negative,新冠,2020-02-20,中方 紧急 向 日本 捐赠 一批 新冠 肺炎 核酸 检测 试剂盒 有没有 写 几句 诗 鼓励 他们 一下,2020-02-20 22:51:00,2,28,65,__label__negative,0.03115,0.97968,1e-05,0.97968,4.0,"防控, 李兰娟, 二十日, 确诊, 患者","Prevention and control, Li Lanjuan, 20th, Confirmed diagnosis, patient"
170,876,__label__negative,新冠,2020-02-20,这 一辈子 没白,2020-02-20 15:33:00,0,0,0,__label__negative,0.01206,0.87749,1e-05,0.87749,3.0,"o, 血浆, 不幸, 康复者, 型","o, plasma, unfortunately, Rehabilitation person, type"
171,880,__label__positive,新冠,2020-02-20,相信 武汉 湖北 加油 武汉 挺住 一图 读懂 新型 冠状病毒 肺炎 诊疗 方案 试行 第六版 二千 零 二十年 二月 十九日 国家 卫生 健康 委员会 发布 了 新型 冠状病毒 肺炎 诊疗 方案 试行 第六版 相比 于 此前 的 版本 新版 的 诊疗 方案 中 增加 了 新冠 病毒 的 传播 途径 在 某些 情况 下 存在 经 气溶胶 传播 的 可能 取消 湖北省 ​ ,2020-02-20 22:50:00,0,0,0,__label__positive,0.99116,0.0036,0.01323,0.99116,1.0,"病人, 工作, 护士, 医院, 出院","patient, jobs, nurse, hospital, Discharged"
172,888,__label__neutral,新冠,2020-02-20,日本 某些 官员 真的 sb 没话 讲 新冠 肺炎 已 开始 在 日本 流行,2020-02-20 22:50:00,0,0,1,__label__negative,0.00759,0.7773100000000001,0.14035,0.7773100000000001,1.0,"病人, 工作, 护士, 医院, 出院","patient, jobs, nurse, hospital, Discharged"
173,889,__label__positive,新冠,2020-02-20,陕西 防控 新冠 肺炎 最新 安康 汉滨区 调整 为 疫情 中 风险 县 区 陕西 现有 中 风险 地区 三十个 今天 二月 二十日 下午 陕西省 新型 冠状病毒 感染 的 肺炎 疫情 防控 工作 情况 第十五 场 新闻 发布会 举行 西部 网 陕西 头条 记者 从 会上 获悉 按照 关于 科学 防治 精准 施策 分区 分级 做好 新冠 肺炎 疫情 防控 工作 的 指导 意见 ​ ,2020-02-20 22:50:00,0,0,2,__label__positive,0.83549,0.00713,0.20182,0.83549,1.0,"病人, 工作, 护士, 医院, 出院","patient, jobs, nurse, hospital, Discharged"
174,901,__label__positive,新冠,2020-02-20,不得不 承认 美国 在 有些 方面 确实 是 一 流水,2020-02-20 21:40:00,0,0,0,__label__neutral,1e-05,0.12253,0.98505,0.98505,1.0,"病人, 工作, 护士, 医院, 出院","patient, jobs, nurse, hospital, Discharged"
175,903,__label__negative,新冠,2020-02-20,周一 上班 情况 深圳 地铁 咪头 微讯社 新型 冠状病毒 新冠 肺炎 二 omvzb 二十,2020-02-20 22:50:00,0,0,0,__label__negative,0.01134,0.99525,0.00045,0.99525,2.0,"韩国, 病例, 死亡, 二十, 感染","Korea, Case, death, twenty, infection"
176,906,__label__negative,新冠,2020-02-20,中国科协 网 策划 组织 编辑 科协 人战 疫 时刻 系列 文章 深入 挖掘 科协 一体 两翼 广大干部 职工 坚守阵地 发挥优势 为 抗击 疫情 做 贡献 的 典型 人 典型 事 集中反映 科协 人 在 中国科协 党组 带领 下 奋战 抗击 新冠 病毒 战役 一线 舍小家 顾 大家 的 顽强拼搏 和 奋斗 精神 为 坚决 打赢 疫情 防控 的 人民战争 凝聚 继续 前行 ​ ,2020-02-20 22:50:00,0,0,0,__label__positive,0.69926,0.13662,0.0237,0.69926,3.0,"o, 血浆, 不幸, 康复者, 型","o, plasma, unfortunately, Rehabilitation person, type"
177,912,__label__positive,新冠,2020-02-20,我 在 看 新冠 肺炎 康复者 捐献 血浆 享 无偿献血 待遇 跟 新浪 看 热点 o 新冠 肺炎 康复者 捐献 血浆 享 无偿献血 待遇,2020-02-20 22:50:00,0,0,0,__label__positive,0.9954,0.00074,1e-05,0.9954,3.0,"o, 血浆, 不幸, 康复者, 型","o, plasma, unfortunately, Rehabilitation person, type"
178,919,__label__positive,新冠,2020-02-20,广东省 内 机关 企业 及 工厂 节后 复工 防控 新冠 肺炎 工作 指引 o 广东省 内 机关 企业 及 工厂 节后 复工 防控 新冠 肺炎 工作 指引,2020-02-20 22:50:00,0,0,0,__label__positive,0.7931199999999999,0.04604,0.00281,0.7931199999999999,0.0,"医院, 患者, 武汉市, 特殊, 救治","hospital, patient, Wuhan, special, Cure"
179,922,__label__positive,新冠,2020-02-20,共同 战疫 疫情 防控 甘肃 在 行动 疫情 增长 态势 放缓 甘肃省 将 有序 推进 复工 复产 二月 二十日 记者 从 省政府 新闻办 召开 的 新闻 发布会 上 获悉 截至 二月 十九日 二十四时 我省 累计 报告 新冠 肺炎 确诊 病例 九十 一例 累计 治愈 出院 六十五 例 死亡 二例 正在 治疗 二十四 例 二 lwxig 二十 前 我省 疫情 增长 态势 放缓 新增 病例 呈现 下降 趋势 ​ ,2020-02-20 22:50:00,0,0,0,__label__positive,0.30076,0.16028,0.04744,0.30076,1.0,"病人, 工作, 护士, 医院, 出院","patient, jobs, nurse, hospital, Discharged"
180,924,__label__negative,新冠,2020-02-20,新冠 病毒 下 众生相 确诊 老师 在 武汉 方舱 医院 直播 开课 其实 真的 没什么 我 就是 做 了 一个 老师 该 做 的 事情 杜荣 是 一名 英语老师 她 还是 一名 新冠 肺炎 确诊 患者 已经 在 武汉 方舱 医院 上 了 一周 的 钉 钉 直播 课 虽然 在 医院 可 心里 放不下 学生 希望 老师 能 安心 养病 不要 太 牵挂 学生 学生 们 都 会 等 她 健康 归 ​ ,2020-02-20 22:50:00,0,2,0,__label__positive,0.78794,0.21735,0.00206,0.78794,0.0,"医院, 患者, 武汉市, 特殊, 救治","hospital, patient, Wuhan, special, Cure"
181,930,__label__positive,新冠,2020-02-20,上饶 同 城 上饶 身边 事 全力 打响 重大项目 复工 攻坚战 上饶 积极 推进 重大项目 全面 开 复工 市城 投 集团 作为 我市 城市 建设 重要 平台 之一 重点 按照 成熟 一个 开工 一个 的 要求 实行 阶段 化 复工 由 各 子公司 牵头 明确 了 一名 信息员 负责 对 各 项目 工地 人员 进行 摸排 对 摸排 人员 信息 实行 每日 一 报送 ​ ,2020-02-20 22:50:00,0,0,0,__label__positive,0.93047,0.18244,0.0013800000000000002,0.93047,4.0,"防控, 李兰娟, 二十日, 确诊, 患者","Prevention and control, Li Lanjuan, 20th, Confirmed diagnosis, patient"
182,938,__label__positive,新冠,2020-02-20,赤峰市 检察机关 发布 妨害 新冠 肺炎 疫情 防控 犯罪 典型 案例 新冠 肺炎 疫情 发生 以来 赤峰市 检察机关 贯彻落实 党中央 高检院 自治区 院 和 市委 决策 部署 在 介入 侦查 引导 取证 审查逮捕 审查起诉 各个环节 积极主动 履行 检察 职能 对 涉疫 犯罪 快 捕快 诉 依法严惩 确保 办案 与 防疫 两不误 为 疫情 防控 工作 提供 有力 ​ ,2020-02-20 22:49:00,4,0,0,__label__positive,0.99966,0.00147,0.00147,0.99966,1.0,"病人, 工作, 护士, 医院, 出院","patient, jobs, nurse, hospital, Discharged"
183,942,__label__negative,新冠,2020-02-20,自新冠 肺炎 起 至今 自己 已 禁足 二十八 天 了 今天 全国 确诊 病例 七万 四千 六 百八十 人 死亡 二千 一百二十 二人 虽然 这 几天 病例 看似 在 逐日 在 减少 但 自己 心里 总 感觉 疫情 离 我们 越来越近 了 复兴 医院 人民 医院 已有 多人 被 染病 实属无奈 的 老爸 还 得 继续 在 复兴 医院 透析 只能 是 防护 防护 再 防护 了 借此 小画 来 平抚 自己 不平静的 心,2020-02-20 22:49:00,0,1,2,__label__negative,0.02034,0.7931199999999999,0.06372,0.7931199999999999,0.0,"医院, 患者, 武汉市, 特殊, 救治","hospital, patient, Wuhan, special, Cure"
184,947,__label__positive,新冠,2020-02-20,联防 联控 江西 在 行动 好消息 武汉 洪山 方舱 医院 又 有 四十八 位 患者 痊愈 出院 江西 治愈 十九人 武汉 洪山 方舱 医院 传来 好消息 今天 四十八 名新冠 肺炎 患者 康复 出院 是 出院 人 数最多 的 一次 其中 包括 南昌大学 第二 附属 医院 和 第四 附属 医院 在内 的 江西 支援 武汉 医疗队 负责的 c 区 就 有 十九 名 患者 出院 赣州 战疫 ​ ,2020-02-20 22:49:00,1,0,8,__label__positive,0.99594,0.02299,1e-05,0.99594,1.0,"病人, 工作, 护士, 医院, 出院","patient, jobs, nurse, hospital, Discharged"
185,949,__label__negative,新冠,2020-02-20,还是 要 老生常谈 一下 疫情 的 数字 的确 稳些 了 但 新冠 它 可 还 没走 呢 之前 形势 比较 严峻 时 的 防护 我 还是 建议 暂时 一样 都 不要 减 包括 减少 外出 和 接触 包括 非必要 情况 下 减少 就医 一人 潜伏 全屋 团灭 这种 事情 最近 大家 也 都 见 过 报道 了 对于 北京 这种 超大 城市 返 工潮 院感 这 两样 大考 最终 成绩 有 多 ​ ,2020-02-20 22:49:00,32,48,91,__label__negative,0.06955,0.6076699999999999,0.05186,0.6076699999999999,2.0,"韩国, 病例, 死亡, 二十, 感染","Korea, Case, death, twenty, infection"
186,956,__label__neutral,新冠,2020-02-20,辟谣 网传 胡场 精神病院 患者 全部 感染 等 信息 纯属 谣言 辟谣 仙桃市 卫生 健康 委员会 今天 二月 二十日 发布 信息 网传 胡场 精神病院 患者 全部 感染 不属实 系 谣言 具体 如下 　 　 近日 网传 胡场 精神病院 患者 全部 感染 胡场 精神病院 确诊 病人 跑出去 了 等 信息 不属实 系 谣言 胡场 精神病 医院 ​ ,2020-02-20 22:49:00,16,24,140,__label__positive,0.37024,0.18244,0.03623,0.37024,3.0,"o, 血浆, 不幸, 康复者, 型","o, plasma, unfortunately, Rehabilitation person, type"
187,963,__label__positive,新冠,2020-02-20,返 来 绥 人士 你 的 隔离 事关 全城 安危 春节假期 过后 特别 是 最近 一个 时期 大批 在 外地 的 人员 从 全国 各地 返回 或 来到 绥芬河 或 准备 复工 复业 或 准备 投资 兴业 或 为了 孩子 上学 做 准备 为此 欢迎 回家 但 有 一条 硬杠 必须 严格 隔离 十四天 绥芬河 是 个 移民城市 以 宽广 的 胸怀 接纳 全国 各地 人士 来 ​ ,2020-02-20 22:48:00,0,0,0,__label__positive,0.69265,0.37024,0.01066,0.69265,2.0,"韩国, 病例, 死亡, 二十, 感染","Korea, Case, death, twenty, infection"
188,974,__label__negative,新冠,2020-02-20,关于 瑞德 西韦 对 新冠 肺炎 患者 产生 奇效 的 消息 们 该 怎样 理解 二月 八日 一位 自称 入住 武汉 金银 潭 医院 的 患者 发出 一个 消息 美国 那个 新药 瑞德 西韦 真的 牛 看着 同 病房 的 重症 吃 了 一天 肉眼 可见 的 好转 现在 精神 地 坐 着 跟 我 聊天 引起 很多 转发 和 评论 二 kzbyk 二十 十七个 小时 就 从 icu 状态 恢复 了 九十六 的 肺功 ​ ,2020-02-20 22:48:00,0,0,0,__label__negative,0.19684,0.23372,0.02519,0.23372,0.0,"医院, 患者, 武汉市, 特殊, 救治","hospital, patient, Wuhan, special, Cure"
189,977,__label__positive,新冠,2020-02-20,关注 新冠 肺炎 记者 连线 援助 湖北 医疗队 护士 每天 都 要 采集 咽 拭子 与 病毒 面对面 昨天 是 我市 第二批 援助 湖北 医疗队 抵达 武汉 援助 东西 湖 方舱 医院 的 第十一天 在 医疗队 有 一项 重要的 工作 是 为 病人 采集 咽 拭子 这是 进行 核酸 检测 判断 患者 是否 感染 新冠 病毒 的 重要 一步 也 是 一项 高危 工作 昨天上午 记 ​ ,2020-02-20 22:48:00,0,2,4,__label__positive,0.9903,0.05034,1e-05,0.9903,1.0,"病人, 工作, 护士, 医院, 出院","patient, jobs, nurse, hospital, Discharged"
190,980,__label__negative,新冠,2020-02-20,一线 日记 我 虽然 是 个 孤儿 但 从未 被 抛弃 新乡 医学院 第一 附属 医院 胡炳倩 二月 十九日 今天 是 我 驰援 武汉 的 第二十五 天 今天 很 高兴 因为 在 隔离病房 我 分管 的 一位 特殊 患者 出院 二月 十七日 在 得知 快要 出院 的 时候 这位 患者 给 我们 写 了 一封 感谢信 感谢 河南 医疗队 对 他 的 精心 照顾 这名 患者 从小 ​ ,2020-02-20 22:48:00,0,0,1,__label__positive,0.7931199999999999,0.20182,0.0014199999999999998,0.7931199999999999,1.0,"病人, 工作, 护士, 医院, 出院","patient, jobs, nurse, hospital, Discharged"
191,982,__label__negative,新冠,2020-02-20,今年 绝对 是 工作 以来 第一次 遇到 的 非 个人 原因 放 了 一个多月 假的 虽然 是因为 新冠 病毒 疫情 带来 的 长假 不能 说 是 高兴的 事 但 确实 很 难得 一遇 的 休息 在家 长长 久久 的 陪伴 在 父母 身边 做做 家务 聊聊天 我 想 大家 都 在 关心 疫情 可能 没有 意识 到 这 是 多么 难得 的 机会 可以 和 家人 如此 长时间 的 亲密 相处 一旦 返工 了 ​ ,2020-02-20 22:48:00,0,0,1,__label__negative,0.00556,0.99143,0.00691,0.99143,1.0,"病人, 工作, 护士, 医院, 出院","patient, jobs, nurse, hospital, Discharged"
192,983,__label__negative,新冠,2020-02-20,今年 绝对 是 工作 以来 第一次 遇到 的 非 个人 原因 放 了 一个多月 假的 虽然 是因为 新冠 病毒 疫情 带来 的 长假 不能 说 是 高兴的 事 但 确实 很 难得 一遇 的 休息 在家 长长 久久 的 陪伴 在 父母 身边 做做 家务 聊聊天 我 想 大家 都 在 关心 疫情 可能 没有 意识 到 这 是 多么 难得 的 机会 可以 和 家人 如此 长时间 的 亲密 相处 一旦 返工 了 ​ ,2020-02-20 22:48:00,0,0,1,__label__negative,0.00556,0.99143,0.00691,0.99143,1.0,"病人, 工作, 护士, 医院, 出院","patient, jobs, nurse, hospital, Discharged"
