,id,label,keyword,date,content,time,forward,comment,like,predict,__label__positive,__label__negative,__label__neutral,predict_score,topic,topic_keyword,topic_keyword_en
124,186,-1,冠状病毒,2020-01-17,回复 确实 武汉 人 人均 你 爹 不喷 你 都 对不起 你 这 逼 崽子 回复 别 说实话 会 被 武汉 人 喷,2020-01-17 16:35:00,0,0,0,__label__neutral,0.00328,0.14415999999999998,0.8222,0.8222,3.0,"武汉, 口罩, 发现, 患者, 泰国","Wuhan, Mask, Find, patient, Thailand"
125,187,-1,冠状病毒,2020-01-17,挺 严重的 看 起,2020-01-17 16:35:00,0,0,0,__label__negative,0.0006,0.27514,0.03115,0.27514,0.0,"武汉, 发现, 泰国, 患者, 第二例","Wuhan, Find, Thailand, patient, Second case"
126,188,-1,冠状病毒,2020-01-17,我 觉得 吧 无论 我们 在 哪里 都 得 注意 点 即使 没有 这个 冠状病毒 还有 流感,2020-01-17 16:35:00,0,1,0,__label__negative,0.00079,0.93992,0.09536,0.93992,3.0,"武汉, 口罩, 发现, 患者, 泰国","Wuhan, Mask, Find, patient, Thailand"
127,189,-1,冠状病毒,2020-01-17,回复 骂 政府 是 真 怕 得病 是 假 天天 啥事 也 没耽误 还 能 出来 逼 逼 两句 爱国 有罪 也 真是 闲 的 回复 楼下 有些 人 说 政府 为了 维稳 隐瞒 真相 然后 这帮 人 晚上 聚餐 的 聚餐 泡吧 的 泡吧 哪里 人多往 哪里 凑 一分钟 都 不舍得 耽搁 要 真爱 生,2020-01-17 16:35:00,0,0,0,__label__neutral,0.002,0.71224,0.76066,0.76066,3.0,"武汉, 口罩, 发现, 患者, 泰国","Wuhan, Mask, Find, patient, Thailand"
128,190,-1,冠状病毒,2020-01-17,泰国 发现 第二例 新型 冠状病毒 肺炎 患者 过年 要 去 泰国 的 我 忐忑不安,2020-01-17 21:19:00,0,0,0,__label__neutral,0.00339,0.07808999999999999,0.88081,0.88081,1.0,"泰国, 发现, 患者, 第二例, 病毒","Thailand, Find, patient, Second case, virus"
129,191,-1,冠状病毒,2020-01-17,好 吓人,2020-01-17 16:35:00,0,0,0,__label__negative,1e-05,0.99942,1e-05,0.99942,1.0,"泰国, 发现, 患者, 第二例, 病毒","Thailand, Find, patient, Second case, virus"
130,192,-1,冠状病毒,2020-01-17,泰国 发现 第二例 新型 冠状病毒 肺炎 患者 很 好奇 这个 病毒 只 出国 不出 省 的 嘛,2020-01-17 21:17:00,1,1,13,__label__neutral,0.73107,0.00048,0.94816,0.94816,2.0,"武汉, sars, 相似, o, 专家","Wuhan, sars, similar, o, expert"
131,193,-1,冠状病毒,2020-01-17,泰国 发现 第二例 武汉 新型 冠状病毒 肺炎 患者 一月 十七日 cctv 网络 春晚 泰国 公共 卫生部 在 其 官网 公布 已 发现 第二例 二千 零 一十九 ncov 确诊 病例 患者 是 一名 七十四岁 中国籍 女子 这 也 是 在 中国 境外 发现 的 第三例 新型 冠状病毒 确诊 病例 目前 两名 确诊 患者 在 负 气压 隔离 病,2020-01-17 21:15:00,0,0,0,__label__neutral,0.01244,0.10089,0.94968,0.94968,4.0,"发现, 患者, 泰国, 确诊, 第二例","Find, patient, Thailand, Confirmed diagnosis, Second case"
132,194,-1,冠状病毒,2020-01-17,腾讯 新闻 武汉 新型 冠状病毒 纪事 肥胖 人士 等 为 高危 人群 尚未 锁定 病毒 源头 o 武汉 新型 冠状病毒 纪事 肥胖 人士 等 为 高危 人群 尚未 锁定 病毒 源头,2020-01-17 21:14:00,0,0,1,__label__negative,0.19684,0.59268,0.05666,0.59268,2.0,"武汉, sars, 相似, o, 专家","Wuhan, sars, similar, o, expert"
133,195,-1,冠状病毒,2020-01-17,泰国 发现 第二例 武汉 新型 冠状病毒 肺炎 患者 一月 十七日 张子枫 艺考 分数 泰国 公共 卫生部 在 其 官网 公布 已 发现 第二例 二千 零 一十九 ncov 确诊 病例 患者 是 一名 七十四岁 中国籍 女子 这 也 是 在 中国 境外 发现 的 第三例 新型 冠状病毒 确诊 病例 目前 两名 确诊 患者 在 负 气压 隔离病房 中 接受 治疗 两人 之,2020-01-17 21:14:00,0,0,0,__label__neutral,0.03965,0.0421,0.94336,0.94336,4.0,"发现, 患者, 泰国, 确诊, 第二例","Find, patient, Thailand, Confirmed diagnosis, Second case"
134,197,-1,冠状病毒,2020-01-17,泰国 发现 第二例 武汉 新型 冠状病毒 肺炎 患者 一月 十七日 张子枫 艺考 分数 泰国 公共 卫生部 在 其 官网 公布 已 发现 第二例 二千 零 一十九 ncov 确诊 病例 患者 是 一名 七十四岁 中国籍 女子 这 也 是 在 中国 境外 发现 的 第三例 新型 冠状病毒 确诊 病例 目前 两名 确诊 患者 在 负 气压 隔离病房 中 接受,2020-01-17 21:14:00,0,0,0,__label__neutral,0.03022,0.07808999999999999,0.90193,0.90193,4.0,"发现, 患者, 泰国, 确诊, 第二例","Find, patient, Thailand, Confirmed diagnosis, Second case"
135,198,-1,冠状病毒,2020-01-17,十三日 到达 泰国 十七日 就 诊断 清楚 是 新型 冠状病毒 肺炎 什么 先进 的 技术手段,2020-01-17 20:41:00,0,1,0,__label__neutral,0.00807,0.00309,0.99783,0.99783,0.0,"武汉, 发现, 泰国, 患者, 第二例","Wuhan, Find, Thailand, patient, Second case"
136,204,-1,冠状病毒,2020-01-17,泰国 发现 第二例 武汉 新型 冠状病毒 肺炎 患者 一月 十七日 蔡徐坤 想 拜师 学 扔 纸飞机 泰国 公共 卫生部 在 其 官网 公布 已 发现 第二例 二千 零 一十九 ncov 确诊 病例 患者 是 一名 七十四岁 中国籍 女子 这 也 是 在 中国 境外 发现 的 第三例 新型 冠状病毒 确诊 病例 目前 两,2020-01-17 21:14:00,0,0,0,__label__neutral,0.00886,0.13662,0.93992,0.93992,4.0,"发现, 患者, 泰国, 确诊, 第二例","Find, patient, Thailand, Confirmed diagnosis, Second case"
137,205,-1,冠状病毒,2020-01-17,回复 真敢 说 啊 我怕 被 喷 都 不敢 这么 说 回复 可能 这 也 是 武汉 会 出现 这 病毒 的 原因,2020-01-17 16:35:00,0,0,0,__label__negative,1e-05,0.97405,0.38492,0.97405,3.0,"武汉, 口罩, 发现, 患者, 泰国","Wuhan, Mask, Find, patient, Thailand"
138,206,-1,冠状病毒,2020-01-17,泰国 发现 第二例 武汉 新型 冠状病毒 肺炎 患者 一月 十七日 醉驾 玛莎拉蒂 司机 庭审 痛哭 泰国 公共 卫生部 在 其 官网 公布 已 发现 第二例 二千 零 一十九 ncov 确诊 病例 患者 是 一名 七十四岁 中国籍 女子 这 也 是 在 中国 境外 发现 的 第三例 新型 冠状病毒 确诊 病例 目前 两名 确诊 患者 在 负 气压 隔离病房 中接,2020-01-17 21:13:00,0,0,0,__label__neutral,0.03115,0.05341,0.93992,0.93992,4.0,"发现, 患者, 泰国, 确诊, 第二例","Find, patient, Thailand, Confirmed diagnosis, Second case"
139,208,-1,冠状病毒,2020-01-17,泰国 发现 第二例 武汉 新型 冠状病毒 肺炎 患者 一月 十七日 我国 男性 比 女性 多 三千 零 四十九万 泰国 公共 卫生部 在 其 官网 公布 已 发现 第二例 二千 零 一十九 ncov 确诊 病例 患者 是 一名 七十四岁 中国籍 女子 这 也 是 在 中国 境外 发现 的 第三例 新型 冠状病毒 确诊 病例 目,2020-01-17 21:12:00,0,0,0,__label__neutral,0.01745,0.10972,0.93246,0.93246,4.0,"发现, 患者, 泰国, 确诊, 第二例","Find, patient, Thailand, Confirmed diagnosis, Second case"
140,209,-1,冠状病毒,2020-01-17,泰国 发现 第二例 武汉 新型 冠状病毒 肺炎 患者 一月 十七日 锦衣 之下 泰国 公共 卫生部 在 其 官网 公布 已 发现 第二例 二千 零 一十九 ncov 确诊 病例 患者 是 一名 七十四岁 中国籍 女子 这 也 是 在 中国 境外 发现 的 第三例 新型 冠状病毒,2020-01-17 21:11:00,0,0,1,__label__neutral,0.05341,0.04338,0.945,0.945,4.0,"发现, 患者, 泰国, 确诊, 第二例","Find, patient, Thailand, Confirmed diagnosis, Second case"
141,210,-1,冠状病毒,2020-01-17,泰国 发现 第二例 武汉 新型 冠状病毒 肺炎 患者 一月 十七日 开车 进 故宫 泰国 公共 卫生部 在 其 官网 公布 已 发现 第二例 二千 零 一十九 ncov 确诊 病例 患者 是 一名 七十四岁 中国籍 女子 这 也 是 在 中国 境外 发现 的 第三例 新型 冠状病毒 确诊 病例 目前 两名 确诊 患者 在 负 气压 隔,2020-01-17 21:11:00,0,0,0,__label__neutral,0.05341,0.03411,0.93246,0.93246,4.0,"发现, 患者, 泰国, 确诊, 第二例","Find, patient, Thailand, Confirmed diagnosis, Second case"
142,211,-1,冠状病毒,2020-01-17,回复 都 是 海鲜 市场 那批 发病 时间 有 的 早 有 的 晚 奇怪 为什么 都 是 中国 人 泰国 发现 第二例 新型 冠状病毒 肺炎 患者 这 是 在 中国 境外 发现 的 第三例 新型 冠状病毒 确诊 病例 同样,2020-01-17 17:18:00,0,0,0,__label__neutral,0.00942,0.39982,0.62247,0.62247,4.0,"发现, 患者, 泰国, 确诊, 第二例","Find, patient, Thailand, Confirmed diagnosis, Second case"
143,212,-1,冠状病毒,2020-01-17,泰国 发现 第二例 武汉 新型 冠状病毒 肺炎 患者 一月 十七日 锦衣 之下 泰国 公共 卫生部 在 其 官网 公布 已 发现 第二例 二千 零 一十九 ncov 确诊 病例 患者 是 一名 七十四岁 中国籍 女子 这 也 是 在 中国 境外 发现 的 第三例 新型 冠状病毒 确诊 病例 目前 两名 确诊 患者 在 负 气压 隔离病房 中接,2020-01-17 21:10:00,0,0,0,__label__neutral,0.0331,0.04887,0.93441,0.93441,4.0,"发现, 患者, 泰国, 确诊, 第二例","Find, patient, Thailand, Confirmed diagnosis, Second case"
144,213,-1,冠状病毒,2020-01-17,泰国 发现 第二例 武汉 新型 冠状病毒 肺炎 患者 一月 十七日 文旅部 取消 九家 饭店 五星级 资格 泰国 公共 卫生部 在 其 官网 公布 已 发现 第二例 二千 零 一十九 ncov 确诊 病例 患者 是 一名 七十四岁 中国籍 女子 这 也 是 在 中国 境外 发现 的 第三例 新型 冠状病毒 确诊 病例 目前 两名,2020-01-17 21:10:00,0,0,0,__label__neutral,0.018000000000000002,0.13297,0.8903,0.8903,4.0,"发现, 患者, 泰国, 确诊, 第二例","Find, patient, Thailand, Confirmed diagnosis, Second case"
145,215,-1,冠状病毒,2020-01-17,泰国 发现 第二例 武汉 新型 冠状病毒 肺炎 患者 七十四岁 中国籍 女子 一月 十七日 泰国 公共 卫生部 在 其 官网 公布 已 发现 第二例 二千 零 一十九 ncov 确诊 病例 患者 是 一名 七十四岁 中国籍 女子 这 也 是 在 中国 境外 发现 的 第三例 新型 冠状病毒 确诊 病例 目前 两名 确诊 患者 在 负 气压 隔离病房 中 接受 治疗 两人 之间 发病 并 无 相关性 ​ ,2020-01-17 21:10:00,4,5,17,__label__neutral,0.05836,0.04744,0.87749,0.87749,4.0,"发现, 患者, 泰国, 确诊, 第二例","Find, patient, Thailand, Confirmed diagnosis, Second case"
146,221,-1,冠状病毒,2020-01-17,泰国 发现 第二例 武汉 新型 冠状病毒 肺炎 患者 一月 十七日 迪丽 热巴 少女 感脏 辫 泰国 公共 卫生部 在 其 官网 公布 已 发现 第二例 二千 零 一十九 ncov 确诊 病例 患者 是 一名 七十四岁 中国籍 女子 这 也 是 在 中国 境外 发现 的 第三例 新型 冠状病毒 确诊 病例 目前 两名 确诊 患者 在 负 气压 隔离病房 中,2020-01-17 21:09:00,0,0,0,__label__neutral,0.03211,0.10089,0.84798,0.84798,4.0,"发现, 患者, 泰国, 确诊, 第二例","Find, patient, Thailand, Confirmed diagnosis, Second case"
147,222,-1,冠状病毒,2020-01-17,泰国 发现 第二例 武汉 新型 冠状病毒 肺炎 患者 一月 十七日 estar 战胜 fpx 泰国 公共 卫生部 在 其 官网 公布 已 发现 第二例 二千 零 一十九 ncov 确诊 病例 患者 是 一名 七十四岁 中国籍 女子 这 也 是 在 中国 境外 发现 的 第三例 新型 冠状病毒 确诊 病例 目前 两名 确诊 患者 在 负 气压 隔离病房 中 接受,2020-01-17 21:08:00,0,0,0,__label__neutral,0.0331,0.09536,0.8933200000000001,0.8933200000000001,4.0,"发现, 患者, 泰国, 确诊, 第二例","Find, patient, Thailand, Confirmed diagnosis, Second case"
148,223,-1,冠状病毒,2020-01-17,武汉 骚不动 了 冠状病毒 使 我 去 药店 一个 口罩 都 没买 到 板蓝根 也 被 抢光 了 去 屈成氏 抢 到 最后 一个 网红 口罩 医生 说 不行 连 tb 卖家 也 要 为 我 指点江山 免疫力 低 的 我 泪目,2020-01-17 21:08:00,3,123,119,__label__negative,0.00328,0.85967,0.03115,0.85967,3.0,"武汉, 口罩, 发现, 患者, 泰国","Wuhan, Mask, Find, patient, Thailand"
149,224,-1,冠状病毒,2020-01-17,泰国 发现 第二例 新型 冠状病毒 肺炎 患者 dbq 本 武汉 人 真的 慌 了,2020-01-17 21:08:00,0,0,0,__label__neutral,0.00058,0.01913,0.9982,0.9982,0.0,"武汉, 发现, 泰国, 患者, 第二例","Wuhan, Find, Thailand, patient, Second case"
150,225,-1,冠状病毒,2020-01-17,midea 美的 wbl 二千五百 二十一 h 料理 机 六十九 元 近期 好价 感兴趣 的 可以 看 下 泰国 发现 第二例 新型 冠状病毒 肺炎 患者 用到 铁皮 的 彩妆 文旅部 取消 九家 饭店 五星级 资格 十元 券 微博 专享 限时 领券,2020-01-17 21:08:00,0,0,0,__label__neutral,0.004079999999999999,0.32083,0.81288,0.81288,0.0,"武汉, 发现, 泰国, 患者, 第二例","Wuhan, Find, Thailand, patient, Second case"
151,227,-1,冠状病毒,2020-01-17,泰国 发现 第二例 武汉 新型 冠状病毒 肺炎 患者 一月 十七日 我国 男性 比 女性 多 三千 零 四十九万 泰国 公共 卫生部 在 其 官网 公布 已 发现 第二例 二千 零 一十九 ncov 确诊 病例 患者 是 一名 七十四岁 中国籍 女子 这 也 是 在 中国 境外 发现 的 第三例 新型 冠状病毒 确诊 病例 目前 两名 确诊 患者 在,2020-01-17 21:08:00,0,0,0,__label__neutral,0.01641,0.08037000000000001,0.93992,0.93992,4.0,"发现, 患者, 泰国, 确诊, 第二例","Find, patient, Thailand, Confirmed diagnosis, Second case"
152,228,-1,冠状病毒,2020-01-17,泰国 发现 第二例 新型 冠状病毒 肺炎 患者 虽然 这种 病毒 没有 传染性 但 我 对 任何 问题 一定 要 搞清 原因 搞清 为什么 搞清 对策 搞清 过程 我 认为 这才 是 正确的 态度,2020-01-17 21:07:00,0,6,10,__label__neutral,0.02299,0.23372,0.46103,0.46103,0.0,"武汉, 发现, 泰国, 患者, 第二例","Wuhan, Find, Thailand, patient, Second case"
153,229,-1,冠状病毒,2020-01-17,泰国 发现 第二例 武汉 新型 冠状病毒 肺炎 患者 一月 十七日 露 小宝 ll 泰国 公共 卫生部 在 其 官网 公布 已 发现 第二例 二千 零 一十九 ncov 确诊 病例 患者 是 一名 七十四岁 中国籍 女子 这 也 是 在 中国 境外 发现 的 第三例 新型 冠状病毒 确诊 病例 目前 两名 确诊 患者 在 负 气压 隔离病房 中 接受 治疗 两人 之间 发病 并,2020-01-17 21:07:00,0,0,0,__label__neutral,0.03848,0.08757000000000001,0.86705,0.86705,4.0,"发现, 患者, 泰国, 确诊, 第二例","Find, patient, Thailand, Confirmed diagnosis, Second case"
154,230,-1,冠状病毒,2020-01-17,作为 公众 应该 知道 自己 所在 的 城市 有 多少 观察 中 病例 并 做出 防范 非典 的 惨痛教训 还 在 牢记 历史 是 为了 不要 重蹈 复辙 不是 合 不合 心意 而是 符不 符合 逻辑 相比 出国 武汉 去 其他 国内 城市 的 人流量 不是 更大 吗 那 难道 国内 其他 城市 没有 病例 无语 完了 非 要说 全国 都 在 传染 才合 心意,2020-01-17 16:35:00,0,0,0,__label__negative,0.05666,0.93441,0.00592,0.93441,3.0,"武汉, 口罩, 发现, 患者, 泰国","Wuhan, Mask, Find, patient, Thailand"
155,231,-1,冠状病毒,2020-01-17,泰国 发现 第二例 武汉 新型 冠状病毒 肺炎 患者 一月 十七日 李晨 像 极了 放假 后 的 我 泰国 公共 卫生部 在 其 官网 公布 已 发现 第二例 二千 零 一十九 ncov 确诊 病例 患者 是 一名 七十四岁 中国籍 女子 这 也 是 在 中国 境外 发现 的 第三例 新型 冠状病毒 确诊 病例 目前 两名 确诊 患者 在 负 气压 隔离病房,2020-01-17 21:06:00,0,0,0,__label__neutral,0.02443,0.0901,0.88405,0.88405,4.0,"发现, 患者, 泰国, 确诊, 第二例","Find, patient, Thailand, Confirmed diagnosis, Second case"
156,232,-1,冠状病毒,2020-01-17,在 我 无法 回国 了 之后 我 很 担心 我们 公司 下 一步 决策,2020-01-17 16:35:00,0,4,0,__label__positive,0.25684,0.01002,0.0601,0.25684,0.0,"武汉, 发现, 泰国, 患者, 第二例","Wuhan, Find, Thailand, patient, Second case"
157,233,-1,冠状病毒,2020-01-17,泰国 发现 第二例 新型 冠状病毒 肺炎 患者 祈求 平安 🙏 拜托 尽快 查明 原因 啊 找到 有效的 治疗 方法 加油,2020-01-17 21:06:00,0,0,3,__label__negative,0.21735,0.34866,0.08037000000000001,0.34866,1.0,"泰国, 发现, 患者, 第二例, 病毒","Thailand, Find, patient, Second case, virus"
158,234,-1,冠状病毒,2020-01-17,武汉 武汉 不明 原因 肺炎 病原体 为 新型 冠状病毒,2020-01-17 11:30:00,0,0,0,__label__negative,1e-05,0.97632,0.19684,0.97632,0.0,"武汉, 发现, 泰国, 患者, 第二例","Wuhan, Find, Thailand, patient, Second case"
159,235,-1,冠状病毒,2020-01-17,周一 与 周五 的 区别 泰国 新型 冠状病毒 病例 为 武汉 游客,2020-01-17 21:06:00,0,0,0,__label__positive,0.12941,0.12593,0.04887,0.12941,4.0,"发现, 患者, 泰国, 确诊, 第二例","Find, patient, Thailand, Confirmed diagnosis, Second case"
160,237,-1,冠状病毒,2020-01-17,我 在 看 泰国 发现 第二例 武汉 新型 冠状病毒 肺炎 患者 跟 新浪 看 热点 o 泰国 发现 第二例 武汉 新型 冠状病毒 肺炎 患者,2020-01-17 21:05:00,0,0,0,__label__neutral,0.40734,0.016919999999999998,0.6442399999999999,0.6442399999999999,4.0,"发现, 患者, 泰国, 确诊, 第二例","Find, patient, Thailand, Confirmed diagnosis, Second case"
161,242,-1,冠状病毒,2020-01-17,泰国 发现 第二例 武汉 新型 冠状病毒 肺炎 患者 一月 十七日 吴京 把 道具 蛋糕 给 吃 了 泰国 公共 卫生部 在 其 官网 公布 已 发现 第二例 二千 零 一十九 ncov 确诊 病例 患者 是 一名 七十四岁 中国籍 女子 这 也 是 在 中国 境外 发现 的 第三例 新型 冠状病毒 确诊 病例 目前 两名 确诊 患者 在 负 气压 隔离病房 中 接受 治疗 两人,2020-01-17 21:05:00,0,0,0,__label__neutral,0.08511,0.04086,0.8267200000000001,0.8267200000000001,4.0,"发现, 患者, 泰国, 确诊, 第二例","Find, patient, Thailand, Confirmed diagnosis, Second case"
162,243,-1,冠状病毒,2020-01-17,泰国 发现 第二例 武汉 新型 冠状病毒 肺炎 患者 一月 十七日 张子枫 艺考 分数 泰国 公共 卫生部 在 其 官网 公布 已 发现 第二例 二千 零 一十九 ncov 确诊 病例 患者 是 一名 七十四岁 中国籍 女子 这 也 是 在 中国 境外 发现 的 第三例 新型 冠状病毒 确诊 病例 目前 两名 确诊 患者 在 负 气压 隔离病房 中 接受 治疗,2020-01-17 21:04:00,0,0,0,__label__neutral,0.02034,0.11921,0.8903,0.8903,4.0,"发现, 患者, 泰国, 确诊, 第二例","Find, patient, Thailand, Confirmed diagnosis, Second case"
163,244,-1,冠状病毒,2020-01-17,泰国 发现 第二例 武汉 新型 冠状病毒 肺炎 患者 一月 十七日 唐探 三想 看 人数 破纪录 泰国 公共 卫生部 在 其 官网 公布 已 发现 第二例 二千 零 一十九 ncov 确诊 病例 患者 是 一名 七十四岁 中国籍 女子 这 也 是 在 中国 境外 发现 的 第三例 新型 冠状病毒 确诊 病例 目前 两名 确诊 患者 在 负 气压 隔离病房 中 接受 治,2020-01-17 21:04:00,0,0,2,__label__neutral,0.01543,0.16452999999999998,0.8933200000000001,0.8933200000000001,4.0,"发现, 患者, 泰国, 确诊, 第二例","Find, patient, Thailand, Confirmed diagnosis, Second case"
164,245,-1,冠状病毒,2020-01-17,泰国 发现 第二例 新型 冠状病毒 肺炎 患者 那么 我们 在 二十一 号 武汉 转机 大概 要 在 武汉 机场 停留 三 小时 左右 这 怎么办 只是 想 客观 了解 一下 毕竟 过年 期间 人员 来往 太 频繁 尽量 不想 无意 中 做 了 传播者,2020-01-17 21:03:00,0,0,0,__label__negative,0.00151,0.8397399999999999,0.36298,0.8397399999999999,0.0,"武汉, 发现, 泰国, 患者, 第二例","Wuhan, Find, Thailand, patient, Second case"
165,247,-1,冠状病毒,2020-01-17,感觉 有点 可怕 因为 未知 而且 离得 太近,2020-01-17 16:35:00,0,0,1,__label__negative,1e-05,0.99642,0.10972,0.99642,0.0,"武汉, 发现, 泰国, 患者, 第二例","Wuhan, Find, Thailand, patient, Second case"
166,248,-1,冠状病毒,2020-01-17,不会 轻易 结束 自 昌盛 若芹 己 的 性命 　 　 要 不要 把 尸体 背 回去 耶稣 问道 　 　 要 尸体 干什么 把 电脑 带 回来 就行了 　 　 好 的 　 　 挂断 耶稣 的 电话 泰国 发现 一例 新型 冠状病毒 病例,2020-01-17 21:02:00,0,0,0,__label__negative,1e-05,0.92631,0.6076699999999999,0.92631,0.0,"武汉, 发现, 泰国, 患者, 第二例","Wuhan, Find, Thailand, patient, Second case"
167,250,-1,冠状病毒,2020-01-17,泰国 发现 第二例 新型 冠状病毒 肺炎 患者 不是 慌有 什么 用 你 自己 做好 防范 不就 好 了 自己 担心 就 戴 口罩 喝 板蓝根 少去 人 多 的 地方 搞不懂 在 微博上 积极 评论 的 人 说 那些 话 有用吗,2020-01-17 21:01:00,0,0,0,__label__neutral,0.008329999999999999,0.06756000000000001,0.97325,0.97325,3.0,"武汉, 口罩, 发现, 患者, 泰国","Wuhan, Mask, Find, patient, Thailand"
168,251,-1,冠状病毒,2020-01-17,泰国 发现 第二例 武汉 新型 冠状病毒 肺炎 患者 一月 十七日 pdd 泰国 公共 卫生部 在 其 官网 公布 已 发现 第二例 二千 零 一十九 ncov 确诊 病例 患者 是 一名 七十四岁 中国籍 女子 这 也 是 在 中国 境外 发现 的 第三例 新型 冠状病毒 确诊 病例 目前 两名 确诊 患者 在 负 气压 隔离病房 中,2020-01-17 21:01:00,0,0,0,__label__neutral,0.04086,0.05186,0.88721,0.88721,4.0,"发现, 患者, 泰国, 确诊, 第二例","Find, patient, Thailand, Confirmed diagnosis, Second case"
169,252,-1,冠状病毒,2020-01-17,cnn 中国 的 新型 sars 样 病毒 已经 传播 到 泰国 对此 我们 仍然 知之甚少 中国 官方 否认 是 sars 🙏 泰国 发现 第二例 新型 冠状病毒 肺炎 患者,2020-01-17 21:01:00,1,3,12,__label__negative,0.11281,0.37755,0.25092,0.37755,4.0,"发现, 患者, 泰国, 确诊, 第二例","Find, patient, Thailand, Confirmed diagnosis, Second case"
170,253,-1,冠状病毒,2020-01-17,泰国 发现 第二例 武汉 新型 冠状病毒 肺炎 患者 一月 十七日 康辉 朱广权 尼格 买 提群口 相声 泰国 公共 卫生部 在 其 官网 公布 已 发现 第二例 二千 零 一十九 ncov 确诊 病例 患者 是 一名 七十四岁 中国籍 女子 这 也 是 在 中国 境外 发现 的 第三例 新型 冠状病毒 确诊 病例 目前 两名 确诊 患者 在 负 气压 隔离病房 中 接受 治疗,2020-01-17 21:01:00,0,0,0,__label__neutral,0.01497,0.12941,0.90992,0.90992,4.0,"发现, 患者, 泰国, 确诊, 第二例","Find, patient, Thailand, Confirmed diagnosis, Second case"
171,254,-1,冠状病毒,2020-01-17,泰国 发现 第二例 武汉 新型 冠状病毒 肺炎 患者 一月 十七日 醉驾 玛莎拉蒂 司机 庭审 痛哭 泰国 公共 卫生部 在 其 官网 公布 已 发现 第二例 二千 零 一十九 ncov 确诊 病例 患者 是 一名 七十四岁 中国籍 女子 这 也 是 在 中国 境外 发现 的 第三例 新型 冠状病毒 确诊 病例 目前 两名 确诊,2020-01-17 21:01:00,0,0,0,__label__neutral,0.01034,0.06561,0.9698,0.9698,4.0,"发现, 患者, 泰国, 确诊, 第二例","Find, patient, Thailand, Confirmed diagnosis, Second case"
172,255,-1,冠状病毒,2020-01-17,腾讯 新闻 腾讯 新闻 专题 武汉 发现 新型 冠状病毒 o 打开 腾讯 新闻,2020-01-17 21:01:00,0,0,0,__label__positive,0.98551,0.02932,0.00114,0.98551,2.0,"武汉, sars, 相似, o, 专家","Wuhan, sars, similar, o, expert"
173,260,-1,冠状病毒,2020-01-17,泰国 发现 第二例 武汉 新型 冠状病毒 肺炎 患者 一月 十七日 吴京 把 道具 蛋糕 给 吃 了 泰国 公共 卫生部 在 其 官网 公布 已 发现 第二例 二千 零 一十九 ncov 确诊 病例 患者 是 一名 七十四岁 中国籍 女子 这 也 是 在 中国 境外 发现 的 第三例 新型 冠状病毒 确诊 病例 目前 两名 确诊 患者 在 负 气压 隔离病房 中 接受 治,2020-01-17 21:00:00,0,0,0,__label__neutral,0.0716,0.06372,0.78267,0.78267,4.0,"发现, 患者, 泰国, 确诊, 第二例","Find, patient, Thailand, Confirmed diagnosis, Second case"
174,261,-1,冠状病毒,2020-01-17,过年 要 坐 高铁 回 武汉 的 我 要 搞清楚 是 怎么 感染,2020-01-17 16:35:00,0,1,0,__label__negative,1e-05,0.99962,0.18714,0.99962,0.0,"武汉, 发现, 泰国, 患者, 第二例","Wuhan, Find, Thailand, patient, Second case"
175,262,-1,冠状病毒,2020-01-17,本来 想 下学期 接着 做 医院 大厅 志愿者 好歹 整个 长期 义工 诶 没想到 出来 个 冠状病毒 不敢 去 了 不敢 去 了,2020-01-17 21:00:00,0,0,0,__label__negative,1e-05,0.99642,0.03115,0.99642,3.0,"武汉, 口罩, 发现, 患者, 泰国","Wuhan, Mask, Find, patient, Thailand"
