,id,label,keyword,date,content,time,forward,comment,like,predict,__label__positive,__label__negative,__label__neutral,predict_score,topic,topic_keyword,topic_keyword_en
104,505,__label__neutral,新冠,2020-02-20,当当网 确认 一 员工 确诊 新冠 肺炎 近日 有 消息 称 当当网 一 员工 被 确诊 新冠 肺炎 此前 该 员工 曾 在 公司 办公 数日 对此 当当网 二十日 回应 称 二月 十九日 晚 从 疾控中心 得知 当当 密切接触 者 员工 核酸 检测 为 阳性 先生 和 孩子 目前 核酸 检测 还是 阴性 当当网 称 正在 配合 疾控中心 妥善 安排 密切接触 者 同时 以 专业 部门 ​ ,2020-02-20 22:55:00,0,0,0,__label__neutral,0.00462,0.00713,0.99428,0.99428,4.0,"防控, 李兰娟, 二十日, 确诊, 患者","Prevention and control, Li Lanjuan, 20th, Confirmed diagnosis, patient"
105,508,__label__neutral,新冠,2020-02-20,当当网 确认 一 员工 确诊 新冠 肺炎 近日 有 消息 称 当当网 一 员工 被 确诊 新冠 肺炎 此前 该 员工 曾 在 公司 办公 数日 对此 当当网 二十日 回应 称 二月 十九日 晚 从 疾控中心 得知 当当 密切接触 者 员工 核酸 检测 为 阳性 先生 和 孩子 目前 核酸 检测 还是 阴性 当当网 称 正在 配合 疾控中心 妥善 安排 密切接触 者 同时 以 专业 部门 ​ ,2020-02-20 22:55:00,0,0,0,__label__neutral,0.00462,0.00713,0.99428,0.99428,4.0,"防控, 李兰娟, 二十日, 确诊, 患者","Prevention and control, Li Lanjuan, 20th, Confirmed diagnosis, patient"
106,513,__label__negative,新冠,2020-02-20,战疫 时刻 逆行 看 最美 志愿者 　 　 你 赴 战场 我保 后方 天津医科大学 总医院 为 落实 天津市 关于 疫情 期间 加强 医院 出入 管理 的 要求 加强 入院 人员 信息 登记 工作 我院 志愿者 踊跃报名 健康 管理中心 院团委 积极 配合 门诊 办公室 保卫处 等 部门 结合 信息化 手段 加强 门控 管理 优 ​ ,2020-02-20 22:54:00,0,0,0,__label__positive,0.99311,1e-05,0.22817,0.99311,2.0,"韩国, 病例, 死亡, 二十, 感染","Korea, Case, death, twenty, infection"
107,514,__label__neutral,新冠,2020-02-20,又现 特殊 案例 一 男子 痰 咽 检测 阴性 粪便 为 阳性 据 浙江 舟山市 卫健委 二十日 通报 二月 十六日 晚 戚 某某 粪便 标本 新冠 病毒检测 阳性 痰 咽 拭子 检测 阴性 无 临床表现 根据 新冠 肺炎 诊疗 方案 不符合 疑似病例 和 确诊 病例 诊断 标准 为 降低 可能 传染 的 风险 将 其 由 救护车 送 至 定点医院 隔离 治疗 二月 十八日 再次 检测 粪便 ​ ,2020-02-20 22:54:00,0,0,0,__label__positive,0.21735,0.04744,0.0601,0.21735,0.0,"医院, 患者, 武汉市, 特殊, 救治","hospital, patient, Wuhan, special, Cure"
108,516,__label__negative,新冠,2020-02-20,随着 新冠 疫情 的 发展 我们 遵照 着 钟南山 院士 的 指示 宅 在家 今天 例外 叔仔 二人 去 惠州 做 检查 昨天 在 惠东 妇幼保健 院照 了 b 超说 宝宝 右脑 增宽 十一 ㎜ 建议 到 上级 医院 复查 老天 保佑 虚惊一场 我 和 宝爸 带 着 小小 宝贝 去 医院 小不点 有点 鼻塞 干呕 到 了 医院 门口 看到 两位 护士 穿 了 防护服 ​ ,2020-02-20 22:54:00,0,0,0,__label__negative,0.1067,0.2451,0.10376,0.2451,0.0,"医院, 患者, 武汉市, 特殊, 救治","hospital, patient, Wuhan, special, Cure"
109,520,__label__positive,新冠,2020-02-20,可以 跑步 了 关于 如何 省 口罩 科学 戴 口罩 二月 十八日 举行 的 广东省 新冠 肺炎 疫情 防控 情况 新闻 发布会 终于 明确 强调 在 非 疫区 空旷 且 通风 场所 不需要 佩戴 口罩,2020-02-20 22:54:00,4,3,7,__label__neutral,0.01856,0.07371,0.65136,0.65136,4.0,"防控, 李兰娟, 二十日, 确诊, 患者","Prevention and control, Li Lanjuan, 20th, Confirmed diagnosis, patient"
110,527,__label__negative,新冠,2020-02-20,真的 很 心疼 请 您 多 保重,2020-02-20 20:14:00,0,0,0,__label__negative,1e-05,1.00001,0.00041,1.00001,0.0,"医院, 患者, 武汉市, 特殊, 救治","hospital, patient, Wuhan, special, Cure"
111,550,__label__negative,新冠,2020-02-20,太 辛苦,2020-02-20 20:14:00,0,0,0,__label__negative,1e-05,1.00001,1e-05,1.00001,4.0,"防控, 李兰娟, 二十日, 确诊, 患者","Prevention and control, Li Lanjuan, 20th, Confirmed diagnosis, patient"
112,551,__label__negative,新冠,2020-02-20, 媒体 勇哥 共同 战疫 关注 新冠 肺炎 将 战疫 进行 到底 致敬 李兰娟 院士 致敬 战 疫 一线 最 可爱的 人 l 媒体 勇哥 的 微博 视频 ​ ​,2020-02-20 22:54:00,0,0,1,__label__positive,0.99663,0.06756000000000001,1e-05,0.99663,3.0,"o, 血浆, 不幸, 康复者, 型","o, plasma, unfortunately, Rehabilitation person, type"
113,555,__label__negative,新冠,2020-02-20,李 院士 最重要 保护 好 她,2020-02-20 21:30:00,0,0,0,__label__negative,1e-05,0.9988,0.0008900000000000002,0.9988,2.0,"韩国, 病例, 死亡, 二十, 感染","Korea, Case, death, twenty, infection"
114,558,__label__neutral,新冠,2020-02-20, 点亮 志愿者 韩国 出现 首例 新冠 肺炎 死亡 病例 为 住院 二十 馀 年 的 病人 参考消息 网 二月 二十日 报道 韩媒称 韩国 一家 医院 有 一例 新型 冠状病毒 确诊 病例 于 十九日 死亡 这是 韩国 境内 首次 出现 感染 新冠 的 死亡 病例 此人 在 该院 住院 二十多年 具体 死亡 原因 待查 截至 二十日 下午 四点 韩国 累计 确诊 病例 一百 零 四例 韩国 官员 ​ ,2020-02-20 22:54:00,0,0,0,__label__positive,0.95533,0.00477,0.0601,0.95533,2.0,"韩国, 病例, 死亡, 二十, 感染","Korea, Case, death, twenty, infection"
115,559,__label__positive,新冠,2020-02-20,抗击 疫情 重庆 行动 全民 防控 众志成城 渝北区 可 预约 购买 口罩 人群 范围 扩大 据 渝北区 新冠 肺炎 疫情 防控 工作 指挥部 物资 保障 组 消息 渝北区 可 预约 购买 口罩 人群 范围 扩大 今日 起 居住 在 渝北 的 非 渝北 籍 居民 也 能 购买 另外 六十岁 以上 或 确有 操作 困难的 居民 可携带 本人 身份证 到 就近 药店 由 导购 帮助 完成 预约 ​ ,2020-02-20 22:54:00,8,61,45,__label__positive,0.95916,0.0927,0.0007700000000000001,0.95916,1.0,"病人, 工作, 护士, 医院, 出院","patient, jobs, nurse, hospital, Discharged"
116,565,__label__negative,新冠,2020-02-20,扩 急求 o 型 血 康复者 血浆 求助 武大 资环 学院 赵玉华 教授 不幸 罹患 新冠 其 全家 感染 爱人 已 不幸 离世 目前 在 中南 医院 icu 抢救 急需 o 型 血 康复者 捐献 血浆 救命,2020-02-20 21:25:00,0,0,0,__label__negative,1e-05,0.99332,0.00219,0.99332,3.0,"o, 血浆, 不幸, 康复者, 型","o, plasma, unfortunately, Rehabilitation person, type"
117,568,__label__negative,新冠,2020-02-20,扩 急求 o 型 血 康复者 血浆 求助 武大 资环 学院 赵玉华 教授 不幸 罹患 新冠 其 全家 感染 爱人 已 不幸 离世 目前 在 中南 医院 icu 抢救 急需 o 型 血 康复者 捐献 血浆 救命,2020-02-20 21:25:00,0,0,0,__label__negative,1e-05,0.99332,0.00219,0.99332,3.0,"o, 血浆, 不幸, 康复者, 型","o, plasma, unfortunately, Rehabilitation person, type"
118,574,__label__negative,新冠,2020-02-20,🆘 继续 帮转 希望 赵老师 得救 求助 武大 资环 学院 赵玉华 教授 不幸 罹患 新冠 其 全家 感染 爱人 已 不幸 离世 目前 在 中南 医院 icu 抢救 急需 o 型 血 康复者 捐献 血浆 救命,2020-02-20 21:25:00,9,0,0,__label__negative,1e-05,0.88721,0.1067,0.88721,3.0,"o, 血浆, 不幸, 康复者, 型","o, plasma, unfortunately, Rehabilitation person, type"
119,595,__label__negative,新冠,2020-02-20,这下 有 希望 了 加,2020-02-20 21:40:00,0,0,0,__label__positive,0.36298,0.3346,1e-05,0.36298,4.0,"防控, 李兰娟, 二十日, 确诊, 患者","Prevention and control, Li Lanjuan, 20th, Confirmed diagnosis, patient"
120,597,__label__positive,新冠,2020-02-20,又 有 三例 确诊 患者 在 三亚 出院 三亚 今天 共五人 出院 新型 冠状病毒 新冠 肺炎 最新 动态 二月 二十日 下午 南部 战区 海军 第二 医院 又 有 三例 新冠 肺炎 确诊 病例 患者 经过 综合 诊治 符合国家 卫生 健康 委新冠 肺炎 确诊 病例 解除 隔离 和 出院 标准 于 当天 出院 截至 二月 二十日 十九时 三亚 累计 已有 三十七 例 确诊 病例 治愈 出院 周 某某 ​ ,2020-02-20 22:53:00,0,0,0,__label__positive,0.98505,0.00241,0.0601,0.98505,1.0,"病人, 工作, 护士, 医院, 出院","patient, jobs, nurse, hospital, Discharged"
121,598,__label__negative,新冠,2020-02-20,回复 司马 本人 也 不想 戴 的 志愿者 查得 紧 一到 僻 背处 就 卸掉 了 向前 翻 他 之前 的 微博 吧 你 志同道合 的 朋友 方舟子 可是 不建议 带 口罩 的 还 说 新冠 病毒 不容易 感染 你 怎么 跟 他 对着干,2020-02-20 21:33:00,0,0,0,__label__negative,0.00118,0.8397399999999999,0.48439,0.8397399999999999,1.0,"病人, 工作, 护士, 医院, 出院","patient, jobs, nurse, hospital, Discharged"
122,602,__label__negative,新冠,2020-02-20,您 辛苦,2020-02-20 20:14:00,0,0,0,__label__negative,1e-05,0.99888,1e-05,0.99888,3.0,"o, 血浆, 不幸, 康复者, 型","o, plasma, unfortunately, Rehabilitation person, type"
123,612,__label__negative,新冠,2020-02-20,转,2020-02-20 22:06:00,0,0,0,__label__neutral,1e-05,1e-05,1.00001,1.00001,4.0,"防控, 李兰娟, 二十日, 确诊, 患者","Prevention and control, Li Lanjuan, 20th, Confirmed diagnosis, patient"
124,618,__label__positive,新冠,2020-02-20,咸阳 身边 事 累计 十例 又 有 二例 新冠 肺炎 患者 治愈 出院 二月 二十日 咸阳市 两例 新冠 肺炎 患者 在 市中心 医院 东郊 分院 治愈 出院 患者 宋某 男 四十岁 陕西 武功 人 一月 二十一日 与 家人 从 武汉 返回 武功 一月 二十五日 出现 发热 体温 最高 三十八 五 感 乏困 无力 咳嗽 咳痰 一月 二十九日 在 当地 医院 就诊 并 住院 隔离 治疗 期间 仍 ​ ,2020-02-20 22:53:00,0,0,0,__label__positive,0.53122,0.04604,0.10089,0.53122,4.0,"防控, 李兰娟, 二十日, 确诊, 患者","Prevention and control, Li Lanjuan, 20th, Confirmed diagnosis, patient"
125,626,__label__positive,新冠,2020-02-20,黄奇帆 新冠 肺炎 疫情 下 五千 八百 字 建言 公共 卫生防疫 体系 改革 遴选 公选 笔试 面试 素养 积淀 o 黄奇帆 新冠 肺炎 疫情 下 五千 八百 字 建言 公共 卫生防疫 体系 改革 遴选 公选 笔试 面试 素养 积淀 从 宏观 上 来看 武汉 的 防疫 应对 问题 不是 湖北 独有的 公共卫生 与 传染病 防治 领域 是 中国 经济 供给 侧 结构性 改革 的 落后 领域 甚至 是 盲点 从 二千 零 三年 的 非典 到 二千 零 二十年 的 新冠 肺炎 中国 公共卫生 体系 的 短板 始 ​ ,2020-02-20 22:53:00,2,0,0,__label__positive,0.84391,0.02677,0.02597,0.84391,3.0,"o, 血浆, 不幸, 康复者, 型","o, plasma, unfortunately, Rehabilitation person, type"
126,631,__label__negative,新冠,2020-02-20,管轶新 证据 再次 指向 穿山甲 与 新冠 病毒 氨基酸 相似 度达 九十七 四 o 管轶新 证据 再次 指向 穿山甲 与 新冠 病毒 氨基酸 相似 度达 九十七 四 一月 十五日 他 表示 疫情 也 控制 住 了 我们 已经 可以 看到 胜利的 曙光 相信 民众 可以 过个 好 年 但 一 月 二十三 日 他 又 说 保守 估计 此次 感染 规模 最终 可能 会 是 sars 的 十 倍 起跳 我 怎么 觉得 各行各业 都 充斥 着 类似 股评家 的 角色 ​ ,2020-02-20 22:53:00,0,0,0,__label__negative,0.36298,0.54675,0.00713,0.54675,2.0,"韩国, 病例, 死亡, 二十, 感染","Korea, Case, death, twenty, infection"
127,636,__label__positive,新冠,2020-02-20,湖北 除 疫情 防控 必需 外 各类 企业 不早 于 三月 十日 复工 新华社 武汉 二月 二十日 电 记者 梁建强 黎昌政 湖北省 新冠 肺炎 疫情 防控 指挥部 二十日 发布 通告 称 当前 全省 疫情 防控 正 处于 最 吃劲 的 关键期 疫情 形势 开始 出现 积极 变化 但 总体 形势 仍然 严峻 复杂 为 巩固 和 扩大 疫情 防控 效果 坚决 阻断 疫情 传播 切实 保障 人民 ​ ,2020-02-20 22:53:00,0,0,0,__label__positive,0.96591,0.01066,0.00886,0.96591,4.0,"防控, 李兰娟, 二十日, 确诊, 患者","Prevention and control, Li Lanjuan, 20th, Confirmed diagnosis, patient"
128,639,__label__negative,新冠,2020-02-20,共读 打卡 血疫 美 理查德 普雷斯顿 上海译文出版社 又 一本 译文 纪实 在 这个 时候 读 也 是 很 应景 了 与 新冠 病毒 不同 的 是 埃 博拉 病毒 属于 丝状 病毒 它 有 三个 亚属 扎伊尔 埃 博拉 苏丹 埃 博拉 和 雷斯顿 埃 博拉 高度 致命 来自 热带雨林 它 与 马尔堡 病毒 关系密切 埃 博拉 是 ​ ,2020-02-20 22:53:00,7,0,4,__label__positive,0.99525,0.00759,0.00396,0.99525,1.0,"病人, 工作, 护士, 医院, 出院","patient, jobs, nurse, hospital, Discharged"
129,642,__label__negative,新冠,2020-02-20,线上 打折 售房 业内人士 不排除 更多 房企 通过 以价 换量 促进 回款 新冠 肺炎 疫情 将 使 房地产 行业 一季度 销售 受到 较大 冲击 湖北 及 周边 省市 冲击 更大 政策 维稳 按揭 投放 趋稳及 房企 积极 应对 全年 销售 稳中 趋弱 东方 金诚 房地产 行业 高级 分析师 谢瑞 表示 在 应对 疫情 上 多家 企业 推出 线上 售房 vr 看 ​ ,2020-02-20 22:53:00,0,0,0,__label__negative,0.0073599999999999985,0.99783,0.00264,0.99783,2.0,"韩国, 病例, 死亡, 二十, 感染","Korea, Case, death, twenty, infection"
130,645,__label__negative,新冠,2020-02-20,线上 打折 售房 业内人士 不排除 更多 房企 通过 以价 换量 促进 回款 新冠 肺炎 疫情 将 使 房地产 行业 一季度 销售 受到 较大 冲击 湖北 及 周边 省市 冲击 更大 政策 维稳 按揭 投放 趋稳及 房企 积极 应对 全年 销售 稳中 趋弱 东方 金诚 房地产 行业 高级 分析师 谢瑞 表示 在 应对 疫情 上 多家 企业 推出 线上 售房 vr 看 ​ ,2020-02-20 22:53:00,0,0,0,__label__negative,0.0073599999999999985,0.99783,0.00264,0.99783,2.0,"韩国, 病例, 死亡, 二十, 感染","Korea, Case, death, twenty, infection"
131,649,__label__negative,新冠,2020-02-20,听过 算数 不能 当真 的 一看 人太多 了 还是 不免 了 变挂 了 讲 的 每 一句 话 都 是 逗你玩 不是 说 免费,2020-02-20 19:17:00,2,0,3,__label__negative,0.01283,0.7982,0.0421,0.7982,3.0,"o, 血浆, 不幸, 康复者, 型","o, plasma, unfortunately, Rehabilitation person, type"
132,657,__label__negative,新冠,2020-02-20,扩 急求 o 型 血 康复者 血浆 求助 武大 资环 学院 赵玉华 教授 不幸 罹患 新冠 其 全家 感染 爱人 已 不幸 离世 目前 在 中南 医院 icu 抢救 急需 o 型 血 康复者 捐献 血浆 救命,2020-02-20 21:25:00,0,0,0,__label__negative,1e-05,0.99332,0.00219,0.99332,3.0,"o, 血浆, 不幸, 康复者, 型","o, plasma, unfortunately, Rehabilitation person, type"
133,662,__label__negative,新冠,2020-02-20,扩 急求 o 型 血 康复者 血浆 求助 武大 资环 学院 赵玉华 教授 不幸 罹患 新冠 其 全家 感染 爱人 已 不幸 离世 目前 在 中南 医院 icu 抢救 急需 o 型 血 康复者 捐献 血浆 救命,2020-02-20 21:25:00,0,0,0,__label__negative,1e-05,0.99332,0.00219,0.99332,3.0,"o, 血浆, 不幸, 康复者, 型","o, plasma, unfortunately, Rehabilitation person, type"
134,664,__label__negative,新冠,2020-02-20,扩 急求 o 型 血 康复者 血浆 求助 武大 资环 学院 赵玉华 教授 不幸 罹患 新冠 其 全家 感染 爱人 已 不幸 离世 目前 在 中南 医院 icu 抢救 急需 o 型 血 康复者 捐献 血浆 救命,2020-02-20 21:25:00,0,0,0,__label__negative,1e-05,0.99332,0.00219,0.99332,3.0,"o, 血浆, 不幸, 康复者, 型","o, plasma, unfortunately, Rehabilitation person, type"
135,665,__label__negative,新冠,2020-02-20,扩 急求 o 型 血 康复者 血浆 求助 武大 资环 学院 赵玉华 教授 不幸 罹患 新冠 其 全家 感染 爱人 已 不幸 离世 目前 在 中南 医院 icu 抢救 急需 o 型 血 康复者 捐献 血浆 救命,2020-02-20 21:25:00,0,0,0,__label__negative,1e-05,0.99332,0.00219,0.99332,3.0,"o, 血浆, 不幸, 康复者, 型","o, plasma, unfortunately, Rehabilitation person, type"
136,671,__label__neutral,新冠,2020-02-20,推荐 大家 速看 这篇 呈列 了 非常 多 关键 事实 前期 白皮 入排 标准 严重 阻碍 了 新冠 患者 确诊 入院 有些 有 明显 症状 的 人 因为 不符合标准 又 被 放出去 游荡 了 一个多 星期 以及 十二月 三十一日 前 就 有 一百 零四人 感染 十五 人 死亡 但 一月 六日 还有 医生 因为 没被 告知 危险 接诊 肺炎 病人 而 被 感染 http,2020-02-20 18:18:00,0,0,0,__label__positive,0.56986,0.16887,0.31406,0.56986,4.0,"防控, 李兰娟, 二十日, 确诊, 患者","Prevention and control, Li Lanjuan, 20th, Confirmed diagnosis, patient"
137,674,__label__negative,新冠,2020-02-20,古体诗 词 书法 新冠 造就 学模 七绝 新冠 意外 得 收获 近 亿 学子 宅家 摹 一场 病毒 一代 朔 写 进 自学 史书 磋 诗作 书法 者 张文祥 万绢 诗书 郎 二千 零 二十 二 二十 于 广西 南宁市,2020-02-20 22:53:00,0,0,0,__label__negative,0.08037000000000001,0.94166,0.01002,0.94166,2.0,"韩国, 病例, 死亡, 二十, 感染","Korea, Case, death, twenty, infection"
138,686,__label__negative,新冠,2020-02-20,一图 读懂 新型 冠状病毒 肺炎 诊疗 方案 试行 第六版 二千 零 二十年 二月 十九日 国家 卫生 健康 委员会 发布 了 新型 冠状病毒 肺炎 诊疗 方案 试行 第六版 相比 于 此前 的 版本 新版 的 诊疗 方案 中 增加 了 新冠 病毒 的 传播 途径 在 某些 情况 下 存在 经 气溶胶 传播 的 可能 取消 湖北省 和 湖北省 以外 其他 省份 的 区别 统 ​ ,2020-02-20 22:53:00,0,0,0,__label__positive,0.9707,0.0117,0.01066,0.9707,1.0,"病人, 工作, 护士, 医院, 出院","patient, jobs, nurse, hospital, Discharged"
139,693,__label__negative,新冠,2020-02-20,扩 扩 急求 o 型 血 康复者 血浆 求助 武大 资环 学院 赵玉华 教授 不幸 罹患 新冠 其 全家 感染 爱人 已 不幸 离世 目前 在 中南 医院 icu 抢救 急需 o 型 血 康复者 捐献 血浆 救命,2020-02-20 21:25:00,0,0,0,__label__negative,1e-05,0.99332,0.0014199999999999998,0.99332,3.0,"o, 血浆, 不幸, 康复者, 型","o, plasma, unfortunately, Rehabilitation person, type"
140,696,__label__positive,新冠,2020-02-20,新冠 的 研究 期待 不断 推进 能快 尽量 快 o 药学 快讯 特辑 新型 冠状病毒 研究 速递,2020-02-20 22:52:00,0,0,0,__label__neutral,0.13662,0.04469,0.25092,0.25092,4.0,"防控, 李兰娟, 二十日, 确诊, 患者","Prevention and control, Li Lanjuan, 20th, Confirmed diagnosis, patient"
141,699,__label__neutral,新冠,2020-02-20,再 怎么样 死亡率 最高的 地区 应该 全免 他们 挤压 在 狭小 的 区域 内 用 自己 的 性命 为 全国 做 了 贡献 之前 一直 报道 的 免费 啊 不是 说 免费,2020-02-20 19:17:00,0,0,0,__label__neutral,0.10972,0.00783,0.96154,0.96154,4.0,"防控, 李兰娟, 二十日, 确诊, 患者","Prevention and control, Li Lanjuan, 20th, Confirmed diagnosis, patient"
142,704,__label__positive,新冠,2020-02-20,武汉市 公布 非新冠 肺炎 特殊 患者 医疗 救治 医院 名单 o 武汉市 公布 非新冠 肺炎 特殊 患者 医疗 救治 医院 名单,2020-02-20 22:52:00,0,0,0,__label__negative,0.2451,0.5775100000000001,1e-05,0.5775100000000001,0.0,"医院, 患者, 武汉市, 特殊, 救治","hospital, patient, Wuhan, special, Cure"
143,705,__label__positive,新冠,2020-02-20,今晚 金华 婺城 两趟 返岗 专列 到达 八百多 人 返岗 复工   晚上 八 二十三 分 金华 婺城 首趟 复工 专列 g 一千三百 七十四 次列车 搭载 六百名 贵阳 籍 务工人员 到达 金华 站 晚上 九 十分 第二趟 专列 g 一千 三百七十六 次列车 搭载 二百名 云南 籍 务工人员 也 准时到达 金华 站 八百名 务工人员 在 工作人员 的 引导 下 分批 有序 的 排队 经过 红外 体温 检验 后出 站 他们 ​ ,2020-02-20 22:52:00,1,1,4,__label__negative,0.11281,0.67919,0.05836,0.67919,4.0,"防控, 李兰娟, 二十日, 确诊, 患者","Prevention and control, Li Lanjuan, 20th, Confirmed diagnosis, patient"
144,708,__label__positive,新冠,2020-02-20,武汉市 公布 非新冠 肺炎 特殊 患者 医疗 救治 医院 名单 o 武汉市 公布 非新冠 肺炎 特殊 患者 医疗 救治 医院 名单,2020-02-20 22:52:00,0,0,0,__label__negative,0.2451,0.5775100000000001,1e-05,0.5775100000000001,0.0,"医院, 患者, 武汉市, 特殊, 救治","hospital, patient, Wuhan, special, Cure"
145,709,__label__positive,新冠,2020-02-20,武汉市 公布 非新冠 肺炎 特殊 患者 医疗 救治 医院 名单 o 武汉市 公布 非新冠 肺炎 特殊 患者 医疗 救治 医院 名单,2020-02-20 22:52:00,0,0,0,__label__negative,0.2451,0.5775100000000001,1e-05,0.5775100000000001,0.0,"医院, 患者, 武汉市, 特殊, 救治","hospital, patient, Wuhan, special, Cure"
146,713,__label__negative,新冠,2020-02-20,吴亦凡益 起来  吴亦凡  吴亦凡 与 每个 你 央视 六套 报道 吴亦凡 鼓励 奋战 在 新冠 一线 的 粉,2020-02-19 19:04:00,0,0,0,__label__positive,0.87749,0.01283,0.06756000000000001,0.87749,3.0,"o, 血浆, 不幸, 康复者, 型","o, plasma, unfortunately, Rehabilitation person, type"
147,725,__label__negative,新冠,2020-02-20,中方 提供 新冠 病毒 基因组 序列 后 美方 找到 疫苗 和 药物 开发 关键 靶点 美国 科研 团队 根据 中国 研究 人员 提供 的 病毒 基因组 序列 首次 绘制 出 新型 冠状病毒 一个 关键 蛋白 分子 的 三 d 结构 这种 蛋白 是 开发 疫苗 治疗 性 抗体 和 药物 的 关键 靶点 via 参考消息 希望 可靠 l 新华 国际 的 微博 视频,2020-02-20 22:52:00,0,0,0,__label__positive,0.7773100000000001,0.21208,0.00434,0.7773100000000001,3.0,"o, 血浆, 不幸, 康复者, 型","o, plasma, unfortunately, Rehabilitation person, type"
148,733,__label__negative,新冠,2020-02-20,扩 急求 o 型 血 康复者 血浆 求助 武大 资环 学院 赵玉华 教授 不幸 罹患 新冠 其 全家 感染 爱人 已 不幸 离世 目前 在 中南 医院 icu 抢救 急需 o 型 血 康复者 捐献 血浆 救命,2020-02-20 21:25:00,0,0,0,__label__negative,1e-05,0.99332,0.00219,0.99332,3.0,"o, 血浆, 不幸, 康复者, 型","o, plasma, unfortunately, Rehabilitation person, type"
149,737,__label__negative,新冠,2020-02-20,扩 急求 o 型 血 康复者 血浆 求助 武大 资环 学院 赵玉华 教授 不幸 罹患 新冠 其 全家 感染 爱人 已 不幸 离世 目前 在 中南 医院 icu 抢救 急需 o 型 血 康复者 捐献 血浆 救命,2020-02-20 21:25:00,0,0,0,__label__negative,1e-05,0.99332,0.00219,0.99332,3.0,"o, 血浆, 不幸, 康复者, 型","o, plasma, unfortunately, Rehabilitation person, type"
150,743,__label__positive,新冠,2020-02-20,根据 cdc 发在 中华 流行病学 杂志 的 论文 一月 十号 前 发病 病例 已经 分布 在 二十个 省市 一百多个 县区 推荐 大家 速看 这篇 呈列 了 非常 多 关键 事实 前期 白皮 入排 标准 严重 阻碍 了 新冠 患者 确诊 入院 以及 十二月 三十一日 前 就 有 一百 零四人 感染 十五 人 死亡,2020-02-20 18:18:00,0,0,0,__label__positive,0.6442399999999999,0.16452999999999998,0.21735,0.6442399999999999,4.0,"防控, 李兰娟, 二十日, 确诊, 患者","Prevention and control, Li Lanjuan, 20th, Confirmed diagnosis, patient"
151,744,__label__positive,新冠,2020-02-20,转发 成都 开通 九万 六千 零八新冠 肺炎 防控 免费 心理 援助 热线 二十四 小时 在线,2020-02-20 21:32:00,0,0,0,__label__negative,0.00434,0.87749,0.07808999999999999,0.87749,2.0,"韩国, 病例, 死亡, 二十, 感染","Korea, Case, death, twenty, infection"
152,747,__label__positive,新冠,2020-02-20,三千 零 一十九 人 感染 这是 一群 集体 赴死 的 中国 人 今天 所有 中国 的 头条 只 为 他们 o 三千 零 一十九 人 感染 这是 一群 集体 赴死 的 中国 人 今天 所有 中国 的 头条 只 为 他们 陈辉 两艘 游轮 两种 命运 新冠 肺炎 疫情 中 公主 号 歌诗 达 号 的 悲惨 幸福 遭遇 o 陈辉 两艘 游轮 两种 命运 新冠 肺炎 疫情 中 公主 号 歌诗 达 号 的 悲惨 幸福 遭遇 二 潮州,2020-02-20 22:52:00,0,0,0,__label__neutral,0.11921,0.04744,0.28778000000000004,0.28778000000000004,0.0,"医院, 患者, 武汉市, 特殊, 救治","hospital, patient, Wuhan, special, Cure"
153,756,__label__positive,新冠,2020-02-20,督促 牺牲 人员 所在单位 及时 向 退役军人 事务 部门 申报 烈士 中国日报 记者 我们 看到 昨天 卫健委 发布 了 关于 妥善 做好 新冠 肺炎 疫情 防控 牺牲 人员 烈士 褒扬 工作 的 通知 里面 提出 应当 给予 符合 烈士 条件 的 同志 评定 为 烈士 请问 哪些 牺牲 的 同志 可以 参与 烈士 的 评定 相关 单位 应该 走 什么样 的 程序 谢谢 二千 零 二十 二 ​ ,2020-02-20 22:52:00,0,0,2,__label__positive,0.99581,0.00264,0.00241,0.99581,2.0,"韩国, 病例, 死亡, 二十, 感染","Korea, Case, death, twenty, infection"
